Je pourray bien dessus moy-mesme	Je pourrai bien dessus moi-même
Quoy que mon amour soit extresme,	Quoi que mon amour soit extrême,
De dire que je n'ayme poinct.	De dire que je n’aime point.
Mais feindre d'en aymer un autre,	Mais feindre d’en aimer un autre,
Comme en effect je fay le vostre,	Comme en effet je fais le vôtre,
Je n'en sçaurois avoir le cœur.	Je n’en saurais avoir le cœur.
Et s'il le faut, ou que je meure,	Et s’il le faut, ou que je meure,
Faites moy mourir de bonne heure.	Faites-moi mourir de bonne heure.
La beauté qu'à mon dam la mort a peu dissoudre,	La beauté qu’à mon dam la mort a pu dissoudre,
La despoüillant si tost de son humanité,	La dépouillant si tôt de son humanité,
Tant sa vie fut courte et grande sa beauté.	Tant sa vie fut courte et grande sa beauté.
Ces yeux jadis autheurs des douces entreprises	Ces yeux jadis auteurs des douces entreprises
Yeux qui furent si plains, de toutes mignardises	Yeux qui furent si pleins, de toutes mignardises
Qu'on ne les vid jamais sans qu'ils fussent aymez.	Qu’on ne les vit jamais sans qu’ils fussent aimés.
S'il est vray la beauté d'entre nous est ravie,	S’il est vrai la beauté d’entre nous est ravie,
Amour pleure vaincu, qui fut tousjours vaincoeur,	Amour pleure vaincu, qui fut toujours vainqueur,
Et celle qui donnoit à mille cœurs la vie,	Et celle qui donnait à mille cœurs la vie,
Est morte, si ce n'est qu'elle vive en mon cœur.	Est morte, si ce n’est qu’elle vive en mon cœur.
Puis que le plus parfait est le plustost ravy ?	Puisque le plus parfait est le plus tôt ravi?
Et qu'ainsi que du corps l'ombre est inseparable ?	Et qu’ainsi que du corps l’ombre est inséparable?
Il semble aussi, Cleon, que vostre destinée	Il semble aussi, Cléon, que votre destinée
Ayt dés son Orient vostre jour achevé,	Ait dès son Orient votre jour achevé,
Puis que vostre beauté morte aussi tost que née,	Puisque votre beauté morte aussitôt que née,
Au lieu de son berceau, son cercueil a treuvé.	Au lieu de son berceau, son cercueil a trouvé.
Mais je me trompe, helas ! je suis le mort moy-mesme,	Mais je me trompe, hélas! je suis le mort moi-même,
Puis que quand j'ay vescu c'est vous qui m'animiez	Puisque quand j’ai vécu c’est vous qui m’animiez
Vous estes vive en moy parce que vous m'aymiez.	Vous êtes vive en moi parce que vous m’aimiez.
Ou si je vis, Amour veut donner cognoissance,	Ou si je vis, Amour veut donner connaissance,
Ou comme un puissant Dieu pour montrer sa puissance,	Ou comme un puissant Dieu pour montrer sa puissance,
Il luy plaist que sans cœur puisse vivre un Amant.	Il lui plaît que sans cœur puisse vivre un Amant.
Que s'il est vray, Cleon, qu'enfin vous soyez morte,	Que s’il est vrai, Cléon, qu’enfin vous soyez morte,
Nous sommes morts tous deux d'excés de nos amours.	Nous sommes morts tous deux d’excès de nos amours.
Amour vous fait mourir pour l'ennuy que je porte,	Amour vous fait mourir pour l’ennui que je porte,
Et moy pour vostre mort je remeurs tous les jours.	Et moi pour votre mort je remeurs tous les jours.
Sans que par mes regrets la mort peust s'attendrir,	Sans que par mes regrets la mort pût s’attendrir,
Et mes deux yeux changez en sources eternelles	Et mes deux yeux changez en sources éternelles
Quand Amour avec moy d'une si belle morte,	Quand Amour avec moi d’une si belle morte,
Ayant plaint quelque temps le passage fatal,	Ayant plaint quelque temps le passage fatal,
Laissons, dit-il, les pleurs, plaignons-la d'autre sorte,	Laissons, dit-il, les pleurs, plaignons-la d’autre sorte,
Les larmes sont trop peu pour pleurer nostre mal.	Les larmes sont trop peu pour pleurer notre mal.
Si l'on me desdaigne, je laisse	Si l’on me dédaigne, je laisse
La cruelle avec son desdain,	La cruelle avec son dédain,
De faire nouvelle maistresse,	De faire nouvelle maîtresse,
C'est erreur de se consumer	C’est erreur de se consumer
Le plus souvent ces tant discrettes	Le plus souvent ces tant discrètes
Qui vont nos amours mesprisant,	Qui vont nos amours méprisant,
Ont au cœur un feu plus cuisant,	Ont au cœur un feu plus cuisant,
Mais les flames en sont secrettes,	Mais les flammes en sont secrètes,
Que pour d'autres nous allumons,	Que pour d’autres nous allumons,
Ce-pendant que nous les aymons.	Cependant que nous les aimons.
Qui deceu de sa loyauté,	Qui déçu de sa loyauté,
Ayme une cruelle beauté,	Aime une cruelle beauté,
Qui de quelque idole impuissant,	Qui de quelque idole impuissant,
Jamais le secours ne ressant ?	Jamais le secours ne ressent?
On dit bien que qui ne se lasse	On dit bien que qui ne se lasse
De longuement importuner,	De longuement importuner,
Par force en fin se fait donner,	Par force enfin se fait donner,
Mais c'est avoir mauvaise grace,	Mais c’est avoir mauvaise grâce,
Que d'estre tousjours importun.	Que d’être toujours importun.
Voyez les ces Amants fideles,	Voyez les ces Amants fidèles,
Les soupirs, les regrets, les pleurs	Les soupirs, les regrets, les pleurs
Sont leurs contenances plus belles,	Sont leurs contenances plus belles,
Et semble que pour estre Amant,	Et semble que pour être Amant,
Il faille plaindre seulement.	Il faille plaindre seulement.
Celuy doit-il s'appeller homme,	Celui doit-il s’appeler homme,
Qui l'honneur de l'homme étouffant,	Qui l’honneur de l’homme étouffant,
Pour la perte de quelque pomme,	Pour la perte de quelque pomme,
Plustost le faut-il pas nommer,	Plutôt le faut-il pas nommer,
Moy qui veux fuïr ces sottises,	Moi qui veux fuir ces sottises,
Qui ne donnent que de l'ennuy,	Qui ne donnent que de l’ennui,
Rendu sage du mal d'autruy,	Rendu sage du mal d’autrui,
M'en vas usant de mes franchises ;	M’en vais usant de mes franchises;
Et ne puis estre mescontant,	Et ne puis être mécontent,
Que l'on m'en appelle inconstant.	Que l’on m’en appelle inconstant.
Qu'Amour en vous voyant me planta dans le cœur,	Qu’Amour en vous voyant me planta dans le cœur,
Et que tant de desirs avec tant de longueur,	Et que tant de désirs avec tant de longueur,
Puis qu'il faut que le temps qui vid son origine,	Puisqu’il faut que le temps qui vit son origine,
Triomphe de sa fin, et s'en die vainqueur,	Triomphe de sa fin, et s’en dise vainqueur,
Faisons un beau dessein, et sans vivre en langueur,	Faisons un beau dessein, et sans vivre en langueur,
Ostons-en tout d'un coup, et la fleur & l'espine,	Ôtons-en tout d’un coup, et la fleur et l’épine,
Chassons tous ces desirs, esteignons tous ces feux,	Chassons tous ces désirs, éteignons tous ces feux,
Rompons tous ces liens, serrez de tant de nœuds,	Rompons tous ces liens, serrés de tant de nœuds,
Nous le vaincrons ainsi, cet Amour indompté,	Nous le vaincrons ainsi, cet Amour indompté,
Et ferons constamment de nostre volonté,	Et ferons constamment de notre volonté,
