Expliquons-la toutefois, puis que noſtre illuſtre ſujet nous y conduit, & qu’elle a une parfaite conformité avec noſtre texte.	Expliquons-la toutefois, puisque notre illustre sujet nous y conduit, et qu’elle a une parfaite conformité avec notre texte.
Une excellente doctrine de Saint Thomas nous la fait entendre, & concilie toutes choſes.	Une excellente doctrine de Saint Thomas nous la fait entendre, et concilie toutes choses.
Dieu témoigne plus d’amour au juſte toûjours fidele;	Dieu témoigne plus d’amour au juste toujours fidèle;
il en témoigne davantage auſſi au pecheur réconcilié;	il en témoigne davantage aussi au pécheur réconcilié;
mais en deux manieres differentes.	mais en deux manières différentes.
L’un paroiſtra plus favoriſé, ſi l’on a égard à ce qu’il eſt;	L’un paraîtra plus favorisé, si l’on a égard à ce qu’il est;
& l’autre, ſi l’on remarque d’où il eſt ſorti.	et l’autre, si l’on remarque d’où il est sorti.
Dieu conſerve au juſte un plus grand don;	Dieu conserve au juste un plus grand don;
il retire le pecheur d’un plus grand mal.	il retire le pécheur d’un plus grand mal.
Le juſte ſemblera plus avantagé, ſi l’on peſe ſon mérite;	Le juste semblera plus avantagé, si l’on pèse son mérite;
& le pecheur plus cheri, ſi l’on conſidere ſon indignité.	et le pécheur plus chéri, si l’on considère son indignité.
Le pere du Prodigue l'explique luy-meſme:	Le père du Prodigue l’explique lui-même:
Luc. 15. 31. Mon fils, vous eſtes toûjours avec moy, & tout ce qui eſt à moy eſt à vous;	Luc. 15. 31. Mon fils, vous êtes toujours avec moi, et tout ce qui est à moi est à vous;
c'eſt ce qu’il dit à celuy à qui il conſerve un plus grand don:	c’est ce qu’il dit à celui à qui il conserve un plus grand don:
Ibid. 32. Il falloit ſe réjoûïr parce que voſtre frere eſtoit mort, & il eſt reſſuſcité;	Ibid. 32. Il fallait se réjouir parce que votre frère était mort, et il est ressuscité;
c’eſt ainſi qu’il parle de celuy qu’il retire d’un plus grand abiſme de maux.	c’est ainsi qu’il parle de celui qu’il retire d’un plus grand abîme de maux.
Ainſi les cœurs ſont ſaiſis d’une joye ſoudaine par la grace ineſperée d’un beau jour d’hiver, qui aprés un temps pluvieux vient réjoûïr tout d’un coup la face du monde;	Ainsi les cœurs sont saisis d’une joie soudaine par la grâce inespérée d’un beau jour d’hiver, qui après un temps pluvieux vient réjouir tout d’un coup la face du monde;
mais on ne laiſſe pas de luy préferer la conſtante ſerenité d’une ſaiſon plus benigne:	mais on ne laisse pas de lui préférer la constante sérénité d’une saison plus bénigne:
& s’il nous eſt permis d’expliquer les ſentimens du Sauveur par ces ſentimens humains, il s’émeut plus ſenſiblement ſur les pecheurs convertis, qui ſont ſa nouvelle conqueſte ; mais il réſerve une plus douce familiarité aux juſtes, qui ſont ſes anciens & perpetuels amis:	et s’il nous est permis d’expliquer les sentiments du Sauveur par ces sentiments humains, il s’émeut plus sensiblement sur les pécheurs convertis, qui sont sa nouvelle conquête; mais il réserve une plus douce familiarité aux justes, qui sont ses anciens et perpétuels amis:
puis que s’il dit, parlant du Prodigue:	puisque s’il dit, parlant du Prodigue:
Ibid. 22. Qu'on luy rende ſa premiere	Ibid. 22. Qu’on lui rende sa première
