& on voyoit paroiſtre en cette jeune Princeſſe plus de belles qualitez qu'elle n’attendoit de couronnes.	et on voyait paraître en cette jeune Princesse plus de belles qualités qu’elle n’attendait de couronnes.
Philippe l’éleve ainſi pour ſes Eſtats:	Philippe l’élève ainsi pour ses États:
Dieu qui nous aime la deſtine à LOUIS.	Dieu qui nous aime la destine à LOUIS.
Ceſſez, Princes & Potentats, de troubler par vos prétentions le projet de ce Mariage. Que l’Amour qui ſemble auſſi le vouloir troubler, cede luy-meſme.	Cessez, Princes et Potentats, de troubler par vos prétentions le projet de ce Mariage. Que l’Amour qui semble aussi le vouloir troubler, cède lui-même.
L’Amour peut bien remuer le cœur des Heros du monde;	L’Amour peut bien remuer le cœur des Héros du monde;
il peut bien y ſoulever des tempeſtes & y exciter des mouvemens qui faſſent trembler les Politiques, & qui donnent des eſperances aux inſenſez:	il peut bien y soulever des tempêtes et y exciter des mouvements qui fassent trembler les Politiques, et qui donnent des espérances aux insensés:
mais il y a des ames d’un ordre ſuperieur à ſes loix, à qui il ne peut inſpirer des ſentimens indignes de leur rang.	mais il y a des âmes d’un ordre supérieur à ses lois, à qui il ne peut inspirer des sentiments indignes de leur rang.
Il y a des meſures priſes dans le Ciel qu’il ne peut rompre;	Il y a des mesures prises dans le Ciel qu’il ne peut rompre;
& l’Infante non-ſeulement par ſon auguſte naiſſance, mais encore par ſa vertu & par ſa réputation eſt ſeule digne de LOUIS.	et l’Infante non seulement par son auguste naissance, mais encore par sa vertu et par sa réputation est seule digne de LOUIS.
C’eſtoit Prov. 19. 14. la femme prudente qui eſt donnée proprement par le Seigneur, comme dit le Sage.	C’était Prov. 19. 14. la femme prudente qui est donnée proprement par le Seigneur, comme dit le Sage.
Pourquoy donnée proprement par le Seigneur, puis que c’eſt le Seigneur qui donne tout;	Pourquoi donnée proprement par le Seigneur, puisque c’est le Seigneur qui donne tout;
& quel eſt ce merveilleux avantage qui merite d’eſtre attribué d’une façon ſi particuliere à la divine bonté?	et quel est ce merveilleux avantage qui mérite d’être attribué d’une façon si particulière à la divine bonté?
Il ne faut pour l’entendre que conſiderer ce que peut dans les Maiſons la prudence temperée d’une femme ſage pour les ſouſtenir, pour y faire fleurir dans la pieté la veritable ſageſſe, & pour calmer des paſſions violentes qu’une réſiſtance emportée ne feroit qu’aigrir.	Il ne faut pour l’entendre que considérer ce que peut dans les Maisons la prudence tempérée d’une femme sage pour les soutenir, pour y faire fleurir dans la piété la véritable sagesse, et pour calmer des passions violentes qu’une résistance emportée ne ferait qu’aigrir.
Iſle pacifique où ſe doivent terminer les differends de deux grands Empires à qui tu ſers de limites:	Île pacifique où se doivent terminer les différents de deux grands Empires à qui tu sers de limites:
Iſle éternellement mémorable par les Conferences de deux grands Miniſtres;	Île éternellement mémorable par les Conférences de deux grands Ministres;
où l’on vit déveloper toutes les adreſſes & tous les ſecrets d’une politique ſi differente;	où l’on vit développer toutes les adresses et tous les secrets d’une politique si différente;
où l’un ſe donnoit du poids par ſa lenteur, & l’autre prenoit l’aſcendant par ſa pénétration:	où l’un se donnait du poids par sa lenteur, et l’autre prenait l’ascendant par sa pénétration:
auguſte Journée où deux fieres nations longtemps ennemies, & alors réconciliées par MARIE TERESE s’avancent ſur leurs confins, leurs Rois à leur teſte, non plus pour ſe combatre, mais pour s’embraſſer;	auguste Journée où deux fières nations longtemps ennemies, et alors réconciliées par MARIE-THÉRÈSE s’avancent sur leurs confins, leurs Rois à leur tête, non plus pour se combattre, mais pour s’embrasser;
où ces deux Rois avec leur Cour d’une grandeur, d’une politeſſe, & d’une magnificence auſſi-bien que d’une conduite ſi differente, furent l’un à l'autre & à tout l’Univers un ſi grand ſpectacle: Feſtes ſacrées, Mariage fortuné, Voile nuptial, Benediction, Sacrifice, puis-je meſler aujourd’huy vos céremonies & vos pompes avec ces pompes funebres, & le comble des grandeurs avec leurs ruines?	où ces deux Rois avec leur Cour d’une grandeur, d’une politesse, et d’une magnificence aussi bien que d’une conduite si différente, furent l’un à l’autre et à tout l’Univers un si grand spectacle: Fêtes sacrées, Mariage fortuné, Voile nuptial, Bénédiction, Sacrifice, puis-je mêler aujourd’hui vos cérémonies et vos pompes avec ces pompes funèbres, et le comble des grandeurs avec leurs ruines?
Alors l’Eſpagne perdit ce que nous gagnions:	Alors l’Espagne perdit ce que nous gagnions:
maintenant nous perdons tout les uns & les autres;	maintenant nous perdons tout les uns et les autres;
& MARIE TERESE perit pour toute la terre.	et MARIE-THÉRÈSE périt pour toute la terre.
L’Eſpagne pleuroit ſeule:	L’Espagne pleurait seule:
maintenant que la France & l’Eſpagne meſlent leurs larmes, & en verſent des torrens, qui pourroit les arreſter? Mais ſi l’Eſpagne pleuroit ſon Infante qu’elle voyoit monter ſur le thrône le plus glorieux de l’Univers, quels ſeront nos gemiſſemens à la veûë de ce tombeau, où tous enſemble nous ne voyons plus que l’inévitable néant des grandeurs humaines?	maintenant que la France et l’Espagne mêlent leurs larmes, et en versent des torrents, qui pourrait les arrêter? Mais si l’Espagne pleurait son Infante qu’elle voyait monter sur le trône le plus glorieux de l’Univers, quels seront nos gémissements à la vue de ce tombeau, où tous ensemble nous ne voyons plus que l’inévitable néant des grandeurs humaines?
Taiſons-nous:	Taisons-nous:
ce n'eſt pas des larmes que je veux tirer de vos yeux.	ce n’est pas des larmes que je veux tirer de vos yeux.
Je poſe les fondemens des inſtructions que je veux graver dans vos cœurs:	Je pose les fondements des instructions que je veux graver dans vos cœurs:
auſſi- bien la vanité des choſes humaines tant de fois étalée dans cette chaire, ne ſe montre que trop d’elle-meſme ſans le ſecours de ma voix, dans ce Sceptre ſitoſt tombé d’une ſi royale main, & dans une ſi haute Majeſté ſi promptement diſſipée.	aussi-bien la vanité des choses humaines tant de fois étalée dans cette chaire, ne se montre que trop d’elle-même sans le secours de ma voix, dans ce Sceptre sitôt tombé d’une si royale main, et dans une si haute Majesté si promptement dissipée.
Mais ce qui en faiſoit le plus grand éclat n’a pas encore paru.	Mais ce qui en faisait le plus grand éclat n’a pas encore paru.
Une Reine ſi grande par tant de titres, le devenoit tous les jours par les grandes actions du Roy & par le continuel accroiſſement de ſa gloire. Sous luy la France a appris à ſe connoiſtre.	Une Reine si grande par tant de titres, le devenait tous les jours par les grandes actions du Roi et par le continuel accroissement de sa gloire. Sous lui la France a appris à se connaître.
Elle ſe trouve des forces que les ſiecles précedens ne ſçavoient pas:	Elle se trouve des forces que les siècles précédents ne savaient pas:
l’ordre & la diſcipline militaire s’augmentent avec les armées.	l’ordre et la discipline militaire s’augmentent avec les armées.
Si les François peuvent tout, c’eſt que leur Roy eſt par tout leur Capitaine;	Si les Français peuvent tout, c’est que leur Roi est partout leur Capitaine;
& aprés qu’il a choiſi l’endroit principal qu’il doit animer par ſa valeur, il agit de tous coſtez par l’impreſſion de ſa vertu.	et après qu’il a choisi l’endroit principal qu’il doit animer par sa valeur, il agit de tous côtés par l’impression de sa vertu.
Jamais on n’a fait la guerre avec une force plus inévitable, puis qu’en mépriſant les ſaiſons, il a oſté juſqu'à la défenſe à ſes ennemis.	Jamais on n’a fait la guerre avec une force plus inévitable, puisqu’en méprisant les saisons, il a ôté jusqu’à la défense à ses ennemis.
Les ſoldats ménagez & expoſez quand il faut, marchent avec confiance ſous ſes étendarts:	Les soldats ménagés et exposés quand il faut, marchent avec confiance sous ses étendards:
nul fleuve ne les arreſte, nulle fortereſſe ne les effraye.	nul fleuve ne les arrête, nulle forteresse ne les effraie.
On ſçait que LOUIS foudroye les villes plûtoſt qu’il ne les aſſiege, & tout eſt ouvert à ſa puiſſance.	On sait que LOUIS foudroie les villes plutôt qu’il ne les assiège, et tout est ouvert à sa puissance.
Les Politiques ne ſe meſlent plus de deviner ſes deſſeins.	Les Politiques ne se mêlent plus de deviner ses desseins.
Quand il marche, tout ſe croit également menacé:	Quand il marche, tout se croit également menacé:
un voyage tranquille devient tout-à-coup une expedition redoutable à ſes ennemis.	un voyage tranquille devient tout à coup une expédition redoutable à ses ennemis.
Gand tombe avant qu’on penſe à le munir: LOUIS y vient par de longs détours;	Gand tombe avant qu’on pense à le munir: LOUIS y vient par de longs détours;
& la Reine qui l’accompagne au cœur de l’hyver, joint au plaiſir de le ſuivre celuy de ſervir ſecrettement à ſes deſſeins.	et la Reine qui l’accompagne au cœur de l’hiver, joint au plaisir de le suivre celui de servir secrètement à ses desseins.
Par les ſoins d’un ſi grand Roy, la France entiere n’eſt plus, pour ainſi parler, qu’une ſeule fortereſſe qui montre de tous coſtez un front redoutable.	Par les soins d’un si grand Roi, la France entière n’est plus, pour ainsi parler, qu’une seule forteresse qui montre de tous côtés un front redoutable.
Couverte de toutes parts, elle eſt capable de tenir la paix avec ſeûreté dans ſon ſein, mais auſſi de porter la guerre par tout où il faut, & de fraper de prés & de loin avec une égale force.	Couverte de toutes parts, elle est capable de tenir la paix avec sûreté dans son sein, mais aussi de porter la guerre partout où il faut, et de frapper de près et de loin avec une égale force.
Nos ennemis le ſçavent bien dire, & nos alliez ont reſſenti dans le plus grand éloignement, combien la main de LOUIS eſtoit ſecourable.	Nos ennemis le savent bien dire, et nos alliés ont ressenti dans le plus grand éloignement, combien la main de LOUIS était secourable.
Avant luy, la France preſque ſans vaiſſeaux, tenoit en vain aux deux mers:	Avant lui, la France presque sans vaisseaux, tenait en vain aux deux mers:
maintenant on les voit couvertes depuis le Levant juſqu’au Couchant de nos Flotes victorieuſes, & la hardieſſe Francoiſe porte par tout la terreur avec le nom de LOUIS.	maintenant on les voit couvertes depuis le Levant jusqu’au Couchant de nos Flottes victorieuses, et la hardiesse Française porte partout la terreur avec le nom de LOUIS.
Tu cederas, ou tu tomberas ſous ce vainqueur, Alger riche des dépouïlles de la Chreſtienté.	Tu céderas, ou tu tomberas sous ce vainqueur, Alger riche des dépouilles de la Chrétienté.
Tu diſois en ton cœur avare;	Tu disais en ton cœur avare;
Je tiens la mer ſous mes loix, & les nations ſont ma proye.	Je tiens la mer sous mes lois, et les nations sont ma proie.
La legereté de tes vaiſſeaux te donnoit de la confiance: mais tu te verras attaquée dans tes murailles, comme un oiſeau raviſſant qu’on iroit chercher parmi ſes rochers & dans ſon nid, où il partage ſon butin à ſes petits.	La légèreté de tes vaisseaux te donnait de la confiance: mais tu te verras attaquée dans tes murailles, comme un oiseau ravissant qu’on irait chercher parmi ses rochers et dans son nid, où il partage son butin à ses petits.
Tu rends déja tes eſclaves.	Tu rends déjà tes esclaves.
LOUIS a briſé les fers donc tu accablois ſes Sujets qui ſont nez pour eſtre libres ſous ſon glorieux Empire.	LOUIS a brisé les fers donc tu accablais ses Sujets qui sont nés pour être libres sous son glorieux Empire.
Tes maiſons ne ſont plus qu’un amas de pierres. Dans ta brutale fureur tu te tournes contre toy-meſme, & tu ne ſçais comment aſſouvir ta rage impuiſſante.	Tes maisons ne sont plus qu’un amas de pierres. Dans ta brutale fureur tu te tournes contre toi-même, et tu ne sais comment assouvir ta rage impuissante.
Mais nous verrons la fin de tes brigandages.	Mais nous verrons la fin de tes brigandages.
Les Pilotes étonnez s’écrient par avance, EZech. 27. 32. Qui eſt ſemblable à Tyr?	Les Pilotes étonnés s’écrient par avance, EZech. 27. 32. Qui est semblable à Tyr?
toutefois elle s'eſt tuë dans le milieu de la mer;	toutefois elle s’est tue dans le milieu de la mer;
& la navigation va eſtre aſſeürée par les armes de LOUIS.	et la navigation va être assurée par les armes de LOUIS.
L’éloquence s’eſt épuiſée à loûër la ſageſſe de ſes loix & l’ordre de ſes Finances.	L’éloquence s’est épuisée à louer la sagesse de ses lois et l’ordre de ses Finances.
Que n’a-t-on pas dit de ſa fermeté, à laquelle nous voyons ceder juſqu'à la fureur des Duels?	Que n’a-t-on pas dit de sa fermeté, à laquelle nous voyons céder jusqu’à la fureur des Duels?
La ſévere Juſtice de LOUIS jointe à ſes inclinations bienfaiſantes fait aimer à la France l’autorité ſous laquelle heureuſement réünie elle eſt tranquille & victorieuſe.	La sévère Justice de LOUIS jointe à ses inclinations bienfaisantes fait aimer à la France l’autorité sous laquelle heureusement réunie elle est tranquille et victorieuse.
Qui veut entendre combien la raiſon préſide dans les conſeils de ce Prince, n’a qu’à preſter l’oreille quand il luy plaiſt d’en expliquer les motifs.	Qui veut entendre combien la raison préside dans les conseils de ce Prince, n’a qu’à prêter l’oreille quand il lui plaît d’en expliquer les motifs.
Je pourrois icy prendre à témoin les ſages Miniſtres des Cours étrangeres, qui le trouvent auſſi convaincant dans ſes diſcours que redoutable par ſes armes.	Je pourrais ici prendre à témoin les sages Ministres des Cours étrangères, qui le trouvent aussi convaincant dans ses discours que redoutable par ses armes.
La nobleſſe de ſes expreſſions vient de celle de ſes ſentimens, & ſes paroles préciſes ſont l’image de la juſteſſe qui regne dans ſes penſées.	La noblesse de ses expressions vient de celle de ses sentiments, et ses paroles précises sont l’image de la justesse qui règne dans ses pensées.
Pendant qu’il parle avec tant de force, une douceur ſurprenante luy ouvre les cœurs, & donne je ne ſçay comment un nouvel éclat à la Majeſté qu’elle tempere.	Pendant qu’il parle avec tant de force, une douceur surprenante lui ouvre les cœurs, et donne je ne sais comment un nouvel éclat à la Majesté qu’elle tempère.
N’oublions pas ce qui faiſoit la joye de la Reine.	N’oublions pas ce qui faisait la joie de la Reine.
LOUIS eſt le rempart de la Religion:	LOUIS est le rempart de la Religion:
c’eſt à la Religion qu’il fait ſervir ſes armes redoutées par mer & par terre.	c’est à la Religion qu’il fait servir ses armes redoutées par mer et par terre.
Mais ſongeons qu’il ne l’établit par tout au dehors que parce qu’il la fait regner au dedans & au milieu de ſon cœur.	Mais songeons qu’il ne l’établit partout au dehors que parce qu’il la fait régner au dedans et au milieu de son cœur.
C’eſt là qu’il abbat des ennemis plus terribles que ceux que tant de Puiſſances jalouſes de ſa grandeur, & l’Europe entiere pourroit armer contre luy.	C’est là qu’il abat des ennemis plus terribles que ceux que tant de Puissances jalouses de sa grandeur, et l’Europe entière pourrait armer contre lui.
Nos vrais ennemis ſont en nous-meſmes, & LOUIS combat ceux-là plus que tous les autres.	Nos vrais ennemis sont en nous-mêmes, et LOUIS combat ceux-là plus que tous les autres.
Vous voyez tomber de toutes parts les Temples de l’Héreſie:	Vous voyez tomber de toutes parts les Temples de l’Hérésie:
ce qu’il renverſe au dedans eſt un ſacrifice bien plus agréable ; & l’ouvrage du Chreſtien, c’eſt de détruire les paſſions qui feroient de nos cœurs un Temple d’Idoles.	ce qu’il renverse au dedans est un sacrifice bien plus agréable; et l’ouvrage du Chrétien, c’est de détruire les passions qui feraient de nos cœurs un Temple d’Idoles.
Que ſerviroit à LOUIS d’avoir étendu ſa gloire par tout où s’étend le genre humain?	Que servirait à LOUIS d’avoir étendu sa gloire partout où s’étend le genre humain?
Ce ne luy eſt rien d’eſtre l’homme que les autres hommes admirent:	Ce ne lui est rien d’être l’homme que les autres hommes admirent:
il veut eſtre, avec David, l'homme ſelon le cœur de Dieu.	il veut être, avec David, l’homme selon le cœur de Dieu.
C’eſt pourquoy Dieu le benit.	C’est pourquoi Dieu le bénit.
Tout le genre humain demeure d’accord qu’il n’y a rien de plus grand que ce qu’il fait, ſi ce n’eſt qu’on veuille compter pour plus grand encore tout ce qu’il n’a pas voulu faire, & les bornes qu’il a données à ſa puiſſance.	Tout le genre humain demeure d’accord qu’il n’y a rien de plus grand que ce qu’il fait, si ce n’est qu’on veuille compter pour plus grand encore tout ce qu’il n’a pas voulu faire, et les bornes qu’il a données à sa puissance.
Adorez donc, O GRAND ROY, celuy qui vous fait regner, qui vous fait vaincre, & qui vous donne dans la victoire, malgré la fierté qu’elle inſpire, des ſentimens ſi moderez!	Adorez donc, Ô GRAND ROI, celui qui vous fait régner, qui vous fait vaincre, et qui vous donne dans la victoire, malgré la fierté qu’elle inspire, des sentiments si modérés!
Puiſſe la Chreſtienté ouvrir les yeux, & reconnoiſtre le vengeur que Dieu luy envoye. Pendant, ô malheur, ô honte, ô juſte punition de nos pechez!	Puisse la Chrétienté ouvrir les yeux, et reconnaître le vengeur que Dieu lui envoie. Pendant, ô malheur, ô honte, ô juste punition de nos péchés!
pendant, dis-je, qu'elle eſt ravagée par les Infideles qui pénetrent juſqu'à ſes entrailles;	pendant, dis-je, qu’elle est ravagée par les Infidèles qui pénètrent jusqu’à ses entrailles;
que tarde-t- elle à ſe ſouvenir & des ſecours de Candie, & de la fameuſe Journée du Raab, où LOUIS renouvella dans le cœur des Infideles l’ancienne opinion qu’ils ont des armes Françoiſes fatales à leur tyrannie, & par des exploits inouïs devint le rempart de l’Auſtriche dont il avoit eſté la terreur?	que tarde-t-elle à se souvenir et des secours de Candie, et de la fameuse Journée du Raab, où LOUIS renouvela dans le cœur des Infidèles l’ancienne opinion qu’ils ont des armes Françaises fatales à leur tyrannie, et par des exploits inouïs devint le rempart de l’Autriche dont il avait été la terreur?
Ouvrez donc les yeux, CHRESTIENS, & regardez ce Heros, dont nous pouvons. dire, comme Saint Paulin diſoit du Grand Theodoſe, que nous voyons en LOUIS, Paul. Ep. 9. ad Sev. non un Roy, mais un ſerviteur de Jeſus- Chriſt, & un Prince qui s’éleve audeſſus des hommes plus encore par ſa Foy que par ſa Couronne.	Ouvrez donc les yeux, CHRÉTIENS, et regardez ce Héros, dont nous pouvons. dire, comme Saint Paulin disait du Grand Théodose, que nous voyons en LOUIS, Paul. Ep. 9. ad Sev. non un Roi, mais un serviteur de Jésus-Christ, et un Prince qui s’élève au-dessus des hommes plus encore par sa Foi que par sa Couronne.
In Theodoſio non Imperatorem, ſed Chriſti ſervum, nec regno, ſed fide Principem prædicamus.	In Theodosio non Imperatorem, sed Christi servum, nec regno, sed fide Principem prædicamus.
C’eſtoit, MESSIEURS, d’un tel Heros que MARIE TERESE devoit partager la gloire d’une façon particuliere, puis que non contente d’y avoir part comme compagne de ſon thrône, elle ne ceſſoit d’y contribuer par la perſeverance de ſes vœux.	C’était, MESSIEURS, d’un tel Héros que MARIE-THÉRÈSE devait partager la gloire d’une façon particulière, puisque non contente d’y avoir part comme compagne de son trône, elle ne cessait d’y contribuer par la persévérance de ses vœux.
Pendant que ce grand Roy la rendoit la plus illuſtre de toutes les Reines, vous la faiſiez, MONSEIGNEUR, la plus illuſtre de toutes les Meres.	Pendant que ce grand Roi la rendait la plus illustre de toutes les Reines, vous la faisiez, MONSEIGNEUR, la plus illustre de toutes les Mères.
Vos reſpects l’ont conſolée de la perte de ſes autres enfans. Vous les luy avez rendus:	Vos respects l’ont consolée de la perte de ses autres enfants. Vous les lui avez rendus:
elle s’eſt veûë renaiſtre dans ce Prince qui fait vos délices & les noſtres;	elle s’est vue renaître dans ce Prince qui fait vos délices et les nôtres;
& elle a trouvé une fille digne d’elle dans cette auguſte Princeſſe, qui par ſon rare mérite autant que par les droits d’un nœud ſacré ne fait avec vous qu’un meſme cœur.	et elle a trouvé une fille digne d’elle dans cette auguste Princesse, qui par son rare mérite autant que par les droits d’un nœud sacré ne fait avec vous qu’un même cœur.
Si nous l’avons admirée dés le moment qu'elle parut, le Roy a confirmé noſtre jugement ; & maintenant devenuë, malgré ſes ſouhaits, la principale décoration d’une Cour dont un ſi grand Roy fait le ſouſtien, elle eſt la conſolation de toute la France.	Si nous l’avons admirée dès le moment qu’elle parut, le Roi a confirmé notre jugement; et maintenant devenue, malgré ses souhaits, la principale décoration d’une Cour dont un si grand Roi fait le soutien, elle est la consolation de toute la France.
Ainſi noſtre Reine, heureuſe par ſa naiſſance, qui luy rendoit la pieté auſſi-bien que la grandeur comme héreditaire, par ſa ſainte éducation, par ſon mariage, par la gloire & par l’amour d’un ſi grand Roy, par le mérite & par les reſpects de ſes enfans, & par la vénération de tous les peuples, ne voyoit rien ſur la terre qui ne fuſt audeſſous d’elle. Elevez maintenant, ô Seigneur, & mes penſées & ma voix!	Ainsi notre Reine, heureuse par sa naissance, qui lui rendait la piété aussi bien que la grandeur comme héréditaire, par sa sainte éducation, par son mariage, par la gloire et par l’amour d’un si grand Roi, par le mérite et par les respects de ses enfants, et par la vénération de tous les peuples, ne voyait rien sur la terre qui ne fut au-dessous d’elle. Élevez maintenant, ô Seigneur, et mes pensées et ma voix!
Que je puiſſe repreſenter à cette auguſte Audiance l’incomparable beauté d’une ame que vous avez toûjours habitée, qui n’a jamais Eph. 4. 30. affligé voſtre Eſprit Saint, qui jamais n'a perdu  le gouſt du don celeſte;	Que je puisse représenter à cette auguste Audience l’incomparable beauté d’une âme que vous avez toujours habitée, qui n’a jamais Eph. 4. 30. affligé votre Esprit Saint, qui jamais n’a perdu le goût du don céleste;
afin que nous commencions malheureux pecheurs à verſer ſur nous-meſmes un torrent de larmes, & que ravis des chaſtes attraits de l’innocence, jamais nous ne nous laſſions d’en pleurer la perte.	afin que nous commencions malheureux pécheurs à verser sur nous-mêmes un torrent de larmes, et que ravis des chastes attraits de l’innocence, jamais nous ne nous lassions d’en pleurer la perte.
A la verité, CHRESTIENS, quand on voit dans l’Evangile  la brebis perduë préférée par le bon Paſteur à tout le reſte du troupeau;	À la vérité, CHRÉTIENS, quand on voit dans l’Évangile la brebis perdue préférée par le bon Pasteur à tout le reste du troupeau;
quand on y lit cét heureux retour du Prodigue retrouvé, & ce tranſport d’un pere attendri qui met en joye toute ſa famille:	quand on y lit cet heureux retour du Prodigue retrouvé, et ce transport d’un père attendri qui met en joie toute sa famille:
on eſt tenté de croire que la penitence eſt préferée à l’innocence meſme, & que le Prodigue retourné reçoit plus de graces que ſon aiſné, qui ne s’eſt jamais échapé de la maiſon paternelle.	on est tenté de croire que la pénitence est préférée à l’innocence même, et que le Prodigue retourné reçoit plus de grâces que son aîné, qui ne s’est jamais échappé de la maison paternelle.
Il eſt l’aiſne toutefois, & deux mots que luy dit ſon pere luy font bien entendre qu’il n’a pas perdu ſes avantages:	Il est l’aîné toutefois, et deux mots que lui dit son père lui font bien entendre qu’il n’a pas perdu ses avantages:
Ibid 31. Mon fils, luy dit-il, vous eſtes toûjours avec moy, & tout ce qui eſt à moy eſt à vous.	Ibid 31. Mon fils, lui dit-il, vous êtes toujours avec moi, et tout ce qui est à moi est à vous.
Cette parole, MESSIEURS, ne ſe traite gueres dans les chaires, parce que cette inviolable fidelité ne ſe trouve gueres dans les mœurs.	Cette parole, MESSIEURS, ne se traite guère dans les chaires, parce que cette inviolable fidélité ne se trouve guère dans les mœurs.
