A toute extremité vendons-leur cherement noſtre vie, & les enuelopans dans noſtre perte, faiſons ou qu’ils ne ſe ſouuiennent iamais de leur victoire, ou qu’ils ne s’en ſouuiennẽt qu’aqu’auec larmes.	À toute extrémité vendons-leur chèrement notre vie, et les enveloppants dans notre perte, faisons ou qu’ils ne se souviennent jamais de leur victoire, ou qu’ils ne s’en souviennent qu’avec larmes.	A toute extremité vendons-leur cherement noſtre vie, & les enuelopans dans noſtre perte, faiſons ou qu’ils ne ſe ſouuiennent iamais de leur victoire, ou qu’ils ne s’en ſouuiennẽt qu’auec larmes.
Il n’y eut ſang ſi glacé que ceſte eloquance n’eſchauffaſt, ny matelot ſi laſche, qui ne ſouhaittaſt d’eſtre aux mains auec l’ennemy.	Il n’y eut sang si glacé que cette éloquence n’échauffât, ni matelot si lâche, qui ne souhaitât d’être aux mains avec l’ennemi.
En meſme temps le beau Turc fit prendre les armes à tous, & plaça chacun à ſa poſte.	En même temps le beau Turc fit prendre les armes à tous, et plaça chacun à sa poste.
Le Pilote ayant receu l’ordre qu’il falloit garder en vn combat ſi inégal, s’eſloigna de l’iſle de Fer;	Le Pilote ayant reçu l’ordre qu’il fallait garder en un combat si inégal, s’éloigna de l’île de Fer;
& pour contenter la genereuſe impatiance de ſon Capitaine, fut au deuant des ennemis, & gagna la pleine mer, en gagnant le deſſus du vent.	et pour contenter la généreuse impatience de son Capitaine, fut au devant des ennemis, et gagna la pleine mer, en gagnant le dessus du vent.
Les huict vaiſſeaux qui venoient à pleines voiles fondre ſur luy;	Les huit vaisseaux qui venaient à pleines voiles fondre sur lui;
ſe diſpoſerent au combat auec autant d’ordre que s’ils euſſent eſté les plus foibles.	se disposèrent au combat avec autant d’ordre que s’ils eussent été les plus faibles.
Ils ſe ſeparerent, & ayant formé vn croiſſant, en aduancerent de telle ſorte les pointes, qu’ils ſembloient vouloir enfermer celuy qui voguoit le premier.	Ils se séparèrent, et ayant formé un croissant, en avancèrent de telle sorte les pointes, qu’ils semblaient vouloir enfermer celui qui voguait le premier.
Ce vaiſſeau ſe conſerua touſiours l’auantage qu’il auoit ſur les ſept autres;	Ce vaisseau se conserva toujours l’avantage qu’il avait sur les sept autres;
& les laiſſant aſſez loing derriere ſoy, fit croire aux Turcs qu’il vouloit commencer le combat.	et les laissant assez loin derrière soi, fit croire aux Turcs qu’il voulait commencer le combat.
Mais il ne fut pas à la portée de leur Canon, que ceux qui eſtoient dedans, baiſſerent les voiles, & par toutes les marques qui ſont en vſage ſur la mer;	Mais il ne fut pas à la portée de leur Canon, que ceux qui étaient dedans, baissèrent les voiles, et par toutes les marques qui sont en usage sur la mer;
firent cognoiſtre aux Turcs qu’ils ne venoient pas pour les attaquer, mais pour ſe mettre en leur protection.	firent connaître aux Turcs qu’ils ne venaient pas pour les attaquer, mais pour se mettre en leur protection.
Leur genereux Capitaine ne delibera point ſur ce qui eſtoit le plus ſeur de faire en vne coniecture ſi perilleuſe.	Leur généreux Capitaine ne délibéra point sur ce qui était le plus sûr de faire en une conjecture si périlleuse.
D’abord il accorda à ces ſupplians l’aſſiſtance qu’ils luy demandoient;	D’abord il accorda à ces suppliants l’assistance qu’ils lui demandaient;
& s’eſtant aduancé pour les couurir, leur dit en paſſant qu’il les deffendroit contre tout le monde.	et s’étant avancé pour les couvrir, leur dit en passant qu’il les défendrait contre tout le monde.
Ils le remercierent par de longs cris, & des voix confuſes;	Ils le remercièrent par de longs cris, et des voix confuses;
& gaignerent le derriere de l’iſle de Fer.	et gagnèrent le derrière de l’île de Fer.
Luy cepandant rauy que tant de rares aduantures ſe preſentaſſent tout à la fois;	Lui cependant ravi que tant de rares aventures se présentassent tout à la fois;
print vn habillement de teſte, & vne rondache; & ſe tournant vers les ſiens, Aduoüez, leur dit-il, chers compagnons de mes chaines & de ma liberté, que la fortune vient de bonne grace ſe reconcilier auec nous.	prit un habillement de tête, et une rondache; et se tournant vers les siens, Avouez, leur dit-il, chers compagnons de mes chaînes et de ma liberté, que la fortune vient de bonne grâce se réconcilier avec nous.
Nous auons crû que pour nous continuer les teſmoignages de ſa haine, elle nous vouloit reduire a la neceſſité de nous deffendre;	Nous avons crû que pour nous continuer les témoignages de sa haine, elle nous voulait réduire à la nécessité de nous défendre;
& voila que pour nous faire paroiſtre ſon amitié, elle nous conuie à la deffence des autres.	et voilà que pour nous faire paraître son amitié, elle nous convie à la défense des autres.
Que chacun reçoiue comme il doit, ſes premieres faueurs;	Que chacun reçoive comme il doit, ses premières faveurs;
& puis qu’ordinairement elle eſt amoureuſe des des grands courages, monſtrons en ceſte occaſion, que c’eſt auec iuſtice qu’elle veut auoir de l’amour pour nous.	et puis qu’ordinairement elle est amoureuse des des grands courages, montrons en cette occasion, que c’est avec justice qu’elle veut avoir de l’amour pour nous.
Il mit la main à l'eſpée en finiſſant ce diſcours, & commanda à ſes canoniers de ne point tirer que les ennemis n’euſſent fait leur deſcharge.	Il mit la main à l’épée en finissant ce discours, et commanda à ses canonniers de ne point tirer que les ennemis n’eussent fait leur décharge.
Mais ces inconnus, au lieu de fondre tout à la fois ſur ſon vaiſſeau, s’ouurirent à droict & à gauche;	Mais ces inconnus, au lieu de fondre tout à la fois sur son vaisseau, s’ouvrirent à droit et à gauche;
& firent bien voir qu’ils n’auoient autre deſſein que de ſuiure la proye qui leur eſtoit eſchappée.	et firent bien voir qu’ils n’avaient autre dessein que de suivre la proie qui leur était échappée.
Le beau Turc ne fut pas ſatisfait de ceſte déclaration.	Le beau Turc ne fut pas satisfait de cette déclaration.
Il fit auancer ſon vaiſſeau, & alla comme fermer le chemin à celuy des ennemis, qui eſtoit & le plus grand & le plus auancé.	Il fit avancer son vaisseau, et alla comme fermer le chemin à celui des ennemis, qui était et le plus grand et le plus avancé.
Auant qu’il l’euſt ioint, il vit paroiſtre ſur la poupe vn homme armé de toutes pièces, qui par ſon action teſmoignoit bien certainement qu’il n’eſtoit pas vn homme ordinaire.	Avant qu’il l’eût joint, il vit paraître sur la poupe un homme armé de toutes pièces, qui par son action témoignait bien certainement qu’il n’était pas un homme ordinaire.
Si toſt qu’il crût que le Turc le pouuoit oüir;	Si tôt qu’il crut que le Turc le pouvait ouïr;
Ie t’ay reſpecté, luy dit-il, pource que ie t’ay crû ſubiect d’Alcidiane.	Je t’ai respecté, lui dit-il, pource que je t’ai cru sujet d’Alcidiane.
Mais tes habits me font voir que ie me ſuis trompé.	Mais tes habits me font voir que je me suis trompé.
Qui és tu donc, adiouſtat’il, qui foible comme tu és, ozes prendre la deffence des autres, & la prendre ſans ſçauoir ſi tu le peux faire auec iuſtice?	Qui es-tu donc, ajouta-t-il, qui faible comme tu es, oses prendre la défense des autres, et la prendre sans savoir si tu le peux faire avec justice?
La voix de l'affligé qui crie, reſpondit le Turc, & qui demande ſecours contre la violance de ſes perſecuteurs, eſt toujours accompagnée de iuſtice.	La voix de l’affligé qui crie, répondit le Turc, et qui demande secours contre la violence de ses persécuteurs, est toujours accompagnée de justice.
Mais d’où vient, continua-t’il, que connoiſſant ſi bien la Iuſtice, tu la pratiques ſi mal;	Mais d’où vient, continua-t-il, que connaissant si bien la Justice, tu la pratiques si mal;
& veux exercer ſur les foibles, la tyrannie que la force te conſeille?	et veux exercer sur les faibles, la tyrannie que la force te conseille?
Ie donne tes iniures à ta generoſité, luy repliqua l’autre, & ſerois bien aiſe, ſi i’en auois le loiſir, d’apprendre qui tu és.	Je donne tes injures à ta générosité, lui répliqua l’autre, et serais bien aise, si j’en avais le loisir, d’apprendre qui tu es.
Ce ſera pour vne autre fois.	Ce sera pour une autre fois.
Cepandant ne m’arreſtes pas dauantage, ſi tu n’as deſſein de t'expoſer aux violances que tu me reproches.	Cependant ne m’arrêtes pas davantage, si tu n’as dessein de t’exposer aux violences que tu me reproches.
Le beau Turc piqué de ces menaces, & tout enflammé de cette belle ardeur que la gloire allume dans les ieunes courages.	Le beau Turc piqué de ces menaces, et tout enflammé de cette belle ardeur que la gloire allume dans les jeunes courages.
Non, non, dit-il, ie ne puis abandonner les mal-heureux que le Ciel m’ordonne de proteger.	Non, non, dit-il, je ne puis abandonner les malheureux que le Ciel m’ordonne de protéger.
Deſormais ie luy ſuis reſponſable de leurs libertez & de leurs vies.	Désormais je lui suis responsable de leurs libertés et de leurs vies.
Ne croy pas auſſi que ie te quitte, que ie ne ſois aſſuré que tu ne le ſuiuras plus.	Ne crois pas aussi que je te quitte, que je ne sois assuré que tu ne le suivras plus.
Au reſte, apprend que les menaces audacieuſes n’eſpouuantent iamais ceux qui ſçauent comme il faut en chaſtier les autheurs.	Au reste, apprend que les menaces audacieuses n’épouvantent jamais ceux qui savent comme il faut en châtier les auteurs.
Ta reſolution eſt belle, reprit l’autre, mais s’il eſt vray que tes actions reſpondent à la magnificence de tes paroles, n’employe point d’autre bras que le tien pour faire ce glorieux chaſtiment;	Ta résolution est belle, reprit l’autre, mais s’il est vrai que tes actions répondent à la magnificence de tes paroles, n’emploie point d’autre bras que le tien pour faire ce glorieux châtiment;
& commande à tes compagnons d’eſtre ſpectateurs de noſtre combat.	et commande à tes compagnons d’être spectateurs de notre combat.
Ie te promets que non ſeulement ceux qui ſont auec moy, mais ceux auſſi qui me ſuiuent, obſerueront exactement l’ordre que ie leur auray preſcript.	Je te promets que non seulement ceux qui sont avec moi, mais ceux aussi qui me suivent, observeront exactement l’ordre que je leur aurai prescrit.
Le ieune Turc, au lieu de luy reſpondre, ſe tourna vers ſes gens, & pour les obliger à mettre les armes bas, Mes compagnons, leur dit-il, vous auez oüy la propoſition de l’ennemy.	Le jeune Turc, au lieu de lui répondre, se tourna vers ses gens, et pour les obliger à mettre les armes bas, Mes compagnons, leur dit-il, vous avez ouï la proposition de l’ennemi.
Acceptez-la ſi vous m’aimez;	Acceptez-la si vous m’aimez;
& ſouffrez que ie vous dérobe vne partie de la gloire que vous euſſiez acquiſe en ce combat.	et souffrez que je vous dérobe une partie de la gloire que vous eussiez acquise en ce combat.
Ces Turcs poſſible bien contents de ceſte priere, obeïrent diligemment à la volonté de leur Chef.	Ces Turcs possible bien contents de cette prière, obéirent diligemment à la volonté de leur Chef.
Luy s'adreſſant à celuy auquel il deuoit auoir à faire;	Lui s’adressant à celui auquel il devait avoir à faire;
Que tardons nous, luy dit-il.	Que tardons nous, lui dit-il.
Voila mes amis en l’eſtat que tu les deſires.	Voilà mes amis en l’état que tu les désires.
En diſant cela, il s’auance pour frapper le premier.	En disant cela, il s’avance pour frapper le premier.
Mais il fut preuenu, & receut vn ſi peſant coup ſur ſon habillement de teſte, qu’il connut par cét eſſay, qu’il auoit trouué vn ennemy tel qu’il l’auoit ſouuant deſiré.	Mais il fut prévenu, et reçut un si pesant coup sur son habillement de tête, qu’il connut par cet essai, qu’il avait trouvé un ennemi tel qu’il l’avait souvent désiré.
Il voulut en meſme temps faire voir ce qu’il valloit, & porta vn coup de toute ſa force à ſon ennemy.	Il voulut en même temps faire voir ce qu’il valait, et porta un coup de toute sa force à son ennemi.
Il le para, & l’ayant paré, frappa derechef le ieune Turc.	Il le para, et l’ayant paré, frappa derechef le jeune Turc.
Ce cœur de Lion ne conſiderant que la victoire, ſe lance de ſon vaiſſeau dans l’autre, & prend ſa reuanche des coups qu’il a reçeus.	Ce cœur de Lion ne considérant que la victoire, se lance de son vaisseau dans l’autre, et prend sa revanche des coups qu’il a reçus.
Il pare;	Il pare;
il preſſe;	il presse;
il frappe;	il frappe;
il ioint l’adreſſe à la force, & taſte ſon ennemy par tout où il croit le trouuer deſarmé.	il joint l’adresse à la force, et tâte son ennemi par tout où il croit le trouver désarmé.
L’autre qui eſt bien aiſe d’auoir trouué vn ſi vaillant aduerſaire, l’eſpargne;	L’autre qui est bien aise d’avoir trouvé un si vaillant adversaire, l’épargne;
& ne luy fait ſentir la peſanteur de ſon bras, qu’autant qu’il y eſt obligé par la neceſſité de vaincre.	et ne lui fait sentir la pesanteur de son bras, qu’autant qu’il y est obligé par la nécessité de vaincre.
Mais ayant laiſſé tomber ſon eſpée ſur la teſte du beau Turc, plus lourdement qu’il ne vouloit, il le fit chanceler;	Mais ayant laissé tomber son épée sur la tête du beau Turc, plus lourdement qu’il ne voulait, il le fit chanceler;
& le força de mettre vn genoüil ſur le plancher.	et le força de mettre un genou sur le plancher.
Cét eſpouuantable coup ayant eſté vu de tous les ſpectateurs;	Cet épouvantable coup ayant été vu de tous les spectateurs;
les vns paſlirent, & les autres par vne indiſcretion de perſonnes trop zelées, crierent que Polexandre eſtoit touſiours ſans pareil, & touſiours victorieux.	les uns pâlirent, et les autres par une indiscrétion de personnes trop zélées, crièrent que Polexandre était toujours sans pareil, et toujours victorieux.
A peine le ieune Turc eut oüy le nom de Polexandre, qu’il ietta ſon eſpée & ſa rondache;	À peine le jeune Turc eut ouï le nom de Polexandre, qu’il jeta son épée et sa rondache;
& ſe vint luy meſme ietter aux pieds de ſon ennemy.	et se vint lui même jeter aux pieds de son ennemi.
Polexandre fut ſurpris de ceſte action, mais il le fut beaucoup plus lors que le ieune Turc ayant oſté ſon caſque;	Polexandre fut surpris de ceste action, mais il le fut beaucoup plus lorsque le jeune Turc ayant osté son casque;
Ouy, luy dit-il, Polexandre eſt touſiours ſans pareil;	Oui, lui dit-il, Polexandre est toujours sans pareil;
eſt touſiours victorieux; & le temeraire Iphidamante eſt trop honoré d’eſtre vaincu par vn bras qui peut vaincre tout le monde.	est toujours victorieux; et le téméraire Iphidamante est trop honoré d’être vaincu par un bras qui peut vaincre tout le monde.
Seigneur, adiouſta-t’il, vous voyez à vos piés cét Iphidamante, qui ſe nommeroit le plus mal-heureux des hommes, s’il n’auoit le bon-heur d’eſtre voſtre frere.	Seigneur, ajouta-t’il, vous voyez à vos pieds cet Iphidamante, qui se nommerait le plus malheureux des hommes, s’il n’avait le bonheur d’être votre frère.
Iphidamante mon frere?	Iphidamante mon frère?
reprit Polexandre.	reprit Polexandre.
Cela ne peut eſtre.	Cela ne peut être.
Iphidamante eſt mort il y a long temps.	Iphidamante est mort il y a longtemps.
Vn homme de fort bonne mine interuenant à ce diſcours, Sire, dit-il à Polexandre, apres auoir bien conſideré le ieune Turc;	Un homme de fort bonne mine intervenant à ce discours, Sire, dit-il à Polexandre, après avoir bien considéré le jeune Turc;
le Prince Iphidamate n'eſt pas mort comme la Reine voſtre mere à voulu vous faire accroire.	le Prince Iphidamate n’est pas mort comme la Reine votre mère à voulu vous faire accroire.
Il fut donné au Sultan Baiazet pour la rançon du Roy voſtre pere.	Il fut donné au Sultan Bajazet pour la rançon du Roi votre père.
quoy donc, s’eſcria Polexandre, c’eſt icy cét Iphidamante que i’ay tant pleuré?	quoi donc, s’écria Polexandre, c’est ici cet Iphidamante que j’ai tant pleuré?
Ha! mon cher frere, que voſtre rencontre m’eſt chere.	Ha! mon cher frère, que votre rencontre m’est chère.
Mais il ne faut pas s’il vous plaiſt, que nous laiſſions eſchapper le vaiſſeau que vous m’auez empeſché de prendre.	Mais il ne faut pas s’il vous plaît, que nous laissions échapper le vaisseau que vous m’avez empêché de prendre.
Si ie le pers, vous perdrez Polexandre le iour meſme que vous le recouurez.	Si je le perds, vous perdrez Polexandre le jour même que vous le recouvrez.
Allons apres.	Allons après.
Il eſt à Alcidiane, & le Pilote qui le conduit, eſt le ſeul qui ſçait la route par laquelle on peut arriuer à l’iſle de ceſte belle Princeſſe.	Il est à Alcidiane, et le Pilote qui le conduit, est le seul qui sait la route par laquelle on peut arriver à l’île de cette belle Princesse.
Iphidamante extrémement faſché d’eſtre cauſe du deſplaiſir de Polexandre;	Iphidamante extrêmement fâché d’être cause du déplaisir de Polexandre;
luy demanda pardon de la faute qu’il auoit faite;	lui demanda pardon de la faute qu’il avait faite;
& oyant ſouſpirer ce Prince qui le tenoit embraſſé;	et oyant soupirer ce Prince qui le tenait embrassé;
Ie fay vœu, luy dit-il, de ne prendre iamais de repos que vous n’ayez recouuert ce que mon indiſcretion vous a fait perdre.	Je fais vœu, lui dit-il, de ne prendre jamais de repos que vous n’ayez recouvert ce que mon indiscrétion vous a fait perdre.
Polexandre le preſſant contre ſa iouë;	Polexandre le pressant contre sa joue;
Mon cher frere, luy reſpondit-il, ie ne refuſe pas ton aſſiſtance.	Mon cher frère, lui répondit-il, je ne refuse pas ton assistance.
Mais ie crains qu’elle ne me vienne trop tard.	Mais je crains qu’elle ne me vienne trop tard.
En diſant cela, il fit commandement que ſes vaiſſeaux allaſſent apres celui d’Alcidiane.	En disant cela, il fit commandement que ses vaisseaux allassent après celui d’Alcidiane.
Ils partirent tous en meſme temps;	Ils partirent tous en même temps;
& celuy d’Iphidamante auec les autres.	et celui d’Iphidamante avec les autres.
Cepandant Polexandre ayant tiré à part ſon frere, & celuy qui eſtoit entré en leur premiere conuerſation;	Cependant Polexandre ayant tiré à part son frère, et celui qui était entré en leur première conversation;
apprit toutes les fortunes que ce beau Prince auoit couruës à la Cour du Grand Seigneur, & l’occaſion qui l’auoit obligé d’abandonner vn Empire où il ne deuoit pas moins eſperer que la premiere place apres le Souuerain.	apprit toutes les fortunes que ce beau Prince avait courues à la Cour du Grand Seigneur, et l’occasion qui l’avait obligé d’abandonner un Empire où il ne devait pas moins espérer que la première place après le Souverain.
Tout à coup, l’impatiance & le deſplaiſir de Polexandre eſclattant;	Tout à coup, l’impatience et le déplaisir de Polexandre éclatant;
indubitablement, dit-il, nous perdrons le vaiſſeau d’Alcidiane.	indubitablement, dit-il, nous perdrons le vaisseau d’Alcidiane.
Faites vne choſe, qui poſſible reüſſira, adiouſta-t’il s’adreſſant à Iphidamante.	Faites une chose, qui possible réussira, ajouta-t-il s’adressant à Iphidamante.
Rentrez dans voſtre nauire, & allez ſeul apres Lyncée.	Rentrez dans votre navire, et allez seul après Lyncée.
Ie m’imagine que pour reconnoiſſance de la faueur qu’il a receuë de vous;	Je m’imagine que pour reconnaissance de la faveur qu’il a reçue de vous;
il vous attendra ſi vous venez à le deſcouurir.	il vous attendra si vous venez à le découvrir.
Ie ne le pourſuis que pour le rendre heureux auſſi bien que moy.	Je ne le poursuis que pour le rendre heureux aussi bien que moi.
Ie ne penſe pas que vous puiſſiez trouuer à redire a vn deſir ſi innocent.	Je ne pense pas que vous puissiez trouver à redire à un désir si innocent.
Iphidamante ayant conſenty à la volonté de Polexandre, r’entra dans ſon vaiſſeau;	Iphidamante ayant consenti à la volonté de Polexandre, rentra dans son vaisseau;
& rencontra le Muët qu’il auoit ſauué de la mer, qui luy fit entendre par ſignes, qu’il vouloit paſſer dans le vaiſſeau de Polexandre.	et rencontra le Muet qu’il avait sauvé de la mer, qui lui fit entendre par signes, qu’il voulait passer dans le vaisseau de Polexandre.
Il ne luy en demanda point la raiſon, pource que c’euſt eſté perdre ſon temps;	Il ne lui en demanda point la raison, pource que c’eût été perdre son temps;
& l’ayant contenté, prit le coſté de l’iſle de Fer qui regarde le Septentrion.	et l’ayant contenté, prit le côté de l’île de Fer qui regarde le Septentrion.
Polexandre ſingla de l’autre coſté; & comme il vouloit commander quelque choſe aux ſiens;	Polexandre singla de l’autre côté; et comme il voulait commander quelque chose aux siens;
il apperceut le Muët en l’action d’vn homme, que la cholere & la douleur tranſportent.	il aperçut le Muet en l’action d’un homme, que la colère et la douleur transportent.
Il luy demanda le ſujet de ſon agitation.	Il lui demanda le sujet de son agitation.
Mais le Muët tournant la teſte d’vn autre coſté, luy preſenta dédaigneuſement la plus petite de ſes riches boiſtes.	Mais le Muet tournant la tête d’un autre côté, lui présenta dédaigneusement la plus petite de ses riches boîtes.
Polexandre n’eut pas pluſtoſt regardé ceſte boiſte qu’il la reconnut;	Polexandre n’eut pas plus tôt regardé cette boîte qu’il la reconnut;
& la prenant auec ardeur, l’ouurit auec encore plus d'inquietude.	et la prenant avec ardeur, l’ouvrit avec encore plus d’inquiétude.
Si toſt quil y vit le beau pourtraict qui y eſtoit enfermé;	Sitôt qu'il y vit le beau portrait qui y était enfermé;
ô! vniques & glorieuſes reliques de mon bon-heur paſſé, dit-il, cher treſor, que ie recouure apres vne ſi longue perte, eſt-ce pour faire reuiure mes eſperances que le Ciel permet que ie vous reuoye?	ô! uniques et glorieuses reliques de mon bonheur passé, dit-il, cher trésor, que je recouvre après une si longue perte, est-ce pour faire revivre mes espérances que le Ciel permet que je vous revoie?
Il me ſemble, ô belle peinture, que vous me reſpondez que mes felicitez retournent auec vous.	Il me semble, ô belle peinture, que vous me répondez que mes félicités retournent avec vous.
Ie vous croy preſque auſſi fermement que ſi Alcidiane m’en aſſuroit de ſa bouche meſme;	Je vous crois presque aussi fermement que si Alcidiane m’en assurait de sa bouche même;
& vous veux conſulter deſormais, comme l’Ourſe fatale, par qui ie me promets de paruenir vn iour à l’iſle inacceſſible.	et vous veux consulter désormais, comme l’Ourse fatale, par qui je me promets de parvenir un jour à l’île inaccessible.
Apres auoir eſté fort long temps attaché ſur ce pourtraict, il repenſa aux moyens d’en recouurer l’original.	Après avoir été fort longtemps attaché sur ce portrait, il repensa aux moyens d’en recouvrer l’original.
Ayant donc fait de grands remerciemens au dédaigneux Muët;	Ayant donc fait de grands remerciements au dédaigneux Muet;
& fait prendre diverſes routes à ſes ſix vaiſſeaux, il demeura ſeul, & fut ſi heureux que le troiſieſme iour, il deſcouurit le nauire d’Alcidiane.	et fait prendre diverses routes à ses six vaisseaux, il demeura seul, et fut si heureux que le troisième jour, il découvrit le navire d’Alcidiane.
Il luy donna deux iours la chaſſe, & faillit à le ioindre entre l’iſle de Teneriffe & la grand' Canarie.	Il lui donna deux jours la chasse, et faillit à le joindre entre l’île de Ténériffe et la grande Canarie.
Mais le fameux Lyncée adiouſtant par ſon art vne nouuelle viſteſſe à ſon vaiſſeau qui eſtoit excellent voilier, eut touſiours de l'aduantage ſur le peſant nauire de Polexandre, & & à la faueur de la nuict & du vent, il ſe déroba tout à fait à ſa veuë.	Mais le fameux Lyncée ajoutant par son art une nouvelle vitesse à son vaisseau qui était excellent voilier, eut toujours de l’avantage sur le pesant navire de Polexandre, et et à la faveur de la nuit et du vent, il se déroba tout à fait à sa vue.
Polexandre deſeſperé de ce mauuais ſuccez, s’en print à la fortune, au vent, à la mer, & quelquefois meſme à Iphidamante.	Polexandre désespéré de ce mauvais succès, s’en prit à la fortune, au vent, à la mer, et quelquefois même à Iphidamante.
Mais eſtant tous quatre eſgalement ſours pour luy, ils ne reſpondoient ny à ſes iniures ny à ſes prieres.	Mais étant tous quatre également sourds pour lui, ils ne répondaient ni à ses injures ni à ses prières.
Il eſt vray qu’Iphidamante contribuoit tous ſes ſoins & tout ſon eſprit au contentement de ſon frere.	Il est vrai qu’Iphidamante contribuait tous ses soins et tout son esprit au contentement de son frère.
