Et ſans mentir nous y appriſmes de ſi bonnes nouuelles, que nous eſperions deſia d’y gaigner plus de ſix fois au double, & d’y auoir aſſeurance pour tous de franchiſe & de liberté durant tout le mois de Septembre, ſuiuant l’ordonnance du Roy de Siam, à cauſe que c’eſtoit le mois des Sumbayas des Roys.	Et sans mentir nous y apprîmes de si bonnes nouvelles, que nous espérions déjà d’y gagner plus de six fois au double, et d’y avoir assurance pour tous de franchise et de liberté durant tout le mois de Septembre, suivant l’ordonnance du Roi de Siam, à cause que c’était le mois des Sumbayas des Rois.
Pour mieux eſclaircir cecy, il faut ſçauoir que dans toute cette coſte de Malaye, & dans le pays commande vn grand Roy, qui pour vn tiltre fameux & recommandable ſur tous les autres Roys, ſe fait appeller Prechau Saleu, Empereur de tout le Sornau, qui eſt vn pays où il y a treize Royaumes, par nous vulgairement appellez Siam, auſquels ſont ſubjects & rendent hommage quatorze petits Roys, qui auoient accouſtumé anciennement, & meſmes eſtoient obligez de s’en aller en perſonne en la ville de Odiaa, capitale de cet Empire de Sornau, qui eſt maintenant vn Royaume, pour y apporter le tribut, à quoy chacun d’eux eſtoit obligé, & de faire la Sumbaya à leur Empereur, qui eſtoit proprement luy baiſer le coutelas qui eſtoit à ſon coſté.	Pour mieux éclaircir ceci, il faut savoir que dans toute cette côte de Malaye, et dans le pays commande un grand Roi, qui pour un titre fameux et recommandable sur tous les autres Rois, se fait appeler Prechau Saleu, Empereur de tout le Sornau, qui est un pays où il y a treize Royaumes, par nous vulgairement appelés Siam, auxquels sont sujets et rendent hommage quatorze petits Rois, qui avaient accoutumé anciennement, et mêmes étaient obligés de s’en aller en personne en la ville de Odiaa, capitale de cet Empire de Sornau, qui est maintenant un Royaume, pour y apporter le tribut, à quoi chacun d’eux était obligé, et de faire la Sumbaya à leur Empereur, qui était proprement lui baiser le coutelas qui était à son côté.
Or d’autant que cette ville eſt ſituée à 50.	Or d’autant que cette ville est située à 50.
lieuës dans le pays, & que les courans des riuieres y ſont fort grands, ces Roys eſtoient quelquesfois contraints d’y paſſer l’hyuer auec vne deſpence fort grande.	lieues dans le pays, et que les courants des rivières y sont fort grands, ces Rois étaient quelquefois contraints d’y passer l’hiver avec une dépense fort grande.
Dequoy le Prechau Roy de Siam ayant eu aduis par vne requeſte, que tous ces 14.	De quoi le Prechau Roi de Siam ayant eu avis par une requête, que tous ces 14.
Roys luy firent enſemble, il euſt agreable de leur changer cette grande ſubjection en vne autre plus petite.	Rois lui firent ensemble, il eût agréable de leur changer cette grande sujétion en une autre plus petite.
Il ordonna donc qu’à l’aduenir il y auroit en ſon nom vn Vice-Roy dans la ville de Lugor, qu’ils appellent en leur langue Poyho, auquel en ſon nom ces quatorze Roys s’en iroient de trois ans en trois ans luy rendre l’hommage & l’obeyſſance qu’ils auoient accouſtumé de luy faire à luy-meſme;	Il ordonna donc qu’à l’avenir il y aurait en son nom un Vice-Roi dans la ville de Lugor, qu’ils appellent en leur langue Poyho, auquel en son nom ces quatorze Rois s’en iraient de trois ans en trois ans lui rendre l’hommage et l’obéissance qu’ils avaient accoutumé de lui faire à lui-même;
qu’au reſte lors que chacun s’acquiteroit des hommages qu’ils deuoient de trois années paſſées, durant tout le mois qu’ils le viendroient faire, leur marchandiſe ſeroit franche de tous impoſts, comme auſſi celle de tous les autres marchands, tant naturels, qu’eſtrangers, qui durant ce mois entreroient dans ce pays, ou en ſortiroient.	qu’au reste lorsque chacun s’acquitterait des hommages qu’ils devaient de trois années passées, durant tout le mois qu’ils le viendraient faire, leur marchandise serait franche de tous impôts, comme aussi celle de tous les autres marchands, tant naturels, qu’étrangers, qui durant ce mois entreraient dans ce pays, ou en sortiraient.
Or pource que nous y arriuaſmes au temps de cette franchiſe, il y auoit vn ſi grand nombre de marchands qui s’y rendoient de toutes parts, qu’on nous aſſeura qu’il y auoit au port de cette ville plus de quinze cents vaiſſeaux tous chargez d’vne infinité de marchandiſes de grand prix.	Or pource que nous y arrivâmes au temps de cette franchise, il y avait un si grand nombre de marchands qui s’y rendaient de toutes parts, qu’on nous assura qu’il y avait au port de cette ville plus de quinze cents vaisseaux tous chargés d’une infinité de marchandises de grand prix.
Voila la bonne nouuelle qu’on nous appriſt lors que nous arriuaſmes à l’emboucheure de la riuiere, dequoy nous fuſmes ſi cõtents, qu’à l’heure meſme nous reſoluſmes auſſi-toſt que le vent ſeroit vn peu fauorable, d’y entrer dedans.	Voilà la bonne nouvelle qu’on nous apprît lorsque nous arrivâmes à l’embouchure de la rivière, de quoi nous fûmes si contents, qu’à l’heure même nous résolûmes aussitôt que le vent serait un peu favorable, d’y entrer dedans.
Mais helas ! nous fuſmes ſi mal heureux, que nous ne puſmes voir ce dequoy nous auions vn ſi grand deſir.	Mais hélas! nous fûmes si malheureux, que nous ne pûmes voir ce de quoi nous avions un si grand désir.
Car enuiron les dix heures, comme nous eſtions ſur le poinct de nous mettre à table, nous n’euſmes pas pluſtoſt diſne en intention de faire voile, que nous viſmes venir ſur la riuiere vn grand Iunco auec les trinquets, la mezaine, qui s’eſgalant à nous, & recognoiſſant que nous eſtions Portugais, fort peu de nombre, & noſtre vaiſſeau petit, fila ſon cable, le laiſſant dériuer ſur nous en mer, iuſqu’à ce qu’il fut eſgal à noſtre prouë du coſté des tribords:	Car environ les dix heures, comme nous étions sur le point de nous mettre à table, nous n’eûmes pas plutôt dîné en intention de faire voile, que nous vîmes venir sur la rivière un grand Junco avec les trinquets, la misaine, qui s’égalant à nous, et reconnaissant que nous étions Portugais, fort peu de nombre, et notre vaisseau petit, fila son câble, le laissant dériver sur nous en mer, jusqu’à ce qu’il fut égal à notre proue du côté des tribords:
lors ceux qui eſtoient dedans nous ietterent des crampõs attachez a deux groſſes chaines de fer fort longues.	lors ceux qui étaient dedans nous jetèrent des crampons attachés à deux grosses chaînes de fer fort longues.
Ainſi comme leur vaiſſeau eſtoit grand, & le noſtre petit nous demeuraſmes accrochez par le leur.	Ainsi comme leur vaisseau était grand, et le nôtre petit nous demeurâmes accrochés par le leur.
Apres qu’ils nous eurent accrochez de cette ſorte, voila que nous viſmes ſortir de deſſous leur tillac enuiron 70.	Après qu’ils nous eurent accrochés de cette sorte, voilà que nous vîmes sortir de dessous leur tillac environ 70.
ou 80.	ou 80.
Mahumetans qui s’y eſtoient cachez iuſqu’à lors, parmy leſquels il y auoit auſſi des Turcs.	Mahométans qui s’y étaient cachés jusqu’alors, parmi lesquels il y avait aussi des Turcs.
A meſme temps il ſe fit vn grand cry parmy eux, & il nous ietterent quantité de pierres, de dards & de lances, qui tomboient ſi dru deſſus nous, qu’il ſembloit que ce fût de la greſle, tellement que de ſeize Portugais que nous eſtions, il en demeura 12.	À même temps il se fit un grand cri parmi eux, et il nous jetèrent quantité de pierres, de dards et de lances, qui tombaient si dru dessus nous, qu’il semblait que ce fût de la grêle, tellement que de seize Portugais que nous étions, il en demeura 12.
ſur la place auec 36.	sur la place avec 36.
autres, tant garçons que Mariniers.	autres, tant garçons que Mariniers.
Quant à nous 4.	Quant à nous 4.
Portugais, apres nous eſtre ſauuez d’vne ſi meſchante rencontre, nous nous iettaſmes tous dans la mer, où il y en euſt vn de noyé, & nous trois qui reſtions, gaignaſmes la terre le mieux que nous pûmes, & ainſi fort bleſſez que nous eſtions, & paſſans à trauers la vaſe où nous enfondrions iuſqu’à my-corps, nous allâmes nous cacher dans le bois.	Portugais, après nous être sauvez d’une si méchante rencontre, nous nous jetâmes tous dans la mer, où il y en eût un de noyé, et nous trois qui restions, gagnâmes la terre le mieux que nous pûmes, et ainsi fort blessés que nous étions, et passant à travers la vase où nous enfondrions jusqu’à mi-corps, nous allâmes nous cacher dans le bois.
Cependant les Mahumetans du Iunco entrez dans le noſtre, n’eſtant pas contents du maſſacre qu’ils auoient fait des noſtres, tous forcenez de rage, tuerent encore ſix ou ſept garçons qu’ils treuuerent bleſſez ſur le tillac, ſans vouloir donner la vie à pas vn d’eux.	Cependant les Mahométans du Junco entrés dans le nôtre, n’étant pas contents du massacre qu’ils avaient fait des nôtres, tous forcenés de rage, tuèrent encore six ou sept garçons qu’ils trouvèrent blessés sur le tillac, sans vouloir donner la vie à pas un d’eux.
Cela fait, ils embarquerent dans leur Iunco toute la marchandiſe de noſtre vaiſſeau, puis y firent vn grand trou, par le moyen duquel ils le coulerent à fonds.	Cela fait, ils embarquèrent dans leur Junco toute la marchandise de notre vaisseau, puis y firent un grand trou, par le moyen duquel ils le coulèrent à fond.
Alors ils laiſſerent leur ancre dans la mer, & les crampons auec leſquels ils nous auoient accrochez, puis ils ſe mirent incontinent à la voile, pour l’apprehenſion qu’ils auoient d’eſtre recogneus.	Alors ils laissèrent leur ancre dans la mer, et les crampons avec lesquels ils nous avaient accrochés, puis ils se mirent incontinent à la voile, pour l’appréhension qu’ils avaient d’être reconnus.
De l’aduenture que nous euſmes nous trois, apres nous eſtre cachez dans le bois.	De l’aventure que nous eûmes nous trois, après nous être cachés dans le bois.
Comme nous viſmes que nous trois eſtions eſchappez de cette malheureuſe rencontre tous bleſſez, & ſans eſperance d’aucun remede, nous euſmes recours aux pleurs, & en hommes forcenez, nous commençaſmes à nous outrager le viſage.	Comme nous vîmes que nous trois étions échappés de cette malheureuse rencontre tous blessés, et sans espérance d’aucun remède, nous eûmes recours aux pleurs, et en hommes forcenés, nous commençâmes à nous outrager le visage.
Car en ce deſaſtre il nous eſtoit impoſſible de nous reſoudre, ſi fort nous eſtions eſtonnez de ce que nous auions veu depuis demie heure.	Car en ce désastre il nous était impossible de nous résoudre, si fort nous étions étonnés de ce que nous avions vu depuis demi-heure.
En cette deſolation nous paſſaſmes le reſte de cette triſte iournée:	En cette désolation nous passâmes le reste de cette triste journée:
mais comme nous apperceuſmes que le lieu eſtoit mareſcageux, & remply de quantité de couleuures & de lezards, nous trouuaſmes que pour noſtre mieux il nous y falloit demeurer toute cette nuict.	mais comme nous aperçûmes que le lieu était marécageux, et rempli de quantité de couleuvres et de lézards, nous trouvâmes que pour notre mieux il nous y fallait demeurer toute cette nuit.
Comme en effet nous l’y paſſaſmes enſeuelis dedans la vase iuſqu’à l’eſtomach.	Comme en effet nous l’y passâmes ensevelis dedans la vase jusqu’à l’estomac.
Le lendemain ſi toſt qu’il fut iour, nous allaſmes le long de la riuiere, & fiſmes en ſorte d’arriuer à vn petit canal que nous n’oſaſmes paſſer, tant pour eſtre fort profond, que pour le grand nombre de lezards que nous y viſmes.	Le lendemain sitôt qu’il fut jour, nous allâmes le long de la rivière, et fîmes en sorte d’arriver à un petit canal que nous n’osâmes passer, tant pour être fort profond, que pour le grand nombre de lézards que nous y vîmes.
Ainſi nous paſſaſmes la nuict en ce meſme lieu auec beaucoup de peine, & y demeuraſmes cinq iours entiers, ſans pouuoir ny paſſer outre, ny reculer, à cauſe des mareſcages tous ionchez d’herbes;	Ainsi nous passâmes la nuit en ce même lieu avec beaucoup de peine, et y demeurâmes cinq jours entiers, sans pouvoir ni passer outre, ni reculer, à cause des marécages tous jonchés d’herbes;
il mourut cependant vn de nos compagnons nommé Baſtien Anriquez homme riche, & qui auoit perdu 8000.	il mourut cependant un de nos compagnons nommé Bastien Anriquez homme riche, et qui avait perdu 8000.
eſcus dans la Lanchare.	écus dans la Lanchare.
De cette façon, de tout ce nombre de gens que nous eſtions auparauant, il ne reſta plus que Chriſtouan Borralho & moy, qui nous miſmes à pleurer au bord de cette riuiere, ſur le corps du pauure defunct qui n’eſtoit qu’à demy enterré.	De cette façon, de tout ce nombre de gens que nous étions auparavant, il ne resta plus que Christouan Borralho et moi, qui nous mîmes à pleurer au bord de cette rivière, sur le corps du pauvre défunt qui n’était qu’à demi enterré.
Car nous eſtions alors ſi foibles, que nous ne pouuions nous remuer, ny preſque parler, tellement que nous faiſions deſia noſtre compte d’acheuer à paſſer en ce lieu, ce peu d’heures que nous eſperions de viure.	Car nous étions alors si faibles, que nous ne pouvions nous remuer, ni presque parler, tellement que nous faisions déjà notre compte d’achever à passer en ce lieu, ce peu d’heures que nous espérions de vivre.
Le lendemain qui eſtoit le 7.	Le lendemain qui était le 7.
iour de noſtre deſaſtre, enuiron Soleil couchant, nous viſmes venir à la rame à mont la riuiere, vne grande barque chargée de ſel, & qui ne fut pas ſi toſt pres de nous, que nous nous proſternaſmes à terre, prians ceux qui eſtoient dedans de nous venir prendre.	jour de notre désastre, environ Soleil couchant, nous vîmes venir à la rame à mont la rivière, une grande barque chargée de sel, et qui ne fut pas sitôt près de nous, que nous nous prosternâmes à terre, priant ceux qui étaient dedans de nous venir prendre.
Eux bien eſtonnez de nous voir, s’arreſterent incontinent, & ſe mirent à nous conſiderer, comme gens qui s’eſtonnoient fort de nous voir ainſi à genoux, & les mains leuées au Ciel, comme ſi nous euſſiõs eſté en prieres.	Eux bien étonnés de nous voir, s’arrêtèrent incontinent, et se mirent à nous considérer, comme gens qui s’étonnaient fort de nous voir ainsi à genoux, et les mains levées au Ciel, comme si nous eussions été en prières.
Neantmoins ſans nous reſpondre autrement, ils firent mine de vouloir ſuiure leur route, ce qui nous obligea derechef de les prier à haute voix, & les larmes aux yeux, de ne point ſouffrir qu’à faute de ſecours, il nous aduint de mourir miſerablement en ce lieu.	Néanmoins sans nous répondre autrement, ils firent mine de vouloir suivre leur route, ce qui nous obligea derechef de les prier à haute voix, et les larmes aux yeux, de ne point souffrir qu’à faute de secours, il nous advint de mourir misérablement en ce lieu.
Alors au bruit de nos cris, & nos gemiſſemens, il ſortit de deſſous le tillac de la barque vne vieille femme, dont le regard plein de grauité la faiſoit paroiſtre telle que nous la recogneuſmes depuis.	Alors au bruit de nos cris, et nos gémissements, il sortit de dessous le tillac de la barque une vieille femme, dont le regard plein de gravité la faisait paraître telle que nous la reconnûmes depuis.
Nous voyant en ſi pitoyable eſtat, & bleſſez comme nous eſtions, touchée de noſtre deſaſtre, & des playes que nous luy monſtrions, elle prit en main vn baſton dont elle frappa quatre ou cinq fois les Mariniers, à cauſe qu’ils refuſoient de nous prendre.	Nous voyant en si pitoyable état, et blessés comme nous étions, touchée de notre désastre, et des plaies que nous lui montrions, elle prit en main un bâton dont elle frappa quatre ou cinq fois les Mariniers, à cause qu’ils refusaient de nous prendre.
Par ce moyen elle fit approcher la barque de terre, où ſe ietterent incontinent quatre ou cinq des gens du Nauire, qui par le commandement qu’elle leur en fit, nous chargerent ſur leurs eſpaules, & nous mirent dans la barque.	Par ce moyen elle fit approcher la barque de terre, où se jetèrent incontinent quatre ou cinq des gens du Navire, qui par le commandement qu’elle leur en fit, nous chargèrent sur leurs épaules, et nous mirent dans la barque.
Cette honorable femme bien faſchée de nous voir ainſi bleſſez, & couuerts de chemiſes & calçons tous enſanglantez & fangeux, les fit incontinent lauer, & apres nous auoir fait bailler à chacun vn linge pour nous couurir, elle voulut que nous fuſſions aſſis aupres d’elle.	Cette honorable femme bien fâchée de nous voir ainsi blessés, et couverts de chemises et caleçons tous ensanglantés et fangeux, les fit incontinent laver, et après nous avoir fait bailler à chacun un linge pour nous couvrir, elle voulut que nous fussions assis auprès d’elle.
Puis commandé qu’elle euſt qu’on nous apportaſt à manger, elle meſme nous en preſentant de ſa propre main, Mangez, mangez, nous diſt-elle, pauures eſtrangers, & ne vous affligez point de vous voir reduits en l’equipage où vous eſtes;	Puis commandé qu’elle eût qu’on nous apportât à manger, elle même nous en présentant de sa propre main, Mangez, mangez, nous dit-elle, pauvres étrangers, et ne vous affligez point de vous voir réduits en l’équipage où vous êtes;
car moy, que vous voyez maintenant, & qui ne ſuis qu’vne femme, qui n’ay pas atteint encore l’aage de 50.	car moi, que vous voyez maintenant, et qui ne suis qu’une femme, qui n’ai pas atteint encore l’âge de 50.
ans, il n’y en a pas ſix que ie me ſuis veuë eſclaue, & volée de plus de cent mille ducats de mon bien.	ans, il n’y en a pas six que je me suis vue esclave, et volée de plus de cent mille ducats de mon bien.
Ce n’eſt pas le tout encore, à cette infortune a eſté iointe la mort de trois fils que i’auois, & celle de mon mary que ie tenois plus cher que les yeux dont ie le regardois.	Ce n’est pas le tout encore, à cette infortune a été jointe la mort de trois fils que j’avais, et celle de mon mari que je tenais plus cher que les yeux dont je le regardais.
Yeux, helas ! auec leſquels ie vis mettre en pieces par les trompes des Elephans du Roy de Siam, tant le pere comme les fils, enſemble deux freres & vn gendre que i’auois.	Yeux, hélas! avec lesquels je vis mettre en pièces par les trompes des Éléphants du Roi de Siam, tant le père comme les fils, ensemble deux frères et un gendre que j’avais.
I’ay mené touſiours depuis vne vie außi triſte que languiſſante, & à tous ces deſplaiſirs en ont ſuccedé beaucoup d’autres encore plus grands.	J’ai mené toujours depuis une vie aussi triste que languissante, et à tous ces déplaisirs en ont succédé beaucoup d’autres encore plus grands.
Car par vne impitoyable fortune i’ay veu trois miennes filles à marier, enſemble mes pere & mere, & trente-deux de mes parens, nepueux, couſins, iettez en des fournaiſes ardentes, durant lequel temps leurs gemiſſemens & leur cris eſtoient ſi grands qu’ils perçoient le Ciel, afin que Dieu les ſecouruſt en la violence de ce tourment inſuportable.	Car par une impitoyable fortune j’ai vu trois miennes filles à marier, ensemble mes père et mère, et trente-deux de mes parents, neveux, cousins, jetés en des fournaises ardentes, durant lequel temps leurs gémissements et leur cris étaient si grands qu’ils perçaient le Ciel, afin que Dieu les secourût en la violence de ce tourment insupportable.
Mais helas ! l’enormité de mes pechez a bouché ſans doute les oreilles à l’infinie clemence du Seigneur des Seigneurs, afin qu’il n’ouyſt cette derniere requeſte, qui me ſembloit ſi iuſte & ſi legitime, en quoy toutesfois ie me ſuis trompée, puis qu’il n’y a rien de plus aſſeuré que ce qu’il plaiſt à ſa diuine Maieſté ordonner.	Mais hélas! l’énormité de mes péchés a bouché sans doute les oreilles à l’infinie clémence du Seigneur des Seigneurs, afin qu’il n’ouït cette dernière requête, qui me semblait si juste et si légitime, en quoi toutefois je me suis trompée, puisqu’il n’y a rien de plus assuré que ce qu’il plaît à sa divine Majesté ordonner.
A ce diſcours nous luy reſpondiſmes, que les pechez que nous auions auſſi commis contre luy, eſtoient cauſe de noſtre infortune.	À ce discours nous lui répondîmes, que les péchés que nous avions aussi commis contre lui, étaient cause de notre infortune.
Puiſque cela eſt, nous repliqua elle, meſlant ſes larmes aux noſtres, il eſt touſiours bon d’aduoüer en vos aduerſitez, que les touches de la main de Dieu ſont bien vrayes, pource qu’en cette verité, enſemble en vne confeſſion de bouche, en vn deſplaiſir de l’auoir offencé, & en vne ferme reſolution de n’y plus retourner, conſiſte tout le remede de vos trauaux & des miens.	Puisque cela est, nous répliqua elle, mêlant ses larmes aux nôtres, il est toujours bon d’avouer en vos adversités, que les touches de la main de Dieu sont bien vraies, pource qu’en cette vérité, ensemble en une confession de bouche, en un déplaisir de l’avoir offensé, et en une ferme résolution de n’y plus retourner, consiste tout le remède de vos travaux et des miens.
Nous ayants ainſi entretenus ſur ſon infortune, elle s’enquiſt de nous, des cauſes de la noſtre, & de quelle façon nous auions eſté reduits en ce miſerable eſtat.	Nous ayant ainsi entretenus sur son infortune, elle s’enquit de nous, des causes de la nôtre, et de quelle façon nous avions été réduits en ce misérable état.
Là deſſus nous luy racontaſmes comme le tout s’eſtoit paſſé, ſans que nous euſſions peu recognoiſtre ny celuy qui nous auoit ainſi mal traictez, ny le ſuiet qui l’auoit obligé à le faire.	Là-dessus nous lui racontâmes comme le tout s’était passé, sans que nous eussions peu reconnaître ni celui qui nous avait ainsi maltraités, ni le sujet qui l’avait obligé à le faire.
A cela les ſiens reſpondirent, que le grand Iunco dont nous parlions eſtoit à vn Mahumetan Guzarate de nation, nommé Coia Acem, qui ce meſme matin eſtoit ſorty de la riuiere chargé de breſil, pour s’en aller en l’Iſle d’Ainan.	À cela les siens répondirent, que le grand Junco dont nous parlions était à un Mahométan Guzarate de nation, nommé Coja Acem, qui ce même matin était sorti de la rivière chargé de brésil, pour s’en aller en l’Île d’Ainan.
A ces mots cette bonne Dame frappant ſa poictrine, & faiſant paroiſtre qu’elle eſtoit grandement eſtonnée, Que l’on me face mourir, diſt elle, ſi cela n’eſt, car i’ay ouy ce Mahumetan dont vous parlez, ſe vanter publiquement deuant tous ceux qui le vouloient eſcouter, qu’il auoit autresfois mis à mort vn grand nombre de gens de la race de ceux de Malaca, & qu’il les hayſſoit tellement, qu’il auoit promis à ſon Mahomet d’en tuer encore vne fois autant.	À ces mots cette bonne Dame frappant sa poitrine, et faisant paraître qu’elle était grandement étonnée, Que l’on me face mourir, dit-elle, si cela n’est, car j’ai ouï ce Mahométan dont vous parlez, se vanter publiquement devant tous ceux qui le voulaient écouter, qu’il avait autrefois mis à mort un grand nombre de gens de la race de ceux de Malaca, et qu’il les haïssait tellement, qu’il avait promis à son Mahomet d’en tuer encore une fois autant.
Eſtonnez d’vne telle nouueauté, nous la priaſmes de nous declarer qui eſtoit cet homme là, & le ſuiet qui l’obligeoit à nous vouloir tant de mal.	Étonnez d’une telle nouveauté, nous la priâmes de nous déclarer qui était cet homme-là, et le sujet qui l’obligeait à nous vouloir tant de mal.
La reſponſe qu’elle nous fit là deſſus, fut qu’elle n’en ſçauoit autre raiſon, ſinon qu’vn grand Capitaine de noſtre nation, nommé Hector de Sylueira luy auoit tué ſon pere, & deux freres dans vn Nauire qu’il leur auoit pris au deſtroit de la Mecque, qui venoient de Iudas, & s’en alloient à Dabul.	La réponse qu’elle nous fit là dessus, fut qu’elle n’en savait autre raison, sinon qu’un grand Capitaine de notre nation, nommé Hector de Sylveira lui avait tué son père, et deux frères dans un Navire qu’il leur avait pris au détroit de la Mecque, qui venaient de Judas, et s’en allaient à Dabul.
Voila ce que nous diſt de luy cette Dame, qui durant que nous fuſmes enſemble, nous raconta pluſieurs autres particularitez touchant la grande hayne que ce Mahumetan nous portoit, & ſur ce qu’il diſoit de nous pour taſcher de nous rendre infames.	Voilà ce que nous dit de lui cette Dame, qui durant que nous fûmes ensemble, nous raconta plusieurs autres particularités touchant la grande haine que ce Mahométan nous portait, et sur ce qu’il disait de nous pour tâcher de nous rendre infâmes.
