Dequoy Antonio de Faria ſe ſentit tellement offencé, qu’il leur fit tirer vne volée de canon, pour voir ſi cela les rendroit plus courtois.	De quoi Antonio de Faria se sentit tellement offensé, qu’il leur fit tirer une volée de canon, pour voir si cela les rendrait plus courtois.
A cette canonnade ils firent reſponſe de cinq balles, ſçauoir trois de faulconneaux, & de deux autres petites pieces de campagne, que les Portugais appellent Camellos.	À cette canonnade ils firent réponse de cinq balles, savoir trois de fauconneaux, et de deux autres petites pièces de campagne, que les Portugais appellent Camellos.
Ce qui nous eſtonna fort, ſi bien que prenans conſeil de ce que nous ferions alors, nous reſoluſmes de demeurer au lieu où nous eſtions, pour ne iuger à propos d’entreprendre vne choſe ſi douteuſe, iuſqu’à ce que le lendemain le iour nous fit recognoiſtre les forces de ce vaiſſeau pour l’attaquer par apres auec plus d’aſſeurance, ou le laiſſer paſſer;	Ce qui nous étonna fort, si bien que prenant conseil de ce que nous ferions alors, nous résolûmes de demeurer au lieu où nous étions, pour ne juger à propos d’entreprendre une chose si douteuse, jusqu’à ce que le lendemain le jour nous fit reconnaître les forces de ce vaisseau pour l’attaquer par après avec plus d’assurance, ou le laisser passer;
ce conſeil ſembla bon à Antonio de Faria, & à tous nous autres, qui faiſans bonne garde, & donnans ordre au neceſſaire, demeuraſmes en ce lieu attendant le iour, & ſur les deux heures apres minuict nous viſmes ſur l’horizon de la mer trois choſes noires à fleur d’eau, que nous ne puſmes bien reconnoiſtre, ce qui fut cauſe que nous eſueillaſmes Antonio de Faria, qui pour lors eſtoit ſur le tillac, & couché ſur vn poulailler, & luy monſtraſmes ce que nous voyons, qui n’eſtoit pas alors beaucoup loing de nous;	ce conseil sembla bon à Antonio de Faria, et à tous nous autres, qui faisant bonne garde, et donnant ordre au nécessaire, demeurâmes en ce lieu attendant le jour, et sur les deux heures après minuict nous vîmes sur l’horizon de la mer trois choses noires à fleur d’eau, que nous ne pûmes bien reconnaître, ce qui fut cause que nous éveillâmes Antonio de Faria, qui pour lors était sur le tillac, et couché sur un poulailler, et lui montrâmes ce que nous voyons, qui n’était pas alors beaucoup loin de nous;
& craignant comme nous faiſions, que ce ne fuſſent des ennemis, il s’eſcria Arme, Arme, Arme, il fut auſſi-toſt obey, & ainſi s’aſſeura de ce dont il ſe doutoit touchant ce que nous auions veu;	et craignant comme nous faisions, que ce ne fussent des ennemis, il s’écria Arme, Arme, Arme, il fut aussitôt obéi, et ainsi s’assura de ce dont il se doutait touchant ce que nous avions vu;
& recognoiſſans que c’eſtoient des vaiſſeaux de rame qui venoient à nous, nous priſmes incontinent les armes, & fuſmes poſez par le Capitaine aux lieux les plus neceſſaires pour nous defendre.	et reconnaissant que c’étaient des vaisseaux de rame qui venaient à nous, nous prîmes incontinent les armes, et fûmes posés par le Capitaine aux lieux les plus nécessaires pour nous défendre.
Il nous ſembla pour lors les voyant venir, voguans à la ſourdine, que c’eſtoient les ennemis du iour precedent;	Il nous sembla pour lors les voyant venir, voguant à la sourdine, que c’étaient les ennemis du jour précédent;
& d’autant qu’en ce lieu il n’y auoit aucune choſe dequoy nous peuſſions auoir crainte, il dit aux ſoldats:	et d’autant qu’en ce lieu il n’y avait aucune chose de quoi nous pussions avoir crainte, il dit aux soldats:
Meſſieurs & freres, c’eſt vn voleur qui nous vient attaquer, à qui il ſemble que nous ne ſoyons que ſix ou ſept, ainſi que l’on a de couſtume d’eſtre en ces vaiſſeaux;	Messieurs et frères, c’est un voleur qui nous vient attaquer, à qui il semble que nous ne soyons que six ou sept, ainsi que l’on a de coutume d’être en ces vaisseaux;
& afin qu’au nom de Ieſus-Chriſt nous puiſſions faire choſe qui ſoit bonne, que chacun ſe baiſſe, afin qu’ils ne puiſſent voir pas vn de nous, & lors nous cognoiſtrons leur deſſein, & ce qu’ils veulent de nous.	et afin qu’au nom de Jésus-Christ nous puissions faire chose qui soit bonne, que chacun se baisse, afin qu’ils ne puissent voir pas un de nous, et lors nous connaîtrons leur dessein, et ce qu’ils veulent de nous.
Cependant qu’on tienne preſts les pots de poudre, par le moyen deſquels & de nos eſpées, i’eſpere que nous viendrons à bout de cette aduanture.	Cependant qu’on tienne prêts les pots de poudre, par le moyen desquels et de nos épées, j’espère que nous viendrons à bout de cette aventure.
Que chacun auſſi cache bien ſa meſche, afin qu’ils ne voyent point de feu, & que par ce moyen ils puiſſent croire que nous ſommes tous endormis;	Que chacun aussi cache bien sa mèche, afin qu’ils ne voient point de feu, et que par ce moyen ils puissent croire que nous sommes tous endormis;
ce qui fut incontinent fait, comme il l’auoit ordonné auec prudence & conſeil.	ce qui fut incontinent fait, comme il l’avait ordonné avec prudence et conseil.
Ces trois vaiſſeaux nous ayans approchez de la longueur d’vn trait d’arbaleſtre, enuironnerent noſtre lorche de poupe & de prouë;	Ces trois vaisseaux nous ayant approchés de la longueur d’un trait d’arbalète, environnèrent notre lorche de poupe et de proue;
apres nous auoir recogneus ſe tournerent pour ſe ioindre cõme s’ils euſſent fait vn nouueau cõſeil, & furent ainſi ioints l’eſpace d’vn quart d’heure.	après nous avoir reconnus se tournèrent pour se joindre comme s’ils eussent fait un nouveau conseil, et furent ainsi joints l’espace d’un quart d’heure.
Cela fait, ils ſe ſeparerent en deux, ſçauoir les deux plus petits enſemble, qui ſe mirent à noſtre poupe, & l’autre plus grand, & qui eſtoit le mieux armé, nous attaqua du coſté d’eſtribord.	Cela fait, ils se séparèrent en deux, savoir les deux plus petits ensemble, qui se mirent à notre poupe, et l’autre plus grand, et qui était le mieux armé, nous attaqua du côté de tribord.
Alors chacun entra dans noſtre Lorche de l’endroit qu’il croyoit eſtre le plus à propos, tellement qu’en moins d’vn demy quart d’heure, plus de quarante hommes y entrerent.	Alors chacun entra dans notre Lorche de l’endroit qu’il croyait être le plus à propos, tellement qu’en moins d’un demi quart d’heure, plus de quarante hommes y entrèrent.
Alors Antonio de Faria ſortit de deſſous le demy pont, où il eſtoit auec quelques quarante ſoldats, & inuoquant S.	Alors Antonio de Faria sortit de dessous le demi-pont, où il était avec quelques quarante soldats, et invoquant S.
Iacques leur Patron, ſe ietta ſur eux ſi courageuſement, qu’en peu de temps il les mit preſque tous a mort.	Jacques leur Patron, se jeta sur eux si courageusement, qu’en peu de temps il les mit presque tous à mort.
Puis s’aydant de quantité de pots de poudre contre ceux qui eſtoient dans les trois vaiſſeaux, il acheua de les défaire, & les contraignit de ſe ietter tous dans la mer.	Puis s’aidant de quantité de pots de poudre contre ceux qui étaient dans les trois vaisseaux, il acheva de les défaire, et les contraignit de se jeter tous dans la mer.
Auec cet aduantage nous ſautaſmes dans leurs Nauires, & les priſmes toutes trois, & ainſi Dieu nous fit la grace, que ſans aucun peril, tout nous demeura entre les mains;	Avec cet avantage nous sautâmes dans leurs Navires, et les prîmes toutes trois, et ainsi Dieu nous fit la grâce, que sans aucun péril, tout nous demeura entre les mains;
ioint que de tous ceux qui s’eſtoient iettez dans la mer, il n’en fut repris que cinq, qui eſtoient encore en vie, l’vn deſquels eſtoit l’eſclaue Cafre qui nous auoit monſtré ſon derriere, & les quatre autres eſtoient vn Turc, deux Achems, & le Capitaine d’vn Iunco nommé Similau, grand Corſaire, & noſtre ennemy mortel;	joint que de tous ceux qui s’étaient jetés dans la mer, il n’en fut repris que cinq, qui étaient encore en vie, l’un desquels était l’esclave Cafre qui nous avait montré son derrière, et les quatre autres étaient un Turc, deux Achems, et le Capitaine d’un Junco nommé Similau, grand Corsaire, et notre ennemi mortel;
Antonio de Faria les fit incontinent mettre à la gehenne, pour ſçauoir d’eux qui ils eſtoient, d’où ils venoient, & ce qu’ils nous vouloient.	Antonio de Faria les fit incontinent mettre à la géhenne, pour savoir d’eux qui ils étaient, d’où ils venaient, et ce qu’ils nous voulaient.
A cela les deux Achems reſpondirent brutalement;	À cela les deux Achems répondirent brutalement;
& comme l’on vouloit auſſi guinder & leuer l’eſclaue qui eſtoit deſia lié pour le tourmenter, il ſe prit à pleurer, priant qu’on ne luy fiſt point de mal;	et comme l’on voulait aussi guinder et lever l’esclave qui était déjà lié pour le tourmenter, il se prit à pleurer, priant qu’on ne lui fît point de mal;
qu’au reſte il eſtoit Chreſtien, comme nous, & que ſans eſtre mis au tourment, il diroit la verité de ce qu’on luy demanderoit.	qu’au reste il était Chrétien, comme nous, et que sans être mis au tourment, il dirait la vérité de ce qu’on lui demanderait.
Antonio de Faria le fit delier, & l’approchant aupres de ſoy, luy fit donner vn morceau de biſcuit, & vne taſſe de vin.	Antonio de Faria le fit délier, et l’approchant auprès de soi, lui fit donner un morceau de biscuit, et une tasse de vin.
Puis l’amadoüant par belles paroles, le pria de luy declarer la verité, puis qu’il eſtoit Chreſtien ainſi qu’il diſoit.	Puis l’amadouant par belles paroles, le pria de lui déclarer la vérité, puis qu’il était Chrétien ainsi qu’il disait.
A quoy il fit reſponſe en ces termes.	À quoi il fit réponse en ces termes.
Si ie ne la vous dis, ne me tenez point pour tel que ie ſuis, ie me nomme Sebaſtien, & ay eſté captif de Gaſpar de Mello, que ce chien de Similau, qui eſt là preſent, tua, il y a enuiron deux ans en Liapoo, auec vingt-cinq Portugais qu’il auoit en ſon Nauire.	Si je ne la vous dis, ne me tenez point pour tel que je suis, je me nomme Sébastien, et ai été captif de Gaspar de Mello, que ce chien de Similau, qui est là présent, tua, il y a environ deux ans en Liapoo, avec vingt-cinq Portugais qu’il avait en son Navire.
Ce qu’entendant Antonio de Faria il fit vn grand cry, comme vn homme remply d’eſtonnement, & diſt:	Ce qu’entendant Antonio de Faria il fit un grand cri, comme un homme rempli d’étonnement, et dit:
Tout beau, ie n’en veux pas ſçauoir dauantage, c’eſt donc là ce chien de Similau qui a tué ton Maiſtre ? Et il reſpondit, Ouy c’eſt luy, & qui vouloit à preſent vous faire le ſemblable, eſtimant que vous n’eſtiez que ſix ou ſept:	Tout beau, je n’en veux pas savoir davantage, c’est donc là ce chien de Similau qui a tué ton Maître? Et il répondit, Oui c’est lui, et qui voulait à présent vous faire le semblable, estimant que vous n’étiez que six ou sept:
& pour cet effet il s’eſt embarqué à la haſte en intention, ainſi qu’il diſoit, de vous prendre en vie, pour vous faire ſortir la ceruelle de la teſte auec vn frontail de corde, comme il a fait à mon Maiſtre;	et pour cet effet il s’est embarqué à la hâte en intention, ainsi qu’il disait, de vous prendre en vie, pour vous faire sortir la cervelle de la tête avec un frontail de corde, comme il a fait à mon Maître;
mais Dieu permet qu’il paye le mal qu’il a commis.	mais Dieu permet qu’il paye le mal qu’il a commis.
Antonio de Faria voyant ce que luy diſoit cet eſclaue, qui luy aſſeura pluſieurs fois que ce chien de Similau auoit amené auec luy tous ſes hommes de guerre, & que dans ſon Iunco il n’eſtoit demeuré que quarante Mariniers Chinois, il ſe reſolut de s’ayder de cette bonne fortune, apres auoir fait mourir Similau & ſes autres compagnons, leur faiſant ſauter la ceruelle de la teſte auec vne corde, comme Similau auoit fait en Liampao à Gaſpar de Melle, & aux autres Portugais.	Antonio de Faria voyant ce que lui disait cet esclave, qui lui assura plusieurs fois que ce chien de Similau avait amené avec lui tous ses hommes de guerre, et que dans son Junco il n’était demeuré que quarante Mariniers Chinois, il se résolut de s’aider de cette bonne fortune, après avoir fait mourir Similau et ses autres compagnons, leur faisant sauter la cervelle de la tête avec une corde, comme Similau avait fait en Liampao à Gaspar de Melle, et aux autres Portugais.
Il s’embarqua incontinent auec trente ſoldats dans le bateau, & dans les Machuas, dans leſquels les ennemis eſtoient venus de Preuau;	Il s’embarqua incontinent avec trente soldats dans le bateau, et dans les Machuas, dans lesquels les ennemis étaient venus de Prevau;
à l’occaſion de la marée & du vent fauorable, en moins d’vne heure il arriua où eſtoit le Iunco ancré à mont la riuiere, vne lieuë loing de nous;	à l’occasion de la marée et du vent favorable, en moins d’une heure il arriva où était le Junco ancré à mont la rivière, une lieue loin de nous;
& l’ayant abordé s’y ietta ſans bruit, & ſe rendit maiſtre de la poupe, de laquelle ſeulement quatre pots de poudre qu’il ietta ſur le tillac où eſtoit cette canaille endormie, les firent tous ſauter dans la mer;	et l’ayant abordé s’y jeta sans bruit, et se rendit maître de la poupe, de laquelle seulement quatre pots de poudre qu’il jeta sur le tillac où était cette canaille endormie, les firent tous sauter dans la mer;
dont il en mourut dix ou douze, & les autres, à cauſe qu’ils crioient ſur l’eau, qu’ils ſe noyoient, & qu’on les prit, Antonio de Faria en fit tirer, à cauſe qu’il auoit beſoin d’eux pour la nauigation du Iunco, qui eſtoit fort grand & haut.	dont il en mourut dix ou douze, et les autres, à cause qu’ils criaient sur l’eau, qu’ils se noyaient, et qu’on les prit, Antonio de Faria en fit tirer, à cause qu’il avait besoin d’eux pour la navigation du Junco, qui était fort grand et haut.
Et voila comme il pleuſt à Dieu par vn iuſte iugement de ſa diuine Iuſtice, que la gloire de ce chien maudit fut le miniſtre qui mit en execution le chaſtiment de ſes cruautez, & qu’entre les mains des Portugais il receuſt la punition de ce qu’il leur auoit fait.	Et voilà comme il plut à Dieu par un juste jugement de sa divine Justice, que la gloire de ce chien maudit fut le ministre qui mit en exécution le châtiment de ses cruautés, et qu’entre les mains des Portugais il reçût la punition de ce qu’il leur avait fait.
Alors enuiron le poinct du iour faiſant inuentaire de toute la priſe, il ſe treuua trente ſix mille Taeis en argent du Iappon, qui valent de noſtre monnoye cinquante-quatre mille ducats, outre pluſieurs ſortes de bonnes marchandiſes qui pour lors ne furent priſées, pour n’en auoir pas eu le temps, à cauſe que le pays eſtoit deſia mutiné, & que les habitans y faiſoient quantité de feux, auec leſquels ils ont accouſtumé de ſe donner des aduis les vns aux autres, quand il y a quelque allarme d’ennemis;	Alors environ le point du jour faisant inventaire de toute la prise, il se trouva trente-six mille Taels en argent du Japon, qui valent de notre monnaie cinquante-quatre mille ducats, outre plusieurs sortes de bonnes marchandises qui pour lors ne furent prisées, pour n’en avoir pas eu le temps, à cause que le pays était déjà mutiné, et que les habitants y faisaient quantité de feux, avec lesquels ils ont accoutumé de se donner des avis les uns aux autres, quand il y a quelque alarme d’ennemis;
ce qui contraignit Antonio de Faria de faire voile en diligence.	ce qui contraignit Antonio de Faria de faire voile en diligence.
Comment Antonio de Faria arriua à la riuiere de Tinacoreu, que nous appellons Varella, & de l’aduis que luy donnerent quelques marchands de ce Royaume.	Comment Antonio de Faria arriva à la rivière de Tinacoreu, que nous appelons Varella, et de l’avis que lui donnèrent quelques marchands de ce Royaume.
Antonio de Faria partit de cette riuiere de Toobaſoy, vn Mercredy matin veille de la Feſte-Dieu, en l’année 1540.	Antonio de Faria partit de cette rivière de Toobasoy, un Mercredi matin veille de la Fête-Dieu, en l’année 1540.
& nauigea le long de la coſte du Royaume de Champaa, craignant de s’éloigner auec le vent de l’Eſt, lequel en cet endroit eſt ſouuent impetueux, principalement en la conionction des nouuelles & pleines Lunes.	et navigua le long de la côte du Royaume de Champaa, craignant de s’éloigner avec le vent de l’Est, lequel en cet endroit est souvent impétueux, principalement en la conjonction des nouvelles et pleines Lunes.
Le Vendredy ſuiuant nous nous trouuaſmes vis à vis d’vne riuiere, que les habitans du pays nomment Tinacoreu, & que nous autres appellons Varella, où il fut trouué à propos par le conſeil de quelques-vns de nous, d’y entrer, pour s’informer de quelqu’vn, de ce que Pedro de Faria auoit enuie de ſçauoir, & auſſi pour voir ſi en ce lieu là il n’auroit point nouuelles de Coia Achem qu’il cherchoit;	Le Vendredi suivant nous nous trouvâmes vis-à-vis d’une rivière, que les habitants du pays nomment Tinacoreu, et que nous autres appelons Varella, où il fut trouvé à propos par le conseil de quelques-uns de nous, d’y entrer, pour s’informer de quelqu’un, de ce que Pedro de Faria avait envie de savoir, et aussi pour voir si en ce lieu-là il n’aurait point nouvelles de Coja Achem qu’il cherchait;
parce que tous les Iuncos de Siam, & de toute la coſte de Malaye qui nauigent à la Chine, ont accouſtumé de faire leur commerce en cette riuiere, où par fois ils vendent bien leur marchandiſe en échange d’or & de bois de Calambouc, & auſſi d’yuoire, dont ce Royaume eſt abondant;	parce que tous les Juncos de Siam, et de toute la côte de Malaye qui naviguent à la Chine, ont accoutumé de faire leur commerce en cette rivière, où parfois ils vendent bien leur marchandise en échange d’or et de bois de Calambouc, et aussi d’ivoire, dont ce Royaume est abondant;
& ayant donné fonds vn peu plus auant que l’emboucheure, vis à vis d’vn petit village nommé Taiquilleu, il vint incontinent à nous force paraoos, & pluſieurs petites barques de peſcheurs pleines de rafraiſchiſſements, leſquels n’ayans encore veu des hommes faits comme nous, ſe dirent les vns aux autres, Voicy vne grande nouueauté auec laquelle Dieu nous viſite, prions-le qu’il luy plaiſe par ſa bonté infinie, que ces hommes barbus ne ſoient ceux qui pour leur profit & intereſt particulier eſtoient les pays, comme marchands, & apres les pillent comme larrons.	et ayant donné fonds un peu plus avant que l’emboucheure, vis-à-vis d’un petit village nommé Taiquilleu, il vint incontinent à nous force paraoos, et plusieurs petites barques de pêcheurs pleines de rafraîchissements, lesquels n’ayant encore vu des hommes faits comme nous, se dirent les uns aux autres, Voici une grande nouveauté avec laquelle Dieu nous visite, prions-le qu’il lui plaise par sa bonté infinie, que ces hommes barbus ne soient ceux qui pour leur profit et intérêt particulier étaient les pays, comme marchands, et après les pillent comme larrons.
Retirons nous dans le bois, de peur que les eſtincelles de ces tiſons blanchis par le viſage, auec la blancheur des cendres qu’ils portent ſur leurs yeux, ne bruſlent les maiſons où nous habitons, & ne reduiſent en cendre les champs de nos labeurs, comme ils ont accouſtumé de faire aux terres d’autruy.	Retirons-nous dans le bois, de peur que les étincelles de ces tisons blanchis par le visage, avec la blancheur des cendres qu’ils portent sur leurs yeux, ne brûlent les maisons où nous habitons, et ne réduisent en cendre les champs de nos labeurs, comme ils ont accoutumé de faire aux terres d’autrui.
A quoy quelques-vns des leurs firent reſponſe, A Dieu ne plaiſe que cela ſoit, & encore que par malheur ils ſoient deſia chez nous, au moins faiſons en ſorte qu’ils ne puiſſent recognoiſtre que nous les redoutions comme nos ennemis:	À quoi quelques-uns des leurs firent réponse, À Dieu ne plaise que cela soit, et encore que par malheur ils soient déjà chez nous, au moins faisons en sorte qu’ils ne puissent reconnaître que nous les redoutions comme nos ennemis:
car ſi cela eſt, ils nous attaqueront auec plus d’aſſeurance.	car si cela est, ils nous attaqueront avec plus d’assurance.
C’est pourquoy le meilleur eſt, qu’auec vn ioyeux ſemblant, & des paroles de courtoiſie, nous taſchions d’apprendre ce qu’ils pretendent de nous, afin que ſçachants d’eux la verité, nous l’eſcriuions incontinent à Hoyaa Paquir, à Congrau où il eſt à preſent.	C’est pourquoi le meilleur est, qu’avec un joyeux semblant, et des paroles de courtoisie, nous tâchions d’apprendre ce qu’ils prétendent de nous, afin que sachant d’eux la vérité, nous l’écrivions incontinent à Hoyaa Paquir, à Congrau où il est à présent.
Antonio de Faria feignant de ne les entendre, encore que ce qu’ils diſoient, luy fut redit par vn interprete, les receut honneſtement, & achepta d’eux les rafraiſchiſſements qu’ils apportoient, qu’il leur fit payer comme ils deſiroient.	Antonio de Faria feignant de ne les entendre, encore que ce qu’ils disaient, lui fut redit par un interprète, les reçut honnêtement, et acheta d’eux les rafraîchissements qu’ils apportaient, qu’il leur fit payer comme ils désiraient.
Dequoy ils ſe tinrent pour grandement ſatisfaits, & eux luy demandans d’où il eſtoit, & ce qu’il vouloit, il leur fit reſponſe qu’il eſtoit du Royaume de Siam, de la contrée des eſtrangers de Tanauçarim, & que comme marchand qu’il eſtoit, il alloit en l’Iſle de Lequios pour trafiquer, & qu’il n’eſtoit venu en ce lieu que pour ſçauoir des nouuelles d’vn ſien amy nommé Coia Acem, qui s’y en alloit auſſi, ſur quoy il s’enquiſt d’eux s’il eſtoit encore paſſé, ou non;	De quoi ils se tinrent pour grandement satisfaits, et eux lui demandant d’où il était, et ce qu’il voulait, il leur fit réponse qu’il était du Royaume de Siam, de la contrée des étrangers de Tanauçarim, et que comme marchand qu’il était, il allait en l’Île de Lequios pour trafiquer, et qu’il n’était venu en ce lieu que pour savoir des nouvelles d’un sien ami nommé Coja Acem, qui s’y en allait aussi, sur quoi il s’enquit d’eux s’il était encore passé, ou non;
qu’au reſte il s’en vouloit aller promptement, tant pour ne perdre temps, qu’à cauſe qu’il recognoiſſoit qu’il ne pouuoit en ce lieu vẽdre ce qu’il auoit de marchandiſe.	qu’au reste il s’en voulait aller promptement, tant pour ne perdre temps, qu’à cause qu’il reconnaissait qu’il ne pouvait en ce lieu vendre ce qu’il avait de marchandise.
Ils luy reſpondirent à cela, Vous dites vray, car en ce village il n’y a autre choſe que des filets & des bateaux de peſcheurs, auec leſquels nous gaignons noſtre vie aſſez pauurement.	Ils lui répondirent à cela, Vous dites vrai, car en ce village il n’y a autre chose que des filets et des bateaux de pêcheurs, avec lesquels nous gagnons notre vie assez pauvrement.
Toutesfois, adiouſterent-ils, ſi tu allois à mont la riuiere iuſqu’en la ville de Pilaucacem, où eſt le Roy, tu vendrois non ſeulement la marchandiſe qui eſt dans tes vaiſſeaux, pour riche qu’elle puiſſe eſtre, mais encore plus que n’en ſçauroient porter dix autres Nauires ſemblables aux tiens pource qu’en ce lieu il y a des marchands ſi riches, & qui font ſi gros trafic, qu’ils ne vont en traitte que par troupes d’Elephans, bœufs, & chameaux, qu’ils enuoyent chargez de marchandiſes aux terres de Lauhos, Pafuaas & Gueos, qui ſont peuplées de gens fort riches.	Toutefois, ajoutèrent-ils, si tu allais à mont la rivière jusqu’en la ville de Pilaucacem, où est le Roi, tu vendrais non seulement la marchandise qui est dans tes vaisseaux, pour riche qu’elle puisse être, mais encore plus que n’en sauraient porter dix autres Navires semblables aux tiens pource qu’en ce lieu il y a des marchands si riches, et qui font si gros trafic, qu’ils ne vont en traite que par troupes d’Éléphants, bœufs, et chameaux, qu’ils envoient chargés de marchandises aux terres de Lauhos, Pafuaas et Gueos, qui sont peuplées de gens fort riches.
