Le doüaire ſe regle au bien qu’on vous apporte.	Le douaire se règle au bien qu’on vous apporte.
Ie l’ayme, & cét amour eſt mon grand embarras.	Je l’aime, et cet amour est mon grand embarras.
On peut auantager vne femme en ce cas.	On peut avantager une femme en ce cas.
Quel traitemeur luy faire en pareille auanture?	Quel traitement lui faire en pareille aventure?
L’ordre eſt que le futur doit doüer la future	L’ordre est que le futur doit douer la future
Du tiers du dot qu’elle a, mais cét ordre n’eſt rien,	Du tiers du dot qu’elle a, mais cet ordre n’est rien,
Et l’on va plus auant lors que l’on le veut bien.	Et l’on va plus avant lorsque l’on le veut bien.
Si......	Si…
Pour le preciput il les regarde enſemble,	Pour le préciput il les regarde ensemble,
Ie dis que le futur peut comme bon luy ſemble	Je dis que le futur peut comme bon lui semble
Doüer la future.	Douer la future.
Euh!	Euh!
Il peut l’auantager	Il peut l’avantager
Lors qu’il l’ayme beaucoup & qu’il veur l’obliger,	Lors qu’il l’aime beaucoup et qu’il veut l’obliger,
Et cela par doüaire, ou préfix qu’on appelle,	Et cela par douaire, ou préfix qu’on appelle,
Qui demeure perdu par le treſpas d’icelle,	Qui demeure perdu par le trépas d’icelle,
Ou ſans retour, qui va de ladite à ſes hoirs,	Ou sans retour, qui va de ladite à ses hoirs,
Ou Couſtumier, ſelon les differens vouloirs,	Ou Coutumier, selon les différents vouloirs,
Ou par donation dans le Contract formelle,	Ou par donation dans le Contrat formelle,
Qu'on fait, ou pure & ſimple, ou qu’on fait mutuelle;	Qu’on fait, ou pure et simple, ou qu’on fait mutuelle;
Pourquoy hauſſer le dos? eſt-ce qu’on parle en fat,	Pourquoi hausser le dos? est-ce qu’on parle en fat,
Et que l’on ne ſçait pas les formes d’vn Contract?	Et que l’on ne sait pas les formes d’un Contrat?
Qui me les apprendra? perſonne; ie preſume.	Qui me les apprendra? personne; je présume.
Sçais-je pas qu’eſtant joints on eſt par la Couſtume,	Sais-je pas qu’étant joints on est par la Coutume,
Communs en meubles, biens, immeubles & conqueſts,	Communs en meubles, biens, immeubles et conquêts,
A moins que par vn Acte on y renonce exprés?	À moins que par un Acte on y renonce exprès?
Sçay-je pas que le tiers du bien de la future	Sais-je pas que le tiers du bien de la future
Entre en communauté? pour......	Entre en communauté? pour…
Oüy, c’eſt choſe ſeure,	Oui, c'est chose sûre,
Vous ſçauez tout cela, mais qui vous en dit mot?	Vous savez tout cela mais qui vous en dit mot?
Vous qui me pretendez faire paſſer pour ſot,	Vous qui me prétendez faire passer pour sot,
En me hauſſant l’eſpaule, & faiſant la grimace.	En me haussant l’épaule, et faisant la grimace.
La peſte ſoit fait l’homme, & ſa chienne de face.	La peste soit fait l’homme, et sa chienne de face.
Adieu. C’eſt le moyen de vous faire finir.	Adieu. C’est le moyen de vous faire finir.
Pour dreſſer vn Contract m’a-t’on pas fait venir?	Pour dresser un Contrat m’a-t-on pas fait venir?
Ouy, ie vous ay mandé: mais la choſe eſt remiſe,	Oui, je vous ai mandé: mais la chose est remise,
Et l’on vous mandera quand l’heure ſera priſe.	Et l’on vous mandera quand l’heure sera prise.
Voyez quel Diable d’homme auec ſon entretien?	Voyez quel Diable d’homme avec son entretien?
Ie penſe qu’il en tient, & ie croy penſer bien.	Je pense qu’il en tient, et je crois penser bien.
M’Eſtes-vous pas venu querir pour voſtre Maiſtre?	M’êtes-vous pas venu quérir pour votre Maître?
Oüy.	Oui.
I’ignore pour qui vous le pouuez connoiſtre:	J’ignore pour qui vous le pouvez connaître:
Mais allez de ma part luy dire de ce pas	Mais allez de ma part lui dire de ce pas
Que c’eſt vn fou fieffé.	Que c’est un fou fieffé.
Nous n’y manquerons pas.	Nous n’y manquerons pas.
MOnſieur......	MOnsieur…
Approchez-vous, vous eſtes mes fidelles,	Approchez-vous, vous êtes mes fidèles,
Mes bons, mes vrays amis, & i’en ſçay des nouuelles.	Mes bons, mes vrais amis, et j’en sais des nouvelles.
Le Notaire......	Le Notaire…
Laiſſons, c’eſt pour quelqu’autre iour.	Laissons, c’est pour quelque autre jour.
On veut à mon honneur joüer d’vn mauuais tour:	On veut à mon honneur jouer d’un mauvais tour:
Et quel affront pour vous mes enfans pourroit-c’eſtre,	Et quel affront pour vous mes enfants pourrait-ce être,
Si l’on auoit oſté l’honneur à voſtre Maiſtre?	Si l’on avait ôté l’honneur à votre Maître?
Vous n’oſeriez aprés paroiſtre en nul endroit,	Vous n’oseriez après paraître en nul endroit,
Et chacun vous voyant vous monſtreroit au doigt:	Et chacun vous voyant vous montrerait au doigt:
Donc puiſqu’autant que moy l’affaire vous regarde,	Donc puisque autant que moi l’affaire vous regarde,
Il faut de voſtre part faire vne telle garde	Il faut de votre part faire un telle garde
Que ce galand ne puiſſe en aucune façon......	Que ce galant ne puisse en aucune façon…
Vous nous auez tantoſt monſtré noſtre leçon.	Vous nous avez tantôt montré notre leçon.
Mais à ſes beaux diſcours gardez-bien de vous rendre.	Mais à ses beaux discours gardez bien de vous rendre.
Oh vrayment......	Oh vraiment…
Nous ſçauons comme il faut s’en deffendre.	Nous savons comme il faut s’en défendre.
S’il venoit doucement. Alain mon pauure cœur	S’il venait doucement. Alain, mon pauvre cœur
Par vn peu de ſecours ſoulage ma langueur.	Par un peu de secours soulage ma langueur.
Vous eſtes vn ſot.	Vous êtes un sot.
Bon. Georgette ma mignonne	Bon. Georgette ma mignonne
Tu me parois ſi douce, & ſi bonne perſonne.	Tu me parais si douce, et si bonne personne.
Vous eſtes vn nigaut.	Vous êtes un nigaud.
Bon. Quel mal trouues-tu	Bon. Quel mal trouves-tu
Dans vn deſſein honneſte, & tout plein de vertu?	Dans un dessein honnête, et tout plein de vertu?
Vous eſtes vn fripon.	Vous êtes un fripon.
Fort bien. Ma mort eſt ſeure	>Fort bien. Ma mort est sûre
Si tu ne prens pitié des peines que j’endure.	Si tu ne prends pitié des peines que j’endure.
Vous eſtes vn beneſt, vn impudent.	Vous êtes un benêt, un impudent.
Fort bien.	Fort bien.
Ie ne ſuis pas vn homme à vouloir rien pour rien,	Je ne suis pas un homme à vouloir rien pour rien,
Ie ſçay quand on me ſert en garder la memoire:	Je sais quand on me sert en garder la mémoire:
Cependant par auance, Alain voilà pour boire,	Cependant par avance, Alain voilà pour boire,
Et voilà pour t’auoir, Georgette, vn cottillon,	Et voilà pour t’avoir, Georgette, un cotillon,
Ce n’eſt de mes bien-faits qu’vn ſimple eſchãtillon,	Ce n’est de mes bienfaits qu’un simple échantillon,
Toute la courtoiſie enfin dont ie vous preſſe,	Toute la courtoisie enfin dont je vous presse,
C’eſt que ie puiſſe voir voſtre belle Maiſtreſſe.	C’est que je puisse voir votre belle Maîtresse.
A d’autres.	À d’autres.
Bon cela.	Bon cela.
Hors d’icy.	Hors d’ici.
Bon.	Bon.
Mais toſt.	Mais tôt.
Bon. Hola, c’eſt aſſez.	Bon. Holà, c’est assez.
Fais-je pas comme il faut?	Fais-je pas comme il faut?
Eſt-ce de la façon que vous voulez l’entendre?	Est-ce de la façon que vous voulez l’entendre?
Oüy, fort bien, hors l’argent qu’il ne falloit pas prendre.	Oui, fort bien, hors l’argent qu’il ne fallait pas prendre.
Nous ne nous ſommes pas ſouuenus de ce point.	Nous ne nous sommes pas souvenus de ce point.
Voulez-vous qu’à l’inſtant nous recommençions,	Voulez-vous qu’à l’instant nous recommencions,
Point.	Point.
Suffit, rentrez tous deux.	Suffit, rentrez tous deux.
Vous n’auez rien qu'à dire	Vous n’avez rien qu'à dire
Non, vous, dis-je, rentrez, puis que ie le deſire.	Non, non, dis-je, rentrez, puisque je le désire.
Ie vous laiſſe l’argent, allez, ie vous rejoins,	Je vous laisse l’argent, allez, je vous rejoins,
Ayez bien l’oil à tout, & ſecondez mes ſoins.	Ayez bien l’œil à tout, et secondez mes soins.
IE veux pour eſpion qui ſoit d’exacte veuë,	JE veux pour espion qui soit d’exacte vue,
Prendre le Sauetier du coin de noſtre ruë;	Prendre le Savetier du coin de notre rue;
Dans la maiſon touſiours ie pretends la tenir,	Dans la maison toujours je prétends la tenir,
Y faire bonne garde, & ſur tout en bannir	Y faire bonne garde, et sur tout en bannir
Vendeuſes de Ruban, Perruquieres, Coiffeuſes,	Vendeuses de Ruban, Perruquières, Coiffeuses,
Faiſeuſes de Mouchoirs, Gantieres, Reuendeuſes,	Faiseuses de Mouchoirs, Gantières, Revendeuses,
Tous ces gẽs qui ſous main trauaillent chaque iour,	Tous ces gens qui sous main travaillent chaque jour,
A faire reüſſir les myſteres d’amour;	À faire réussir les mystères d’amour;
Enfin i’ay veu le monde, & i’en ſçay les fineſſes,	Enfin j’ai vu le monde, et j’en sais les finesses.
Il faudra que mon homme ait de grandes addreſſes,	Il faudra que mon homme ait de grandes adresses,
Si Meſfage ou Poulet de ſa part peut entrer.	Si Message ou Poulet de sa part peut entrer.
LA place m’eſt heureuſe à vous y rencontrer,	La place m’est heureuse à vous y rencontrer.
Ie viens de l’eſchapper bien belle ie vous iure,	Je viens de l’échapper bien belle je vous jure,
Au ſortir d’auec vous ſans preuoir l’auanture,	Au sortir d’avec vous sans prévoir l’aventure,
Seule dans ſon balcon i’ay veu paroiſtre Agnés,	Seule dans son balcon j’ai vu paraître Agnès,
Qui des arbres prochains prenoit vn peu le frais,	Qui des arbres prochains prenait un peu le frais,
Aprés m’auoir fait ſigne, elle aſceu faire en ſorte	Après m’avoir fait signe, elle a su faire en sorte
Deſcendant au iardin de m’en ouurir la porte:	Descendant au jardin de m’en ouvrir la porte:
Mais à peine tous deux dans ſa chambre eſtions nous,	Mais à peine tous deux dans la chambre étions-nous,
Quelle à ſur les degrez entendu ſon ialoux,	Qu’elle a sur les degrés entendu son jaloux,
Et tout ce qu’elle a pû dans vn tel acceſſoire,	Et tout ce qu’elle a pu dans un tel accessoire,
C’eſt de me renfermer dans vne grande armoire,	C’est de me renfermer dans une grande armoire,
Il eſt entré d’abord; ie ne le voyois pas,	Il est entré d’abord; je ne le voyais pas,
Mais ie l’oyois marcher ſans rien dire à grands pas;	Mais je l’oyais marcher sans rien dire à grands pas;
Pouſſant de temps en temps des ſoupirs pitoyables,	Poussant de temps en temps des soupirs pitoyables,
Et donnant quelquefois de grands coups ſur les tables,	Et donnant quelquefois de grands coups sur les tables,
Frapant vn petit chien qui pour luy s’émouuoit,	Frappant un petit chien qui pour lui s’émouvait,
Et iettant bruſquement les hardes qu’il trouuoit,	Et jetant brusquement les hardes qu’il trouvait,
Il a meſme caſſé d’vne main mutinée,	Il a même cassé, d’une main mutinée,
Des vaſes dont la belle ornoit ſa cheminée,	Des vases dont la belle ornait sa cheminée,
Et ſans doute il faut bien qu’à ce becque cornu,	Et sans doute il faut bien qu’à ce becque cornu,
Du trait qu’elle a ioüé quelque iour ſoit venu,	Du trait qu’elle a joué quelque jour soit venu.
Enfin aprés cent tours ayant de la maniere,	Enfin après cent tours ayant de la manière,
Sur ce qui n’en peut mais déchargé ſa colere,	Sur ce qui n’en peut mais déchargé sa colère,
Mon ialoux inquiet ſans dire ſon ennuy,	Mon jaloux inquiet sans dire son ennui,
Eſt ſorty de la chambre, & moy de mon eſtuy,	Est sorti de la chambre, et moi de mon étui,
Nous n’auons point voulu de peur du perſonnage,	Nous n’avons point voulu de peur du personnage,
Riſquer à nous tenir enſemble dauantage,	Risquer à nous tenir ensemble davantage,
C’eſtoit trop hazarder; mais ie dois cette nuit,	C’était trop hasarder; mais je dois cette nuit,
Dans ſa chambre vn peu tard m’introduire ſans bruit,	Dans sa chambre un peu tard m’introduire sans bruit,
En touſſant par trois fois ie me feray connoiſtre,	En toussant par trois fois je me ferai connaître,
Et ie dois au ſignal voir ouurir la feneſtre,	Et je dois au signal voir ouvrir la fenêtre,
Dont auec vne échelle, & ſecondé d’Agnes,	Dont avec une échelle, et secondé d’Agnès,
Mon amour taſchera de me gagner l’accés,	Mon amour tâchera de me gagner l’accès.
Comme à mon ſeul amy ie veux bien vous l’apprendre,	Comme à mon seul ami je veux bien vous l’apprendre,
L’allegreſſe du cœur s’augmente à la reſpandre,	L’allégresse du cœur s’augmente à la répandre,
Et gouſtaſt-on cent fois vn bon-heur trop parfait,	Et goûtât-on cent fois un bonheur trop parfait,
On n’en eſt pas content ſi quelqu’vn ne le ſçait,	On n’en est pas content si quelqu’un ne le sait,
Vous prendrez part ie penſe à l’heur de mes affaires	Vous prendrez part, je pense, à l’heur de mes affaires
Adieu ie vais ſonger aux choſes neceſſaires.	Adieu je vais songer aux choses nécessaires.
QVoy? l’aſtre qui s’obſtine à me deſeſperer,	QUoi? l’astre qui s’obstine à me désespérer,
Ne me donnera pas le temps de reſpirer,	Ne me donnera pas le temps de respirer,
Coup ſur coup ie verray par leur intelligence,	Coup sur coup je verrai par leur intelligence,
De mes ſoins vigilans confondre la prudence,	De mes soins vigilants confondre la prudence,
Et ie ſeray la dupe en ma maturité,	Et je serai la dupe en ma maturité,
D’vne ieune innocente, & d’vn ieune euenté,	D’une jeune innocente, et d’un jeune éventé,
En ſage Philoſophe on m’a veu vingt années,	En sage Philosophe on m’a vu vingt années,
Contempler des maris les triſtes deſtinées.	Contempler des maris les tristes destinées,
Et m’inſtruire auec ſoin de tous les accidens,	Et m’instruire avec soin de tous les accidents,
Qui font dans le mal-heur tomber les plus prudens,	Qui font dans le malheur tomber les plus prudents,
Des diſgraces d’autruy profitant dans mon ame,	Des disgrâces d’autrui profitant dans mon âme,
I’ay cherché les moyens voulant prendre vne femme,	J’ai cherché les moyens voulant prendre une femme,
De pouuoir garantir mon front de tous affronts,	De pouvoir garantir mon front de tous affronts,
Et le tirer de pair d’auec les autres fronts,	Et le tirer de pair d’avec les autres fronts,
Pour ce noble deſſein i’ay creu mettre en pratique,	Pour ce noble dessein j’ai cru mettre en pratique,
Tout ce que peut trouuer l’humaine Politique,	Tout ce que peut trouver l’humaine Politique,
Et comme ſi du ſort il eſtoit arreſté,	Et comme si du sort il était arrêté,
Que nul homme icy bas n’en ſeroit exempté,	Que nul homme ici-bas n’en serait exempté,
Aprés l’experience, & toutes les lumieres,	Après l’expérience, et toutes les lumières,
Que i’ay pû m’acquerir ſur de telles matieres,	Que j’ai pu m’acquérir sur de telles matières,
Aprés vingt ans & plus, de meditation,	Après vingt ans et plus, de méditation,
Pour me conduire en tout auec precaution,	Pour me conduire en tout avec précaution,
De tant d’autres maris i’aurois quitté la trace,	De tant d’autres maris j’aurais quitté la trace,
Pour me trouuer aprés dans la meſme diſgrace.	Pour me trouver après dans la même disgrâce.
Ah bourreau de deſtin vous en aurez menty,	Ah bourreau de destin vous en aurez menti,
De l’obiet qu’on pourſuit, ie ſuis encor nanty,	De l’objet qu’on poursuit, je suis encor nanti.
Si ſon cœur m’eſt volé par ce blondin funeſte,	Si mon cœur m’est volé par ce blondin funeste,
I’empeſcheray du moins qu’on s’empare du reſte,	J’empêcherai du moins qu’on s’empare du reste,
Et cette nuit qu’on prend pour ce galand exploit,	Et cette nuit qu’on prend pour ce galant exploit,
Ne ſe paſſera pas ſi doucement qu’on croit,	Ne se passera pas si doucement qu’on croit,
Ce m’eſt quelque plaiſir parmy tant de triſteſſe,	Ce m’est quelque plaisir, parmi tant de tristesse,
Que l’on me donne auis du piege qu’on me dreſſe,	Que l’on me donne avis du piège qu’on me dresse,
Et que cét eſtourdy qui veut m’eſtre fatal,	Et que cet étourdi qui veut m’être fatal,
Faſſe ſon confident de ſon propre Riual.	Fasse son confident de son propre Rival.
ET bien, ſouperons-nous auant la promenade?	Et bien souperons-nous avant la promenade?
Non, ie ieuſne ce ſoir.	Non, je jeûne ce soir.
D’où vient cette boutade?	D’où vient cette boutade?
De grace excuſez-moy, i’ay quelqu’autre embarras.	De grâce excusez-moi, j’ai quelque autre embarras.
Voſtre hymen reſolu ne ſe fera-t’il pas?	Votre hymen résolu ne se fera-t-il pas?
C’eſt trop s’inquieter des affaires des autres.	C’est trop s’inquiéter des affaires des autres.
Oh, oh, ſi bruſquement? quels chagrins ſont les voſtres?	Oh, oh, si brusquement? quels chagrins sont les vôtres?
Seroit-il point, compere, à voſtre paſſion,	Serait-il point, compère, à votre passion,
Arriué quelque peu de tribulation?	Arrivé quelque peu de tribulation?
Ie le iurerois preſque à voir voſtre viſage.	Je le jurerais presque à voir votre visage.
Quoy qu’il m’arriue au moins auray-ie l’auantage,	Quoi qu’il m’arrive au moins aurai-je l’avantage,
De ne pas reſſembler à de certaines gens,	De ne pas ressembler à de certaines gens,
Qui ſouffrent doucement l’approche des galans.	Qui souffrent doucement l’approche des galants.
C’eſt vn eſtrange fait qu’auec tant de lumieres.	C’est un étrange fait qu’avec tant de lumières.
Vous vous effarouchiez touſiours ſur ces matieres,	Vous vous effarouchiez toujours sur ces matières,
Qu'en cela vous mettiez le ſouuerain bon-heur,	Qu’en cela vous mettiez le souverain bonheur,
Et ne conceuiez point au monde d’autre honneur,	Et ne conceviez point au monde d’autre honneur,
Eſtre auare, brutal, fourbe, meſchant, & laſche,	Être avare, brutal, fourbe, méchant, et lâche,
N’eſt rien à voſtre auis auprés de cette tache,	N’est rien à votre avis auprès de cette tache,
Et de quelque facon qu’on puiſſe auoir veſcu,	Et de quelque façon qu’on puisse avoir vécu,
On eſt homme d’honneur quand on n’eſt point cocu.	On est homme d’honneur quand on n’est point cocu.
A le bien prendre au fond, pourquoy voulez vous croire,	À le bien prendre au fond, pourquoi voulez-vous croire,
Que de ce cas fortuit dépende noſtre gloire?	Que de ce cas fortuit dépende notre gloire?
Et qu’vne ame bien née ait à ſe reprocher,	Et qu’une âme bien née ait à se reprocher,
L’iniuſtice d’vn mal qu’on ne peut empeſcher?	L’injustice d’un mal qu’on ne peut empêcher?
Pourquoy voulez-vous, dis-ie en prenant vne fẽme,	Pourquoi voulez-vous, dis-je, en prenant une femme,
Qu’on ſoit digne à ſon choix de loüange ou de blaſme,	Qu’on soit digne à son choix de louange ou de blâme,
Et qu’on s’aille former vn monſtre plein d’effroy,	Et qu’on s’aille former un monstre plein d’effroi,
De l’affront que nous fait ſon manquement de foy?	De l’affront que nous fait son manquement de foi?
Mettez-vous dans l’eſprit qu’on peut du cocuage,	Mettez-vous dans l’esprit qu’on peut du cocuage,
Se faire en galand homme vne plus douce image,	Se faire en galant homme une plus douce image,
Que des coups du hazard aucun n’eſtant garant,	Que des coups du hasard aucun n’étant garant,
Cet accident de ſoy doit eſtre indifferend,	Cet accident de soi doit être indifférent,
Et qu’enfin tout le mal quoy que le monde gloſe,	Et qu’enfin tout le mal quoi que le monde glose,
N’eſt que dans la facon de receuoir la choſe	N’est que dans la façon de recevoir la chose
Car pour ſe bien conduire en ces difficultez,	Car pour se bien conduire en ces difficultés,
Il y faut comme en tout fuïr les extremitez,	Il y faut comme en tout fuir les extrémités,
N’imiter pas ces gens vn peu trop débonnaires,	N’imiter pas ces gens un peu trop débonnaires,
Qui tirent vanité de ces ſortes d’affaires;	Qui tirent vanité de ces sortes d’affaires;
De leurs femmes toûjours vont citant les galans,	De leurs femmes toujours vont citant les galants,
En font par tout l’éloge, & proſnent leurs talens,	En font par tout l’éloge, et prônent leurs talents,
Teſmoignent auec eux d’eſtroites ſimpathies,	Témoignent avec eux d’étroites sympathies,
Sont de tous leurs cadeaux, de toutes leurs parties:	Sont de tous leurs cadeaux, de toutes leurs parties:
Et font qu’auec raiſon les gens ſont eſtonnez,	Et font qu’avec raison les gens sont étonnés,
De voir leur hardieſſe à montrer là leur nez.	De voir leur hardiesse à montrer là leur nez.
Ce procedé ſans doute eſt tout à fait blâmable:	Ce procédé sans doute est tout à fait blâmable:
Mais l’autre extrémité n’eſt pas moins condamnable,	Mais l’autre extrémité n’est pas moins condamnable,
Si ie n’approuue pas ces amis des galans,	Si je n’approuve pas ces amis des galants,
Ie ne ſuis pas auſſi pour ces gens turbulens,	Je ne suis pas aussi pour ces gens turbulents,
Dont l’imprudent chagrin qui tempeſte & qui gronde,	Dont l’imprudent chagrin qui tempête et qui gronde,
Attire au bruit qu’il fait les yeux de tout le monde;	Attire au bruit qu’il fait les yeux de tout le monde;
Et qui par cét éclat ſemblent ne pas vouloir	Et qui par cet éclat semblent ne pas vouloir
Qu’aucun puiſſe ignorer ce qu’ils peuuent auoir.	Qu’aucun puisse ignorer ce qu’ils peuvent avoir.
Entre ces deux partis il en eſt vn honneſte,	Entre ces deux partis il en est un honnête,
Où dans l’occaſion l’homme prudent s’arreſte,	Où dans l’occasion l’homme prudent s’arrête,
Et quand on le ſçait prendre on n’a point à rougir,	Et quand on le sait prendre on n’a point à rougir,
Du pis dont vne femme auec nous puiſſe agir.	Du pis dont une femme avec nous puisse agir.
Quoy qu’on en puiſſe dire, enfin le cocuage	Quoi qu’on en puisse dire, enfin le cocuage
Sous des traits moins affreux aisément s’enuiſage:	Sous des traits moins affreux aisément s’envisage:
Et comme ie vous dis, toute l’habilité,	Et comme je vous dis toute l’habileté,
Ne va qu’à le ſçauoir tourner du bon coſté.	Ne va qu’à le savoir tourner du bon côté.
Aprés ce beau diſcours toute la confrerie,	Après ce beau discours, toute la confrérie,
Doit vn remerciment à voſtre Seigneurie:	Doit un remerciement à votre Seigneurie:
Et quiconque voudra vous entendre parler,	Et quiconque voudra vous entendre parler,
Montrera de la ioye à s’y voir enroller.	Montrera de la joie à s’y voir enrôler.
Ie ne dis pas cela, car c'eſt ce que ie blaſme:	Je ne dis pas cela, car c’est ce que je blâme:
Mais comme c’eſt le ſort qui nous donne vne femme,	Mais comme c’est le sort qui nous donne une femme,
Ie dis que l’on doit faire ainſi qu’au jeu de dez,	Je dis que l’on doit faire ainsi qu’au jeu de dés,
Où s’il ne vous vient pas ce que vous demandez.	Où, s’il ne vous vient pas ce que vous demandez.
Il faut joüer d’adreſſe, & d’vne ame reduite,	Il faut jouer d’adresse, et d’une âme réduite,
Corriger le hazard par la bonne conduite.	Corriger le hasard par la bonne conduite.
C’eſt à dire dormir, & manger toûjours bien,	C’est-à-dire dormir, et manger toujours bien,
Et ſe perſuader que tout cela n’eſt rien.	Et se persuader que tout cela n’est rien.
Vous penſez-vous mocquer, mais à ne vous rien feindre,	Vous pensez-vous moquer: mais à ne vous rien feindre,
Dans le monde ie voy cent choſes plus à craindre,	Dans le monde je vois cent choses plus à craindre,
Et dont ie me ferois vn bien plus grand mal-heur,	Et dont je me ferais un bien plus grand malheur,
Que de cét accident qui vous fait tant de peur.	Que de cet accident qui vous fait tant de peur.
Penſez-vous qu’à choiſir de deux choſes preſcrites,	Pensez-vous qu’à choisir de deux choses prescrites,
Ie n’aimaſſe pas mieux eſtre ce que vous dites,	Je n’aimasse pas mieux être ce que vous dites,
Que de me voir mari de ces femmes de bien,	Que de me voir mari de ces femmes de bien,
Dont la mauuaiſe humeur fait vn procés ſur rien.	Dont la mauvaise humeur fait un procès sur rien.
Ces dragons de vertu ces honneſtes Diableſſes,	Ces dragons de vertu, ces honnêtes Diablesses,
Se retranchant touſiours ſur leurs ſages proüeſſes,	Se retranchant toujours sur leurs sages prouesses,
Qui pour vn petit tort qu’elles ne nous font pas,	Qui pour un petit tort qu’elles ne nous font pas,
Prennent droit de traiter les gens de haut en bas,	Prennent droit de traiter les gens de haut en bas,
Et veulent ſur le pied de nous eſtre fidelles,	Et veulent sur le pied de nous être fidèles,
Que nous ſoyons tenus à tout endurer d’elles:	Que nous soyons tenus à tout endurer d’elles:
Encor vn coup Compere, apprenez qu’en effet,	Encor un coup Compère, apprenez qu’en effet,
Le cocuage n’eſt que ce que l’on le fait,	Le Cocuage n’est que ce que l’on le fait,
Qu'on peut le ſounaiter pour de certaines cauſes,	Qu’on peut le souhaiter pour de certaines causes,
Et qu’il a ſes plaiſirs comme les autres choſes.	Et qu’il a ses plaisirs comme les autres choses.
Si vous eſtes d’humeur à vous en contenter?	Si vous êtes d’humeur à vous en contenter?
Quant à moy ce n’eſt pas la mienne d’en tâter;	Quant à moi ce n’est pas la mienne d’en tâter;
Et pluſtoſt que ſubir vne telle auanture.....	Et plutôt que subir une telle aventure…
Mon Dieu ne jurez point de peur d’eſtre parjure;	Mon Dieu ne jurez point de peur d’être parjure;
Si le ſort l’a reglé, vos ſoins ſont ſuperflus,	Si le sort l’a réglé, vos soins sont superflus,
