La fureur qui m’anime a de trop juſtes cauſes,	La fureur qui m'anime a de trop justes causes,
Et l’on verra peut-être arriver bien des choſes;	Et l'on verra peut-être arriver bien des choses;
Un deſeſpoir va loin quand il eſt échappé,	Un désespoir va loin quand il est échappé,
Et tout eſt pardonnable à qui ſe voit trompé.	Et tout est pardonnable à qui se voit trompé.
Si l’ingrate à mes yeux pour flatter vôtre flame,	Si l'ingrate à mes yeux pour flatter votre flamme,
A jamais n'être à moi, vient d’engager ſon ame;	À jamais n'être à moi, vient d'engager son âme;
Je ſçaurai bien trouver dans mon juſte courroux	Je saurai bien trouver dans mon juste courroux
Les moyens d’empêcher qu’elle ne ſoit à vous.	Les moyens d'empêcher qu'elle ne soit à vous.
Cet obſtacle n’eſt pas ce qui me met en peine,	Cet obstacle n'est pas ce qui me met en peine,
Nous verrons quelle attente en tout cas ſera vaine,	Nous verrons quelle attente en tout cas sera vaine,
Et chacun de ſes feux pourra par ſa valeur,	Et chacun de ses feux pourra par sa valeur,
Ou defendre la gloire, ou vanger le malheur.	Ou défendre la gloire, ou venger le malheur.
Mais comme entre Rivaux, l'ame la plus poſée,	Mais comme entre Rivaux, l'âme la plus posée,
A des termes d’aigreur, trouve une pente aiſée,	À des termes d'aigreur, trouve une pente aisée,
Et que je ne veux point qu’un pareil entretien	Et que je ne veux point qu'un pareil entretien
Puiſſe trop échauffer vôtre eſprit, & le mien;	Puisse trop échauffer votre esprit, et le mien;
Prince, affranchiſſez-vous d’une gêne ſecrete,	Prince, affranchissez-vous d'une gêne secrète,
Et me donnez moyen de faire ma retraite.	Et me donnez moyen de faire ma retraite.
Non, non, ne craiguez point qu’on pouſſe vôtre eſprit,	Non, non, ne craignez point qu'on pousse votre esprit,
A violer ici l’ordre qu’on vous précrit;	À violer ici l'ordre qu'on vous prescrit;
Quelque juſte ſureur qui me preſſe & vous flatte,	Quelque juste fureur qui me presse et vous flatte,
Je ſçai, Comte, je ſçai, quand il faut qu’elle éclate.	Je sais, Comte, je sais quand il faut qu'elle éclate.
Ces lieux vous ſont ouverts, oüi, ſortez-en, ſortez,	Ces lieux vous sont ouverts, oui, sortez-en, sortez,
Glorieux des douceurs que vous en remportez;	Glorieux des douceurs que vous en remportez;
Mais encor une fois apprenez que ma tête	Mais encore une fois apprenez que ma tête
Peut ſeule dans vos mains mettre vôtre conquête.	Peut seule dans vos mains mettre votre conquête.
Quand nous en ferons-là, le fort en nôtre bras,	Quand nous en serons là, le sort en notre bras,
De tous nos interêts vuidera les debats.	De tous nos intérêts videra les débats.
REtournez, D. Alvar, & perdez l’eſperance,	Retournez, D. Alvar, et perdez l'espérance,
De me perſuader l’oubli de cette offence;	De me persuader l'oubli de cette offense;
Cette playe en mon cœur ne ſçauroit ſe guerir,	Cette plaie en mon cœur ne saurait se guérir,
Et les ſoins qu’on en prend ne font rien que l’ai¬(grir.	Et les soins qu'on en prend ne font rien que l'aigrir.
A quelques faux reſpects croit il que je defere?	À quelques faux respects croit-il que je défère?
Non, non, il a pouſſé trop avant ma colere;	Non, non, il a poussé trop avant ma colère;
Et ſon vain repentir qui porte ici vos pas,	Et son vain repentir qui porte ici vos pas,
Sollicite un pardon que vous n’obtiendrez pas.	Sollicite un pardon que vous n'obtiendrez pas.
Madame, il fait pitié, jamais cœur que je penſe,	Madame, il fait pitié, jamais cœur que je pense,
Par un plus vif remors n’expia ſon offence;	Par un plus vif remords n'expia son offense;
Et ſi dans ſa douleur vous le conſideriez,	Et si dans sa douleur vous le considériez,
Il toucheroit vôtre ame, & vous l’excuſeriez.	Il toucherait votre âme, et vous l'excuseriez.
On ſçait bien que le Prince eſt dans un âge à ſuivre	On sait bien que le Prince est dans un âge à suivre
Les premiers mouvemens où ſon ame ſe livre,	Les premiers mouvements où son âme se livre,
Et qu’en un ſang boüillant, toutes les paſſions	Et qu'en un sang bouillant toutes les passions
Ne laiſſent guere place à des reflexions.	Ne laissent guère place à des réflexions.
Dom Lope prevenu d’une fauſſe lumiere,	Dom Lope prévenu d'une fausse lumière,
De l’erreur de ſon Maître, a fourni la matiere;	De l'erreur de son Maître, a fourni la matière;
Un bruit aſſez confus, dont le zele indiſcret,	Un bruit assez confus, dont le zèle indiscret,
A de l’abord du Comte éventé le ſecret,	A de l'abord du Comte éventé le secret,
Vous avoir miſe auſſi de cette intelligence,	Vous avait mise aussi de cette intelligence,
Que dans ces lieux gardez à donné ſa preſence,	Qui dans ces lieux gardés a donné sa présence,
Le Prince a creu l’avis, & ſon amour ſeduit,	Le Prince a cru l'avis, et son amour séduit,
Sur une fauſſe allarme a fait tout ce grand bruit;	Sur une fausse alarme a fait tout ce grand bruit;
Mais d’une telle erreur ſon ame eſt revenüe,	Mais d'une telle erreur son âme est revenue,
Vôtre innocence, enfin, lui vient d’étre connüe,	Votre innocence, enfin lui vient d'être connue,
Et D. Lope, qu’il chaſſe, eſt un viſible effet,	Et D. Lope qu'il chasse est un visible effet,
Du vif remords qu’il ſent de l’éclat qu’il a fait.	Du vif remords qu'il sent de l'éclat qu'il a fait.
Ah! c’eſt trop promptement qu’il croit mon innocence,	Ah! c'est trop promptement qu'il croit mon innocence,
Il n’en a pas encor une entiere aſſurance;	Il n'en a pas encore une entière assurance;
Dites-lui, dites-lui, qu’il doit bien tout peſer,	Dites-lui, dites-lui, qu'il doit bien tout peser,
Et ne ſe hâter point, de peur de s’abuſer.	Et ne se hâter point, de peur de s'abuser.
Madame, il ſçait trop bien....	Madame, il sait trop bien…
Mais, D. Alvar, de grace,	Mais, D. Alvar, de grâce,
N’étendons pas plus loin un diſcours qui me laſſe,	N'étendons pas plus loin un discours qui me lasse,
Il reveille un chagrin qui vient à contre tems,	Il réveille un chagrin qui vient à contre-temps,
En troubler dans mon cœur d’autres plus importans.	En troubler dans mon cœur d'autres plus importants.
Oüi, d’un trop grand malheur la ſurpriſe me preſſe,	Oui, d'un trop grand malheur la surprise me presse,
Et le bruit du trépas de l’illuſtre Comteſſe,	Et le bruit du trépas de l'illustre Comtesse,
Doit s’emparer, ſi bien de tout mon deplaiſir,	Doit s'emparer, si bien de tout mon déplaisir,
Qu’aucun autre ſouci n’a droit de me ſaiſir.	Qu'aucun autre souci n'a droit de me saisir.
Madame, ce peut étre une fauſſe nouvelle,	Madame, ce peut être une fausse nouvelle,
Mais mon retour au Prince, en porte une crüelle.	Mais mon retour au Prince en porte une cruelle.
De quelque grand ennui qu’il puiſſe étre agité,	De quelque grand ennui qu'il puisse être agité,
Il en aura toujours moins qu’il n’a merité.	Il en aura toujours moins qu'il n'a mérité.
J’Attendois qu’il ſortît, Madame, pour vous dire,	J'attendais qu'il sortît, Madame, pour vous dire
Ce qu’il veut maintenant que vôtre ame reſpire,	Ce qui veut maintenant que votre âme respire,
Puis que vôtre chagrin dans un moment d’ici,	Puisque votre chagrin dans un moment d'ici,
Du ſort de Done Ignes peut ſe voir éclairci.	Du sort de Done Ignès peut se voir éclairci.
Un inconnu qui vient pour cette confidence,	Un inconnu qui vient pour cette confidence,
Vous fait par un des ſiens demander audiance.	Vous fait par un des siens demander audience.
Eliſe, il faut le voir, qu’il vienne promptement.	Élise, il faut le voir, qu'il vienne promptement.
Mais il veut n’étre veu que de vous ſeulement,	Mais il veut n'être vu que de vous seulement,
Et par cet Envoyé, Madame, il ſollicite,	Et par cet Envoyé, Madame, il sollicite,
Qu’il puiſſe ſans témoins vous rendre ſa viſite.	Qu'il puisse sans témoins vous rendre sa visite.
Hé bien nous ſerons ſeuls, & je vais l’ordonner,	Hé bien nous serons seuls, et je vais l'ordonner,
Tandis que tu prendras le ſoin de l’amener.	Tandis que tu prendras le soin de l'amener.
Que mon impatience en ce moment eſt forte!	Que mon impatience en ce moment est forte!
O deſtins, eſt-ce joye, ou douleur qu’on m’apporte?	Ô destins, est-ce joie, ou douleur qu'on m'apporte?
OU....	Où…?
Si vous me cherchez, Madame, me voici.	Si vous me cherchez, Madame, me voici.
En quel lieu vôtre maître....	En quel lieu votre maître…
Il eſt proche d’ici;	Il est proche d'ici;
Le ferai-je venir?	Le ferai-je venir?
Dites lui qu’il s’avance,	Dites-lui qu'il s'avance,
Aſſuré qu’on l’attend avec impatience,	Assuré qu'on l'attend avec impatience,
Et qu’il ne ſe verra d’aucuns yeux éclairé.	Et qu'il ne se verra d'aucuns yeux éclairé.
Je ne ſçai quel ſecret en doit être auguré,	Je ne sais quel secret en doit être auguré,
Tant de precautions qu’il affecte de prendre....	Tant de précautions qu'il affecte de prendre…
Mais le voici deja.	Mais le voici déjà.
SEigneur; pour vous attendre	Seigneur; pour vous attendre
On a fait.... Mais que voi-je, ha! Madame, mes yeux.	On a fait… Mais que vois-je, ha! Madame, mes yeux.
Ne me deſcouvrez point, Eliſe, dans ces lieux,	Ne me découvrez point, Élise, dans ces lieux,
Et laiſſez reſpirer ma triſte deſtinée,	Et laissez respirer ma triste destinée,
Sous une feinte mort, que je me ſuis donnée.	Sous une feinte mort, que je me suis donnée.
C’eſt elle qui m'arrache à tous mes fiers tirans;	C'est elle qui m'arrache à tous mes fiers tyrans;
Car je puis ſous ce nom comprendre mes parens;	Car je puis sous ce nom comprendre mes parents;
J’ai par elle évité cet himen redoutable,	J'ai par elle évité cet hymen redoutable,
Pour qui j’aurois ſouffert une mort veritable;	Pour qui j'aurais souffert une mort véritable;
Et ſous cet équipage, & le bruit de ma mort,	Et sous cet équipage, et le bruit de ma mort,
Il faut cacher à tous le ſecret de mon ſort,	Il faut cacher à tous le secret de mon sort,
Pour me voir à l’abri de l’injuſte pourſuite,	Pour me voir à l'abri de l'injuste poursuite,
Qui pourroit dans ces lieux perſecuter ma fuite.	Qui pourrait dans ces lieux persécuter ma fuite.
Ma ſurpriſe en public eut trahi vos deſirs,	Ma surprise en public eût trahi vos désirs,
Mais allez là dedans étouffer des ſoupirs;	Mais allez là dedans étouffer des soupirs;
Et des charmans tranſports d’une pleine allegreſſe,	Et des charmants transports d'une pleine allégresse,
Saiſir à vôtre aſpect le cœur de la Princeſſe?	Saisir à votre aspect le cœur de la Princesse?
Vous la trouverez ſeule, elle même a pris ſoin	Vous la trouverez seule, elle-même a pris soin
Que vôtre abord fut libre, & n’eut aucun témoin;	Que votre abord fût libre, et n'eût aucun témoin;
Voi-je pas D. Alvar?	Vois-je pas D. Alvar?
LE Prince me renvoye,	Le Prince me renvoie,
Vous prier que pour lui vôtre credit s’employe,	Vous prier que pour lui votre crédit s'emploie,
De ſes jours, belle Eliſe, on doit n’eſperer rien,	De ses jours, belle Élise, on doit n'espérer rien,
S’il n’obtient par vos ſoins un moment d’entretien.	S'il n'obtient par vos soins un moment d'entretien.
Son ame a des tranſports.... Mais le voici lui-même.	Son âme a des transports… Mais le voici lui-même.
AH! ſois un peu ſenſible à ma diſgrace extréme,	Ah! sois un peu sensible à ma disgrâce extrême,
Eliſe, & prend pitié d’un cœur infortuné,	Élise, et prends pitié d'un cœur infortuné,
Qu’aux plus vives douleurs tu vois abandonné.	Qu'aux plus vives douleurs tu vois abandonné.
C’eſt avec d’autre yeux que ne fait la Princeſſe,	C'est avec d'autres yeux que ne fait la Princesse,
Seigneur, que je verrois le tourment qui vous preſſe;	Seigneur, que je verrais le tourment qui vous presse;
Mais nous avons du Ciel, ou du temperament,	Mais nous avons du Ciel ou du tempérament,
Que nous jugeons de tout chacun diverſement.	Que nous jugeons de tout chacun diversement.
Et puis qu’elle vous blame, & que ſa fantaſie,	Et puisqu'elle vous blâme, et que sa fantaisie,
Lui fait un monſtre affreux de vôtre jalouſie;	Lui fait un monstre affreux de votre jalousie;
Je ſerois complaiſant & voudrois m’efforcer	Je serais complaisant et voudrais m'efforcer
De cacher à ſes yeux, ce qui peut les bleſſer.	De cacher à ses yeux, ce qui peut les blesser.
Un Amant ſuit ſans doute une utile methode,	Un Amant suit sans doute une utile méthode,
S’il fait qu’à nôtre humeur la ſienne s’accommode.	S'il fait qu'à notre humeur la sienne s'accommode.
Et cent devoirs font moins que ces ajuſtemens,	Et cent devoirs font moins que ces ajustements,
Qui font crcire en deux cœurs les mêmes ſentimens.	Qui font croire en deux cœurs les mêmes sentiments.
L’art de ces deux rapports fortement les aſſemble,	L'art de ces deux rapports fortement les assemble,
Et nous n’aimons rien tant, que ce qui nous reſſemble.	Et nous n'aimons rien tant que ce qui nous ressemble.
Je le ſçai, mais helas! les deſtins inhumains,	Je le sais, mais, hélas! les destins inhumains,
S’oppoſent à l'effet de ces juſtes deſleins;	S'opposent à l'effet de ces justes desseins;
Et malgré tous mes ſoins viennent toûjours me rendre	Et malgré tous mes soins viennent toujours me tendre
Un piege, dont mon cœur ne ſçauroit ſe defendre;	Un piège, dont mon cœur ne saurait se défendre;
Ce n’eſt pas que l’ingrate aux yeux de mon Rival,	Ce n'est pas que l'ingrate aux yeux de mon Rival,
N’ait fait contre mes feux un aveu trop fatal,	N'ait fait contre mes feux un aveu trop fatal,
Et témoigné pour lui des excez de tendreſſe,	Et témoigné pour lui des excès de tendresse,
Dont le cruel objet me reviendra ſans ceſſe:	Dont le cruel objet me reviendra sans cesse:
Mais comme trop d’ardeur, enfin, m’avoit ſeduit,	Mais comme trop d'ardeur, enfin m'avait séduit,
Quand j’ai creu qu’en ces lieux elle l’ait introduit,	Quand j'ai cru qu'en ces lieux elle l'ait introduit,
D’un trop cuiſant ennui je ſentirois l’atteinte,	D'un trop cuisant ennui je sentirais l'atteinte,
A lui laiſſer ſur moi quelque ſujet de plainte.	À lui laisser sur moi quelque sujet de plainte.
Oüi, je veux faire au moins, ſi je m’en vois quitté,	Oui, je veux faire au moins, si je m'en vois quitté,
Que ce ſoit de ſon cœur pure infidelité;	Que ce soit de son cœur pure infidélité;
Et venant m’excuſer d’un trait de promptitude,	Et venant m'excuser d'un trait de promptitude,
Derober tout pretexte à ſon ingratitude.	Dérober tout prétexte à son ingratitude.
Laiſſez un peu de tems à ſon reſſentiment,	Laissez un peu de temps à son ressentiment,
Et ne la voyez point, Seigneur, ſi promptement.	Et ne la voyez point, Seigneur, si promptement.
Ah! ſi tu me cheris, obtiens que je la voye,	Ah! si tu me chéris, obtiens que je la voie,
C’eſt une liberté qu’il faut qu’elle m’octroye;	C'est une liberté qu'il faut qu'elle m'octroie;
Je ne pars point d’ici qu’au moins ſon fier dedain.	Je ne pars point d'ici qu'au moins son fier dédain.
De grace differez l'effet de ce deſſein.	De grâce différez l'effet de ce dessein.
Non, ne m’oppoſe point une excuſe frivole.	Non, ne m'oppose point une excuse frivole.
Il faut que ce ſoit elle, avec une parole,	Il faut que ce soit elle, avec une parole,
Qui trouve les moyens de le faire en aller;	Qui trouve les moyens de le faire en aller;
Demeurez donc, Seigneur, je m’en vais lui parler.	Demeurez donc, Seigneur, je m'en vais lui parler.
Di lui, que j’ai d’abord banni de ma preſence,	Dis-lui que j'ai d'abord banni de ma présence,
Celui dont les avis ont cauſé mon offence.	Celui dont les avis ont causé mon offense.
Que D. Lope jamais....	Que D. Lope jamais…
QUe vois je, ô juſtes Dieux,	Que vois-je, ô justes Dieux,
Faut il que je m’aſſure au rapport de mes yeux?	Faut-il que je m'assure au rapport de mes yeux?
Ah! ſans doute ils me ſont des témoins trop fidelles.	Ah! sans doute ils me sont des témoins trop fidèles.
Voilà le comble affreux de mes peines mortelles.	Voilà le comble affreux de mes peines mortelles.
Voici le coup fatal qui devoit m’accabler,	Voici le coup fatal qui devait m'accabler,
Et quand par des ſoupçons je me ſentois troubler,	Et quand par des soupçons je me sentais troubler,
C’étoit, c’étoit le Ciel, dont la ſourde menace,	C'était, c'était le Ciel, dont la sourde menace,
Preſageoit à mon cœur cette horrible diſgrace.	Présageait à mon cœur cette horrible disgrâce.
Qu’avez-vous veu, Seigneur, qui vous puiſſe émouvoir?	Qu'avez-vous vu, Seigneur, qui vous puisse émouvoir?
J’ai veu ce que mon ame a peine à concevoir,	J'ai vu ce que mon âme a peine à concevoir,
Et le renverſement de toute la nature	Et le renversement de toute la nature
Ne m’étonneroit pas comme cette avanture.	Ne m'étonnerait pas comme cette aventure.
C’en eſt fait le deſtin.... je ne ſçaurois parler.	C'en est fait… Le destin… Je ne saurais parler.
Seigneur, que vôtre eſprit tâche à ſe rapeller.	Seigneur, que votre esprit tâche à se rappeler.
J’ai veu.... vengeance, ô Ciel.	J'ai vu… vengeance, ô Ciel.
Quelle atteinte ſoudaine....	Quelle atteinte soudaine…
I’en mourrai, D. Alvar, la choſe eſt bien certaine.	J'en mourrai, D. Alvar, la chose est bien certaine.
Mais, Seigneur, qui pourroit....	Mais, Seigneur, qui pourrait…
Ah! tout eſt rüiné;	Ah! tout est ruiné;
Ie ſuis, je ſuis trahi, je fuis aſſaſſiné;	Je suis, je suis trahi, je suis assassiné;
Un homme, ſans mourir te le puis-je bien dire,	Un homme… sans mourir te le puis-je bien dire,
Un homme dans les bras de l’infidelle Eluire?	Un homme dans les bras de l'infidèle Elvire?
Ah! Seigneur, la Princeſſe eſt vertueuſe au point.	Ah! Seigneur, la Princesse est vertueuse au point.
Ah! ſur ce que j’ai veu, ne me conteſtez point.	Ah! sur ce que j'ai vu ne me contestez point.
D. Alvar, c’en eſt trop que ſoutenir ſa gloire,	D. Alvar, c'en est trop que soutenir sa gloire,
Lorſque mes yeux font foi d’une action ſi noire.	Lorsque mes yeux font foi d'une action si noire.
Seigneur, nos paſſions nous font prendre ſouvent,	Seigneur, nos passions nous font prendre souvent,
Pour choſe veritable un objet decevant;	Pour chose véritable un objet décevant;
Et de croire qu’une ame à la vertu nourrie,	Et de croire qu'une âme à la vertu nourrie,
Se puiſſe....	Se puisse…
D. Alvar, laissez moi je vous prie,	D. Alvar, laissez-moi, je vous prie,
Un Conſeiller me choque en cette occaſion,	Un Conseiller me choque en cette occasion,
Et je ne prens avis que de ma paſſion.	Et je ne prends avis que de ma passion.
Il ne faut rien repondre à cet eſprit farouche.	Il ne faut rien répondre à cet esprit farouche.
Ah! que ſenſiblement cette atteinte me touche,	Ah! que sensiblement cette atteinte me touche,
Mais il faut voir qui c’eſt, & de ma main punir....	Mais il faut voir qui c'est, et de ma main punir…
La voici, ma fureur, te peux tu retenir?	La voici, ma fureur, te peux-tu retenir?
HE' bien que voulez-vous, & quel eſpoir, de grace,	Hé bien que voulez-vous, et quel espoir de grâce,
Aprés vos procedez peut flater vôtre audace?	Après vos procédés, peut flatter votre audace?
Oſez vous à mes yeux encor vous preſenter,	Osez-vous à mes yeux encore vous présenter,
Et que me direz-vous que je doire écouter?	Et que me direz-vous que je doive écouter?
Que toutes les horreurs, dont un ame eſt capable	Que toutes les horreurs dont une âme est capable
A vos deloyautez n’ont rien de comparable,	À vos déloyautés n'ont rien de comparable,
Que le ſort, les demons & le Ciel en courroux,	Que le sort, les démons et le Ciel en courroux,
N’ont jamais rien produit de ſi méchant que vous.	N'ont jamais rien produit de si méchant que vous.
Ah! vraiment j’attendois l'excuſe d’une outrage,	Ah! Vraiment, j'attendais l'excuse d'un outrage,
Mais à ce que je vois, c’eſt un autre langage.	Mais, à ce que je vois, c'est un autre langage.
Oüi, oüi, c’en eſt un autre, & vous n’attendiez pas	Oui, oui, c'en est un autre, et vous n'attendiez pas
Que j’euſſe decouvert le traître dans vos bras,	Que j'eusse découvert le traître dans vos bras,
Qu’un funeſte hazard par la porte entr’ouverte,	Qu'un funeste hasard par la porte entr'ouverte,
Eut offert à mes yeux vôtre honte, & ma perte.	Eût offert à mes yeux votre honte, et ma perte.
Eſt-ce l’heureux Amant ſur ſes pas revenu,	Est-ce l'heureux Amant sur ses pas revenu,
Ou quelque autre Rival qui m’étoit inconnu?	Ou quelque autre Rival qui m'était inconnu?
O Ciel! donne à mon cœur des forces ſuffiſantes	ô Ciel! donne à mon cœur des forces suffisantes
Pour pouvoir ſupporter des douleurs ſi cuiſantes.	Pour pouvoir supporter des douleurs si cuisantes.
Rougiſſez maintenant, vous en avez raiſon,	Rougissez maintenant, vous en avez raison,
Et le maſque eſt levé de vôtre trahiſon.	Et le masque est levé de votre trahison.
Voilà ce que marquoient les troubles de mon ame,	Voilà ce que marquaient les troubles de mon âme,
Ce n’étoit pas en vain que s’allarmoit ma flame;	Ce n'était pas en vain que s'alarmait ma flamme;
Par ces frequens foupçons qu’on trouvoit odieux,	Par ces fréquents soupçons qu'on trouvait odieux,
Je cherchois le malheur qu’ont rencontré mes yeux.	Je cherchais le malheur qu'ont rencontré mes yeux.
Et malgré tous vos ſoins , & vôtre adreſſe à feindre,	Et malgré tous vos soins et votre adresse à feindre,
Mon aſtre me diſoit ce que j’avois à craindre;	Mon astre me disait ce que j'avais à craindre;
Mais ne preſumez pas que ſaiis étre vangé,	Mais ne présumez pas que sans être vengé,
Je ſouffre le depit de me voir outragé.	Je souffre le dépit de me voir outragé.
Je ſçai que ſur les vœux on n’a point de puiſſance,	Je sais que sur les vœux on n'a point de puissance,
Que l’amour veur par tout naître ſans dependance,	Que l'amour veut partout naître sans dépendance,
Que jamais par la force on n’entra dans un cœur,	Que jamais par la force on n'entra dans un cœur,
Et que toute ame eft libre à nommer ſon vainqueur	Et que toute âme est libre à nommer son vainqueur
Auſſi ne trouverois-je aucun ſujet de plainte,	Aussi ne trouverais-je aucun sujet de plainte,
Si pour moi vôtre bouche avoit parlé ſans feinte,	Si pour moi votre bouche avait parlé sans feinte,
Et ſon arrét livrant mon eſpoir à la mort,	Et son arrêt livrant mon espoir à la mort,
Mon cœur n’auroit eu droit de s’en prendre qu’au ſort.	Mon cœur n'aurait eu droit de s'en prendre qu'au sort.
Mais d’un aveu trompeur voir ma flame applaudie,	Mais d'un aveu trompeur voir ma flamme applaudie,
C’eſt une trahiſon, c’eſt une perfidie,	C'est une trahison, c'est une perfidie,
Qui ne ſçauroit trouver de trop grands chatimens,	Qui ne saurait trouver de trop grands châtiments,
Et je puis tout permettre à mes reſſentimens;	Et je puis tout permettre à mes ressentiments;
Non, non, n’eſperez rien aprés un tel outrage,	Non, non, n'espérez rien après un tel outrage,
Je ne ſuis plus à moi, je ſuis tout à la rage,	Je ne suis plus à moi, je suis tout à la rage,
Trahi de tous côtez, mis dans un triſte état,	Trahi de tous côtés, mis dans un triste état,
Il faut que mon amour ſe vange avec éclat,	Il faut que mon amour se venge avec éclat,
Qu’ici j’immole tout à ma fureur extréme,	Qu'ici j'immole tout à ma fureur extrême,
Et que mon deſeſpoir acheve par moi-même.	Et que mon désespoir achève par moi-même.
Aſſez paiſiblement vous a t’on écouté,	Assez paisiblement vous a-t-on écouté,
Et pourrai-je a mon tour parler en liberté?	Et pourrai-je à mon tour parler en liberté?
Et par quels beaux diſcours que l’artifice inſpire....	Et par quels beaux discours que l'artifice inspire…
Si vous avez encor quelque choſe à me dire,	Si vous avez encore quelque chose à me dire,
Vous pouvez l’ajouter, je ſuis prête à l’oüir,	Vous pouvez l'ajouter, je suis prête à l'ouïr,
Si non, faites au moins que je puiſſe joüir	Sinon, faites au moins que je puisse jouir
De deux, ou trois momens de paiſible audience.	De deux, ou trois moments de paisible audience.
Hé bien, j’écoute, ô Ciel, quelle eſt ma patience.	Hé bien, j'écoute. ô Ciel, quelle est ma patience.
Je force ma colere, & veux ſans nulle aigreur,	Je force ma colère, et veux sans nulle aigreur,
Repondre à ce diſcours ſi rempli de fureur.	Répondre à ce discours si rempli de fureur.
C'eſt que vous voyez bien....	C'est que vous voyez bien…
Ah! j’ai prété l’oreille,	Ah! J'ai prêté l'oreille,
Autant qu’il vous a plu; rendez-moi la pareille.	Autant qu'il vous a plu; rendez-moi la pareille.
J’admire mon deſtin, & jamais ſous les Cieux,	J'admire mon destin, et jamais sous les Cieux,
Il ne fut rien, je croi, de ſi prodigieux,	Il ne fut rien, je crois, de si prodigieux,
Rien dont la nouveauté ſoit plus inconcevable.	Rien dont la nouveauté soit plus inconcevable.
Et rien que la raiſon rende moins ſupportable.	Et rien que la raison rende moins supportable.
Je me vois un Amant, qui ſans ſe rebuter,	Je me vois un Amant, qui sans se rebuter,
Applique tous ſes ſoins à me perſecuter,	Applique tous ses soins à me persécuter,
Qui dans tout cet amour que ſa bouche m’exprime,	Qui dans tout cet amour que sa bouche m'exprime,
Ne conſerver pour moi nul ſentiment d’eſtime,	Ne conserve pour moi nul sentiment d'estime,
Rien au fond de ce cœur qu’ont pu bleſſer mes yeux,	Rien au fond de ce cœur qu'ont pu blesser mes yeux,
