Qu'on nomme belles aſſemblées,	Qu’on nomme belles assemblées,
Des femmes, tous les iours corrompent les eſprits.	Des femmes, tous les jours corrompent les esprits.
En bonne Politique on les doit interdire;	En bonne Politique on les doit interdire;
Car c'est là, que l'on conſpire	Car c’est là que l’on conspire
Contre les pauures maris.	Contre les pauvres maris.
Toute femme qui veut à l’honneur ſe voüer,	Toute femme qui veut à l’honneur se vouer,
Doit ſe deffendre de ioüer,	Doit se défendre de jouer,
Comme d'vne choſe funeste.	Comme d’une chose funeste.
Car le ieu fort deceuant	Car le jeu fort décevant
Pouſſe vne femme ſouuent,	Pousse une femme souvent,
A ioüer de tout ſon reſte.	À jouer de tout son reste.
Des promenades du temps,	Des promenades du temps,
Ou repas qu'on donne aux champs	Ou repas qu’on donne aux champs
Il ne faut point quelle eſſaye.	Il ne faut point qu’elle essaye.
Selon les prudens cerueaux,	Selon les prudents cerveaux,
Le mari dans ces cadeaux	Le mari dans ces cadeaux
Eſt touſiours ceiuy qui paye.	Est toujours celui qui paye.
Vous acheuerez ſeule, & pas à pas tantoſt	Vous achèverez seule, et pas à pas, tantôt
Ie vous expliqueray ces choſes comme il faut.	Je vous expliquerai ces choses comme il faut.
Ie me ſuis ſouuenu d’vne petite affaire.	Je me suis souvenu d’une petite affaire.
Ie n’ay qu’vn mot à dire, & ne tarderay guere.	Je n’ai qu’un mot à dire, et ne tarderai guère.
Rentrez: & conſeruez ce Liure cherement.	Rentrez: et conservez ce Livre chèrement.
Si le Notaire vient, qu’il m’attende vn moment.	Si le Notaire vient, qu’il m’attende un moment.
IE ne puis faire mieux que d’en faire ma femme.	Je ne puis faire mieux que d’en faire ma femme.
Ainſi que ie voudray, ie tourneray cette ame.	Ainsi que je voudrai, je tournerai cette âme.
Cõme vn morceau de cire entre mes mains elle eſt,	Comme un morceau de cire entre mes mains elle est,
Et ie luy puis donner la forme qui me plaiſt.	Et je lui puis donner la forme qui me plaît.
Il s’en eſt peu fallu que, durant mon abſence,	Il s’en est peu fallu que, durant mon absence,
On ne m’ait attrapé par ſon trop d’innocence,	On ne m’ait attrapé par son trop d’innocence,
Mais il vaut beaucoup mieux, à dire verité,	Mais il vaut beaucoup mieux, à dire vérité,
Que la femme qu’on a pêche de ce coſté.	Que la femme qu’on a pèche de ce côté.
De ces ſortes d’erreurs le remede eſt facile.	De ces sortes d’erreur le remède est facile.
Toute perſonne ſimple aux leçons eſt docile:	Toute personne simple aux leçons est docile:
Et ſi du bon chemin on l’a fait écarter	Et si du bon chemin on l’a fait écarter
Deux mots incontinent l’y peuuent rejetter.	Deux mots incontinent l’y peuvent rejeter.
Mais vne femme habile eſt bien vne autre beſte.	Mais une femme habile est bien une autre bête.
Noſtre ſort ne dépend que de ſa ſeule teſte:	Notre sort ne dépend que de sa seule tête:
De ce qu’elle s’y met, rien ne la fait gauchir,	De ce qu’elle s’y met, rien ne la fait gauchir,
Et nos enſeignemens ne font là que blanchir.	Et nos enseignements ne font là que blanchir.
Son bel eſprit luy ſert a railler nos maximes,	Son bel esprit lui sert à railler nos maximes,
A ſe faire ſouuent des vertus de ſes crimes;	À se faire souvent des vertus de ses crimes;
Et trouuer, pour venir à ſes coupables fins,	Et trouver, pour venir à ses coupables fins,
Des détours à duper l’adreſſe des plus fins.	Des détours à duper l’adresse des plus fins.
Pour ſe parer du coup en vain on ſe fatigue.	Pour se parer du coup en vain on se fatigue.
Vne femme d’eſprit eſt vn diable en intrigue:	Une femme d’esprit est un diable en intrigue:
Et dés que ſon caprice a prononcé tout bas	Et dès que son caprice a prononcé tout bas
L’arreſt de noſtre honneur, il faut paſſer le pas.	L’arrêt de notre honneur, il faut passer le pas.
Beaucoup d’honneſtes gens en pourroient bien que dire.	Beaucoup d’honnêtes gens en pourraient bien que dire.
Enfin mon eſtourdy n’aura pas lieu d’en rire.	Enfin mon étourdi n’aura pas lieu d’en rire.
Par ſon trop de caquet il a ce qu’il luy faut.	Par son trop de caquet il a ce qu’il lui faut.
Voila de nos François l’ordinaire defaut.	Voilà de nos Français l’ordinaire défaut.
Dans la poſſeſſion d’vne bonne fortune,	Dans la possession d’une bonne fortune,
Le ſecret eſt toûjours ce qui les importune;	Le secret est toujours ce qui les importune;
Et la vanité ſotte a pour eux tant d’appas,	Et la vanité sotte a pour eux tant d’appas,
Qu'ils ſe pendroient plutoſt que de ne cauſer pas.	Qu’ils se pendraient plutôt que de ne causer pas.
O que les femmes ſont du diable bien tentées,	Ô que les femmes sont du diable bien tentées,
Lors qu’elles vont choiſir ces teſtes éuentées!	Lorsqu’elles vont choisir ces têtes éventées!
Et que... Mais le voici: cachons-nous toûjours bien,	Et que… Mais le voici: cachons-nous toujours bien,
Et découurons vn peu quel chagrin eſt le ſien.	Et découvrons un peu quel chagrin est le sien.
JE reuiens de chez vous, & le deſtin me montre	Je reviens de chez vous, et le destin me montre
A Qu'il n’a pas reſolu que ie vous y rencontre.	Qu’il n’a pas résolu que je vous y rencontre.
Mais i’iray tant de fois qu’enfin quelque moment...	Mais j’irai tant de fois qu’enfin quelque moment…
Hé mon Dieu! n’entrons point dans ce vain compliment.	Hé mon Dieu! n’entrons point dans ce vain compliment.
Rien ne me faſche tant que ces ceremonies,	Rien ne me fâche tant que ces cérémonies,
Et ſi l’on m’en croyoit, elles ſeroient bannies.	Et si l’on m’en croyait, elles seraient bannies.
C’eſt vn maudit vſage, & la pluſpart des gens	C’est un maudit usage, et la plupart des gens
Y perdent ſottement les deux tiers de leur temps.	Y perdent sottement les deux tiers de leur temps.
Mettons donc ſans façons. Hé bien. vos amourettes.	Mettons donc sans façon. Hé bien vos amourettes.
Puis-ie, Seigneur Horace, apprẽdre où vous en eſtes?	Puis-je, Seigneur Horace, apprendre où vous en êtes?
I’eſtois tantoſt diſtrait par quelque viſion:	J’étais tantôt distrait par quelque vision:
Mais depuis là-deſſus i’ay fait reflexion.	Mais depuis là-dessus j’ai fait réflexion.
De vos premiers progrez i’admire la viteſſe,	De vos premiers progrès j’admire la vitesse,
Et dans l’éuenement mon ame s’intereſſe.	Et dans l’événement mon âme s’intéresse.
Ma foy, depuis qu’à vous s’eſt découuert mon cœur,	Ma foi, depuis qu’à vous s’est découvert mon cœur,
Il eſt à mon amour arriué du malheur.	Il est à mon amour arrivé du malheur.
Oh, oh! comment cela?	Oh, oh! comment cela?
La fortune cruelle,	La fortune cruelle,
A ramené des champs le patron de la belle.	A ramené des champs le patron de la belle.
Quel malheur!	Quel malheur!
Et de plus, à mon tres-grand regret,	Et de plus, à mon très grand regret,
Il a ſceu de nous deux le commerce ſecret.	Il a su de nous deux le commerce secret.
D’où diantre! a-t-il ſi toſt appris cette auanture?	D’où, diantre! a-t-il sitôt appris cette aventure?
Ie ne ſçay. Mais enfin c’eſt vne choſe ſeure.	Je ne sais. Mais enfin c’est une chose sûre.
Ie penſois aller rendre, à mon heure à peu prés,	Je pensais aller rendre, à mon heure, à peu prés,
Ma petite viſite à ſes ieunes attraits.	Ma petite visite à ses jeunes attraits,
Lors que changeant pour moy de ton & de viſage,	Lorsque changeant pour moi de ton et de visage
Et Seruante & Valet m’ont bouché le paſſage,	Et Servante et Valet m’ont bouché le passage,
Et d’vn: retirez-vous, vous nous importunez.	Et d’un: retirez vous, vous nous importunez.
M’ont aſſez rudement fermé la porte au nez.	M’ont assez rudement fermé la porte au nez.
La porte au nez!	La porte au nez!
Au nez.	Au nez.
La choſe eſt vn peu forte.	La chose est un peu forte.
I'ay voulu leur parler au trauers de la porte:	J’ai voulu leur parler au travers de la porte:
Mais à tous mes propos ce qu’ils ont répondu	Mais à tous mes propos ce qu’ils ont répondu
C'eſt, vous n'entrerez point, Monſieur l'a defendu.	C’est, vous n’entrerez point, Monsieur l’a défendu.
Ils n’ont donc point ouuert?	Ils n’ont donc point ouvert?
Non. Et de la feneſtre	Non. Et de la fenêtre
Agnés m’a confirmé le retour de ce Maiſtre;	Agnès m’a confirmé le retour de ce Maître;
En me chaſſant de là d’vn ton plein de fierté,	En me chassant de là d’un ton plein de fierté,
Accompagné d’vn grez que ſa main a ietté.	Accompagné d’un grès que sa main a jeté.
Comment d’vn grez?	Comment d’un grès?
D’vn grez de taille non petite,	D’un grès de taille non petite,
Dont on a par ſes mains regalé ma viſite.	Dont on a par ses mains régalé ma visite.
Diantre! ce ne ſont pas des prunes que cela;	Diantre! ce ne sont pas des prunes que cela;
Et ie trouue faſcheux l’eſtat où vous voila.	Et je trouve fâcheux l’état où vous voilà.
Il eſt vray, ie ſuis mal par ce retour funeſte.	Il est vrai, je suis mal par ce retour funeste.
Certes i’en ſuis faſché pour vous, ie vous proteſte.	Certes j’en suis fâché pour vous, je vous proteste.
Cet homme me rompt tout.	Cet homme me rompt tout.
Oüy, mais cela n’eſt rien,	Oui, mais cela n'est rien,
Et de vous racrocher vous trouuerez moyen.	Et de vous raccrocher vous trouverez moyen.
Il faut bien eſſayer par quelque intelligence	Il faut bien essayer par quelque intelligence
De vaincre du jaloux l'exacte vigilance.	De vaincre du jaloux l’exacte vigilance.
Cela vous eſt facile, & la fille apres tout	Cela vous est facile, et la fille, après tout,
Vous aime.	Vous aime.
Aſſeurément.	Assurément.
Vous en viendrez à bout.	Vous en viendrez à bout.
Ie l’eſpere,	Je l’espère.
Le grés vous a mis en déroute,	Le grès vous a mis en déroute,
Mais cela ne doit pas vous eſtonner.	Mais cela ne doit pas vous étonner.
Sans doute,	Sans doute,
Et i’ay compris d’abord que mon homme eſtoit là,	Et j’ai compris d’abord que mon homme était là,
Qui ſans ſe faire voir conduiſoit tout cela:	Qui sans se faire voir conduisait tout cela:
Mais ce qui m’a ſurpris & qui va vous ſurprendre,	Mais ce qui m’a surpris et qui va vous surprendre,
C’eſt vn autre incident que vous allez entendre,	C’est un autre incident que vous allez entendre,
Vn trait hardy qu’a fait cette ieune beauté,	Un trait hardi qu’a fait cette jeune beauté,
Et qu’on n’attendroit point de ſa ſimplicité;	Et qu’on n’attendrait point de sa simplicité;
Il le faut auoüer, l’amour eſt vn grand maiſtre,	Il le faut avouer, l’amour est un grand maître,
Ce qu’on ne fut iamais il nous enſeigne à l’eſtre,	Ce qu’on ne fut jamais il nous enseigne à l’être,
Et ſouuent de nos mœurs l’abſolu changement	Et souvent de nos mœurs l’absolu changement
Deuient par ſes leçons l’ouurage d’vn moment.	Devient par ses leçons l’ouvrage d’un moment.
De la nature en nous il force les obſtacles,	De la nature en nous il force les obstacles,
Et ſes effets ſoudains ont de l’air des miracles,	Et ses effets soudains ont de l’air des miracles,
D’vn auare à l’inſtant il fait vn liberal:	D’un avare à l’instant il fait un libéral:
Vn Vaillant d’vn Poltron, vn Ciuil d’vn Brutal.	Un Vaillant d’un Poltron, un Civil d’un Brutal.
Il rend agile à tout l’ame la plus peſante,	Il rend agile à tout l’âme la plus pesante,
Et donne de l’eſprit à la plus innocente:	Et donne de l’esprit à la plus innocente:
Ouy, ce dernier miracle éclatte dans Agnés,	Oui, ce dernier miracle éclate dans Agnès,
Car tranchant auec moy par ces termes exprés,	Car tranchant avec moi par ces termes exprès,
Retirez-vous, mon ame aux viſites renonce,	Retirez-vous, mon âme aux visites renonce,
Ie ſçay tous vos diſcours: Et voilà ma reſponce.	Je sais tous vos discours: Et voila ma réponse.
Cette pierre ou ce grés dont vous vous eſtonniez,	Cette pierre ou ce grès dont vous vous étonniez,
Auec vn mot de lettre eſt tombée à mes pieds,	Avec un mot de lettre est tombée à mes pieds,
Et i’admire de voir cette lettre ajuſtée,	Et j’admire de voir cette lettre ajustée,
Auec le ſens des mots; Et la pierre iettée;	Avec le sens des mots; Et la pierre jetée;
D’vne telle action n’eſtes-vous pas ſurpris?	D’une telle action n’êtes-vous pas surpris?
L’amour ſçait-il pas l’art d’aiguiſer les eſprits?	L’Amour sait-il pas l’art d’aiguiser les esprits?
Et peut-on me nier que ſes flames puiſſantes,	Et peut-on me nier que ses flammes puissantes,
Ne faſſent dans vn cœur des choſes eſtonnantes?	Ne fassent dans un cœur des choses étonnantes?
Que dites-vous du tour, & de ce mot d’eſcrit?	Que dites-vous du tour, et de ce mot d’écrit?
Euh! n’admirez-vous point cette adreſſe d’eſprit?	Euh! n’admirez-vous point cette adresse d’esprit?
Trouuez-vous pas plaiſant de voir quel Perſonnage	Trouvez-vous pas plaisant de voir quel Personnage
A ioüé mon jaloux dans tout ce badinage.	A joué mon jaloux dans tout ce badinage.
Dites,	Dites,
Oüy fort plaiſant,	Oui fort plaisant.
Riez-en donc vn peu,	Riez-en donc un peu,
Cét homme gendarmé d’abord contre mon feu,	Cet homme gendarmé d’abord contre mon feu,
Qui chez luy ſe retranche, & de grés fait parade,	Qui chez lui se retranche, et de grès fait parade,
Comme ſi i’y voulois entrer par eſcalade,	Comme si j’y voulais entrer par escalade,
Qui pour me repouſſer dans ſon bizarre effroy,	Qui pour me repousser dans son bizarre effroi,
Anime du dedans tous ſes gens contre moy,	Anime du dedans tous ses gens contre moi,
Et qu’abuſe à ſes yeux par ſa machine meſme,	Et qu’abuse à ses yeux par sa machine même,
Celle qu’il veut tenir dans l’ignorance extréme:	Celle qu’il veut tenir dans l’ignorance extrême:
Pour moy ie vous l’auouë, encor que ſon retour	Pour moi je vous l’avoue, encor que son retour
En vn grand embarras jette icy mon amour,	En un grand embarras jette ici mon amour,
Ie tiens cela plaiſant autant qu’on ſçauroit dire,	Je tiens cela plaisant autant qu’on saurait dire,
Ie ne puis y ſonger ſans de bon cœur en rire.	Je ne puis y songer sans de bon cœur en rire.
Et vous n’enriez pas aſſez à mon auis.	Et vous n’en riez pas assez à mon avis.
Pardonnez-moy, i’en ris tout autant que ie puis.	Pardonnez-moi, j’en ris tout autant que je puis.
Mais il faut qu’en amy ie vous montre la lettre.	Mais il faut qu’en ami je vous montre la lettre.
Tout ce que ſon cœur ſent, ſa main a ſçeu l’y mettre:	Tout ce que son cœur sent, sa main a su l’y mettre:
Mais en termes touchans, & tous pleins de bonté,	Mais en termes touchants, et tous pleins de bonté,
De tendreſſe innocente, & d’ingenuité,	De tendresse innocente, et d’ingénuité,
De la maniere enfin que la pure nature	De la manière enfin que la pure nature
Exprime de l’amour la premiere bleſſure.	Exprime de l’amour la première blessure.
Voilà, friponne, à quoy l’eſcriture te fert,	Voilà, friponne, à quoi l’écriture te sert,
Et contre mon deſſein l’art t’en fut découuert.	Et contre mon dessein l’art t’en fut découvert.
Hom chienne.	Hom chienne.
Qu'auez-vous?	Qu'avez-vous?
Moy? rien; c’eſt que ie touſſe,	Moi? rien; c'est que je tousse,
Auez-vous jamais veu, d’expreſſion plus douce,	Avez-vous jamais vu, d’expression plus douce,
Malgré les ſoins maudits d’vn iniuſte pouuoir,	Malgré les soins maudits d’un injuste pouvoir,
Vn plus beau naturel peut-il ſe faire voir?	Un plus beau naturel peut-il se faire voir?
Et n’eſt-ce pas ſans doute vn crime puniſſable,	Et n’est-ce pas sans doute un crime punissable,
De gaſter meſchamment ce fons d’ame admirable?	De gâter méchamment ce fonds d’âme admirable?
D’auoir dans l’ignorance & la ſtupidité,	D’avoir dans l’ignorance et la stupidité,
Voulu de cét esprit eſtoufer la clarté?	Voulu de cet esprit étouffer la clarté?
L’amour a commencé d’en déchirer le voile,	L’amour a commencé d’en déchirer le voile,
Et ſi par la faueur de quelque bonne eſtoile,	Et si par la faveur de quelque bonne étoile,
Ie puis, comme i’eſpere, à ce franc animal,	Je puis, comme j’espère, à ce franc animal,
Ce traiſtre, ce bourreau, ce faquin, ce brutal......	Ce traître, ce bourreau, ce faquin, ce brutal…
Adieu.	Adieu.
Comment ſi viſte?	Comment si vite?
Il m’eſt dans la pensée	Il m'est dans la pensée
Venu tout maintenant vne affaire preſſée.	Venu tout maintenant une affaire pressée.
Mais ne ſçauriez-vous point comme on la tient de prés,	Mais ne sauriez-vous point, comme on la tient de près,
Qui dans cette maiſon pourroit auoir accés,	Qui dans cette maison pourrait avoir accès,
I’en vſe ſans ſcrupule, & ce n’eſt pas merueille,	J’en use sans scrupule, et ce n’est pas merveille,
Qu’on ſe puiſſe entre amis ſeruir à la pareille,	Qu’on se puisse entre amis servir à la pareille.
Ie n’ay plus là dedans que gens pour m’obſeruer,	Je n’ai plus là-dedans que gens pour m’observer,
Et ſeruante & valet que ie viens de trouuer,	Et servante et valet que je viens de trouver,
N’ont iamais de quelque air que ie m’y ſois pû prendre,	N’ont jamais de quelque air que je m’y sois pu prendre
Adoucy leur rudeſſe à me vouloir entendre,	Adouci leur rudesse à me vouloir entendre,
I’auois pour de tels coups certaine vieille en main,	J’avais pour de tels coups certaine vieille en main,
D’vn genie à vray dire au deſſus de l’humain,	D’un génie à vrai dire au-dessus de l’humain,
Elle m’a dans l’abord ſerui de bonne ſorte:	Elle m’a dans l’abord servi de bonne sorte:
Mais depuis quatre iours la pauure femme eſt morte,	Mais depuis quatre jours la pauvre femme est morte,
Ne me pourriez-vous point ouurir quelque moyen?	Ne me pourriez-vous point ouvrir quelque moyen?
Non vrayment, & ſans moy vous en trouuerez bien.	Non vraiment, et sans moi vous en trouverez bien.
Adieu donc. Vous voyez ce que ie vous confie.	Adieu donc. Vous voyez ce que je vous confie.
COmme il faut deuant lui que ie me mortifie,	COmme il faut devant lui que je me mortifie,
Quelle peine à cacher mon déplaiſir cuiſant.	Quelle peine à cacher mon déplaisir cuisant.
Quoy pour vne innocente, vn eſprit ſi preſent?	Quoi pour une innocente, un esprit si pressent?
Elle a feint d’eſtre telle à mes yeux la traiſtreſſe;	Elle a feint être telle à mes yeux la traîtresse;
Ou le diable à ſon ame a ſouflé cette adreſſe:	Ou le diable à son âme a soufflé cette adresse:
Enfin me voilà mort par ce funeſte eſcrit,	Enfin me voilà mort par ce funeste écrit,
Ie voy qu’il a le traiſtre empaumé ſon eſprit,	Je vois qu’il a le traître empaumé son esprit,
Qu'à ma ſuppreſſion il s’eſt ancré chez elle,	Qu’à ma suppression il s’est ancré chez elle,
Et c’eſt mon deſeſpoir, & ma peine mortelle,	Et c’est mon désespoir, et ma peine mortelle,
Ie ſouffre doublement dans le vol de ſon cœur,	Je souffre doublement dans le vol de son cœur,
Et l’amour y pâtit auſſi bien que l’honneur.	Et l’amour y pâtit aussi bien que l’honneur.
I’enrage de trouuer cette place vſurpée,	J’enrage de trouver cette place usurpée,
Et i’enrage de voir ma prudence trompée.	Et j’enrage de voir ma prudence trompée.
Ie ſçay que pour punir ſon amour libertin	Je sais que pour punir son amour libertin
Ie n’ay qu’à laiſſer faire à ſon mauuais deſtin,	Je n’ai qu’à laisser faire à son mauvais destin,
Que ie ſeray vangé d’elle par elle-meſme:	Que je serai vengé d’elle par elle-même:
Mais il eſt bien faſcheux de perdre ce qu’on aime.	Mais il est bien fâcheux de perdre ce qu’on aime.
Ciel! puiſque pour vn choix i’ay tant Philoſophé,	Ciel! puisque pour un choix j’ai tant Philosophé,
Faut-il de ſes appas m’eſtre ſi fort coëffé?	Faut-il de ses appas m’être si fort coiffé?
Elle n’a ni parens, ni ſupport, ni richeſſe,	Elle n’a ni parents, ni support, ni richesse,
Elle trahit mes ſoins, mes bontez, ma tendreſſe,	Elle trahit mes soins, mes bontés, ma tendresse,
Et cependant ie l’aime, aprés ce laſche tour,	Et cependant je l’aime, après ce lâche tour,
Iuſqu’à ne me pouuoir paſſer de cét amour.	Jusqu’à ne me pouvoir passer de cet amour.
Sot, n’as-tu point de honte, ah ie creue, i’enrage,	Sot, n’as-tu point de honte, ah je crève, j’enrage,
Et ie ſoufleterois mille fois mon viſage,	Et je souffletterais mille fois mon visage,
Ie veux entrer vn peu; mais ſeulement pour voir	Je veux entrer un peu; mais seulement pour voir
Quelle eſt ſa contenance aprés vn trait ſi noir.	Quelle est sa contenance après un trait si noir.
Ciel! faites que mon front ſoit exempt de diſgrace,	Ciel! faites que mon front soit exempt de disgrâce,
Ou bien s’il eſt eſcrit, qu’il faille que i’y paſſe,	Ou bien s’il est écrit, qu’il faille que j’y passe,
Donnez-moy tout au moins pour de tels accidens,	Donnez-moi tout au moins pour de tels accidents
La conſtance qu’on voit à de certaines gens.	La constance qu’on voit à de certaines gens.
I’Ay peine, ie l’auouë, à demeurer en place,	J’ai peine, je l’avoue, à demeurer en place,
Et de mille ſoucis mon eſprit s’embaraſſe,	Et de mille soucis mon esprit s’embarrasse,
Pour pouuoir mettre vn ordre & dedans & dehors,	Pour pouvoir mettre un ordre et dedans et dehors,
Qui du godelureau rompe tous les efforts:	Qui du godelureau rompe tous les efforts:
De quel œil la traiſtreſſe a ſouſtenu ma veuë,	De quel œil la traîtresse a soutenu ma vue,
De tout ce qu’elle a fait elle n’eſt point émeuë.	De tout ce qu’elle a fait elle n’est point émue.
Et bien qu’elle me mette à deux doigts du treſpas,	Et bien qu’elle me mette à deux doigts du trépas,
On diroit à la voir qu’elle n’y touche pas.	On dirait à la voir qu’elle n’y touche pas.
Plus en la regardant ie la voyois tranquile,	Plus en la regardant je la voyais tranquille,
Plus ie ſentois en moy s’eſchaufer vne bile,	Plus je sentais en moi s’échauffer une bile,
Et ces boüillants tranſports dont s’enflammoit mon cœur,	Et ces bouillants transports dont s’enflammait mon cœur,
Y ſembloient redoubler mon amoureuſe ardeur.	Y semblaient redoubler mon amoureuse ardeur.
I’eſtois aigry, faſché, deſeſperé contre elle,	J’étais aigri, fâché, désespéré contre elle,
Et cependant iamais ie ne la vis ſi belle;	Et cependant jamais je ne la vis si belle;
Iamais ſes yeux au miens n’ont paru ſi perçans,	Jamais ses yeux aux miens n’ont paru si perçants,
Iamais ie n’eus pour eux des deſirs ſi preſſans,	Jamais je n’eus pour eux des désirs si pressants,
Et ie ſens là dedans qu’il faudra que ie creue,	Et je sens là-dedans qu’il faudra que je crève,
Si de mon triſte ſort la diſgrace s’acheue.	Si de mon triste sort la disgrâce s’achève.
Quoy? i’auray dirigé ſon education	Quoi? j’aurai dirigé son éducation
Auec tant de tendreſſe & de précaution?	Avec tant de tendresse et de précaution,
Ie l’auray fait paſſer chez moy dés ſon enfance,	Je l’aurai fait passer chez moi dès son enfance,
Et i’en auray chery la plus tendre eſperance.	Et j’en aurai chéri la plus tendre espérance,
Mon cœur aura baſty ſur ſes attraits naiſſans,	Mon cœur aura bâti sur ses attraits naissants,
Et creu la mitonner pour moy durant treize ans.	Et cru la mitonner pour moi durant treize ans,
Afin qu’vn ieune fou dont elle s’amourache	Afin qu’un jeune fou dont elle s’amourache
Me la vienne euleuer iuſque ſur la mouſtache,	Me la vienne enlever jusque sur la moustache,
Lors qu’elle eſt auec moy mariée à demy.	Lorsqu’elle est avec moi mariée à demi.
Non parbleu, non parbleu, petit ſor mon amy,	Non parbleu, non parbleu, petit sot mon ami,
Vous aurez beau tourner où i'y perdray mes peines,	Vous aurez beau tourner ou j’y perdrai mes peines,
Ou ie rendray ma foy, vos eſperances vaines,	Ou je rendrai ma foi, vos espérances vaines,
Et de moy tout à fait vous ne vous rirez point.	Et de moi tout à fait vous ne vous rirez point.
AH le voilà! Bon iour, me voicy tout à point	Ah le voilà! Bonjour, me voici tout à point
Pour dreſſer le contract que vous ſouhaittez faire.	Pour dresser le contrat que vous souhaitez faire.
Comment faire!	Comment faire!
Il le faut dans la forme ordinaire,	Il le faut dans la forme ordinaire,
A mes précautions ie veux ſonger de prés,	À mes précautions je veux songer de près,
Ie ne paſſeray rien contre vos intereſts.	Je ne passerai rien contre vos intérêts.
Il ſe faut garantir de toutes les ſurpriſes.	Il se faut garantir de toutes les surprises.
Suffit qu’entre mes mains vos affaires ſoient miſes,	Suffit qu’entre mes mains vos affaires soient mises,
Il ne vous faudra point de peur d’eſtre deçeu,	Il ne vous faudra point de peur d’être déçu,
Quittancer le Contract que vous n’ayez receu.	Quittancer le Contrat que vous n’ayez reçu.
I’ay peur ſi ie vais faire éclater quelque choſe	J’ai peur si je vais faire éclater quelque chose
Que de cét incident par la ville on ne cauſe.	Que de cet incident par la ville on ne cause.
Et bien il eſt aisé d’empeſcher cét éclat,	Et bien il est aisé d’empêcher cet éclat,
Et l’on peut en ſecret faire voſtre Contract.	Et l’on peut en secret faire votre Contrat.
Mais comment faudra-il qu’auec elle j’en ſorte?	Mais comment faudra-il qu’avec elle j’en sorte?
