Qui faſſe droit au ſang que j’ai reçû des Cieux,	Qui fasse droit au sang que j'ai reçu des Cieux,
Et de mes actions défende l’innocence	Et de mes actions défende l'innocence
Contre le moindre effort d’une fauſſe apparence,	Contre le moindre effort d'une fausse apparence,
Oüi, je vous.... Ah! ſur tout ne m’interrompez point.	Oui, je vois… Ah! surtout ne m'interrompez point.
Je vois, dis-je, mon ſort malheureux à ce point,	Je vois, dis-je, mon sort malheureux à ce point,
Qu’un cœur qui dit qu’il m’aime, & qui doit faire croire,	Qu'un cœur qui dit qu'il m'aime, et qui doit faire croire,
Que quand tout l’Univers douteroit de ma gloire,	Que, quand tout l'Univers douterait de ma gloire,
Il voudroit contre tous en être le garand,	Il voudrait contre tous en être le garant,
Eſt celui qui s’en fait l’ennemi le plus grand.	Est celui qui s'en fait l'ennemi le plus grand.
On ne voit échaper aux ſoins que prend ſa flame	On ne voit échapper aux soins que prend sa flamme
Aucune occaſion de ſoupçonner mon ame;	Aucune occasion de soupçonner mon âme;
Mais c’eſt peu des ſoupçons, il en fait des éclats,	Mais c'est peu des soupçons, il en fait des éclats,
Que ſans étre bleſſé l’amour ne ſouffre pas.	Que sans être blessé l'amour ne souffre pas.
Loin d’agir en Amant, qui plus que la mort méme	Loin d'agir en Amant, qui plus que la mort même
Apprehende toujours d’offencer ce qu’il aime,	Appréhende toujours d'offenser ce qu'il aime,
Qui ſe plaint doucement, & cherche avec reſpect	Qui se plaint doucement, et cherche avec respect
A pouvoir s’éclaircir de ce qu’il croit ſuſpect.	À pouvoir s'éclaircir de ce qu'il croit suspect.
A toute extremité dans ſes doutes il paſſe,	À toute extrémité dans ses doutes il passe,
Et ce n’eſt que fureur, qu’injure, & que menace;	Et ce n'est que fureur, qu'injure et que menace;
Cependant aujourd’hui je veux fermer les yeux	Cependant aujourd'hui je veux fermer les yeux
Sur tout ce qui devroit me le rendre odieux,	Sur tout ce qui devrait me le rendre odieux,
Et lui donner moyen par une bonté pure	Et lui donner moyen par une bonté pure
De tirer ſon ſalut d’une nouvelle injure.	De tirer son salut d'une nouvelle injure.
Ce grand emportement qu’il m’a falu ſouffrir,	Ce grand emportement qu'il m'a fallu souffrir,
Part de ce qu’à vos yeux le hazard vient d’offrir,	Part de ce qu'à vos yeux le hasard vient d'offrir,
J’aurois tort de vouloir dementir vôtre veüe,	J'aurais tort de vouloir démentir votre vue,
Et vôtre ame ſans doute a dû paroître émeüe,	Et votre âme sans doute a dû paraître émue,
Et n’eſt-ce pas....	Et n'est-ce pas…
Encor un peu d’attention,	Encore un peu d'attention,
Et vous allez ſçavoir ma reſolution.	Et vous allez savoir ma résolution.
Il faut que de nous deux le deſtin s’accompliſſe,	Il faut que de nous deux le destin s'accomplisse,
Vous êtes maintenant ſur un orand precipice,	Vous êtes maintenant sur un grand précipice,
Et ce que vôtre cœur pourra déliberer,	Et ce que votre cœur pourra délibérer,
Va vous y faire choir, ou bien vous en tirer.	Va vous y faire choir, ou bien vous en tirer.
Si malgré cet objet qui vous a pû ſurprendre,	Si malgré cet objet qui vous a pu surprendre,
Prince, vous me rendez ce que vous devez rendre,	Prince, vous me rendez ce que vous devez rendre,
Et ne demandez point d’autre preuve que moi	Et ne demandez point d'autre preuve que moi
Pour condamner l’erreur du trouble où je vous voi.	Pour condamner l'erreur du trouble où je vous vois.
Si de vos ſentimens la prompte déferance.	Si de vos sentiments la prompte déférence.
Veut ſur ma ſeule foi croire mon innocence,	Veut sur ma seule foi croire mon innocence,
Et de tous vos ſoupçons démentir le credit,	Et de tous vos soupçons démentir le crédit,
Pour croire aveuglement ce que mon cœur vous dit;	Pour croire aveuglément ce que mon cœur vous dit;
Cette ſoûmiſſion, cette marque d’eſtime,	Cette soumission, cette marque d'estime,
Du paſſé dans ce cœur efface tout le crime.	Du passé dans ce cœur efface tout le crime.
Je retracte à l’inſtant, ce qu’un juſte courroux	Je rétracte à l'instant, ce qu'un juste courroux
M’a fait dans la chaleur prononcer contre vous;	M'a fait dans la chaleur prononcer contre vous;
Et ſi je puis un jour choiſir ma deſtinée,	Et si je puis un jour choisir ma destinée,
Sans choquer les devoirs du rang où je ſuis née,	Sans choquer les devoirs du rang où je suis née,
Mon honneur fatisfait par ce reſpect ſoudain	Mon honneur satisfait par ce respect soudain
Promet à vôtre amour & mes veux, & ma main;	Promet à votre amour et mes vœux et ma main;
Mais prêtez bien l’oreille à ce que je vais dire,	Mais prêtez bien l'oreille à ce que je vais dire,
Si cet offre ſur vous obtient ſi peu d’empire,	Si cet offre sur vous obtient si peu d'empire,
Que vous me refuſiez de me faire entre nous	Que vous me refusiez de me faire entre nous
Un ſacrifice entier de vos ſoupçons jaloux;	Un sacrifice entier de vos soupçons jaloux;
S’il ne vous ſuffit pas de toute l’aſſurance	S'il ne vous suffit pas de toute l'assurance
Que vous peuvent donner mon cœur, & ma naiſſance.	Que vous peuvent donner mon cœur et ma naissance.
Et que de vôtre eſprit les ombrages puiſſans	Et que de votre esprit les ombrages puissants
Forcent mon innocence à convaincre vos ſens,	Forcent mon innocence à convaincre vos sens,
Et porter à vos yeux l’éclatant témoignage	Et porter à vos yeux l'éclatant témoignage
D’une vertu ſincere à qui l’on fait outrage:	D'une vertu sincère à qui l'on fait outrage:
Ie ſuis prête à le faire, & vous ſerez content,	Je suis prête à le faire, et vous serez content,
Mais il vous faut de moi détacher à l’inſtant,	Mais il vous faut de moi détacher à l'instant,
A mesvœux pour jamais renoncer de vous même,	À mes vœux pour jamais renoncer de vous-même,
Et j’atteſte du Ciel la puiſſance ſupréme,	Et j'atteste du Ciel la puissance suprême,
Que quoi que le deſtin puiſſe ordonner de nous,	Que, quoi que le destin puisse ordonner de nous,
Ie choiſirai plûtôt d’être à la mort qu’à vous;	Je choisirai plutôt d'être à la mort qu'à vous;
Voilà dans ces deux choix de quoi vous ſatisfaire,	Voilà dans ces deux choix de quoi vous satisfaire,
Aviſez maintenant celui qui peut vous plaire.	Avisez maintenant celui qui peut vous plaire.
Iuſte Ciel! jamais rien peut-il étre inventé	Juste Ciel! jamais rien peut-il être inventé
Avec plus d’artifice, & de deloyauté?	Avec plus d'artifice, et de déloyauté?
Tout ce que des Enfers la malice étudie,	Tout ce que des Enfers la malice étudie,
A t’il rien de ſi noir que cette perfidie,	A-t-il rien de si noir que cette perfidie,
Et peut-elle trouver dans toute ſa rigueur	Et peut-elle trouver dans toute sa rigueur
Un plus cruel moyen d’embaraſſer un cœur?	Un plus cruel moyen d'embarrasser un cœur?
Ah! que vous ſçavez bien, ici contre moy-même,	Ah! que vous savez bien, ici contre moi-même,
Ingrate, vous ſervir de ma foibleſſe extrême,	Ingrate, vous servir de ma faiblesse extrême,
Et ménager pour vous l’effort prodigieux	Et ménager pour vous l'effort prodigieux
De ce fatal amour né de vos traîtres yeux,	De ce fatal amour né de vos traîtres yeux,
Parce qu’on eſt ſurpriſe, & qu’on manque d'excuſe,	Parce qu'on est surprise, et qu'on manque d'excuse,
D’un offre de pardon on emprunte la ruſe,	D'un offre de pardon on emprunte la ruse,
Vôtre feinte douceur forge un amuſement,	Votre feinte douceur forge un amusement,
Pour divertir l’effet de mon reſſentiment;	Pour divertir l'effet de mon ressentiment;
Et par le nœud ſubtil du choix qu’elle embaraſſe,	Et par le nœud subtil du choix qu'elle embarrasse,
Veut ſoûtraire un perfide au coup qui le menace.	Veut soustraire un perfide au coup qui le menace.
Oüi, vos dexteritez veulent me détourner	Oui, vos dextérités veulent me détourner
D’un éclairciſſement qui vous doit condamner;	D'un éclaircissement qui vous doit condamner;
Et vôtre ame feignant une innocente entiere	Et votre âme feignant une innocence entière
Ne s’offre a m’en donner une pleine lumiere,	Ne s'offre à m'en donner une pleine lumière,
Qu’à des conditions qu’aprés d’ardans ſouhaits,	Qu'à des conditions qu'après d'ardents souhaits,
Vous penſez que mon cœur n’acceptera jamais;	Vous pensez que mon cœur n'acceptera jamais;
Mois vous ſerez trompée en me croyant ſurprendre,	Mais vous serez trompée en me croyant surprendre,
Oüi, oüi, je pretends voir ce qui doit vous defendre,	Oui, oui, je prétends voir ce qui doit vous défendre,
Et quel fameux prodige acuſant ma fureur,	Et quel fameux prodige accusant ma fureur,
Peut de ce que j’ai veu juſtiſier l’horreur.	Peut de ce que j'ai vu justifier l'horreur.
Songez que ce par choix vous allez vous precrire	Songez que par ce choix vous allez vous prescrire
De ne plus rien pretendre au cœur de Done Eluire.	De ne plus rien prétendre au cœur de Done Elvire.
Soit, je ſouſcris à tout, & mes vœux auſſi bien,	Soit, je souscris à tout, et mes vœux aussi bien,
En l’état où je ſuis, ne pretendent plus rien.	En l'état où je suis, ne prétendent plus rien.
Vous vous repentirez de l’éclat que vous faites.	Vous vous repentirez de l'éclat que vous faites.
Non, non, tous ces diſcours ſont de vaines defaites,	Non, non, tous ces discours sont de vaines défaites,
Et c’eſt moi bien plûtôt qui dois vous avertir,	Et c'est moi bien plutôt qui dois vous avertir,
Que quelqu’autre dans peu ſe pourra repentir;	Que quelque autre dans peu se pourra repentir;
Le traître, quel qu’il ſoit, n’aura pas l’avantage	Le traître, quel qu'il soit, n'aura pas l'avantage
De dérober ſa vie à l’effort de ma rage.	De dérober sa vie à l'effort de ma rage.
Ah! c’eſt trop en ſouffrir, & mon cœur irrité	Ah! c'est trop en souffrir, et mon cœur irrité
Ne doit plus conſerver une ſotte bonté;	Ne doit plus conserver une sotte bonté;
Abandonnent l’ingrat à ſon propre caprice;	Abandonnons l'ingrat à son propre caprice;
Et puis qu’il veut perir, conſentons qu’il periſſe;	Et puisqu'il veut périr, consentons qu'il périsse;
Eliſe.... A cet éclat vous voulez me forcer,	Élise… À cet éclat vous voulez me forcer,
Mais je vous apprendrai que c’eſt trop m’offenſer.	Mais je vous apprendrai que c'est trop m'offenser.
Faites un peu ſortir la perſonne cherie....	Faites un peu sortir la personne chérie…
Allez, vous m’entendez, dites que je l’en prie.	Allez, vous m'entendez, dites que je l'en prie.
Et je puis....	Et je puis…
Attendez vous ſerez ſatisfait.	Attendez, vous serez satisfait.
Voici de ſon jaloux ſans doute un nouveau trait.	Voici de son jaloux sans doute un nouveau trait.
Prenez garde qu’au moins cette noble colere,	Prenez garde qu'au moins cette noble colère,
Dans la même fierté, juſqu’au bout perſevere;	Dans la même fierté, jusqu'au bout persévère;
Et ſur tout deformais ſongez bien à quel prix	Et surtout désormais songez bien à quel prix
Vous avez voulu voir vos ſoupçons éclaircis.	Vous avez voulu voir vos soupçons éclaircis.
Voici, graces au Ciel, ce qui les a fait naître,	Voici, grâces au Ciel, ce qui les a fait naître,
Ces ſoupçons obligeans que l’on me fait paroître,	Ces soupçons obligeants que l'on me fait paraître,
Voyez bien ce viſage, & ſi de Done Ignes,	Voyez bien ce visage, et si de Done Ignès,
Vos yeux au méme inſtant n’i connoiſſent les traits.	Vos yeux au même instant n'y connaissent les traits.
O Ciel?	Ô Ciel!
Si la fureur dont vôtre ame eſt émüe,	Si la fureur dont votre âme est émue,
Vous trouble juſques là l’uſage de la veüe,	Vous trouble jusque-là l'usage de la vue,
Vous avez d’autres yeux à pouvoir conſulter,	Vous avez d'autres yeux à pouvoir consulter,
Qui ne vous laiſſeront aucun lieu de douter.	Qui ne vous laisseront aucun lieu de douter.
Sa mort eſt une adreſſe au beſoin inventée	Sa mort est une adresse au besoin inventée
Pour fuir l’authorité qui l’a perſecutée,	Pour fuir l'autorité qui l'a persécutée,
Et ſous un tel habit elle cachoit ſon ſort	Et sous un tel habit elle cachait son sort
Pour mieux joüir du fruit de cette feinte mort.	Pour mieux jouir du fruit de cette feinte mort.
Madame, pardonnez, s’il faut que je conſente	Madame, pardonnez, s'il faut que je consente
A trahir vos ſecrets, & tromper vôtre attente;	À trahir vos secrets et tromper votre attente;
Je me vois expoſée à ſa temerité,	Je me vois exposée à sa témérité,
Toutes mes actions n’ont plus de liberté,	Toutes mes actions n'ont plus de liberté,
Et mon honneur en butte aux ſoupçons qu’il peut prendre	Et mon honneur en butte aux soupçons qu'il peut prendre
Eſt reduit à toute heure aux ſoins de le defendre.	Est réduit à toute heure aux soins de se défendre.
Nos doux embraſſemens qu’à ſurpris ce jaloux,	Nos doux embrassements qu'a surpris ce jaloux,
De cent indignitez m’ont fait ſouffrir les coups.	De cent indignités m'ont fait souffrir les coups.
Oüi, voilà le ſujet d’une fureur ſi prompte,	Oui, voilà le sujet d'une fureur si prompte,
Et l’aſſuré témoin qu’on produit de ma honte,	Et l'assuré témoin qu'on produit de ma honte,
Joüiſſez à cette heure en tiran abſolu	Jouissez à cette heure en tyran absolu
De l’éclairciſſement que vous avez voulu;	De l'éclaircissement que vous avez voulu;
Mais ſçachez que j’aurai ſans ceſſe la memoire	Mais sachez que j'aurai sans cesse la mémoire
De l’outrage ſanglant qu’on a fait à ma gloire,	De l'outrage sanglant qu'on a fait à ma gloire,
Et ſi je puis jamais oublier mes ſermens,	Et si je puis jamais oublier mes serments,
Tombent ſur moi du Ciel les plus grands chatiment,	Tombent sur moi du Ciel les plus grands châtiments,
Qu’un tonnerre éclatant mette ma tête en poudre.	Qu'un tonnerre éclatant mette ma tête en poudre.
Lors qu’à ſouffrir vos feux je pourrai me reſoudre,	Lorsqu'à souffrir vos feux je pourrai me résoudre,
Allons, Madame, allons, ôtons nous de ces lieux,	Allons, Madame, allons, ôtons-nous de ces lieux,
Qu’infectent les regards d’un monſtre furieux,	Qu'infectent les regards d'un monstre furieux,
Fuyons-en promptement l’atteinte envenimée,	Fuyons-en promptement l'atteinte envenimée,
Evitons les effets de ſa rage animée,	Évitons les effets de sa rage animée,
Et ne faiſons des vœux dans nos juſtes deſſeins,	Et ne faisons des vœux, dans nos justes desseins,
Que pour nous voir bien-tôt affranchir de ſes mains.	Que pour nous voir bientôt affranchir de ses mains.
Seigneur, de vos ſoupçons l’injuſte violence,	Seigneur, de vos soupçons l'injuste violence,
A la même vertu vient de faire une offence.	À la même vertu vient de faire une offense.
Quelles triſtes clartez diſſipent mon erreur,	Quelles tristes clartés dissipent mon erreur,
Envelopent mes ſens d’une profonde horreur,	Enveloppent mes sens d'une profonde horreur,
Et ne laisſent plus voir à mon ame abatüe,	Et ne laissent plus voir à mon âme abattue,
Que l’effroiable objet d’un remords qui me tüe:	Que l'effroyable objet d'un remords qui me tue:
Ah! D. Alvar, je voi que vous avez raiſon,	Ah! D. Alvar, je vois que vous avez raison,
Mais l’Enfer dans mon cœur a ſouflé ſon poiſon;	Mais l'Enfer dans mon cœur a soufflé son poison;
Et par un trait fatal d’une rigueur extrême,	Et par un trait fatal d'une rigueur extrême,
Mon plus grand ennemi ſe rencontre en moi-même.	Mon plus grand ennemi se rencontre en moi-même.
Que me ſert-il d’aimer du plus ardent amour,	Que me sert-il d'aimer du plus ardent amour,
Qu’une ame conſumée ait jamais mis au jour;	Qu'une âme consumée ait jamais mis au jour;
Si par ſes mouvemens qui font toute ma peine,	Si par ses mouvements qui font toute ma peine,
Cet amour à tous coups ſe rend digne de haine?	Cet amour à tous coups se rend digne de haine?
Il faut, il faut vanger par mon juſte trépas	Il faut, il faut venger par mon juste trépas
L’outrage que j’ai fait à ſes divins appas?	L'outrage que j'ai fait à ses divins appas?
Auſſi bien quel conſeil aujourd’hui puis-je ſuivre?	Aussi bien quel conseil aujourd'hui puis-je suivre?
Ah! j’ai perdu l’objet, pour qui j’aimois à vivre,	Ah! j'ai perdu l'objet pour qui j'aimais à vivre,
Si j’ai pû renoncer à l’eſpoir de ſes vœux,	Si j'ai pu renoncer à l'espoir de ses vœux,
Renoncer à la vie, eſt beaucoup moins fâcheux.	Renoncer à la vie, est beaucoup moins fâcheux.
Seigneur.	Seigneur…
Non, D. Alvar, ma mort eſt neceſſaire,	Non, D. Alvar, ma mort est nécessaire,
Il n’eſt ſoins, ny raiſons qui m’en puiſſent diſtraire;	Il n'est soins, ni raisons qui m'en puissent distraire;
Mais il faut que mon ſort en ſe precipitant	Mais il faut que mon sort en se précipitant
Rende à cette Princeſſe un ſervice éclatant.	Rende à cette Princesse un service éclatant.
Et je veux me chercher dans cette illuſtre envie	Et je veux me chercher dans cette illustre envie
Les moyens glorieux de ſortir de la vie,	Les moyens glorieux de sortir de la vie,
Faire par un grand coup qui ſignale ma foi,	Faire par un grand coup, qui signale ma foi,
Qu’en expirant pour elle, elle ait regret à moi,	Qu'en expirant pour elle, elle ait regret à moi,
Et qu’elle puiſſe dire en ſe voyant vangée,	Et qu'elle puisse dire, en se voyant vengée,
C’eſt par ſon trop d’amour qu’il m’avoit outragée.	C'est par son trop d'amour qu'il m'avait outragée.
Il faut que de ma main un illuſtre attentat	Il faut que de ma main un illustre attentat
Porte une mort trop deuë au ſein de Mauregat,	Porte une mort trop due au sein de Mauregat,
Que j’aille prevenir par une belle audace,	Que j'aille prévenir par une belle audace,
Le coup, dont la Caſtille avec bruit le menace,	Le coup, dont la Castille avec bruit le menace,
Et j’auray des douceurs dans mon inſtant fatal,	Et j'aurai des douceurs dans mon instant fatal,
De ravir cette gloire à l’eſpoir d’un Rival.	De ravir cette gloire à l'espoir d'un Rival.
Un ſervice, Seigneur, de cette conſequence	Un service, Seigneur, de cette conséquence
Auroit bien le pouvoir d’effacer vôtre offence;	Aurait bien le pouvoir d'effacer votre offense;
Mais hazarder....	Mais hasarder…
Allons par un juſte devoir,	Allons, par un juste devoir,
Faire à ce noble effort ſervir mon deſeſpoir.	Faire à ce noble effort servir mon désespoir.
OUy, jamais il ne fut de ſi rude ſurpriſe,	Oui, jamais il ne fut de si rude surprise,
Il venoit de former cette haute entrepriſe,	Il venait de former cette haute entreprise,
A l’avide deſir d’immoler Mauregat,	À l'avide désir d'immoler Mauregat,
De ſon prompt déſeſpoir, il tournoit toutl’éclat.	De son prompt désespoir, il tournait tout l'éclat.
Ses ſoins precipitez vouloient à ſon courage	Ses soins précipités voulaient à son courage
De cette juſte mort aſſurer l'avantage,	De cette juste mort assurer l'avantage,
Y chercher ſon pardon, & prevenir l’ennuy,	Y chercher son pardon, et prévenir l'ennui,
Qu’un Rival partageaſt cette gloire avec lüy.	Qu'un Rival partageât cette gloire avec lui.
Il ſortoit de ces murs, quand un bruit trop fidele,	Il sortait de ces murs, quand un bruit trop fidèle,
Eſt venu luy porter la facheuſe nouvelle,	Est venu lui porter la fâcheuse nouvelle,
Que ce même Rival qu’il vouloit prevenir	Que ce même Rival qu'il voulait prévenir
A remporté l’honneur qu’il penſoit obtenir;	A remporté l'honneur qu'il pensait obtenir;
L’a prevenu luy-même, en immolant le traître,	L'a prévenu lui-même, en immolant le traître,
Et pouſſe dans ce jour, Dom Alphonſe à paroître,	Et pousse dans ce jour Dom Alphonse à paraître,
Qui d’un ſi prompt ſuccés va gouter la douceur,	Qui d'un si prompt succès va goûter la douceur,
Et vient prendre en ces lieux la Princeſſe ſa ſœur:	Et vient prendre en ces lieux la Princesse sa sœur:
Et ce qui n’a pas peine à gagner la croyance,	Et, ce qui n'a pas peine à gagner la croyance,
On entend publier que c’eſt la recompenſe,	On entend publier que c'est la récompense,
Dont il pretend payer le ſervice éclatant	Dont il prétend payer le service éclatant
Du bras qui luy fait jour au Thrône qui l’attend.	Du bras qui lui fait jour au Trône qui l'attend.
Oüi, Done Eluire a ſçeu ces nouvelles ſemées,	Oui, Done Elvire a su ces nouvelles semées,
Et du vieux Dom Loüis les trouve confirmées.	Et du vieux Dom Louis les trouve confirmées.
Qui vient de luy mander, que Leon dans ce jour,	Qui vient de lui mander, que Léon dans ce jour,
De Dom Alphonſe, & d’elle, attend l’heureux retour,	De Dom Alphonse, et d'elle attend l'heureux retour,
Et que c’eſt-là qu’on doit, par un revers proſpere,	Et que c'est là qu'on doit, par un revers prospère,
Luy voir prendre un époux de la main de ce Frere:	Lui voir prendre un époux de la main de ce Frère:
Dans ce peu qu’il en dit, il donne aſſez à voir,	Dans ce peu qu'il en dit, il donne assez à voir,
Que Dom Sylve eſt l’époux qu’elle doit recevoir.	Que Dom Sylve est l'époux qu'elle doit recevoir.
Ce coup au cœur du Prince....	Ce coup au cœur du Prince…
Eſt ſans doute bien rude,	Est sans doute bien rude,
Et je le trouve à plaindre en ſon inquietude,	Et je le trouve à plaindre en son inquiétude,
Son interêt pourtant, ſi j'en ay bien jugé,	Son intérêt pourtant, si j'en ai bien jugé,
Eſt encor cher au cœur qu’il a tant outragé;	Est encor cher au cœur qu'il a tant outragé;
Et je n’ay point connu, qu’à ce ſuccés qu’on vante,	Et je n'ai point connu, qu'à ce succès qu'on vante,
La Princeſſe ait fait voir une ame fort contente,	La Princesse ait fait voir une âme fort contente,
De ce Frere qui vient, & de la lettre auſſi,	De ce Frère qui vient, et de la lettre aussi,
Mais....	Mais…
FAites Dom Alvar venir la Princeſſe ici,	Faites, Dom Alvar, venir la Princesse ici,
Soffrez que devant vous je luy parle, Madame,	Souffrez que devant vous je lui parle, Madame,
Sur cet évenement, dont on ſurprend mon ame;	Sur cet événement, dont on surprend mon âme;
Et ne m’accuſez point d’un trop prompt changement,	Et ne m'accusez point d'un trop prompt changement,
Si je perds contre luy tout mon reſſentiment.	Si je perds contre lui tout mon ressentiment.
Sa diſgrace imprevuë a pris droit de l’éteindre,	Sa disgrâce imprévue a pris droit de l'éteindre,
Sans luy laiſſer ma haine, il eſt aſſez à plaindre.	Sans lui laisser ma haine, il est assez à plaindre.
Et le Ciel qui s'expoſe à ce trait de rigueur,	Et le Ciel, qui l'expose à ce trait de rigueur,
N’a que trop bien ſervi les ſermens de mon cœur.	N'a que trop bien servi les serments de mon cœur.
Un éclatant arrêt de ma gloire outragée,	Un éclatant arrêt de ma gloire outragée,
A jamais n’être à luy me tenoit engagée;	À jamais n'être à lui me tenait engagée;
Mais quand par les deſtins il eſt executé,	Mais quand par les destins il est exécuté,
J’y vois pour ſon amour trop de ſeverité;	J'y vois pour son amour trop de sévérité;
Et le triſte ſuccés de tout ce qu’il m’adreſſe	Et le triste succès de tout ce qu'il m'adresse
M’efface ſon offence, & lui rend ma tendreſſe.	M'efface son offense, et lui rend ma tendresse.
Oüi, mon cœur trop vangé par de ſi rudes coups,	Oui, mon cœur trop vengé par de si rudes coups,
Laiſſe à leur cruauté deſarmer ſon courroux,	Laisse à leur cruauté désarmer son courroux,
Et cherche maintenant par un ſoin pitoyable	Et cherche maintenant par un soin pitoyable
A conſoler le ſort d’un Amant miſerable?	À consoler le sort d'un Amant misérable?
Et je croi que ſa flâme à bien pû meriter	Et je crois que sa flamme a bien pu mériter
Cette compaſſion que je lui veux prêter.	Cette compassion que je lui veux prêter.
Madame, on auroit tort de trouver à redire	Madame, on aurait tort de trouver à redire
Aux tendres ſentimens qu’on voit qu’il vous inſpire,	Aux tendres sentiments qu'on voit qu'il vous inspire,
Ce qu’il a fait pour vous... Il vient, & ſa pâleur,	Ce qu'il a fait pour vous… Il vient, et sa pâleur,
De ce coup ſurprenant marque aſſez la douleur.	De ce coup surprenant marque assez la douleur.
MAdame, avec quel front faut il que je m’avance,	Madame, avec quel front faut-il que je m'avance,
Quand je viens vous offrir l’odieuſe preſence....	Quand je viens vous offrir l'odieuse présence…
Prince, ne parlons plus de mon reſſentiment,	Prince, ne parlons plus de mon ressentiment,
Voſtre ſort dans mon ame a fait du changement,	Votre sort dans mon âme a fait du changement,
Et par le triſte êtat ou ſa rigueur vous jette,	Et par le triste état où sa rigueur vous jette,
Ma colere eſt éteinte, & nôtre paix eſt faire.	Ma colère est éteinte, et notre paix est faite.
Oüi, bien que vôtre amour ait merité les coups,	Oui, bien que votre amour ait mérité les coups,
Que fait ſur lui du Ciel éclater le courroux;	Que fait sur lui du Ciel éclater le courroux;
Bien que ſes noirs ſoupçons ayent offencé ma gloire;	Bien que ses noirs soupçons aient offensé ma gloire;
Par des indignitez qu’on auroit peine à croire;	Par des indignités qu'on aurait peine à croire;
J’avoüerai toutefois que je plains ſon malheur,	J'avouerai toutefois que je plains son malheur,
Juſqu’à voir nos ſuccés avec quelque douleur;	Jusqu'à voir nos succès avec quelque douleur;
Que je haï les faveurs de ce fameux ſervice,	Que je hais les faveurs de ce fameux service,
