Un Amant en fureur eſt mauvais Politique,	Un Amant en fureur est mauvais Politique,
Et négligeant la guerre en ce funeſte jour,	Et négligeant la guerre en ce funeste jour,
Je ne ſuis occupe que des ſoins de l’amour.	Je ne suis occupé que des soins de l’amour.
Mon Rival eſt aimé, ma fatale victoire	Mon Rival est aimé, ma fatale victoire
Ne tourne qu’à ma honte, & ne ſert qu’à ſa gloire,	Ne tourne qu’à ma honte, et ne sert qu’à sa gloire,
Roxane apuye en vain mes projets & les ſiens,	Roxane appuie en vain mes projets et les siens,
Mais il va décider de ſes jours & des miens;	Mais il va décider de ses jours et des miens;
Roxane pour ſervir ſa flame & ma tendreſſe,	Roxane pour servir sa flamme et ma tendresse,
Voudroit ſans balancer m’unir à la Princeſſe,	Voudrait sans balancer m’unir à la Princesse,
Et je voudrois auſſi par un hymen fatal	Et je voudrais aussi par un hymen fatal
Unir en ce moment Roxane à mon Rival.	Unir en ce moment Roxane à mon Rival.
Ah! ſans plus nous geſner d’une indigne contrainte,	Ah! sans plus nous gêner d’une indigne contrainte,
Au defaut de l’amour, ſervons-nous de la crainte,	Au défaut de l’amour, servons-nous de la crainte,
Ils voudront ſe ſauver l’un & l’autre à leur tour,	Ils voudront se sauver l’un et l’autre à leur tour,
Et leur amour tremblant peut ſervir noſtre amour,	Et leur amour tremblant peut servir notre amour,
Statira doit venir. J’ay ſçeu luy faire entendre	Statira doit venir. J’ai su lui faire entendre
Que dans peu ſon Amant en ce lieu ſe doit rendre,	Que dans peu son Amant en ce lieu se doit rendre,
Je conſens qu’il la voye, & vais l’y préparer,	Je consens qu’il la voit, et vais l’y préparer,
Mais ils ne ſe verront que pour ſe ſéparer.	Mais ils ne se verront que pour se séparer.
Je la vois, elle vient dans une douce attente.	Je la vois, elle vient dans une douce attente.
AH! Seigneur, ſe peut-il que Roxane conſente	Ah! Seigneur, se peut-il que Roxane consente
A ſouffrir que je voye un Prince malheureux?	À souffrir que je voie un Prince si malheureux?
Oüy, Madame, il eſt vray, vous vous verrez tous deux,	Oui, Madame, il est vrai, vous vous verrez tous deux,
Cette entreveuë à vous, a nous, eſt néceſſaire,	Cette entrevue à vous, à nous, est nécessaire,
Il vous en faut icy découvrir le miſtere;	Il vous en faut ici découvrir le mystère;
Roxane vous permet un ſi doux entretien,	Roxane vous permet un si doux entretien,
Mais c’eſt pour ménager voſtre ſort & le ſien;	Mais c’est pour ménager votre sort et le sien;
Vos feux ont rallumé tous les feux de la guerre,	Vos feux ont rallumé tous les feux de la guerre,
Madame, nous eſtions les maîtres de la Terre;	Madame, nous étions les maîtres de la Terre;
Vous voyez cependant pour vous ce que je pers,	Vous voyez cependant pour vous ce que je perds,
Voſtre amour aujourd’huy me coûte l’Univers;	Votre amour aujourd’hui me coûte l’Univers;
Vous nous faites verſer & du ſang & des larmes,	Vous nous faites verser et du sang et des larmes,
Nous ſommes incertains du ſuccés de nos armes,	Nous sommes incertains du succès de nos armes,
Le temps preſſe, & du moins par un dernier effort	Le temps presse, et du moins par un dernier effort
Il faut Roxane & moy terminer noſtre ſort,	Il faut Roxane et moi terminer notre sort,
Roxane eſt irritée, elle eſt voſtre ennemie,	Roxane est irritée, elle est votre ennemie,
Vous aimez mon Rival, & ma flame eſt trahie;	Vous aimez mon Rival, et ma flamme est trahie;
Avant que Ptolomée ait pû le ſecourir,	Avant que Ptolomée ait pu le secourir,
Il faut le couronner, ou le faire périr,	Il faut le couronner, ou le faire périr,
Son ſalut ou ſa mort dépend de ſa réponſe;	Son salut ou sa mort dépend de sa réponse;
Madame, en vous voyant, faites qu’il y renonce,	Madame, en vous voyant, faites qu’il y renonce,
Roxane mépriſée en cet inſtant fatal	Roxane méprisée en cet instant fatal
Eſt plus à craindre encor que le bras d’un Rival,	Est plus à craindre encore que le bras d’un Rival,
Il faut ſans balancer les unir l’un & l’autre,	Il faut sans balancer les unir l’un et l’autre,
Ou que je perce un cœur qui m’arrache le voſtre.	Ou que je perce un cœur qui m’arrache le vôtre.
Ah! Seigneur, arreſtez, dûſſay-je me trahir,	Ah! Seigneur, arrêtez; devais-je me trahir,
A Roxane irritée il nous faut obeïr;	À Roxane irritée il nous faut obéir;
Quand je devrois ſur moy faire tomber la foudre,	Quand je devrais sur moi faire tomber la foudre,
Qu'on le faſſe venir, & je vais l'y réſoudre;	Qu’on le fasse venir, et je vais l’y résoudre;
Oüy, pour tourner ſon cœur à ce funeſte choix,	Oui, pour tourner son cœur à ce funeste choix,
Laiſſez moy luy parler pour la derniere fois.	Laissez-moi lui parler pour la dernière fois.
Hé bien? vous le verrez, mais ſongez l’un & l’autre	Hé bien? vous le verrez, mais songez l’un et l’autre
A regler noſtre ſort auſſi bien que le voſtre;	À régler notre sort aussi-bien que le vôtre;
Vous pleurez mon Rival, ah! que j’en ſuis jaloux!	Vous pleurez mon Rival, ah! que j’en suis jaloux!
Helas! qu’a-t-il a craindre? il eſt aimé de vous,	Hélas! qu’a-t-il à craindre? il est aimé de vous,
Et quoy que ma fureur de la mort le menace,	Et quoi que ma fureur de la mort le menace,
Madame, en ce moment que ne ſuis-je en ſa place?	Madame, en ce moment que ne suis-je en sa place?
Que n’ay-je ſes périls & ſon ſort aujourd’huy?	Que n’ai-je ses périls et son sort aujourd’hui?
Hay de vous, je ſuis plus à plaindre que luy,	Haï de vous, je suis plus à plaindre que lui,
Vous l’allez voir, Madame.	Vous l’allez voir, Madame.
AH! funeſte entreveuë!	AH! funeste entrevue!
Je le verray, Cleone, & ce penſer me tuë.	Je le verrai, Cléone, et ce penser me tue.
Quoy donc? ma propre bouche en ce triſte moment	Quoi donc? ma propre bouche en ce triste moment
Va prononcer ma mort pour ſauver mon Amant,	Va prononcer ma mort pour sauver mon Amant,
Ma flame va parler pour éteindre la ſienne,	Ma flamme va parler pour éteindre la sienne,
Et ma bouche.... il en faut une autre que la mienne,	Et ma bouche… il en faut une autre que la mienne,
Et je vais le prier aux deſpens de ſes jours	Et je vais le prier aux dépens de ses jours
De haïr ma Rivale, & de m’aimer toûjours.	De haïr ma Rivale, et de m’aimer toujours.
Mais Dieux! s’il ne l'épouſe, il va ceſſer de vivre;	Mais Dieux! s’il ne l’épouse, il va cesser de vivre;
Helas! s’il eſtoit mort, je n’aurois qu’à le ſuivre;	Hélas! s’il était mort, je n’aurais qu’à le suivre;
Tantoſt malgré Roxane & mes ſens éperdus,	Tantôt, malgré Roxane et mes sens éperdus,
Il a veu mes ſoûpirs qu’il a trop entendus,	Il a vu mes soupirs qu’il a trop entendus,
Il connoît que je l’aime, & malgré ma contrainte	Il connaît que je l’aime, et malgré ma contrainte
Il a trop penetré l’artifice & la feinte,	Il a trop pénétré l’artifice et la feinte,
Mais je vais maintenant luy parler ſans témoins;	Mais je vais maintenant lui parler sans témoins;
Quand il verra mes pleurs, m’en aimera-t-il moins?	Quand il verra mes pleurs, m’en aimera-t-il moins?
Je connois trop ſon cœur, & le mien en friſſonne,	Je connais trop son cœur, et le mien en frissonne,
Il me ſera fidelle, & périra, Cleone;	Il me sera fidèle, et périra, Cléone;
Je me flate peut-eſtre, il ne périra pas,	Je me flatte peut-être, il ne périra pas,
Roxane l’a ſauvé, Roxane a des apas,	Roxane l’a sauvé, Roxane a des appâts,
Et quand je luy diray de n’eſtre plus fidelle,	Et quand je lui dirai de n’être plus fidèle,
S’il m’alloit obeïr & ſoûpirer pour elle?	S’il m’allait obéir et soupirer pour elle?
Ciel! que vay-je luy dire? ah Dieux! il doit venir,	Ciel! que vais-je lui dire? ah Dieux! il doit venir,
Quel funeſte ſujet de nous entretenir?	Quel funeste sujet de nous entretenir?
On vient, Cleone, on ouvre, on entre, & c'eſt luy-meſme.	On vient, Cléone, on ouvre, on entre, et c’est lui-même.
MAdame, quel plaiſir de voir ce que l’on aime!	MAdame, quel plaisir de voir ce que l’on aime!
Je n’oſois l’eſperer, mais puis qu’il m’eſt permis,	Je n’osais l’espérer, mais puisqu’il m’est permis,
Je veux pardonner tout à nos fiers Ennemis;	Je veux pardonner tout à nos fiers Ennemis;
Dans un moment ſi doux partagez-vous ma joye,	Dans un moment si doux partagez-vous ma joie,
Roxane & Perdiccas ſouffrent que je vous voye,	Roxane et Perdiccas souffrent que je vous vois,
Quel Dieu les a fléchis? ma Princeſſe & vos pleurs	Quel Dieu les a fléchis? ma Princesse et vos pleurs
Auroient-ils attendry ces barbares Vainqueurs?	Auraient-ils attendri ces barbares Vainqueurs?
Nous pouvons à préſent nous parler ſans contrainte,	Nous pouvons à présent nous parler sans contrainte,
Et que n’ay-je tantoſt démeſlé voſtre crainte?	Et que n’ai-je tantôt démêlé votre crainte?
Vous m’auriez épargné de mortels déplaiſirs,	Vous m’auriez épargné de mortels déplaisirs,
Si j’avois reconnu vos pleurs & vos ſoûpirs;	Si j’avais reconnu vos pleurs et vos soupirs;
Roxane eſtoit préſente, & redoutant ſa rage,	Roxane était présente, et redoutant sa rage,
Il falloit me tenir ce funeſte langage;	Il fallait me tenir ce funeste langage;
Pouvons-nous pas loin d’elle oublier nos douleurs?	Pouvons-nous pas loin d’elle oublier nos douleurs?
Mais, Madame, je vois vos yeux baignez de pleurs,	Mais, Madame, je vois vos yeux baignés de pleurs,
On diroit à vous voir que mon abord vous gêne,	On dirait à vous voir que mon abord vous gêne,
Il ſemble que ma joye augmente voſtre peine,	Il semble que ma joie augmente votre peine,
Parlez.	Parlez.
Il faut, Seigneur....	Il faut, Seigneur…
Quoy?	Quoi?
Cruel ſouvenir:	Cruel souvenir:
Il faut....	Il faut…
Que faut-il donc?	Que faut-il donc?
Me quitter, ou périr.	Me quitter, ou périr.
Qui moy, Madame, on veut que je vous abandonne?	Qui moi, Madame, on veut que je vous abandonne?
Perdiccas vous menace, & Roxane l’ordonne,	Perdiccas vous menace, et Roxane l’ordonne,
Tout le veut, elle eſt belle, & peut-eſtre, Seigneur,	Tout le veut, elle est belle, et peut-être, Seigneur,
Vous le voudrez bientoſt aux deſpens de mon cœur.	Vous le voudrez bientôt aux dépens de mon cœur.
Quel étrange diſcours! & depuis quand, Madame,	Quel étrange discours! et depuis quand, Madame,
Voulez-vous de Roxane autoriſer la flame?	Voulez-vous de Roxane autoriser la flamme?
Pouriez-vous luy ceder mes ſoûpirs & ma foy?	Pourriez-vous lui céder mes soupirs et ma foi?
Quoy? parlez-vous pour elle, ou parlez vous à moy?	Quoi? parlez-vous pour elle, ou parlez-vous à moi?
Roxane veut en vain que je vous abandonne,	Roxane veut en vain que je vous abandonne,
Mais Perdiccas le veut, & c’eſt luy qui l’ordonne,	Mais Perdiccas le veut, et c’est lui qui l’ordonne,
Il vous aime, Madame, & peut-eſtre aujourd’huy	Il vous aime, Madame, et peut-être aujourd’hui
Voſtre cœur agit moins pour elle que pour luy.	Votre cœur agit moins pour elle que pour lui.
Et depuis quand, Seigneur, en voyant mes allarmes,	Et depuis quand, Seigneur, en voyant mes alarmes,
Expliquez-vous ſi mal le langage des larmes?	Expliquez-vous si mal le langage des larmes?
Ne l'entendez-vous plus, & mes ſoûpirs, helas!	Ne l’entendez-vous plus, et mes soupirs, hélas!
Ingrat, vous diſent-ils que j’aime Perdiccas?	Ingrat, vous disent-ils que j’aime Perdiccas?
Eh! pardonnez, Madame, un peu de jalouſie,	Eh! pardonnez, Madame, un peu de jalousie,
Oubliez Perdiccas autant que je l'oublie;	Oubliez Perdiccas autant que je l’oublie;
Nos cruels Ennemis en de ſi chers momens	Nos cruels Ennemis en de si chers moments
Doivent-ils partager nos tendres ſentimens?	Doivent-ils partager nos tendres sentiments?
Je vous vois, il ſuffit, & mon ame contente	Je vous vois, il suffit, et mon âme contente
Dédaigne de ſonger que Roxane eſt Amante.	Dédaigne de songer que Roxane est Amante.
Ah! quãd de Perdiccas mon cœur craint le couroux,	Ah! quand de Perdiccas mon cœur craint le courroux,
Je penſe moins à luy que je ne penſe à vous;	Je pense moins à lui que je ne pense à vous;
Aprenez les horreurs de l’effroy qui me tuë,	Apprenez les horreurs de l’effroi qui me tue,
Sçavez-vous les raiſons d’une telle entreveuë?	Savez-vous les raisons d’une telle entrevue?
Nous nous voyõs, Seigneur, on nous le ſouffre, mais	Nous nous voyons, Seigneur, on nous le souffre, mais
C’eſtpour mieux nous réſoudre à ne nous voir jamais.	C’est pour mieux nous résoudre à ne nous voir jamais.
Dans une heure, Seigneur, Perdiccas vous cõdamne	Dans une heure, Seigneur, Perdiccas vous condamne
A choiſir ou la mort, ou l’hymen de Roxane;	À choisir ou la mort, ou l’hymen de Roxane;
Malgré moy, faites-vous un genéreux effort,	Malgré moi, faites-vous un généreux effort,
Et choiſiſſez plutoſt Roxane que la mort.	Et choisissez plutôt Roxane que la mort.
Moy, Madame?	Moi, Madame?
Oüy, vous. Songez à voſtre vie,	Oui, vous. Songez à vôtre vie,
Roxane vous rendra le maiſtre de l’Aſie,	Roxane vous rendra le maître de l’Asie,
Oubliez-moy, Seigneur, laiſſez-moy dans les fers,	Oubliez-moi, Seigneur, laissez-moi dans les fers,
Un Héros tel que vous ſe doit à l’Univers,	Un Héros tel que vous se doit à l’Univers,
Et ſi vous périſſiez par une mort fi prompte,	Et si vous périssiez par une mort si prompte,
L’Univers, de vos jours me demanderoit conte.	L’Univers, de vos jours me demanderait compte.
Ciel! que m’oſez-vous dire? Helas! ſi je vous pers,	Ciel! que m’osez-vous dire? Hélas! si je vous perds,
Madame, & que m’importe à moy de l’Univers?	Madame, et que m’importe à moi de l’Univers?
Dois-je vivre un moment, ſi vous m’eſtes ravie?	Dois-je vivre un moment, si vous m’êtes ravie?
Je cede à Perdiccas & la Perſe & l'Aſie;	Je cède à Perdiccas et la Perse et l’Asie;
Le Trône eſt-il l’objet de mes vœux les plus doux,	Le Trône est-il l’objet de mes vœux les plus doux,
Et ſoûpiray-je, enfin, pour l’Empire, ou pour vous?	Et soupirai-je, enfin, pour l’Empire, ou pour vous?
Helas! ſans vous, mon cœur dans une paix profonde	Hélas! sans vous, mon cœur dans une paix profonde
Verroit tranquilement la conqueſte du monde,	Verrait tranquillement la conquête du monde,
Je l’abandonne à qui peut en eſtre vainqueur,	Je l’abandonne à qui peut en être vainqueur,
Mais je diſputeray celle de voſtre cœur.	Mais je disputerai celle de votre cœur.
Et ſongez-vous, Seigneur, que la triſte conqueſte	Et songez-vous, Seigneur, que la triste conquête
D’un cœur comme le mien vous peut coûter la teſte?	D’un cœur comme le mien vous peut coûter la tête?
Ne vous ſouvient-il plus de ce jour douloureux	Ne vous souvient-il plus de ce jour douloureux
Où les feux d’Aléxandre éteignirent nos feux,	Où les feux d’Alexandre éteignirent nos feux,
Quand vous-meſme chargé de ſon funeſte homage,	Quand vous-même chargé de son funeste hommage,
Vous parûtes, la mort peinte ſur le viſage,	Vous parûtes, la mort peinte sur le visage,
Et fiſtes pour ma gloire un genéreux effort?	Et fîtes pour ma gloire un généreux effort?
Mais helas! aujourd’huy que je crains voſtre mort,	Mais hélas! aujourd’hui que je crains votre mort,
Que je crains Perdiccas & Roxane en furie,	Que je crains Perdiccas et Roxane en furie,
J’en veux faire un pareil pour ſauver voſtre vie;	J’en veux faire un pareil pour sauver votre vie;
L’amour fait voſtre crime, on preſſe, on vous attend,	L’amour fait votre crime, on presse, on vous attend,
Si vous ne m’aimez plus, vous ſerez innocent,	Si vous ne m’aimez plus, vous serez innocent,
C’eſt ce cruel amour, Seigneur, qui vous accable,	C’est ce cruel amour, Seigneur, qui vous accable,
Etoufez-le.... Mais non, ſoyez toûjours coupable;	Étouffez-le… Mais non, soyez toujours coupable;
Que dis-je? ce n’eſt plus Roxane & Perdiccas,	Que dis-je? ce n’est plus Roxane et Perdiccas,
C’eſt moy, c’eſt Statira qui vous mene au trépas;	C’est moi, c’est Statira qui vous mène au trépas;
Vous verrois-je périr? non, ſoyez infidelle,	Vous verrais-je périr? non, soyez infidèle,
Allez, ſortez plutoſt, & ſoûpirez pour elle,	Allez, sortez plutôt, et soupirez pour elle,
Je ne puis demeurer apres un tel effort,	Je ne puis demeurer après un tel effort,
Chaque inſtant pres de vous va haſter voſtre mort,	Chaque instant près de vous va hâter votre mort,
Et mon perfide cœur qui ſe plaint, qui ſoúpire,	Et mon perfide cœur qui se plaint, qui soupire,
Si je vous vois encor, ſçaura trop m’en dédire.	Si je vous vois encore, saura trop m’en dédire.
Quoy? vous m’abandonnez en cette extrémité,	Quoi? vous m’abandonnez en cette extrémité,
Et de grace, Madame, un peu de fermeté?	Et de grâce, Madame, un peu de fermeté?
Je mépriſe Roxane, & ma tendreſſe extréme	Je méprise Roxane, et ma tendresse extrême
Fait que je hais Roxane autant que je vous aime,	Fait que je hais Roxane autant que je vous aime,
Je déteſte Roxane, & je veux....	Je déteste Roxane, et je veux…
Achevez,	Achevez,
Et voyez de plus pres l'Objet que vous bravez;	Et voyez de plus près l’Objet que vous bravez;
J’ay trop bien entendu ce qui peut vous confondre,	J’ai trop bien entendu ce qui peut vous confondre,
Ingrat, dans un moment je vais vous y répondre;	Ingrat, dans un moment je vais vous y répondre;
Qu'on redouble ma Garde, & ſur tout, Peuceſtas,	Qu’on redouble ma Garde, et surtout, Peucestas,
Qu'on ferme de ces lieux l’entrée à Perdiccas.	Qu’on ferme de ces lieux l’entrée à Perdiccas.
Madame, quel deſſein?...	Madame, quel dessein?…
Ma vangeance & ma honte,	Ma vengeance et ma honte,
De mes juſtes deſſeins pouront vous rendre conte.	De mes justes desseins pourront vous rendre compte.
Grâce aux Dieux! je ſuis libre, & vais tranquilement	Grâce aux Dieux! je suis libre, et vais tranquillement
Immoler ma Rivale aux yeux de ſon Amant.	Immoler ma Rivale aux yeux de son Amant.
Je mépriſe Roxane, & ma tendreſſe extréme	Je méprise Roxane, et ma tendresse extrême
Fait que je hais Roxane autant que je vous aime;	Fait que je hais Roxane autant que je vous aime;
Ce diſcours vous charmoit, Madame, & ſes ſoúpirs	Ce discours vous charmait, Madame, et ses soupirs
Aux deſpens de Roxane ont flaté vos deſirs;	Aux dépens de Roxane ont flatté vos désirs;
Loin de moy, devant vous, c’eſt donc moy qu’on déteſte?	Loin de moi, devant vous, c’est donc moi qu’on déteste?
Mais vous m’allez payer un plaiſir ſi funeſte.	Mais vous m’allez payer un plaisir si funeste.
Madame, au nom des Dieux, écoutez....	Madame, au nom des Dieux, écoutez…
Non, Seigneur,	Non, Seigneur,
Laiſſez, laiſſez agir librement ſa fureur;	Laissez, laissez agir librement sa fureur;
Depuis un ſi longtemps, de mon ſong alterée,	Depuis un si longtemps, de mon sang altérée,
A toutes ſes fureurs mon ame eſt préparée.	À toutes ses fureurs mon âme est préparée.
Fille de Cohortan, acheve tes deſſeins,	Fille de Cohortan, achève tes desseins,
Dans le ſang de tes Roys oſes tremper tes mains,	Dans le sang de tes Rois ose tremper tes mains,
Frape.	Frappe.
Dans un moment vous ſerez obeïe,	Dans un moment vous serez obéie,
Aprochez-vous.	Approchez-vous.
Ah Ciel! que je crains pour ſa vie!	Ah Ciel! que je crains pour sa vie!
Calmez voſtre couroux, Madame, au nom des Dieux;	Calmez votre courroux, Madame, au nom des Dieux;
Qu'ordõnez vous helas! quel trouble dans vos yeux!	Qu’ordonnez-vous hélas! quel trouble dans vos yeux!
Madame, c’eſt ſur moy, ſur ma coupable teſte,	Madame, c’est sur moi, sur ma coupable tête,
Que doit icy tomber l’éclat de la tempeſte,	Que doit ici tomber l’éclat de la tempête,
Mon amour fait ſon crime, il le faut expier,	Mon amour fait son crime, il le faut expier,
Et mon ſang répandu peut la juſtifier.	Et mon sang répandu peut la justifier.
Oüy, Barbaré, il eſt vray; ton amour fait ton crime,	Oui, Barbare, il est vrai; ton amour fait ton crime,
Cependant ma Rivale en ſera la Victime,	Cependant ma Rivale en sera la Victime,
On me déteſte, on l’aime, & l’on m'oſe outrager,	On me déteste, on l’aime, et l’on m’ose outrager,
Mais enfin, grace au Ciel, j’ay ſur qui m’en vanger.	Mais enfin, grâce au Ciel, j’ai sur qui m’en venger.
Pour goúter la douceur à ma vangeance offerte,	Pour goûter la douceur à ma vengeance offerte,
Préparons à tes yeux l'apareil de ſa perte;	Préparons à tes yeux l’appareil de sa perte;
Pour t’en faire ſentir l’amertume à longs traits,	Pour t’en faire sentir l’amertume à longs traits,
Ma fureur, à pas lents, va ſervir mes ſouhaits.	Ma fureur, à pas lents, va servir mes souhaits.
Ne croy pas cependant au tranſport qui m’entraîne,	Ne crois pas cependant au transport qui m’entraîne,
Que l’amour.... Non, Ingrat, je n’ay que de la haine,	Que l’amour… Non, Ingrat, je n’ai que de la haine;
Il faut la ſatisfaire, & Roxane le peut,	Il faut la satisfaire, et Roxane le peut,
Politique, raiſon, ſeûreté, tout le veut;	Politique, raison, sûreté, tout le veut;
Oüy, perdons Starira.... mais malgré mon envie,	Oui, perdons Statira… mais malgré mon envie,
Leonatus, un mot luy peut ſauver la vie.	Léonatus, un mot lui peut sauver la vie.
Voſtre refus dût-il me coûter le trépas,	Votre refus dût-il me coûter le trépas,
Ce mot qui m’eſt ſi cher, ne le prononcez pas.	Ce mot qui m’est si cher, ne le prononcez pas.
Je crains voſtre tendreſſe autãt que ſavangeance,	Je crains votre tendresse autant que sa vengeance,
Ce n’eſt point Statira, c’eſt moy qui vous offence;	Ce n’est point Statira, c’est moi qui vous offense;
Ah! Madame, arreſtez, & détournez ſur moy	Ah! Madame, arrêtez, et détournez sur moi
Ces regards menaçans qui me glaçent d’effroy;	Ces regards menaçants qui me glacent d’effroi;
Le Ciel nous eſt témoin que tantoſt elle-meſme,	Le Ciel nous est témoin que tantôt elle-même,
En renonçant pour vous a ma tendreſſe extréme,	En renonçant pour vous à ma tendresse extrême,
Elle a voulu.... mais quoy, mon amour m’a trahy.	Elle a voulu… mais quoi, mon amour m’a trahi.
Et pourquoy voſtre cœur n’a-t-il pas obey?	Et pourquoi votre cœur n’a-t-il pas obéi?
Je ne dis plus qu’un mot, & veux eſtre obeïe;	Je ne dis plus qu’un mot, et veux être obéie;
Tu ſçais bien qu’un coup d’œil luy peut coûter la vie,	Tu sais bien qu’un coup d’œil lui peut coûter la vie,
Veux-tu la voir périr, veux-tu la conſerver?	Veux-tu la voir périr, veux-tu la conserver?
Que ne feray-je point helas! pour la ſauver?	Que ne ferais-je point, hélas! pour la sauver?
Qu’on cherche Perdiccas, il faut que toute à l’heure	Qu’on cherche Perdiccas, il faut que tout à l’heure
Ton Rival, à tes yeux, l'épouſe, ou qu’elle meure.	Ton Rival, à tes yeux, l’épouse, ou qu’elle meure.
Epouſer Perdiccas?	Épouser Perdiccas?
Pour calmer ſon couroux,	Pour calmer son courroux,
Oubliez-moy, Madame, & ne ſongez qu’à vous,	Oubliez-moi, Madame, et ne songez qu’à vous,
Donnez à Perdiccas....	Donnez à Perdiccas…
Voſtre amour m’y condamne,	Votre amour m'y condamne,
Et vous ne voulez pas vous donner à Roxane?	Et vous ne voulez pas vous donner à Roxane?
Ils ſont également ardens à m’offencer,	Ils sont également ardents à m’offenser,
Ah perdons-les tous deux, mais par qui commencer?	Ah perdons-les tous deux, mais par qui commencer?
Oüy, je vais....	Oui, je vais…
Ah! Madame, il faut prendre ma vie,	Ah! Madame, il faut prendre ma vie,
Avant que de remplir cette funeſte envie;	Avant que de remplir cette funeste envie;
Tout deſarmé ſans-doute, & tout ſeul que je ſuis,	Tout désarmé sans-doute, et tout seul que je suis,
Mon deſeſpoir poura bien plus que je ne puis.	Mon désespoir pourra bien plus que je ne puis.
VEnez, venez, Seigneur, ſecourir la Princeſſe.	VEnez, venez, Seigneur, secourir la Princesse.
Madame, vous ſçavez juſqu’où va ma tendreſſe,	Madame, vous savez jusqu’où va ma tendresse,
Retenez....	Retenez…
Perdiccas, ton cœur va te trahir,	Perdiccas, ton cœur va te trahir,
Je ne ſçais plus aimer, je ne ſçais que haïr;	Je ne sais plus aimer, je ne sais que haïr;
Pour éteindre une ardeur à nos deſſeins fatale,	Pour éteindre une ardeur à nos desseins fatale,
Je te rends ton Rival, donne-moy ma Rivale.	Je te rends ton Rival, donne-moi ma Rivale.
Si voſtre cœur, Madame, en ce funeſte jour	Si votre cœur, Madame, en ce funeste jour
A de la haine, helas! le mien a de l’amour,	A de la haine, hélas! Le mien a de l’amour,
Juſqu’au dernier ſoûpir je défendray ſa vie.	Jusqu’au dernier soupir je défendrai sa vie.
Vous eſtes genéreux, & je vous la confie,	Vous êtes généreux, et je vous la confie,
C’eſt aſſez qu’un Rival luy donne du ſecours.	C’est assez qu’un rival lui donne du secours.
Tout hay que je ſuis, j'auray ſoin de ſes jours;	Tout haï que je suis, j’aurai soin de ses jours;
Mais quand vous ſerez libre, en lieu pour vous défendre,	Mais quand vous serez libre, en lieu pour vous défendre,
J’iray la diſputer en Rival d’Aléxandre.	J’irai la disputer en Rival d’Alexandre.
Allons, Madame.	Allons, Madame.
Helas!	Hélas!
Je ne crains plus ſa mort,	Je ne crains plus sa mort,
Vous pouvez maintenant ordonner de mon ſort,	Vous pouvez maintenant ordonner de mon sort,
ſe l'attendray, Madame.	Je l’attendrai, Madame.
AH! quelle vive atteinte!	AH! quelle vive atteinte!
