Leonatus qui craint les ennuis d'un long Siege,	Léonatus qui craint les ennuis d’un long Siège,
Voulant les prévenir, court de luy-meſme au piege,	Voulant les prévenir, court de lui-même au piège,
Il le veut, je le ſers. Si le succés heureux	Il le veut, je le sers. Si le succès heureux
Luy donne ſa Princeſſe, il couronne mes feux;	Lui donne sa Princesse, il couronne mes feux;
S’il périt, mon Rival deviendra ma victime,	S’il périt, mon Rival deviendra ma victime,
Et ſa propre valeur va m’épargner un crime;	Et sa propre valeur va m’épargner un crime;
Je hais Leonatus, il me fait de l’horreur,	Je hais Léonatus, il me fait de l’horreur,
Tu vois que de Roxane il m'enleve le cœur,	Tu vois que de Roxane il m’enlève le cœur,
Et quoy qu’enfin le ſien pour Statira ſoûpire,	Et quoiqu’enfin le sien pour Statira soupire,
De l'amour de Roxane il ne faut pas l'inſtruire,	De l’amour de Roxane il ne faut pas l’instruire,
Il l'ignore, & je veux qu’il l’ignore toûjours,	Il l’ignore, et je veux qu’il l’ignore toujours,
Ou qu’il n’en ſoit inſtruit qu’aux deſpẽs de ſes jours;	Ou qu’il n’en soit instruit qu’aux dépens de ses jours;
Mais Roxane qui craint le pouvoir de mon Pere,	Mais Roxane qui craint le pouvoir de mon Père,
Qui ſçait qu’Antipater peut ſervir ma colere,	Qui sait qu’Antipater peut servir ma colère,
Que ſon Armée avance, a connu que tantôt	Que son Armée avance, a connu que tantôt
Son eſprit irrité m’avoit parlé trop haut.	Son esprit irrité m’avait parlé trop haut.
Dieux! ſi ſon cœur pouvoir.... La voicy, la cruelle,	Dieux! Si son cœur pouvait… La voici, la cruelle,
Cours prendre garde à tout, & me laiſſe avecque elle.	Cours prendre garde à tout, et me laisse avec elle.
JE vous cherchois, Seigneur, vous en eſtes ſurpris,	JE vous cherchais, Seigneur, vous en êtes surpris,
Mais nous devons quiter l’aigreur & le-mépris,	Mais nous devons quitter l’aigreur et le mépris,
Nos eſprits inquiets en avoient l’un & l'autre,	Nos esprits inquiets en avaient l’un et l’autre,
Mon cœur en eſtoit plein auſſi-bien que le voſtre,	Mon cœur en était plein aussi bien que le vôtre,
Dans un péril preſſant nous devons les banir,	Dans un péril pressant nous devons les bannir,
Et de grands intéreſts nous doivent réünir,	Et de grands intérêts nous doivent réunir,
Je rends à vos vertus un tribut légitime,	Je rends à vos vertus un tribut légitime,
Voyons, ſi vous voulez mériter mon eſtime.	Voyons, si vous voulez mériter mon estime.
Je feray tout, Madame, & pour la mériter,	Je ferai tout, Madame, et pour la mériter,
Que faut-il....	Que faut-il…
Un deſſein qu’il faut exécuter.	Un dessein qu’il faut exécuter.
Le fier Leonatus nous brave, nous menace,	Le fier Léonatus nous brave, nous menace,
Et déja Ptolomée aſſiege cette Place,	Et déjà Ptolomée assiège cette Place,
Il apoche, on l'a veu du haut de nos Rempars	Il approche, on l’a vu du haut de nos Remparts
Faire contre nos Murs marches ſes Etendars;	Faire contre nos Murs marcher ses Étendards;
Nous pourrons d’un ſeul coup prévenir la tempeſte,	Nous pourrions d’un seul coup prévenir la tempête,
Il ne faudroit, Seigneur, abatre qu’une Teſte,	Il ne faudrait, Seigneur, abattre qu’une Tête,
Punir Leonatus de ſa temérité....	Punir Léonatus de sa témérité…
Contre luy voſtre cœur ſeroit-il irrité,	Contre lui votre cœur serait-il irrité,
Madame, & pouriez-vous m'aſſurer d’une haine....	Madame, et pourriez-vous m’assurer d’une haine…
De ma haine, Seigneur! Dieux! elle eſt trop certaine,	De ma haine, Seigneur! Dieux! elle est trop certaine,
Roxane contre luy n’en a point à demy,	Roxane contre lui n’en a point à demi,
Je hay Leonatus en mortel Ennemy,	Je hais Léonatus en mortel Ennemi,
Luy qui prétend nous faire une ſanglante guerre,	Lui qui prétend nous faire une sanglante guerre,
Qui contre nous ſoûleve & le Ciel & la Terre,	Qui contre nous soulève et le Ciel et la Terre,
Leonatus, enfin, que je veux deſormais....	Léonatus, enfin, que je veux désormais…
Pourquoy me demander, Seigneur, ſi je le hais?	Pourquoi me demander, Seigneur, si je le hais?
Hé bien? à vous ſervir ma main eſt toute preſte;	Hé bien? À vous servir ma main est toute prête;
Mais, Madame, oſez vous me demander ſa Teſte?	Mais, Madame, osez vous me demander sa Tête?
De qui?	De qui?
D’un Ennemy qui vous eſt odieux,	D’un Ennemi qui vous est odieux,
Qui vient....	Qui vient…
Ce n’eſt pas là, Seigneur, ce que je veux,	Ce n’est pas là, Seigneur, ce que je veux,
Mais je veux l’attaquer par un autre Luy-meſme,	Mais je veux l’attaquer par un autre Lui-même,
Et ne veux le punir que dans l’Objet qu’il aime;	Et ne veux le punir que dans l’Objet qu’il aime;
li nous faut ébloüir & tromper Perdiccas,	Il nous faut éblouir et tromper Perdiccas.
Immolons en ſecret les funeſtes appas	Immolons en secret les funestes appas
Pour qui Leonatus....	Pour qui Léonatus…
Je vous entens, Madame,	Je vous entends, Madame,
Vous voulez que je preſte un crime à voſtre flame;	Vous voulez que je prête un crime à votre flamme;
Et que mon propre bras à mon amour fatal,	Et que mon propre bras à mon amour fatal,
Perde voſtre Rivale, & ſerve mon Rival;	Perde votre Rivale, et serve mon Rival;
Bien loin de le haïr, ſon amour vous outrage,	Bien loin de le haïr, son amour vous outrage,
Et vous en ſoûpirez de douleur & de rage;	Et vous en soupirez de douleur et de rage;
Faites mieux. Puniſſez qui vous oſe outrager,	Faites mieux. Punissez qui vous ose outrager,
Et donnez à mon bras le ſoin de vous vanger;	Et donnez à mon bras le soin de vous venger;
Vous l'aimez, & l’Ingrat peut-il en aimer d’autres?	Vous l’aimez, et l’Ingrat peut-il en aimer d’autres?
Peut-on eſtre touché d'autres yeux que des voſtres?	Peut-on être touché d’autres yeux que des vôtres?
Madame, ſi ce Prince adoroit vos attraits,	Madame, si ce Prince adorait vos attraits,
Tout mon Rival qu’il eſt, je luy pardonnerois;	Tout mon rival qu’il est, je lui pardonnerais;
Mais pour luy pardonner vous n’avez point d’excuſe,	Mais pour lui pardonner vous n’avez point d’excuse,
Je luy veux arracher ce cœur qu’il vous refuſe,	Je lui veux arracher ce cœur qu’il vous refuse,
Et pour voir aujourd’huy ſes crimes expiez,	Et pour voir aujourd’hui ses crimes expiés,
Vous l’aporter ſanglant, & le mettre à vos pieds.	Vous l’apporter sanglant, et le mettre à vos pieds.
Je ne veux point, Seigneur, de pareilles Victimes,	Je ne veux point, Seigneur, de pareilles Victimes,
Un ſoûpir ſeul pouroit expier tous ſes crimes,	Un soupir seul pourrait expier tous ses crimes,
Vous m’aimez, je vous plains, je ne puis rien de plus.	Vous m’aimez, je vous plains, je ne puis rien de plus.
Ah Dieux! que Caſſander n’eſt il Leonatus,	Ah Dieux! Que Cassandre n’est-il Léonatus,
Ou que Leonatus changeant de coeur & d’ame,	Ou que Léonatus, changeant de cœur et d’âme,
N’a-t-il de Caſſander les tranſports & la flame?	N’a-t-il de Cassandre les transports et la flamme?
MAdame, Statira n’eſt plus dans le Palais,	MAdame, Statira n’est plus dans le Palais,
On vient de l’enlever par des ordres ſecrets,	On vient de l’enlever par des ordres secrets,
Pluſieurs Gardes gagnez ont fait cette ſurpriſe,	Plusieurs Gardes gagnés ont fait cette surprise,
Mais on ne connoît point l'Autheur de l'entrepriſe.	Mais on ne connaît point l’Auteur de l’entreprise.
Il périra, le Traiſtre. Allons, ſortons, Seigneur,	Il périra, le Traître. Allons, sortons, Seigneur,
Empeſchons....	Empêchons…
Demeurer, j'en puniray l’Auteur;	Demeurer, j'en punirai l’Auteur;
Mais peut-eſtre qu’auſſi par de fauſſes allarmes....	Mais peut-être qu’aussi par de fausses alarmes…
Non, Seigneur, Perdiccas a déjà pris les armes,	Non, Seigneur, Perdiccas a déjà pris les armes,
Et par un grand Combat pres de la Porte....	Et par un grand Combat près de la Porte…
Helas!	Hélas!
Seigneur, allez, courez ſoútenir Perdiccas,	Seigneur, allez, courez soutenir Perdiccas,
Prenez ma Garde encor, & joignez-y la voſtre,	Prenez ma Garde encore, et joignez-y la vôtre,
Partez....	Partez…
Voſtre intéreſt n’eſt que trop joint au noſtre,	>Votre intérêt n’est que trop joint au nôtre,
Repoſez vous ſur moy, Madame, & demeurez,	Reposez-vous sur moi, Madame, et demeurez,
J’y cours.	J’y cours.
Rendez le calme à mes ſens égarez;	Rendez le calme à mes sens égarés;
Sur tout, ſi vous m’aimez, Seigneur, quoyqu’il arrive,	Surtout, si vous m’aimez, Seigneur, quoiqu’il arrive,
S’il ſe peut, en ces lieux ramenez ma Captive.	S’il se peut, en ces lieux ramenez ma Captive.
LEonatus ſans-doute a formé ce deſſein,	LÉonatus sans doute a formé ce dessein,
Ce grand coup, Heſione, eſt party de ſa main,	Ce grand coup, Hésione, est parti de sa main,
Ils s’aiment, avecque elle il eſt d’intelligence,	Ils s’aiment, avec elle il est d’intelligence,
Et tantoſt ſa fierté marquoit ſon aſſurance.	Et tantôt sa fierté marquait son assurance.
Ciel! avec quelle audace il nous a demandé	Ciel! Avec quelle audace il nous a demandé
Ce que déja luy-meſme il s’eſtoit accordé?	Ce que déjà lui-même il s’était accordé?
Et ce Prince content & fier de ſa tendreſſe,	Et ce Prince content et fier de sa tendresse,
Parloit en Amant ſeúr du cœur de ſa Maiſtreſſe;	Parlait en Amant sûr du cœur de sa Maîtresse;
Mon amour en partant cent fois m'a ſçeu tenter,	Mon amour en partant cent fois m’a su tenter,
Contre le droit des Gens, de le faire arreſter,	Contre le droit des Gens, de le faire arrêter,
Mais il m'a prévenuë, & ſon ardeur fatale	Mais il m’a prévenue, et son ardeur fatale
Avec tout mon eſpoir m’enleve ma Rivale;	Avec tout mon espoir m’enlève ma Rivale;
Cependant on combat, Heſione, & je crains	Cependant on combat, Hésione, et je crains
Peut-eſtre qu’avec luy Perdiccas eſt aux mains;	Peut-être qu’avec lui Perdiccas est aux mains;
Peut-eſtre que.... Sortons, car je n’oſe me dire....	Peut-être que… Sortons, car je n’ose me dire…
Madame, Perdiccas va de tout vous inſtruire,	Madame, Perdiccas va de tout vous instruire,
Le voicy.	Le voici.
SCavez-vous que je viens d'arreſter	Savez-vous que je viens d'arrêter
Un cruel attentat preſt à s'exécuter?	Un cruel attentat prêt à s’exécuter?
J'ay repris Statira, Madame.	J’ai repris Statira, Madame.
Quelle joye!	Quelle joie!
Quoy, vous avez repris une ſi belle proye?	Quoi, vous avez repris une si belle proie?
Oüy, Madame, & la Reyne eſtoit preſte à ſortir,	Oui, Madame, et la Reine était prête à sortir,
Lors qu'un Garde fidelle eſt venu m’avertir:	Lorsqu’un Garde fidèle est venu m’avertir:
Auſſitoſt j’ay couru, ſuivy de quelque Eſcorte,	Aussitôt j’ai couru, suivi de quelque Escorte,
Quand l’infidelle Arbate a fait ouvrir la Porte.	Quand l’infidèle Arbate a fait ouvrir la Porte.
Là pluſieurs Gens armez apuyant-ſes deſſeins,	Là plusieurs Gens armés appuyant ses desseins,
Ont avancé vers nous, & ſont venus aux mains;	Ont avancé vers nous, et sont venus aux mains;
Mon amour a rendu ma fureur occupée,	Mon amour a rendu ma fureur occupée,
Arbate eſt le premier tombe ſous mon Epée;	Arbate est le premier tombé sous mon Épée;
Mais certain Inconnu, qui le Caſque abaiſſé,	Mais certain Inconnu, qui le Casque abaissé,
A travers mille Dards vers moy s’eſt élancé,	À travers mille dards vers moi s’est élancé,
Glaçant tous nos Soldats de ſes cris redoutables,	Glaçant tous nos Soldats de ses cris redoutables,
S’eſt fait jour parmy nous par des coups effroyables.	S’est fait jour parmi nous par des coups effroyables.
La Porte ſe referme; alors de toutes parts	La Porte se referme; alors de toutes parts
On tourne contre luy les Piques & les Dards;	On tourne contre lui les Piques et les Dards;
Les ſiens envelopez de tous coſtez ſuccombent,	Les siens enveloppés de tous côtés succombent,
Mais luy ſeul soútient tout quand tous les autres tombent:	Mais lui seul soutient tout quand tous les autres tombent:
Auſſitoſt j’ay couru reprendre Statira,	Aussitôt j’ai couru reprendre Statira,
Qui toute en pleurs....	Qui toute en pleurs…
Mais Dieux! l’Inconnu périra, Seigneur?	Mais Dieux! L’Inconnu périra, Seigneur ?
Non, non, Madame, & j'ay dit qu'on l'emmeine,	Non, non, Madame, et j’ai dit qu’on l’emmène,
De cette trahiſon il recevra la peine;	De cette trahison il recevra la peine;
J’en veux ſçavoir l’Auteur, j’en veux eſtre éclaircy,	J’en veux savoir l’Auteur, j’en veux être éclairci,
Sur tout j’ay commandé qu’on l’amenât icy,	Surtout j’ai commandé qu’on l’amenât ici,
Vous l’allez voir. A moins qu’un coup trop légitime	Vous l’allez voir. À moins qu’un coup trop légitime
N’ait déja fait payer la peine de ſon crime,	N’ait déjà fait payer la peine de son crime,
Il eſtoit tout couvert de ſang.	Il était tout couvert de sang.
Ciel! que d’efffoy?	Ciel! Que d’effroi?
Je tremble, je friſſonne & je ne ſçay pourquoy;	Je tremble, je frissonne, et je ne sais pourquoi;
Mais, Heſione, hélas! d’où vient que j’en ſoúpire?	Mais, Hésione, hélas! d’où vient que j’en soupire?
Il eſt couvert de ſang, & peut-eſtre il expire,	Il est couvert de sang, et peut-être il expire,
Il n’en faut plus douter; ah! regrets ſuperflus!	Il n’en faut plus douter; ah! regrets superflus!
Seigneur, vous avez fait périr Leonatus.	Seigneur, vous-avez fait périr Léonatus.
Seroit-ce luy, Madame?	Serait-ce lui, Madame?
Oüy, Seigneur, c'eſt luy-meſme;	Oui, Seigneur, c'est luy-même;
Statira, ſon amour, cette valeur ſupréme,	Statira, son amour, cette valeur suprême,
Tout me dit que c’eſt luy qu’on a ſçeu trop punir;	Tout me dit que c’est lui qu’on a su trop punir;
Enfin cet Inconnu tarde trop à venir;	Enfin cet Inconnu tarde trop à venir;
Il faut, pour diſſiper mes mortelles allarmes,	Il faut, pour dissiper mes mortelles alarmes,
Chercher cet Ennemy qui me coúte des larmes.	Chercher cet ennemi qui me coûte des larmes.
Ah! Dieux, d’un tel deſſein je demeure ſurpris;	Ah! Dieux, d’un tel dessein je demeure surpris;
Seroit-ce mon Rival enfin qui ſeroit pris?	Serait-ce mon Rival enfin qui serait pris?
Suivons Roxane, allons penétrer ce miſtere,	Suivons Roxane, allons pénétrer ce mystère,
Et voir ce que le Sort ou l’Amour ont pú faire.	Et voir ce que le Sort ou l’Amour ont pu faire.
CLEONE, en cet inſtant, quel eſpoir m'eſt permis?	CLÉONE, en cet instant, quel espoir m’est permis?
Leonatus eſt ſeul contre mille Ennemis;	Léonatus est seul contre mille Ennemis;
Preſſé de tous coſtez, à mille traits en bute,	Pressé de tous côtés, à mille traits en butte,
Quel ſecours, ou quel Dieu peut retarder ſa chute?	Quel secours, ou quel Dieu peut retarder sa chute?
Caſſander l'a trahy ſans-doute, & Perdiccas	Cassandre l’a trahi sans-doute, et Perdiccas
M'enferme en ce Palais, & vole à ſon trépas;	M’enferme en ce Palais, et vole à son trépas;
Son bras & ſa valeur l’ont trop fait reconnoître,	Son bras et sa valeur l’ont trop fait reconnaître,
On l'attaque, on le preſſe, il ſuccombe peut-eſtre;	On l’attaque, on le presse, il succombe peut-être;
Quelle horreur ſe répand dans mes ſens éperdus!	Quelle horreur se répand dans mes sens éperdus!
Mon Amant eſt Captif, ou peut-eſtre il n’eſt plus,	Mon Amant est captif, ou peut-être il n’est plus,
Son deſeſpoir marquoit ſa trop funeſte envie,	Son désespoir marquait sa trop funeste envie,
Il ne combatoit plus pour défendre ſa vie,	Il ne combattait plus pour défendre sa vie,
Et ſi-toſt qu’il a veu Perdiccas m'enlever,	Et sitôt qu’il a vu Perdiccas m’enlever,
Il a voulu la perdre, & non pas la ſauver.	Il a voulu la perdre, et non pas la sauver.
Dieux! le nombre l'accable, & ç'en eſt fait ſans doute,	Dieux! le nombre l’accable, et s’en est fait sans doute;
Voila ce qu'aujourd'huy ſa tendreſſe luy coûte;	Voilà ce qu’aujourd’hui sa tendresse lui coûte;
Cleone, chaque inſtant redouble mon effroy,	Cléone, chaque instant redouble mon effroi,
Les traits qui vont à luy ſemblent tomber ſur moy:	Les traits qui vont à lui semblent tomber sur moi,
C’eſt moy qui l'ay perdu, malheureuſe Princeſſe,	C’est moi qui l’ai perdu, malheureuse Princesse,
Pourquoy Leonatus eut-il tant de tendreſſe?	Pourquoi Léonatus eut-il tant de tendresse?
Sans mes coupables yeux il n’eut rien entrepris;	Sans mes coupables yeux il n’eut rien entrepris;
Faut-il qu’il en reçoive un ſi funeſte prix?	Faut-il qu’il en reçoive un si funeste prix?
Que ſon a me ait eſté pour moy trop enflâmée?	Que son âme ait été pour moi trop enflammée?
Il n'auroit point péry, s’il m'avoit moins aimée.	Il n’aurait point péri, s’il m’avait moins aimée.
Non, Madame, les Dieux prendrõt ſoin de ſes jours,	Non, Madame, les Dieux prendront soin de ses jours,
J'ay veu de loin voler Roxane à ſon ſecours,	J’ai vu de loin voler Roxane à son secours,
Son cœur (n’en doutez point) dãs ce péril extréme,	Son cœur (n’en doutez point) dans ce péril extrême,
L’entraîne & la cõduit pour ſauver ce qu’elle aime;	L’entraîne et la conduit pour sauver ce qu’elle aime;
Elle ſçaura calmer la fureur des Soldats,	Elle saura calmer la fureur des Soldats,
Et dérober ſa vie au fer de Perdiccas;	Et dérober sa vie au fer de Perdiccas;
Oüy, Madame, eſpérez....	Oui, Madame, espérez…
Eſpérance fatale!	Espérance fatale!
Quoy, mon Amant dévroit la vie à ma Rivale?	Quoi, mon Amant devrait la vie à ma Rivale?
Ciel, en me raſſurant, tu redoubles ma peur,	Ciel, en me rassurant, tu redoubles ma peur,
Et pour me conſoler, tu me perces le cœur.	Et pour me consoler, tu me perces le cœur.
Cruelle, voy mon ame également atteinte,	Cruelle, vois mon âme également atteinte,
Frémir de l'eſpérance autant que de la crainte,	Frémir de l’espérance autant que de la crainte,
L’une & l’autre m’accable, & me fait ſoûpirer;	L’une et l’autre m’accablent, et me font soupirer;
Hélas! que dois-je craindre, ou que dois-je eſpérer?	Hélas! que dois-je craindre, ou que dois-je espérer?
Mais je voy Perdiccas, & je crains de l'entendre,	Mais je vois Perdiccas, et je crains de l’entendre,
Il vient à nous.	Il vient à nous.
SEigneur, que venez-vous m’aprendre?	SEigneur, que venez-vous m’apprendre?
Avez-vous aſſouvy voſtre in juſte fureur?	Avez-vous assouvi votre injuste fureur?
Avez vous immolé, grands Dieux! mon Défenſeur,	Avez-vous immolé, grands Dieux! mon Défenseur,
Ce Héros qui pour moy....	Ce Héros qui pour moi…
Vous le pleuriez, Madame,	Vous le pleuriez, Madame,
Il eſt vivant. Je voy le plaiſir de voſtre ame,	Il est vivant. Je vois le plaisir de votre âme,
Et que vous aſſurant de ſes jours, je prévois	Et que vous assurant de ses jours, je prévois
Que vous m’écouterez pour la premiere fois.	Que vous m’écouterez pour la première fois.
Oüy dans l’heureux inſtant que je vous ay repriſe,	Oui, dans l’heureux instant que je vous ai reprise,
Et qu’il alloit payer ſa coupable entrepriſe,	Et qu’il allait payer sa coupable entreprise,
Que tout couvert du ſang de qui l’environnoit,	Que tout couvert du sang de qui l’environnait,
J’ay connu mon Rival aux grãds coups qu'il dõnoit,	J’ai connu mon Rival aux grands coups qu’il donnait,
Madame, je luy dois rendre ce témoignage,	Madame, je lui dois rendre ce témoignage,
Tout mon Rival qu'il eſt, j’admirois ſon courage,	Tout mon Rival qu’il est, j’admirais son courage,
Et preſt à le combatre, helas! j’eſtois jaloux	Et prêt à le combattre, hélas! j’étais jaloux
Que tout autre que moy voulut mourir pour vous.	Que tout autre que moi voulut mourir pour vous.
Mais Roxane en ces lieux par l’amour amenée,	Mais Roxane en ces lieux par l’amour amenée,
A ſuivy le panchant dont elle eſt entraînée,	A suivi le penchant dont elle est entraînée,
Et malgré mille traits s’eſtant miſe entre nous,	Et malgré mille traits s’étant mise entre nous,
A dérobé ſa vie à mon juſte couroux;	A dérobé sa vie à mon juste courroux;
Cependant pour ſes jours ne ſoyez plus en peine,	Cependant pour ses jours ne soyez plus en peine,
Ils ſont eu ſeûreté dans les mains delà Reyne.	Il sont en sûreté dans les mains de la Reine.
Vous frémiſſez, Madame, & voſtre joye enfin	Vous frémissez, Madame, et votre joie enfin
Se diſſipe & ſe change en un ſombre chagrin.	Se dissipe et se change en un sombre chagrin.
Dans les mains de Roxane il a voulu ſe rendre,	Dans les mains de Roxane il a voulu se rendre,
Luy, qui de mille Bras avoit pû ſe défendre;	Lui, qui de mille Bras avait pu se défendre;
Roxane ſeule, ah Dieux! l’a donc ſçeu deſarmer?	Roxane seule, ah Dieux! L’a donc su désarmer?
Par ſon amour peut-eſtre il s’eſt laiſſé charmer,	Par son amour peut-être il s’est laissé charmer,
Et voyant par mes ſoins ſon attente trompée,	Et voyant par mes soins son attente trompée,
Dans les mains de Roxane il a mis ſon Epée,	Dans les mains de Roxane il a mis son Épée,
Qui briſée à demy, marque de ſa valeur....	Qui brisée à demi, marque de sa valeur…
Il s’en devoit plonger les reſtes dans le cœur,	Il s’en devait plonger les restes dans le cœur,
Plutoſt que de la rendre à Roxane.	Plutôt que de la rendre à Roxane.
Madame,	Madame,
Ce Prince doit la vie à l’ardeur de ſa flame,	Ce Prince doit la vie à l’ardeur de sa flamme,
Sans l’amour de Roxane il alloit ſuccomber,	Sans l’amour de Roxane il allait succomber,
Et ſous ce bras peut-eſtre on l’auroit veu tomber;	Et sous ce bras peut-être on l’aurait vu tomber;
Mais il faut qu’il réponde à noſtre juſte envie,	Mais il faut qu’il réponde à notre juste envie,
Qu’il luy donne ſon cœur pour le prix de ſa vie;	Qu’il lui donne son cœur pour le prix de sa vie;
Ah Dieux! vous pâliſſez, Madame, à ce diſcours.	Ah Dieux! vous pâlissez, Madame, à ce discours.
Eſt-ce à vous à régler ſa fortune & ſes jours?	Est-ce à vous à régler sa fortune et ses jours?
Quoy, le ſang d’Alexandre eſt-il donc voſtre Eſclave?	Quoi, le sang d’Alexandre est-il donc votre Esclave?
Vous nous parlez en Maiſtre, & voſtre orgueil nous brave;	Vous nous parlez en Maître, et votre orgueil nous brave;
Et depuis quand, Seigneur, eſtes-vous noſtre Roy?	Et depuis quand, Seigneur, êtes-vous notre Roi?
Vous n’avez aucun droit ny ſur luy, ny ſur moy,	Vous n’avez aucun droit ni sur lui, ni sur moi,
Sur ſes jours cependant vous parlez d’entreprendre,	Sur ses jours cependant vous parlez d’entreprendre,
Vous oſez retenir la Veuve d’Alexandre,	Vous osez retenir la Veuve d’Alexandre,
Pour me donner les fers de ceux qu’il a vaincus?	Pour me donner des fers de ceux qu’il a vaincus?
C’eſt allez que je ſois Fille de Darius,	C’est assez que je sois Fille de Darius,
Et bien que je doive eſtre indépendante & Reyne,	Et bien que je doive être indépendante et Reine,
Le ſang de Darius eſtoit né pour la chaîne,	Le sang de Darius était né pour la chaîne,
Je le vois.	Je le vois.
Non, Madame, il eſt né pour régner,	Non, Madame, il est né pour régner,
Le Trône de la Perſe eſt-il à dédaigner,	Le Trône de la Perse est-il à dédaigner,
Je vous l'offre.... Mais Dieux! je voy qu’on me mépriſe,	Je vous l’offre… Mais Dieux! je vois qu’on me méprise,
Que de Leonatus voſtre ame eſt trop épriſe,	Que de Léonatus votre âme est trop éprise,
Il n’en faut plus douter, mon Rival eſt heureux,	Il n’en faut plus douter, mon Rival est heureux,
J’ay gémy trop longtemps, & j’ay trop fait de vœux,	J’ai gémi trop longtemps, et j’ai trop fait de vœux,
Je connois voſtre amour par voſtre jalouſie,	Je connais votre amour par votre jalousie,
Madame, cet amour luy peut coûter la vie,	Madame, cet amour lui peut coûter la vie,
Il eſt entre nos mains ce Rival fortuné,	Il est entre nos mains ce Rival fortuné,
Voyez à quels malheurs il ſera deſtiné,	Voyez à quels malheurs il sera destiné,
Il y va d’un Empire, il y va de vous-meſme,	Il y va d’un Empire, il y va de vous-même,
Je ſuis le malheureux, on me mépriſe, on l’aime;	Je suis le malheureux, on me méprise, on l’aime;
Mais ſi vous dédaignez mes ſoûpirs & ma foy.	Mais si vous dédaignez mes soupirs et ma foi.
Je puis enſevelir mon Rival avec moy.	Je puis ensevelir mon Rival avec moi.
Ah! je vois que pour luy voſtre ame eſt allarmée,	Ah! Je vois que pour lui votre âme est alarmée,
Et la mienne eſt de rage & d’amour enflamée.	Et la mienne est de rage et d’amour enflammée.
Roxane va venir; mais ſans vous étonner,	Roxane va venir; mais sans vous étonner,
Pour luy, ſuivez l’avis qu’elle doit vous donner,	Pour lui, suivez l’avis qu’elle doit vous donner,
Il faut que voſtre cœur deſormais l’abandonne,	Il faut que votre cœur désormais l’abandonne,
Et ſur tout que dans peu Roxane le couronne.	Et surtout que dans peu Roxane le couronne.
C’eſt vous en dire aſſez. Adieu, Madame.	C’est vous en dire assez. Adieu, Madame.
Helas!	Hélas!
Qu’entens-je? que dit-il? quel afreux embaras!	Qu’entends-je? que dit-il? Quel affreux embarras!
Pour ce Prince, Cleone, à peine je reſpire,	Pour ce Prince, Cléone, à peine je respire,
Que l’on m’aprend qu’il faut.... Ah! mon cœur en ſoûpire,	Que l’on m’apprend qu’il faut… Ah! mon cœur en soupire,
Et Perdiccas (d’horreur je m’en ſens friſſonner)	Et Perdiccas (d’horreur je m’en sens frissonner)
