Ne luy laiſſe le jour que pour m’abandonner.	Ne lui laisse le jour que pour m’abandonner.
Vois donc à quels malheurs le Deſtin me cõdamne,	Vois donc à quels malheurs le Destin me condamne,
Verray-je mon Amant couronné par Roxane?	Verrai-je mon amant couronné par Roxane?
Verray-je Perdiccas l’immoler... Que d’effroy!	Verrai-je Perdiccas l’immoler… Que d’effroi!
Mais s’il vit pour Roxane, eſt-il pas mort pour moy?	Mais s’il vit pour Roxane, est-il pas mort pour moi?
Ne craignez rien, Madame, il vous ſera fidelle,	Ne craignez rien, Madame, il vous sera fidèle,
Ce Prince, qui pour vous....	Ce Prince, qui pour vous…
Helas! Roxane eſt belle,	Hélas! Roxane est belle,
Leonatus a veu pour luy ce qu’elle a fait.	Léonatus a vu pour lui ce qu’elle a fait.
Dieux! ne l’a-t-elle pas deſarmé tout-à-fait?	Dieux! ne l’a-t-elle pas désarmé tout-à-fait?
Peut-eſtre qu’ébloüy de l’éclat de ſes charmes,	Peut-être qu’ébloui de l’éclat de ses charmes,
Ce n’eſt qu'à ſa beauté qu’il a rendu les armes;	Ce n’est qu’à sa beauté qu’il a rendu les armes;
Peut-eſtre que touché de ſon empreſſement,	Peut-être que touché de son empressement,
Il oublie à ſes pieds qu’il eſtoit mon Amant;	Il oublie à ses pieds qu’il était mon Amant;
Elle eſt belle, elle l’aime; ah que de jalouſie!	Elle est belle, elle aime; ah que de jalousie!
Des mains de Perdiccas elle a ſauvé ſa vie,	Des mains de Perdiccas elle a sauvé sa vie,
Il peut eſtre atendry d’un amour ſi preſſant,	Il peut être attendri d’un amour si pressant,
Cleone, ſi ſon cœur eſtoit reconnoiſſant?	Cléone, si son cœur était reconnaissant?
Ciel! de quel ſouvenirmon ame eſt combatuë!	Ciel! de quel souvenir mon âme est combattue!
Ma Rivale le ſauve, & c’eſt moy qui le tuë,	Ma Rivale le sauve, et c’est moi qui le tue,
C’eſt moy qui l’ay conduit dans cet inſtant fatal,	C’est moi qui l’ai conduit dans cet instant fatal,
Dans les bras d’une Amante, & dans ceux d’un Rival.	Dans les bras d’une Amante, et dans ceux d’un Rival.
Mais Roxane paroît; que j’en ſuis allarmée!	Mais Roxane paraît; que j’en suis alarmée!
Elle a l’air trop content pour n’eſtre pas aimée.	Elle a l’air trop content pour n’être pas aimée.
VOus me devez icy quelque remercîment,	VOus me devez ici quelque remerciement,
Madame, j’ay ſauvé le jour à voſtre Amant;	Madame, j’ai sauvé le jour à votre Amant;
Vous voyez de quel air pour vous je m'intéreſſe:	Vous voyez de quel air pour vous je m’intéresse:
Mais, Madame, d’où vient cette ſombre triſteſſe?	Mais, Madame, d’où vient cette sombre tristesse?
Eſtoit-ce pour vos yeux un ſpéctacle plus doux,	Était-ce pour vos yeux un spectacle plus doux,
De voir Leonatus preſt à mourir pour vous?	De voir Léonatus prêt à mourir pour vous?
Il eut mieux par ſa mort ſignalé ſa tendreſſe;	Il eut mieux par sa mort signalé sa tendresse;
Mais c’eſt pouſſer trop loin voſtre délicateſſe,	Mais c’est pousser trop loin votre délicatesse,
Je vous viens d’épargner de ſenſibles regrets,	Je vous viens d’épargner de sensibles regrets,
Nous avons un Oſtage aſſuré de la Paix;	Nous avons un Otage assuré de la Paix;
Pour peu qu’à mes deſſeins ſa prudence réponde,	Pour peu qu’à mes desseins sa prudence réponde,
Nous allons diſpoſer de l’Empire du Monde.	Nous allons disposer de l’Empire du Monde.
Madame, je prens part à ce rare bonheur,	Madame, je prends part à ce rare bonheur,
Mais avez-vous déja diſpoſé de ſon cœur?	Mais avez-vous déjà disposé de son cœur?
Vous eſtes genéreuſe, il eſt vray, je l’avouë,	Vous êtes généreuse, il est vrai, je l’avoue,
Ce que vous avez fait mérité qu’on vous louë;	Ce que vous avez fait mérite qu’on vous loue;
Il vous doit tout enfin... Mais, Madame, entre nous,	Il vous doit tout enfin… Mais, Madame, entre nous,
Vous l’avez cõſervé moins pour moy que pour vous.	Vous l’avez conservé moins pour moi que pour vous.
J’ay fait ce que j’ay dû, mais à parler ſans feindre,	J’ai fait ce que j’ai dû, mais à parler sans feindre,
Madame, pour ſes jours un Rival eſt à craindre;	Madame, pour ses jours un Rival est à craindre;
Un Rival mépriſé, jaloux, & furieux,	Un Rival méprisé, jaloux, et furieux,
Peut le faire expirer malgré nous à nos yeux:	Peut le faire expirer malgré nous à nos yeux:
Je l’ay veu, ſa fureur m’a paru ſans égale,	Je l’ai vu, sa fureur m’a paru sans égale,
Et pour moy ſi j’aimois, que j’euſſe une Rivale,	Et pour moi si j’aimais, que j’eusse une Rivale,
Mon plaiſir le plus doux, je ne puis le celer,	Mon plaisir le plus doux, je ne puis le celer,
Ce ſeroit à mes yeux de la faire immoler;	Ce serait à mes yeux de la faire immoler;
J’entre dans ſes tranſports, & connois ſa tendreſſe,	J’entre dans ses transports, et connais sa tendresse,
C’eſt pour Leonatus que ma crainte vous preſſe,	C’est pour Léonatus que ma crainte vous presse,
Perdiccas eſt puiſſant, Madame, & vos refus	Perdiccas est puissant, Madame, et vos refus
Vont faire malgré nous périr Leonatus.	Vont faire malgré nous périr Léonatus.
Je ne répons de rien dans ſa fureur extréme.	Je ne réponds de rien dans sa fureur extrême.
Moy, je répons de tout, puis que Roxane l’aime,	Moi, je réponds de tout, puis que Roxane l’aime,
Il eſt entre vos mains, Madame, c’eſt aſſez,	Il est entre vos mains, Madame, c’est assez,
Il eſt en ſeûreté plus que vous ne penſez.	Il est en sûreté plus que vous ne pensez.
Non, ce n’eſt pas aſſez pour aſſurer ſa vie,	Non, ce n’est pas assez pour assurer sa vie,
Il faut qu’à Perdiccas Starira ſoit unie.	Il faut qu’à Perdiccas Statira soit unie.
Moy, Madame?	Moi, Madame?
Oüy, vous. C’eſt l’unique moyen	Oui, vous. C’est l’unique moyen
De retenir ſon bras auſſi-bien que le mien;	De retenir son bras aussi-bien que le mien;
Sans balancer, Madame, il faut qu’il vous épouſe,	Sans balancer, Madame, il faut qu’il vous épouse,
Perdiccas eſt jaloux, & Roxane eſt jalouſe;	Perdiccas est jaloux, et Roxane est jalouse;
Mais ce n’eſt pas aſſez: je viens vous avertir	Mais ce n’est pas assez: je viens vous avertir
Qu’aux yeux de voſtre Amant il y faut conſentir;	Qu’aux yeux de votre Amant il y faut consentir;
J’attens Leonatus, & c’eſt en ma préſence	J’attends Léonatus, et c’est en ma présence
Qu’il vous faut accepter une telle alliance,	Qu’il vous faut accepter une telle alliance,
Qu'il faut le recevoir avecque un air glacé,	Qu’il faut le recevoir avec un air glacé,
Qu'avec luy le préſent démente le paſſé;	Qu’avec lui le présent démente le passé;
De concert avec moy Perdiccas ſçait l'inſtruire	De concert avec moi Perdiccas sait l’instruire
Que voſtre cœur conſent à l’Hymen qu’il deſire;	Que votre cœur consent à l’Hymen qu’il désire;
Il va venir ſans-doute, inquiet, allarmé,	Il va venir sans-doute, inquiet, alarmé,
Mais il faut que par vous cet Hymen confirmé....	Mais il faut que par vous cet Hymen confirmé…
Quoy? je pourois pour luy....	Quoi? je pourrais pour lui…
Du moins il faut le feindre;	Du moins il faut le feindre;
Pour luy, pour vous, pour moy, vous avez tout à craindre;	Pour lui, pour vous, pour moi, vous avez tout à craindre;
Vous m'entendez, ſongez qu’en ce fatal moment	Vous m’entendez, songez qu’en ce fatal moment
Vous allez cécider du ſort de voſtre Amant;	Vous allez décider du sort de votre Amant;
Vous avez dans vos mains voſtre vie & la ſienne,	Vous avez dans vos mains votre vie et la sienne,
Celle de Perdiccas auſſi bien que la mienne,	Celle de Perdiccas aussi bien que la mienne,
Et ſi nous n’avons pas ce que nous chériſſons,	Et si nous n’avons pas ce que nous chérissons,
Nous pourons perdre au moins ce que nous haïſſons;	Nous pourrons perdre au moins ce que nous haïssons;
Songez par des froideurs à préparer ſon ame,	Songez par des froideurs à préparer son âme,
A changer comme vous & d’objet & de flame,	À changer comme vous et d’objet et de flamme,
Ou tremblez....	Ou tremblez…
Hé, mon cœur pouroit-il obeïr?	Hé, mon cœur pourrait-il obéir?
Mes yeux & mes ſoúpirs, tout ſçaura me trahir.	Mes yeux et mes soupirs, tout saura me trahir.
Dois-je faire à mes feux l'indigne violence?...	Dois-je faire à mes feux l’indigne violence?…
Vos feux, de Perdiccas armeront la vangeance;	Vos feux, de Perdiccas armeront la vengeance;
Mais croyez-moy, feignez, il y va de vos jours.	Mais croyez-moi, feignez, il y va de vos jours.
Cruelle, faudra-t-il que je feigne toûjours?	Cruelle, faudra-t-il que je feigne toujours?
Peut-eſtre que ſa mort ſçaura moins vous cõtraindre,	Peut-être que sa mort saura moins vous contraindre,
Et Perdiccas....	Et Perdiccas…
Hé bien? Il faut tâcher de feindre;	Hé bien? Il faut tâcher de feindre;
Dieux! il vient; ah ſortons.	Dieux! il vient; ah sortons.
Madame, demeurez,	Madame, demeurez,
Et ſongez bien ſur tout à ce que vous direz.	Et songez bien surtout à ce que vous direz.
JE ne ſuis point, Madame, accablé de ma chûte,	JE ne suis point, Madame, accablé de ma chute,
A de plus grands malheurs je vois mon ame en bute,	À de plus grands malheurs je vois mon âme en butte,
Je pers la liberté, c’eſt un leger revers;	Je perds la liberté, c’est un léger revers;
Mais, Madame, on m’aprẽd de plus, que je vous pers.	Mais, Madame, on m’apprend de plus, que je vous perds.
Vous me voyez ſurpris d’une étrange nouvelle,	Vous me voyez surpris d’une étrange nouvelle,
Elle vient cependant d’une bouche fidelle,	Elle vient cependant d’une bouche fidèle,
Perdiccas me l’aſſure, & c’eſt luy dont je tiens	Perdiccas me l’assure, et c’est lui dont je tiens
Que l’Hymen doit unir vos feux avec les ſiens;	Que l’Hymen doit unir vos feux avec les siens;
J'auray peine à le croire, à moins que voſtre bouche	J’aurais peine à le croire, à moins que votre bouche
Ne confirme elle-meſme un Arreſt qui me touche;	Ne confirme elle-même un Arrêt qui me touche;
Parlez, qu’en dites vous?... Vous ne répondez pas,	Parlez qu’en dites-vous?… Vous ne répondez pas,
Madame.... Juſte Ciel! croiray-je Perdiccas?	Madame… Juste Ciel! croirai-je Perdiccas?
Sans trop vous expliquer icy ce que je penſe,	Sans trop vous expliquer ici ce que je pense,
Vous devriez, Seigneur, entendre mon ſilence.	Vous devriez, Seigneur, entendre mon silence.
Je ne l’entens que trop ce ſilence odieux,	Je ne l’entends que trop ce silence odieux,
Mon Rival a charmé voſtre cœur & vos yeux.	Mon Rival a charmé votre cœur et vos yeux.
Ah! tantoſt j’en frémis; avec quelle tendreſſe	Ah! tantôt j’en frémis; avec quelle tendresse
A-t-il volé luy-meſme aupres de ſa Maiſtreſſe?	A-t-il volé lui-même auprès de sa Maîtresse?
De quel feu ſon viſage eſtoit-il enflamé!	De quel feu son visage était-il enflammé!
Il combatoit trop bien, pour n’eſtre pas aimé.	Il combattait trop bien, pour n’être pas aimé.
Quoy, Madame, ſes ſoins pendant ma lõgue abſence	Quoi, Madame, ses soins pendant ma longue absence
Ont-ils.... Garderez-vous ce funeſte ſilence,	Ont-ils… Garderez-vous ce funeste silence,
Madame?	Madame?
Helas!	Hélas!
Seigneur, elle a d’autres deſſeins,	Seigneur, elle a d’autres desseins,
Il faut qu’elle aime ailleurs; vous l’aimez, je vous plains.	Il faut qu’elle aime ailleurs; vous l’aimez, je vous plains.
Je vous entens, Madame, & la Reyne infidelle	Je vous entends, Madame, et la Reine infidèle
Me ſacrifie apres ce que j’ay fait pour elle.	Me sacrifie après ce que j’ai fait pour elle.
Quand on ſe taiſt helas! c’eſt parler à demy;	Quand on se tait hélas! c’est parler à demi;
Dieux! elle me préfere un mortel Ennemy,	Dieux! elle me préfère un mortel Ennemi,
A ſon cœur Perdiccas malgré moy peut prétendre,	À son cœur Perdiccas malgré moi peut prétendre,
Moy qui n’eus autrefois pour Rival qu'Alexandre;	Moi qui n’eus autrefois pour Rival qu’Alexandre;
A moy-meſme pour vous je l’avois préféré,	À moi-même pour vous je l’avais préféré,
Cependant voſtre cœur en avoit ſoûpiré,	Cependant votre cœur en avait soupiré,
Et ces tendres ſoúpir, où mon eſpoir ſe fonde,	Et ces tendres soupirs, où mon espoir se fonde,
Me rendoient plus heureux que le Maître du Monde.	Me rendaient plus heureux que le Maître du Monde.
Il m’en ſouvient helas! mais vous en ſoupirez,	Il m’en souvient hélas! mais vous en soupirez,
Que vois-je, juſtes Dieux! Madame, vous pleurez,	Que vois-je, juste Dieux! Madame, vous pleurez,
Pourquoy me cachez-vous ces larmes que j’adore?	Pourquoi me cachez-vous ces larmes que j’adore?
Mais quel eſt ce miſtere, & faut-il que j’ignore....	Mais quel est ce mystère, et faut-il que j’ignore…
Un ſecret....	Un secret…
Non, Seigneur, ne vous y trompez pas,	Non, Seigneur, ne vous y trompez pas,
Au nom des Dieux, croyez que j’aime Perdiccas.	Au nom des Dieux, croyez que j’aime Perdiccas.
Ah! ç’en eſt trop, cruelle, & cet aveu funeſte	Ah! c’en est trop, cruelle, et cet aveu funeste
Arrache de mon cœur tout l’amour qui luy reſte:	Arrache de mon cœur tout l’amour qui lui reste:
Et, Madame, tantoſt pourquoy voſtre ſecours	Et, Madame, tantôt pourquoi votre secours
Vous fiſt-il épargner de ſi malheureux jours?	Vous fit-il épargner de si malheureux jours?
On ne m’a conſervé, (quelle pitié cruelle!)	On ne m’a conservé, (quelle pitié cruelle!)
Que pour voir aujourd’huy ma Princeſſe infidelle,	Que pour voir aujourd’hui ma Princesse infidèle,
Et l’on prétend encor par un Hymen fatal	Et l’on prétend encor par un Hymen fatal
M’atacher en triomphe au Char de mon Rival;	M’attacher en triomphe au Char de mon Rival;
Au lieu de m’acabler d’une importune vie,	Au lieu de m’accabler d’une importune vie,
Rendez-moy cette mort que vous m’avez ravie.	Rendez-moi cette mort que vous m’avez ravie.
Le jour que de ma main vous devez accepter,	Le jour que de ma main vous devez accepter,
Ne vous fuſt pas rendu, Seigneur, pour vous l’oſter.	Ne vous fut pas rendu, Seigneur, pour vous l’ôter.
Non, ſans-doute la vie a pour vous trop de charmes,	Non, sans-doute la vie a pour vous trop de charmes,
Vous la devez à qui vous rendites les armes.	Vous la devez à qui vous rendîtes les armes.
Madame, mon amour deſeſperé, jaloux,	Madame, mon amour désespéré, jaloux,
Ne m’a rendu Captif que pour l’eſtre avec vous;	Ne m’a rendu Captif que pour l’être avec vous;
J’avois fait mes efforts pour briſer voſtre chaîne,	J’avais fait mes efforts pour briser votre chaîne,
Je n’ay pû. J’avois crû qu’une mort plus certaine	Je n’ai pu. J’avais crû qu’une mort plus certaine
M’afranchiroit du moins des maux que j'ay ſoufers;	M’affranchirait du moins des maux que j’ai souffert;
Mais n’ayant pû mourir, j’ay partagé vos fers,	Mais n’ayant pu mourir, j’ai partagé vos fers,
Et trouvois pres de vous, perdant toute eſpérance,	Et trouvais prés de vous, perdant toute espérance,
L’eſclavage, ou la mort moins cruels que l’abſence.	L’esclavage, ou la mort, moins cruels que l’absence.
Mais je vous parle en vain, & j’ay beau proteſter,	Mais je vous parle en vain, et j’ai beau protester,
Ciel! vous ne voulez pas ſeulement m’écouter,	Ciel! vous ne voulez pas seulement m’écouter,
Cependant vous pleurez, oüy, Madame, & je doute...	Cependant vous pleurez, oui, Madame, et je doute…
Croyez tout, & tremblez que je ne vous écoute.	Croyez tout, et tremblez que je ne vous écoute.
Hé bien, je croiray tout, puis que vous le voulez;	Hé bien, je croirai tout, puisque vous le voulez;
Aux feux de Perdiccas les miens ſont immoſez,	Aux feux de Perdiccas les miens sont immolés,
Vous haïſſez la Reyne Ah! ſi j’oſois, Madame,	Vous haïssez la Reine. Ah! si j’osais, Madame,
Vous donner à ſes yeux & mon cœur & mon ame,	Vous donnez à ses feux et mon cœur et mon âme,
Si ce cœur mépriſé ne l’eſtoit pas de vous....	Si ce cœur méprisé ne l’était pas de vous…
Que faites-vous, Seigneur, dans ce tranſport jaloux?	Que faites-vous, Seigneur, dans ce transport jaloux?
Et n’entendez-vous pas un langage ſi tendre?	Et n’entendez-vous pas un langage si tendre?
Mais que dis-je, grands Dieux! je me fais trop enendre:	Mais que dis-je, grands Dieux! je me fais trop entendre:
Dûſſay-je cependant irriter ſon eſprit,	Dussé-je cependant irriter son esprit,
Seigneur, ne croyez rien de tout ce que j'ay dit.	Seigneur, ne croyez rien de tout ce que j’ai dit.
Dieux! que veut-elle dire? &quelle eſt ſa cõtrainte?	Dieux! que veut-elle dire? Et quelle est sa contrainte?
Eſt-ce une verité, Madame, eſt-ce une feinte?	Est-ce une vérité, Madame, est-ce une feinte?
Elle dit devant vous qu’elle aime Perdiccas,	Elle dit devant vous qu’elle aime Perdiccas,
Mais ſes pleurs, ſes ſoûpirs, ne me le diſent pas;	Mais ses pleurs, ses soupirs, ne me le disent pas;
De grace, expliquez-moy cet étrange miſtere.	De grâce, expliquez-moi cet étrange mystère.
Elle n’a que trop dit ce qu’elle devoit taire,	Elle n’a que trop dit ce qu’elle devait taire,
Et lors que voſtre cœur a trop ſçeu l’écouter,	Et lorsque votre cœur a trop su l’écouter,
Ses pleurs & ſes ſoûpirs pouront vous en coûter.	Ses pleurs et ses soupirs pourront vous en coûter.
Mais Seigneur, il eſt temps que Roxane s’explique,	Mais Seigneur, il est temps que Roxane s’explique,
La fiere Statira détruit ma politique;	La fière Statira détruit ma politique;
Si ma haine contre elle a pû vous étonner,	Si ma haine contre elle a pu vous étonner,
J’aime, j’adore.... un Fils que je veux couronner:	J’aime, j’adore… un Fils que je veux couronner:
Elle prétend, Seigneur, régner dans Babylone,	Elle prétend, Seigneur, régner dans Babylone,
Elle eſt contre mon Fils, ma Rivale a ce Trône,	Elle est contre mon fils, ma Rivale à ce Trône,
Nos deſſeins ſont pareils, nos intéreſts égaux,	Nos desseins sont pareils, nos intérêts égaux,
Mais le Trône, Seigneur, ne veut point de Rivaux,	Mais le Trône, Seigneur, ne veut point de Rivaux,
Je ne la puis ſoufrir, je la hais, & je tremble....	Je ne la puis souffrir, je la hais, et je tremble…
Ah! Madame, je vais vous réünir enſemble,	Ah! Madame, je vais vous réunir ensemble,
J’y feray conſentir tous nos Chefs avec nous,	J’y ferai consentir tous nos Chefs avec nous,
Randez moy Satira, Babylone eſt à vous.	Rendez-moi Statira, Babylone est à vous.
Vous la rendre, Seigneur? Avant que m'y réſoudre,	Vous la rendre, Seigneur? Avant que m’y résoudre,
On verra ce Palais & Babylone en poudre;	On verra ce Palais et Babylone en poudre;
Trahirois-je un Amy qui me preſte ſon bras?	Trahirais-je un Ami qui me prête son bras?
Ce ſeroit me trahir, que trahir Perdiccas;	Ce serait me trahir, que trahir Perdiccas;
Il aime Statira quand Roxane l’abhorre;	Il aime Statira quand Roxane l’abhorre;
Elle ne vit qu’autant que Perdiccas l’adore,	Elle ne vit qu’autant que Perdiccas l’adore,
Il prend mes intéreſts, je dois prendre les ſiens,	Il prend mes intérêts, je dois prendre les siens,
Et ſans-doute ils me ſont auſſi chers que les miens.	Et sans-doute ils me sont aussi chers que les miens.
Madame, j’avois crû que cédant Babylone,	Madame, j’avais cru que cédant Babylone,
Vous borniez vos deſirs à l’eſpoir de ce Trône;	Vous borniez vos désirs à l’espoir de ce Trône;
Mais quoy? de Perdiccas les intéreſts trahis	Mais quoi? de Perdiccas les intérêts trahis
Vous ſeront-ils plus chers que ceux de voſtre Fils?	Vous seront-ils plus chers que ceux de votre Fils?
Seigneur, à ce diſcours faut-il que je réponde?	Seigneur, à ce discours faut-il que je réponde?
Un cœur m’eſtoit plus cher que l’Empire du Monde;	Un cœur m’était plus cher que l’Empire du Monde;
Vous m'entẽdez... mais non, vous ne m'entẽdez pas,	Vous m’entendez… mais non, vous ne m’entendez pas,
Vos yeux cherchent l’objet des feux de Perdiccas;	Vos yeux cherchent l’objet des feux de Perdiccas;
Egarez & diſtraits, il vous ſouvient à peine	Égarés et distraits, il vous souvient à peine
Que je ſuis devant vous, que je ſuis voſtre Reyne;	Que je suis devant vous, que je suis votre Reine;
Il eſt vray, j’oubliois & ma gloire & mon Fils,	Il est vrai, j’oubliais et ma gloire et mon Fils,
Pour le ſeul Perdiccas mon cœur les a trahis;	Pour le seul Perdiccas mon cœur les a trahis;
Mais ſoútenons le nom de Veuve d’Aléxandre,	Mais soutenons le nom de Veuve d’Alexandre,
A ce grand ſouvenir Roxane doit ſe rendre,	À ce grand souvenir Roxane doit se rendre,
Et pour placer ſon Fils au Trône de Cyrus,	Et pour placer son fils au Trône de Cyrus,
Achevons d’immoler le ſang de Darius.	Achevons d’immoler le sang de Darius.
Eh! contre Starira quelle fureur extréme?	Eh! contre Statira quelle fureur extrême?
Vous ne la haïſſez que parce que je l’aime;	Vous ne la haïssez que parce que je l’aime;
Faiſant tomber ſur elle un injuſte couroux,	Faisant tomber sur elle un injuste courroux,
C’eſt moins elle que moy qu’on veut percer de coups,	C’est moins elle que moi qu’on veut percer de coups,
Voſtre haine pour moy fuſt toûjours ſans égale....	Votre haine pour moi fut toujours sans égale…
Oüy, je te haïs, Ingrat, autant que ma Rivale:	Oui, je te hais, Ingrat, autant que ma Rivale:
Mais que dis je, grands Dieux! en ce fatal moment,	Mais que dis-je, grands Dieux! en ce fatal moment,
Quand on hait la Rivale, eſt-ce haïr l’Amant?	Quand on hait la Rivale, est-ce haïr l’amant?
Mais, enfin, devant toy Roxane s’eſt trahie,	Mais, enfin, devant toi Roxane s’est trahie,
Perdiccas eſt hay, j’aime, & je ſuis haïe;	Perdiccas est haï, j’aime, et je suis haïe;
Je vais voir ton Rival; avant la fin du jour,	Je vais voir ton Rival; avant la fin du jour,
Si nous n’eſpérons plus du coſté de l’Amour,	Si nous n’espérons plus du côté de l’Amour,
Ayant entre nos mains la vangeance certaine,	Ayant entre nos mains la vengeance certaine,
Du moins nous joüirons des fureurs de la haine.	Du moins nous jouirons des fureurs de la haine.
Gardes, qu’on le remeine à ſon Apartement.	Gardes, qu’on le remmène à son Appartement.
De grace, helas! Madame, arreſtez un moment;	De grâce, hélas! Madame, arrêtez un moment;
Elle fuit. Je vois trop ſa fatale tendreſſe...	Elle fuit. Je vois trop sa fatale tendresse…
Ciel! pers moy ſi tu veux, mais ſauve ma Princeſſe.	Ciel! perds-moi si tu veux, mais sauve ma Princesse.
OUY, Seigneur, Caſſander m'envoye aupres de vous,	Oui, Seigneur, Cassandre m’envoie auprès de vous,
Pour apaiſer Roxane, & fléchir ſon couroux;	Pour apaiser Roxane, et fléchir son courroux;
On ſçait qu’Antipater vient avecque une Armée,	On sait qu’Antipater vient avec une Armée,
Et qu’ils pouroient tous deux ſe joindre à Ptolomée;	Et qu’ils pourraient tous deux se joindre à Ptolomée;
Mais il aime Roxane, & ſon cœur incertain	Mais il aime Roxane, et son cœur incertain
Ne peut contre elle encor former aucun deſſein;	Ne peut contre elle encore former aucun dessein;
Cependant Seleucus, Eumenes, & mille autres,	Cependant Seleucus, Eumenes, et mille autres,
Prenant ſes intéreſts, peuvent quiter les voſtres.	Prenant ses intérêts, peuvent quitter les vôtres.
Je le ſçais, Peuceſtas, & le Ciel en couroux	Je le saïs, Peucestas, et le Ciel en courroux
Dans le meſme malheur nous envelope tous;	Dans le même malheur nous enveloppe tous;
Aléxandre luy-meſme avoit ſçeu le prédire,	Alexandre lui-même avait su le prédire,
Et s’il n’a pas reglé le deſtin de l’Empire,	Et s’il n’a pas réglé le destin de l’Empire,
Ou s’il n’a pas oſé nommer un Succeſleur,	Ou s’il n’a pas osé nommer son Successeur,
C’eſt qu’il n’en pût trouver digne de cet honneur;	C’est qu’il n’en pût trouver digne de cet honneur;
Il l’avoit bien préveu, par des crimes celebres	Il l’avait bien prévu, par des crimes célèbres
On luy va préparer d’étranges jeux funebres,	On lui va préparer d’étranges jeux funèbres,
Quand tous nos Chefs rangez, de diférens Partis,	Quand tous nos Chefs rangés, de différends Partis,
Du monde chancelant vont hâter le débris;	Du monde chancelant vont hâter le débris;
Nous y travaillons tous, en vain tu t’en étonnes,	Nous y travaillons tous, en vain tu t’en étonnes,
Le Ciel ordonne ainſi du deſtin des Couronnes.	Le Ciel ordonne ainsi du destin des Couronnes.
Les Barbares, Seigneur, pouroient bien profiter	Les Barbares, Seigneur, pourraient bien profiter
Des troubles dangereux qui vont vous agiter,	Des troubles dangereux qui vont vous agiter,
Ils pouroient aſſembler des Troupes effroyables,	Ils pourraient assembler des Troupes effroyables,
Telles que Darius....	Telles que Darius…
Ces Troupes innombrables,	Ces Troupes innombrables,
Qui tant & tant de fois porterent nos liens,	Qui tant et tant de fois portèrent nos liens,
N’ont jamais étonné les Macédoniens;	N’ont jamais étonné les Macédoniens;
Les Barbares, croy-moy, ne peuvent plus nous nuire,	Les Barbares, crois-moi, ne peuvent plus nous nuire,
Nous ſeuls pouvons nous vaincre, & pouvons nous détruire;	Nous seuls pouvons nous vaincre, et pouvons nous détruire;
Mais j’abandonne icy le ſoin de ma grandeur,	Mais j’abandonne ici le soin de ma grandeur,
Starira, je l’avouë, occupe tout mon cœur,	Statira, je l’avoue, occupe tout mon cœur,
C’eſt le ſeul intéreſt où Perdicas s’aplique,	C’est le seul intérêt où Perdicas s’applique,
