T’a-t’il de tous les ſiens reproché le trépas?	T’a-t-il de tous les siens reproché le trépas?
S’eſt-il plaint à mes yeux des maux qu’il ne ſent pas?	S’est-il plaint à tes yeux des maux qu’il ne sent pas?
Mais cependant, mon Fils, tu meurs, ſi je n’arreſte	Mais cependant, mon Fils, tu meurs, si je n’arrête
Le fer, que le Cruel tient levé ſur ta teſte.	Le fer, que ce Cruel tient levé sur ta tête.
Je l’en puis détourner, & je t’y vais offrir?	Je l’en puis détourner, et je t’y vais offrir?
Non tu ne mourras point, je ne le puis ſouffrir.	Non tu ne mourras point, je ne le puis souffrir.
Allons trouver Pyrrhus. Mais non, chere Cephiſe,	Allons trouver Pyrrhus. Mais non, chère Céphise,
Va le trouver pour moy.	Va le trouver pour moi.
Que faut-il que je diſe,	Que faut-il que je dise,
Dy-luy que de mon Fils l’amour eſt aſſez fort...	Dis-lui que de mon Fils l’amour est assez fort…
Crois-tu que dans ſon cœur il ait juré ſa mort?	Crois-tu que dans son cœur il ait juré sa mort?
L’amour peut-il ſi loin pouſſer ſa barbarie?	L’amour peut-il si loin pousser sa barbarie?
Madame, il va bien-toſt revenir en furie.	Madame, il va bientôt revenir en furie.
Hé bien, va l’aſſurer....	Hé bien, va l’assurer…
De quoy? De voſtre foy?	De quoi? De votre foi?
Helas! pour la promettre eſt-elle encore à moy?	Hélas! pour la promettre est-elle encore à moi?
O cendres d’un Epoux! ô Troyens! ô mon Pere!	Ô cendres d’un Époux! ô Troyens! ô mon Père!
O mon Fils, que tes jours couſtent cher à ta mere!	Ô mon Fils, que tes jours coûtent cher à ta Mère!
Allons.	Allons.
Où donc, Madame? & que reſolvez-vous?	Où donc, Madame? et que résolvez-vous?
Allons, ſur ſon tombeau conſulter mon Epoux.	Allons, sur son tombeau, consulter mon Époux.
AH! je n’en doute point. C’eſt voſtre Epoux, Madame,	Ah! je n’en doute point. C’est votre Époux, Madame,
C’eſt Hector qui produit ce miracle en voſtre ame.	C’est Hector qui produit ce miracle en votre âme.
Il veut que Troye encor ſe puiſſe relever,	Il veut que Troie encor se puisse relever,
Avec cet heureux Fils, qu’il vous fait conſerver.	Avec cet heureux Fils, qu’il vous fait conserver.
Pyrrhus vous l’a promis. Vous venez de l’entendre,	Pyrrhus vous l’a promis. Vous venez de l’entendre,
Madame, il n’attendoit qu’un mot pour vous le rendre.	Madame, il n’attendait qu’un mot pour vous le rendre.
Croyez en ſes tranſports. Pere Sceptre, Alliez,	Croyez-en ses transports. Père, Sceptre, Alliés,
Content de voſtre cœur, il met tout à vos piez.	Content de votre cœur, il met tout à vos pieds.
Sur luy, ſur tout ſon Peuple il vous rend Souveraine.	Sur lui, sur tout son Peuple il vous rend Souveraine.
Eſt-ce là ce Vainqueur digne de tant de haine?	Est-ce là ce Vainqueur digne de tant de haine?
Déja contre les Grecs plein d’un noble courroux,	Déjà contre les Grecs plein d’un noble courroux,
Le ſoin de voſtre Fils le touche autant que vous.	Le soin de votre Fils le touche autant que vous.
Il previent leur fureur, il luy laiſſe ſa Garde,	Il prévient leur fureur, il lui laisse sa Garde,
Pour ne pas l’expoſer luy-meſme il ſe hazarde.	Pour ne pas l’exposer lui-même il se hasarde.
Mais tout s’apreſte au Temple. Et vous avez promis..	Mais tout s’apprête au Temple. Et vous avez promis…
Ouy, je m’y trouveray. Mais allons voir mon Fils.	Oui, je m’y trouverai. Mais allons voir mon Fils.
Madame, qui vous preſſe? Il ſuffit que ſa veuë	Madame, qui vous presse? Il suffit que sa vue
Deſormais à vos yeux ne ſoit plus deffenduë.	Désormais à vos yeux ne soit plus défendue.
Vous luy pourrez bien-toſt prodiguer vos bontez,	Vous lui pourrez bientôt prodiguer vos bontés,
Et vos embraſſemens ne ſeront plus contez.	Et vos embrassements ne seront plus comptés.
Quel plaiſir d’élever un Enfant, qu’on voit craiſtre,	Quel plaisir! d’élever un Enfant qu’on voit craître,
Non plus comme un Eſclave élevé pour ſon Maiſtre,	Non plus comme un Esclave élevé pour son Maître,
Mais pour voir avec luy renaiſtre tant de Rois!	Mais pour voir avec lui renaître tant de Rois!
Cephiſe, allons le voir pour la derniere fois.	Céphise, allons le voir pour la dernière fois.
Que dites-vous ? ô Dieux!	Que dites-vous? ô Dieux!
O! ma chere Cephiſe,	Ô! ma chère Céphise,
Ce n’eſt point avec toy que mon cœur ſe déguiſe.	Ce n’est point avec toi que mon coeur se déguise.
Ta foy dans mon malheur s’eſt montrée à mes yeux.	Ta foi dans mon malheur s’est montrée à mes yeux.
Mais j’ay crû qu'à mon tour tu me connoiſſois mieux.	Mais j’ai cru qu’à mon tour tu me connaissais mieux.
Quoy donc as-tu penſé qu’Andromaque infidelle,	Quoi donc as-tu pensé qu’Andromaque infidèle,
Pûſt trahir un Epoux qui croit revivre en elle,	Pût trahir un Époux qui croit revivre en elle,
Et que de tant de Morts reveillant la douleur,	Et que de tant de Morts réveillant la douleur,
Le ſoin de mon repos me fiſt troubler le leur?	Le soin de mon repos me fît troubler le leur?
Eſt-ce là cette ardeur tant promiſe à ſa cendre?	Est-ce là cette ardeur tant promise à sa cendre?
Mais ſon Fils periſſoit, il l’a falu défendre.	Mais son Fils périssait, il l’a fallu défendre.
Pyrrhus en m’épouſant s’en déclare l’appuy.	Pyrrhus en m’épousant s’en déclare l’appui.
Il ſufſit. Je veux bien m’en repoſer ſur luy.	Il suffit. Je veux bien m’en reposer sur lui.
Je ſçay quel eſt Pyrrhus. Violent, mais ſincere,	Je sais quel est Pyrrhus. Violent, mais sincère,
Cephiſe, il ſera plus qu’il n’a promis de faire.	Céphise, il fera plus qu’il n’a promis de faire.
Sur le courroux des Grecs je m’en repoſe encor,	Sur le courroux des Grecs, je m’en repose encor,
Leur haine va donner un Pere au Fils d’Hector.	Leur haine va donner un Père au Fils d’Hector.
Je vais donc, puiſqu’il faut que je me ſacrifie,	Je vais donc, puisqu’il faut que je me sacrifie,
Afſurer à Pyrrhus le reſte de ma vie.	Assurer à Pyrrhus le reste de ma vie.
Je vais, en recevant ſa foy ſur les Autels,	Je vais, en recevant sa foi sur les Autels,
L’engager à mon Fils par des nœuds immortels.	L’engager à mon Fils par des nœuds immortels.
Mais auſſi-toſt ma main, à moy ſeule funeſte,	Mais aussitôt ma main, à moi seule funeste,
D’une infidelle vie abbregera le reſte,	D’une infidèle vie abrégera le reste,
Et ſauvant ma vertu, rendra ce que je doy,	Et sauvant ma vertu, rendra ce que je dois,
A Pyrrhus, à mon Fils, à mon Epoux, à moy.	À Pyrrhus, à mon Fils, à mon Époux, à moi.
Voila de mon amour l’innocent ſtratagéme;	Voilà de mon amour l’innocent stratagème;
Voila ce qu’un Epoux m’a commandé luy-méme.	Voilà ce qu’un Époux m’a commandé lui-même.
J’iray ſeule rejoindre Hector, & mes Ayeux.	J’irai seule rejoindre Hector, et mes Aïeux.
Cephiſe, c’eſt à toy de me fermer les yeux.	Céphise, c’est à toi de me fermer les yeux.
Ah! ne pretendez pas que je puiſſe ſurvivre....	Ah! ne prétendez pas que je puisse survivre…
Non, non, je te deffens, Cephiſe, de me ſuivre.	Non non, je te défends, Céphise, de me suivre.
Je confie à tes ſoins mon unique treſor,	Je confie à tes soins mon unique trésor,
Si tu vivois pour moy, vy pour le Fils d’Hector.	Si tu vivais pour moi, vis pour le Fils d’Hector.
De l’eſpoir des Troyens ſeule dépoſitaire,	De l’espoir des Troyens seule dépositaire,
Songe à combien de Roys tu deviens neceſſaire.	Songe, à combien de Rois tu deviens nécessaire.
Veille auprés de Pyrrhus. Fay-luy garder ſa foy.	Veille auprès de Pyrrhus. Fais-lui garder sa foi.
S’il le faut, je conſens que tu parles de moy.	S’il le faut, je consens que tu parles de moi.
Fay luy valoir l’hymen, où je me ſuis rangée;	Fais-lui valoir l’hymen, où je me suis rangée;
Dy-luy, qu’avant ma mort je luy ſus engagée,	Dis-lui, qu’avant ma mort je lui fus engagée,
Que ſes reſſentimens doivent eſtre effacez,	Que ses ressentiments doivent être effacés,
Qu'en luy laiſſant mon Fils, c’eſt l’eſtimer aſſez.	Qu’en lui laissant mon Fils, c’est l’estimer assez.
Fay connoiſtre à mon Fils les Heros de ſa Race.	Fais connaître à mon Fils les Héros de sa Race.
Autant que tu pourras, conduy-le ſur leur trace.	Autant que tu pourras, conduis-le sur leur trace.
Dy-luy, par quels exploits leurs noms ont éclaté,	Dis-lui, par quels exploits leurs noms ont éclaté,
Plûtoſt ce qu’ils ont fait, que ce qu’ils ont eſté.	Plutôt ce qu’ils ont fait, que ce qu’ils ont été.
Parle luy tous les jours des vertus de ſon Pere,	Parle-lui tous les jours des Vertus de son Père,
Et quelquefois auſſi parle luy de ſa Mere.	Et quelquefois aussi parle-lui de sa Mère.
Mais qu’il ne ſonge plus, Cephiſe, à nous vanger,	Mais qu’il ne songe plus, Céphise, à nous venger,
Nous luy laiſſons un Maiſtre, il le doit ménager.	Nous lui laissons un Maître, il le doit ménager.
Qu’il ait de ſes Ayeux un ſouvenir modeſte.	Qu’il ait de ses Aïeux un souvenir modeste.
Il eſt du ſang d’Hector, mais il en eſt le reſte.	Il est du sang d’Hector, mais il en est le reste.
Et pour ce reſte enfin j’ay moy-meſme en un jour	Et pour ce reste enfin j’ai moi-même en un jour
Sacrifié mon ſang, ma haine, & mon amour.	Sacrifié mon sang, ma haine, et mon amour.
Helas!	Hélas!
Ne me ſuy point, ſi ton cœur en allarmes,	Ne me suis point, si ton cœur en alarmes,
Prevoit qu’il ne pourra commander à tes larmes.	Prévoit qu’il ne pourra commander à tes larmes.
On vient. Cache tes pleurs, Cephiſe, & ſouviens-toy,	On vient. Cache tes pleurs, Céphise, et souviens-toi,
Que le ſort d’Andromaque eſt commis à ta foy.	Que le sort d’Andromaque est commis à ta foi.
Ceſt Hermione. Allons, fuyons ſa violence.	C’est Hermione. Allons, fuyons sa violence.
NOn, je ne puis aſſez admirer ce ſilence.	Non, je ne puis assez admirer ce silence.
Vous vous taiſez, Madame, & ce cruel mépris	Vous vous taisez, Madame, et ce cruel mépris
N’a pas du moindre trouble agité vos eſprits?	N’a pas du moindre trouble agité vos esprits?
Vous ſouſtenez en paix une ſi rude attaque?	Vous soutenez en paix une si rude attaque?
Vous qu’on voyoit fremir au ſeul nom d’Andromaque?	Vous qu’on voyait frémir au seul nom d’Andromaque?
Vous qui ſans deſeſpoir ne pouviez endurer	Vous qui sans désespoir ne pouviez endurer
Que Pyrrhus d’un regard la vouluſt honorer?	Que Pyrrhus d’un regard la voulût honorer?
Il l’épouſe. Il luy donne avec ſon Diadéme	Il l’épouse. Il lui donne avec son Diadème
La foy, que vous venez de recevoir vous-méme;	La foi, que vous venez de recevoir vous-même;
Et voſtre bouche encor muette à tant d’ennuy,	Et votre bouche encor muette à tant d’ennui,
N’a pas daigné s’ouvrir pour ſe plaindre de luy?	N’a pas daigné s’ouvrir pour se plaindre de lui?
Ah! que je crains, Madame, un calme ſi funeſte!	Ah! que je crains, Madame, un calme si funeste!
Et qu’il vaudroit bien mieux....	Et qu’il vaudrait bien mieux…
Fais-tu venir Oreſte?	Fais-tu venir Oreste?
Il vient, Madame, il vient. Et vous pouvez juger,	Il vient, Madame, il vient. Et vous pouvez juger,
Que bien-toſt à vos piez il alloit ſe ranger.	Que bientôt à vos pieds il allait se ranger.
Preſt à ſervir toûjours ſans eſpoir de ſalaire,	Prêt à servir toujours sans espoir de salaire,
Vos yeux ne ſont que trop aſſurez de luy plaire.	Vos yeux ne sont que trop assurés de lui plaire.
Mais il entre.	Mais il entre.
AH Madame? Eſt-il vray qu’une fois	AH Madame? Est-il vrai qu’une fois
Oreſte en vous cherchant obeïſſe à vos lois?	Oreste en vous cherchant obéisse à vos lois?
Ne m’a-t-on point ſiatté d’une fauſſe eſperance?	Ne m’a-t-on point flatté d’une fausse espérance?
Avez-vous en effet ſouhaitté ma preſence?	Avez-vous en effet souhaité ma présence?
Croiray-je que vos yeux à la fin deſarmez	Croirai-je que vos yeux à la fin désarmés
Veulent....	Veulent…
Je veux ſçavoir, Seigneur, ſi vous m’aimez.	Je veux savoir, Seigneur, si vous m’aimez.
Si je vous aime! O Dieux! mes ſermens, mes parjures,	Si je vous aime! Ô Dieux! mes serments, mes parjures,
Ma fuite, mon retour, mes reſpects, mes injures,	Ma fuite, mon retour, mes respects, mes injures,
Mon deſeſpoir, mes yeux de pleurs toujours noyez,	Mon désespoir, mes yeux de pleurs toujours noyés,
Quels témoins croyrez-vous, ſi vous ne les croyez?	Quels témoins croirez-vous, si vous ne les croyez?
Vangez-moy, je croy tout.	Vengez-moi, je crois tout.
Hé bien allons, Madame.	Hé bien allons, Madame.
Mettons encore un coup toute la Gréce en flame.	Mettons encore un coup toute la Grèce en flamme.
Prenons, en ſignalant mon bras & voſtre nom,	Prenons, en signalant mon bras et votre nom,
Vous la place d’Helene, & moy d’Agamemnon.	Vous la place d’Hélène, et moi d’Agamemnon.
De Troye en ce pays réveillons les miſeres,	De Troie en ce pays réveillons les misères,
Et qu’on parle de nous ainſi que de nos Peres.	Et qu’on parle de nous ainsi que de nos Pères.
Partons, je ſuis tout preſt.	Partons, je suis tout prêt.
Non, Seigneur, demeurons,	Non, Seigneur, demeurons,
Je ne veux pas ſi loin porter de tels affrons.	Je ne veux pas si loin porter de tels affronts.
Quoy de mes ennemis couronnant l’inſolence,	Quoi de mes ennemis couronnant l’insolence,
J’irois attendre ailleurs une lente vangeance,	J’irais attendre ailleurs une lente vengeance,
Et je m’en remettrois au deſtin des combats,	Et je m’en remettrais au destin des combats,
Qui peut-eſtre à la fin ne me vangeroit pas?	Qui peut-être à la fin ne me vengerait pas?
Je veux qu’à mon depart toute l’Epire pleure.	Je veux qu’à mon départ toute l’Épire pleure.
Mais ſi vous me vangez, vangez-moy dans une heure.	Mais si vous me vengez, vengez-moi dans une heure.
Tous vos retardemens ſont pour moy des refus.	Tous vos retardements sont pour moi des refus.
Courez au Temple. Il faut immoler....	Courez au Temple. Il faut immoler…
Qui?	Qui?
Pyrrhus.	Pyrrhus.
Pyrrhus, Madame?	Pyrrhus, Madame?
Hé! quoy? voſtre haine chancelle?	Hé! quoi? votre haine chancelle?
Ah! courez, & craignez que je ne vous rappelle.	Ah! courez, et craignez que je ne vous rappelle.
N’alleguez point des droits que je veux oublier.	N’alléguez point des droits que je veux oublier.
Et ce n’eſt pas à vous à le juſtifier.	Et ce n’est pas à vous à le justifier.
Moy, je l’excuſerois? Ah! vos bontez, Madame,	Moi, je l’excuserais? Ah! vos bontés, Madame,
Ont gravé trop avant ſes crimes dans mon ame.	Ont gravé trop avant ses crimes dans mon âme.
Vangeons-nous, j’y conſens. Mais par d’autres chemins.	Vengeons-nous, j’y consens. Mais par d’autres chemins.
Soyons ſes Ennemis, & non ſes Aſſaſſins.	Soyons ses Ennemis, et non ses Assassins.
Faiſons de ſa ruïne une juſte Conqueſte.	Faisons de sa ruine une juste Conquête.
Quoy pour réponſe aux Grecs porteray-je ſa teſte?	Quoi pour réponse aux Grecs porterai-je sa tête?
Et n’ay-je pris ſur moy le ſoin de tout l’Eſtat,	Et n’ai-je pris sur moi le soin de tout l’État,
Que pour m’en acquitter par un Aſſaſſinat?	Que pour m’en acquitter par un Assassinat?
Souffrez, au nom des Dieux, que la Grece s’explique,	Souffrez, au nom des Dieux, que la Grèce s’explique,
Et qu’il meure chargé de la haine publique.	Et qu’il meure chargé de la haine publique.
Souvenez-vous qu’il regne, & qu’un front couronné...	Souvenez-vous qu’il règne, et qu’un front couronné…
Ne vous ſuffit-il pas que je l’ay condanné?	Ne vous suffit-il pas que je l’ai condamné?
Ne vous ſuffit-il pas que ma Gloire offenſée	Ne vous suffit-il pas que ma Gloire offensée
Demande une Victime, à moy ſeule adreſſée;	Demande une Victime, à moi seule adressée;
Qu'Hermione eſt le prix d’un Tyran opprimé,	Qu’Hermione est le prix d’un Tyran opprimé,
Que je le hais, enfin, Seigneur, que je l’aimay?	Que je le hais, enfin, Seigneur, que je l’aimai?
Je ne m’en cache point. L’Ingrat m’avoit ſçeu plaire.	Je ne m’en cache point. L’Ingrat m’avait su plaire.
Soit qu’ainſi l’ordonnaſt mon amour, ou mon Pere,	Soit qu’ainsi l’ordonnât mon amour, ou mon Père,
N’importe. Mais enfin reglez-vous là-deſſus.	N’importe. Mais enfin réglez-vous là-dessus.
Malgré mes vœux, Seigneur, honteuſement deceûs,	Malgré mes vœux, Seigneur, honteusement déçus,
Malgré la juſte horreur que ſon crime me donne,	Malgré la juste horreur que son crime me donne,
Tant qu’il vivra, craignez que je ne luy pardonne.	Tant qu’il vivra, craignez que je ne lui pardonne.
Doutez juſqu’à ſa mort d’un courroux incertain,	Doutez jusqu’à sa mort d’un courroux incertain,
S’il ne meurt aujourd’huy, je puis l’aimer demain.	S’il ne meurt aujourd’hui, je puis l’aimer demain.
Hé bien, il faut le perdre, & prevenir ſa grace.	Hé bien, il faut le perdre, et prévenir sa grâce.
Il faut.... Mais cependant, que faut-il que je faſſe?	Il faut… Mais cependant, que faut-il que je fasse?
Comment puis-je ſi toſt ſervir voſtre courroux?	Comment puis-je si tôt servir votre courroux?
Quel chemin juſqu’à luy peut conduire mes coups?	Quel chemin jusqu’à lui peut conduire mes coups?
A peine ſuis- je encore arrivé dans l’Epire,	À peine suis-je encore arrivé dans l’Épire,
Vous voulez par mes mains renverſer un Empire,	Vous voulez par mes mains renverser un Empire,
Vous voulez qu’un Roy meure, & pour ſon chaſtiment,	Vous voulez qu’un Roi meure, et pour son châtiment,
Vous ne donnez qu’un jour, qu’une heure, qu’un moment.	Vous ne donnez qu’un jour, qu’une heure, qu’un moment.
Aux yeux de tout ſon Peuple, il faut que je l’opprime.	Aux yeux de tout son Peuple, il faut que je l’opprime.
Laiſſez-moy vers l’Autel conduire ma Victime.	Laissez-moi vers l’Autel conduire ma Victime.
Je ne m’en défens plus. Et je ne veux qu’aller	Je ne m’en défends plus. Et je ne veux qu’aller
Reconnoiſtre la place où je dois l’immoler.	Reconnaître la place où je dois l’immoler.
Cette Nuit je vous ſers. Cette Nuit je l'attaque.	Cette Nuit je vous sers. Cette Nuit je l’attaque.
Mais cependant ce jour il épouſe Andromaque.	Mais cependant ce Jour il épouse Andromaque.
Dans le Temple déja le trône eſt élevé.	Dans le Temple déjà le trône est élevé.
Ma honte eſt confirmée, & ſon crime achevé.	Ma honte est confirmée, et son crime achevé.
Enfin qu’attendez-vous? Il vous offre ſa Teſte.	Enfin qu’attendez-vous? Il vous offre sa Tête.
Sans Gardes, ſans défenſe il marche à cette Feſte.	Sans Gardes, sans défense il marche à cette Fête.
Autour du Fils d’Hector il les fait tous ranger.	Autour du Fils d’Hector il les fait tous ranger.
Il s’abandonne au bras qui me voudra vanger.	Il s’abandonne au bras qui me voudra venger.
Voulez-vous, malgré luy, prendre ſoin de ſa vie?	Voulez-vous, malgré lui, prendre soin de sa vie?
Armez avec vos Grecs, tous ceux qui m’ont ſuivie.	Armez avec vos Grecs, tous ceux qui m’ont suivie.
Soulevez vos Amis. Tous les miens ſont à vous.	Soulevez vos Amis. Tous les miens sont à vous.
Il me trahit, vous trompe, & nous mépriſe tous.	Il me trahit, vous trompe, et nous méprise tous.
Mais quoy? Déja leur haine eſt égale à la mienne,	Mais quoi? Déjà leur haine est égale à la mienne,
Elle épargne à regret l’Epoux d’une Troyenne.	Elle épargne à regret l’Époux d’une Troyenne.
Parlez. Mon Ennemy ne vous peut échapper.	Parlez. Mon Ennemi ne vous peut échapper.
Ou plûtoſt, il ne faut que les laiſſer frapper.	Ou plutôt, il ne faut que les laisser frapper.
Conduiſez, ou ſuivez une ſureur ſi belle.	Conduisez, ou suivez une fureur si belle.
Revenez tout couvert du ſang de l’Infidelle.	Revenez tout couvert du sang de l’Infidèle.
Allez, en cét eſtat ſoyez ſeur de mon cœur.	Allez, en cet état soyez sûr de mon cœur.
Mais, Madame, ſongez....	Mais, Madame, songez…
Ah! c’en eſt trop, Seigneur.	Ah! c’en est trop, Seigneur.
Tant de raiſonnemens offenſent ma colere.	Tant de raisonnements offensent ma colère.
J’ay voulu vous donner les moyens de me plaire,	J’ai voulu vous donner les moyens de me plaire,
Rendre Oreſte content. Mais enfin je voy bien,	Rendre Oreste content. Mais enfin je vois bien,
Qu’il veut toûjours ſe plaindre, & ne meriter rien.	Qu’il veut toujours se plaindre, et ne mériter rien.
Partez, allez ailleurs vanter voſtre conſtance,	Partez, allez ailleurs vanter votre constance,
Et me laiſſez icy le ſoin de ma vangeance.	Et me laissez ici le soin de ma vengeance.
De mes laſches bontez mon courage eſt confus,	De mes lâches bontés mon courage est confus,
Et c’eſt trop en un jour eſſuyer de refus.	Et c’est trop en un jour essuyer de refus.
Je m’en vais ſeule au Temple, où leur hymen s’apreſte,	Je m’en vais seule au Temple, où leur hymen s’apprête,
Où vous n'oſez aller meriter ma conqueſte.	Où vous n’osez aller mériter ma conquête.
Là, de mon Ennemy je ſçauray m’approcher.	Là, de mon Ennemi je saurai m’approcher.
Je perceray le cœur que je n’ay pû toucher.	Je percerai le cœur, que je n’ai pu toucher.
Et mes ſanglantes mains ſur moy-meſme tournées,	Et mes sanglantes mains sur moi-même tournées,
Auſſi-toſt malgré luy joindront nos deſtinées,	Aussitôt malgré lui joindront nos destinées,
Et tout ingrat qu’il eſt, il me ſera plus doux	Et tout Ingrat qu’il est, il me sera plus doux
De mourir avec luy, que de vivre avec vous.	De mourir avec lui, que de vivre avec vous.
Non, je vous priveray de ce plaiſir funeſte,	Non, je vous priverai de ce plaisir funeste,
Madame, il ne mourra que de la main d’Oreſte.	Madame, il ne mourra que de la main d’Oreste.
Vos Ennemis par moy vont vous eſtre immolez.	Vos Ennemis par moi vont vous être immolés.
Et vous reconnoiſtrez mes ſoins ſi vous voulez.	Et vous reconnaîtrez mes soins si vous voulez.
Mais que dis-je? Ah plûtoſt! permettez que j’eſpere.	Mais que dis-je? Ah plutôt! permettez que j’espère.
Excuſez un Amant, que trouble ſa miſere,	Excusez un Amant, que trouble sa misère,
Qui tout preſt d’eſtre heureux, envie encor le ſort	Qui tout prêt d’être heureux, envie encor le sort
D’un Ingrat condanné par vous-meſme à la mort.	D’un Ingrat, condamné par vous-même à la mort.
Allez. De voſtre ſort laiſſez-moy la conduite.	Allez. De votre sort laissez-moi la conduite.
Et que tous vos Vaiſſeaux ſoient preſts pour noſtre fuite.	Et que tous vos Vaisseaux soient prêts pour notre fuite.
VOus vous perdez, Madame. Et vous devez ſonger...	Vous vous perdez, Madame. Et vous devez songer…
Que je me perde, ou non, je ſonge à me vanger.	Que je me perde, ou non, je songe à me venger.
Je ne ſçay meſme encor, quoy qu’il m’ait pû promettre,	Je ne sais même encor, quoi qu’il m’ait pu promettre,
Sur d’autres que ſur moy, ſi je dois m’en remettre.	Sur d’autres que sur moi, si je dois m’en remettre.
Pyrrhus n’eſt pas coupable à ſes yeux comme aux miens,	Pyrrhus n’est pas coupable à ses yeux, comme aux miens,
Et je tiendrois mes coups bien plus ſeurs que les ſiens.	Et je tiendrais mes coups bien plus sûrs que les siens.
Quel plaiſir, de vanger moy-meſme mon injure,	Quel plaisir, de venger moi-même mon injure,
De retirer mon bras teint du ſang du Parjure,	De retirer mon bras teint du sang du Parjure,
Et pour rendre ſa peine & mes plaiſirs plus grands,	Et pour rendre sa peine et mes plaisirs plus grands,
De cacher ma Rivale à ſes regards mourans!	De cacher ma Rivale à ses regards mourants!
Ah! ſi du moins Oreſte, en puniſſant ſon crime,	Ah! si du moins Oreste, en punissant son crime,
Luy laiſſoit le regret de mourir ma Victime!	Lui laissait le regret de mourir ma Victime!
Va le trouver. Dy-luy qu’il aprenne à l’Ingrat,	Va le trouver. Dis-lui qu’il apprenne à l’Ingrat,
Qu’on l’immole à ma haine, & non pas à l’Eſtat.	Qu’on l’immole à ma haine, et non pas à l’État.
Chere Cleone cours. Ma vangeance eſt perduë,	Chère Cléone cours. Ma vengeance est perdue,
S’il ignore, en mourant, que c’eſt moy qui le tuë.	S’il ignore, en mourant, que c’est moi qui le tue.
Je vous obeïray. Mais qu’eſt-ce que je voy?	Je vous obéirai. Mais qu’est-ce que je vois?
O Dieux! Qui l’auroit cru, Madame? c’eſt le Roy.	Ô Dieux! Qui l’aurait cru, Madame? C’est le Roi.
Ah! cours apres Oreſte, & dy-luy, ma Cleone,	Ah! cours après Oreste, et dis-lui, ma Cléone,
Qu'il n’entreprenne rien ſans revoir Hermione.	Qu’il n’entreprenne rien sans revoir Hermione.
VOus ne m’attendiez pas, Madame, & je voy bien	Vous ne m’attendiez pas, Madame, et je vois bien
Que mon abord icy trouble voſtre entretien.	Que mon abord ici trouble votre entretien.
Je ne viens point armé d’un indigne artifice,	Je ne viens point armé d’un indigne artifice,
D’un voile d’équité couvrir mon injuſtice.	D’un voile d’équité couvrir mon injustice.
Il ſuffit que mon cœur me condamne tout bas,	Il suffit que mon cœur me condamne tout bas,
Et je ſoutiendrois mal ce que je ne croy pas.	Et je soutiendrais mal ce que je ne crois pas.
J’épouſe une Troyenne. Oüy, Madame, & j’avouë	J’épouse une Troyenne. Oui, Madame, et j’avoue
Que je vous ay promis la foy, que je luy vouë.	Que je vous ai promis la foi, que je lui voue.
Un autre vous diroit que dans les champs Troyens	Un autre vous dirait que dans les champs Troyens
