Je ne voy que malheurs qui condannent les Dieux.	Je ne vois que malheurs qui condamnent les Dieux.
Meritons leur courroux, juſtifions leur haine,	Méritons leur courroux, justifions leur haine,
Et que le fruit du Crime en précede la peine.	Et que le fruit du Crime en précède la peine.
Mais toy, par quelle erreur veux-tu toûjours ſur toy	Mais toi, par quelle erreur veux-tu toujours sur toi
Deſtourner un courroux qui ne cherche que moy?	Détourner un courroux qui ne cherche que moi?
Aſſez & trop long-temps mon amité t’accable.	Assez et trop longtemps mon amitié t’accable.
Evite un Malheureux, abandonne un Coupable.	Évite un malheureux, abandonne un Coupable.
Cher Pylade, croy-moy, mon tourment me ſuffit;	Cher Pylade, crois-moi, mon tourment me suffit;
Laiſſe-moy des perils dont j’attens tout le fruit.	Laisse-moi des périls dont j’attends tout le fruit.
Porte aux Grecs cet Enfant que Pyrrhus m’abandonne.	Porte aux Grecs cet Enfant que Pyrrhus m’abandonne.
Va-t’en.	Va-t’en.
Allons, Seigneur enlevons Hermione.	Allons, Seigneur enlevons Hermione.
Au travers des perils un grand Cœur ſe fait jour.	Au travers des périls un grand Cœur se fait jour.
Que ne peut l’amitié conduite par l’amour?	Que ne peut l’amitié conduite par l’amour?
Allons de tous vos Grecs encourager le zele.	Allons de tous vos Grecs encourager le zèle.
Nos Vaiſſeaux ſont tous preſts, & le vent nous appelle.	Nos Vaisseaux sont tous prêts, et le vent nous appelle.
Je ſçay de ce Palais tous les détours obſcurs.	Je sais de ce Palais tous les détours obscurs.
Vous voyez que la Mer en vient battre les Murs.	Vous voyez que la Mer en vient battre les Murs.
Et cette Nuit ſans peine une ſecrette voye	Et cette Nuit sans peine une secrète voie
Juſqu’en voſtre vaiſſeau conduira voſtre proye.	Jusqu’en votre vaisseau conduira votre proie.
J’abuſe, cher Amy, de ton trop d’amitié.	J’abuse, cher Ami, de ton trop d’amitié.
Mais pardonne à des maux, dont toy ſeul as pitié.	Mais pardonne à des maux, dont toi seul as pitié.
Excuſe un Malheureux, qui perd tout ce qu’il aime,	Excuse un Malheureux, qui perd tout ce qu’il aime,
Que tout le Monde hait, & qui ſe hait luy-meſme.	Que tout le Monde hait, et qui se hait lui-même.
Que ne puis-je à mon tour dans un ſort plus heureux....	Que ne puis-je à mon tour, dans un sort plus heureux…
Diſſimulez, Seigneur, c’eſt tout ce que je veux.	Dissimulez, Seigneur, c’est tout ce que je veux.
Gardez qu’avant le coup voſtre deſſein n’éclate.	Gardez qu’avant le coup votre dessein n’éclate.
Oubliez juſque-là qu’Hermione eſt ingrate.	Oubliez jusques-là qu’Hermione est ingrate.
Oubliez voſtre amour. Elle vient, je la voy.	Oubliez votre amour. Elle vient, je la vois.
Va-t’en. Répons-moy d’elle, & je répons de moy.	Va-t’en. Réponds-moi d’elle, et je réponds de moi.
HE bien? mes ſoins vous ont rendu voſtre Conqueſte.	Hé bien? Mes soins vous ont rendu votre Conquête.
J’ay veu Pyrrhus, Madame, & voſtre hymen s’appreſte.	J’ai vu Pyrrhus, Madame, et votre hymen s’apprête.
On le dit. Et de plus, on vient de m’aſſurer,	On le dit. Et de plus, on vient de m’assurer,
Que vous ne me cherchiez que pour m’y préparer.	Que vous ne me cherchiez que pour m’y préparer.
Et voſtre ame à ſes vœux ne ſera pas rebelle?	Et votre âme à ses vœux ne sera pas rebelle?
Qui l’euſt crû, que Pyrrhus ne fuſt pas infidelle?	Qui l’eût cru, que Pyrrhus ne fût pas infidèle?
Que ſa flame attendroit ſi tard pour éclater.	Que sa flamme attendrait si tard pour éclater.
Qu'il reviendroit à moy, quand je l’allois quitter.	Qu’il reviendrait à moi, quand je l’allais quitter.
Je veux croire avec vous, qu’il redoute la Grece,	Je veux croire avec vous, qu’il redoute la Grèce,
Qu'il ſuit ſon intereſt plutoſt que ſa tendreſſe,	Qu’il suit son intérêt plutôt que sa tendresse,
Que mes yeux ſur voſtre ame eſtoient plus abſolus.	Que mes yeux sur votre âme étaient plus absolus.
Non, Madame, il vous aime, & je n’en doute plus.	Non, Madame, il vous aime, et je n’en doute plus.
Vos yeux ne font-ils pas tout ce qu’ils veulent faire?	Vos yeux ne font-ils pas tout ce qu’ils veulent faire?
Et vous ne vouliez pas ſans doute luy déplaire.	Et vous ne vouliez pas sans doute lui déplaire.
Mais que puis-je, Seigneur? On a promis ma foy.	Mais que puis-je, Seigneur? On a promis ma foi.
Luy raviray-je un bien, qu’il ne tient pas de moy?	Lui ravirai-je un bien, qu’il ne tient pas de moi?
L’Amour ne regle pas le ſort d’une Princeſſe.	L’Amour ne règle pas le sort d’une Princesse.
La gloire d’obeïr eſt tout ce qu’on nous laiſſe.	La gloire d’obéir est tout ce qu’on nous laisse.
Cependant je partois, & vous avez pû voir	Cependant je partais, et vous avez pu voir
Combien je relaſchois pour vous de mon devoir.	Combien je relâchais pour vous de mon devoir.
Ah! que vous ſçaviez-bien, Cruelle.... Mais, Madame,	Ah! que vous saviez bien, Cruelle… Mais, Madame,
Chacun peut à ſon choix diſpoſer de ſon ame.	Chacun peut à son choix disposer de son âme.
La voſtre eſtoit à vous. J’eſperois. Mais enfin	La vôtre était à vous. J’espérais. Mais enfin
Vous l’avez pû donner ſans me faire un larcin.	Vous l’avez pu donner sans me faire un larcin.
Je vous accuſe auſſi, bien moins que la Fortune.	Je vous accuse aussi, bien moins que la Fortune.
Et pourquoy vous laſſer d’une plainte importune?	Et pourquoi vous lasser d’une plainte importune?
Tel eſt voſtre devoir, je l’avouë. Et le mien	Tel est votre devoir, je l’avoue. Et le mien
Eſt de vous épargner un ſi triſte entretien.	Est de vous épargner un si triste entretien.
ATendois-tu, Cleone, un courroux ſi modeſte?	Attendais-tu, Cléone, un courroux si modeste?
La douleur qui ſe taiſt n’en eſt que plus funeſte.	La douleur qui se tait n’en est que plus funeste.
Je le plains. D’autant plus qu’Auteur de ſon ennuy,	Je le plains. D’autant plus qu’Auteur de son ennui,
Le coup qui l’a perdu n’eſt party que de luy.	Le coup qui l’a perdu n’est parti que de lui.
Contez depuis quel temps voſtre hymen ſe prépare.	Comptez depuis quel temps votre hymen se prépare.
Il a parlé, Madame, & Pyrrhus ſe déclare.	Il a parlé, Madame, et Pyrrhus se déclare.
Tu crois que Pyrrhus craint? Et que craint-il encor?	Tu crois que Pyrrhus craint? Et que craint-il encor?
Des Peuples, qui dix ans ont fuy devant Hector?	Des Peuples, qui dix ans ont fui devant Hector?
Qui cent fois effrayez de l’abſence d’Achille,	Qui cent fois effrayés de l’absence d’Achille,
Dans leurs vaiſſeaux brulans ont cherché leur azile,	Dans leurs vaisseaux brûlants ont cherché leur asile,
Et qu’on verroit encor, ſans l’appui de ſon Fils,	Et qu’on verrait encor, sans l’appui de son Fils,
Redemander Helene aux Troyens impunis?	Redemander Hélène aux Troyens impunis?
Non, Cleone, il n’eſt point Ennemi de lui-meſme,	Non, Cléone, il n’est point Ennemi de lui-même,
Il veut tout ce qu’il fait, & s’il m’épouſe, il m’aime.	Il veut tout ce qu’il fait, et s’il m’épouse, il m’aime.
Mais qu’Oreſte à ſon gré m’impute ſes douleurs.	Mais qu’Oreste à son gré m’impute ses douleurs.
N’avons-nous d’entretien que celui de ſes pleurs?	N’avons-nous d’entretien que celui de ses pleurs?
Pyrrhus revient à nous. Hé bien, chere Cleone,	Pyrrhus revient à nous. Hé bien, chère Cléone,
Conçois-tu les tranſports de l’heureuſe Hermione?	Conçois-tu les transports de l’heureuse Hermione?
Sçais-tu quel eſt Pyrrhus? T’es-tu fait raconter	Sais-tu quel est Pyrrhus? T’es-tu fait raconter
Le nombre des Exploits.. Mais qui les peut conter?	Le nombre des Exploits… Mais qui les peut compter?
Intrepide, & par tout ſuivi de la Victoire,	Intrépide, et partout suivi de la Victoire,
Charmant, Fidelle enfin, rien ne manque à ſa Gloire.	Charmant, Fidèle enfin, rien ne manque à sa Gloire.
Songe....	Songe…
Diſſimulez. Voſtre Rivale en pleurs,	Dissimulez. Votre Rivale en pleurs,
Vient à vos piez ſans doute apporter ſes douleurs.	Vient à vos pieds sans doute apporter ses douleurs.
Dieux! Ne puis-je à ma joye abandonner mon ame?	Dieux! Ne puis-je à ma joie abandonner mon âme?
Sortons. Que lui dirois-je?	Sortons. Que lui dirais-je?
OU fuyez-vous, Madame?	Où fuyez-vous, Madame?
N’eſt-ce point à vos yeux un ſpectacle aſſez doux	N’est-ce point à vos yeux, un spectacle assez doux
Que la Veuve d’Hector pleurante à vos genoux?	Que la Veuve d’Hector pleurante à vos genoux?
Je ne viens point icy par de jalouſes larmes,	Je ne viens point ici, par de jalouses larmes,
Vous envier un Cœur, qui ſe rend à vos charmes.	Vous envier un Cœur, qui se rend à vos charmes.
Par les mains de ſon Pere, helas! j’ay veu percer	Par les mains de son Père, hélas! j’ai vu percer
Le ſeul, où mes regards prétendoient s’adreſſer	Le seul, où mes regards prétendaient s’adresser.
Ma flame par Hector fut jadis allumée,	Ma flamme par Hector fut jadis allumée,
Avec lui dans la tombe elle s’eſt enfermée.	Avec lui dans la tombe elle s’est enfermée.
Mais il me reſte un Fils. Vous ſçaurez quelque jour,	Mais il me reste un Fils. Vous saurez quelque jour,
Madame, pour un Fils juſqu’où va noſtre amour.	Madame, pour un Fils jusqu’où va notre amour.
Mais vous ne ſçaurez pas, du moins je le ſouhaitte,	Mais vous ne saurez pas, du moins je le souhaite,
En quel trouble mortel ſon intereſt nous jette,	En quel trouble mortel son intérêt nous jette,
Lors que de tant de biens, qui pouvoient nous flatter,	Lorsque de tant de biens, qui pouvaient nous flatter,
C’eſt le ſeul qui nous reſte, & qu’on veut nous l’oſter.	C’est le seul qui nous reste, et qu’on veut nous l’ôter.
Helas! Lors que laſſez de dix ans de miſere,	Hélas! Lorsque lassés de dix ans de misère,
Les Troyens en courroux menaçoient voſtre Mere.	Les Troyens en courroux menaçaient votre Mère.
J’ay ſceu de mon Hector lui procurer l’appui;	J’ai su de mon Hector lui procurer l’appui;
Vous pouvez ſur Pyrrhus ce que j’ai pû ſur lui.	Vous pouvez sur Pyrrhus, ce que j’ai pu sur lui.
Que craint-on d’un Enfant qui ſurvit à ſa perte?	Que craint-on d’un Enfant, qui survit à sa perte?
Laiſſez-moy le cacher en quelque Iſle deſerte.	Laissez-moi le cacher en quelque Île déserte.
Sur les ſoins de ſa Mere on peut s’en aſſurer,	Sur les soins de sa Mère on peut s’en assurer,
Et mon Fils avec moy n’aprendra qu’à pleurer.	Et mon Fils avec moi n’apprendra qu’à pleurer.
Je conçoy vos douleurs. Mais un devoir auſtere,	Je conçois vos douleurs. Mais un devoir austère,
Quand mon Pere a parlé, m’ordonné de me taire.	Quand mon Père a parlé, m’ordonne de me taire.
C’eſt luy, qui de Pyrrhus fait agir le courroux.	C’est lui, qui de Pyrrhus fait agir le courroux.
S’il faut flechir Pyrrhus, qui le peut mieux que vous?	S’il faut fléchir Pyrrhus, qui le peut mieux que vous?
Vos yeux aſſez long-temps ont regné ſur ſon ame.	Vos yeux assez longtemps ont régné sur son âme.
Faites-le prononcer, j’y ſouſcriray, Madame.	Faites-le prononcer, j’y souscrirai, Madame.
QUel mépris la Cruelle attache à ſes refus!	Quel mépris la Cruelle attache à ses refus!
Je croirois ſes conſeils, & je verrois Pyrrhus.	Je croirais ses conseils, et je verrais Pyrrhus.
Un regard confondroit Hermione & la Gréce...	Un regard confondrait Hermione et la Grèce…
Mais luy-meſme il vous cherche.	Mais lui-même il vous cherche.
OU donc eſt la Princeſſe?	Où donc est la Princesse?
Ne m’avois-tu pas dit qu’elle eſtoit en ces lieux?	Ne m’avais-tu pas dit qu’elle était en ces lieux?
Je le croyois.	Je le croyais.
Tu vois le pouvoir de mes yeux.	Tu vois le pouvoir de mes yeux.
Que dit-elle, Phœnix?	Que dit-elle, Phœnix?
Helas! tout m’abandonne.	Hélas! tout m’abandonne.
Allons, Seigneur, marchons ſur les pas d’Hermione.	Allons, Seigneur, marchons sur les pas d’Hermione.
Qu'attendez-vous? Forcez ce ſilence obſtiné.	Qu’attendez-vous? Forcez ce silence obstiné.
Il a promis mon Fils.	Il a promis mon Fils.
Il ne l’a pas donné.	Il ne l’a pas donné.
Non, non, j’ay beau pleurer, ſa mort eſt reſoluë.	Non, non, j’ai beau pleurer, sa mort est résolue.
Daigne-t’elle ſur nous tourner au moins la veuë?	Daigne-t-elle sur nous tourner au moins la vue?
Quel orgueil!	Quel orgueil!
Je ne fay que l’irriter encor.	Je ne fais que l’irriter encor.
Sortons.	Sortons.
Allons aux Grecs livrer le Fils d’Hector.	Allons aux Grecs livrer le Fils d’Hector.
Ah, Seigneur, arreſtez. Que prétendez-vous faire?	Ah! Seigneur, arrêtez. Que prétendez-vous faire?
Si vous livrez le Fils, livrez-leur donc la Mere.	Si vous livrez le Fils, livrez-leur donc la Mère.
Vos ſermens m’ont tantoſt juré tant d’amitié.	Vos serments m’ont tantôt juré tant d’amitié.
Dieux! N’en reſte-t’il pas du moins quelque pitié?	Dieux! N’en reste-t-il pas du moins quelque pitié?
Sans eſpoir de pardon m’avez-vous condannée?	Sans espoir de pardon m’avez-vous condamnée?
Phœnix vous le dira, ma parole eſt donnée.	Phœnix vous le dira, ma parole est donnée.
Vous qui braviez pour moy tant de perils divers!	Vous qui braviez pour moi tant de périls divers!
J’eſtois aveugle alors, mes yeux ſe ſont ouvers.	J’étais aveugle alors, mes yeux se sont ouverts.
Sa grace à vos deſirs pouvoit eſtre accordée.	Sa grâce à vos désirs pouvait être accordée.
Mais vous ne l’avez pas ſeulement demandée.	Mais vous ne l’avez pas seulement demandée.
C’en eſt fait.	C’en est fait.
Ah! Seigneur, vous entendiez aſſez	Ah! Seigneur, vous entendiez assez
Des ſoûpirs, qui craignoient de ſe voir repouſſez.	Des soupirs, qui craignaient de se voir repoussés.
Pardonnez à l’éclat d’une illuſtre fortune	Pardonnez à l’éclat d’une illustre fortune
Ce reſte de fierté, qui craint d’eſtre importune.	Ce reste de fierté, qui craint d’être importune.
Vous ne l’ignorez pas, Andromaque ſans vous	Vous ne l’ignorez pas, Andromaque sans vous
N’auroit jamais d’un Maiſtre embraſſé les genoux.	N’aurait jamais d’un Maître embrassé les genoux.
Non, vous me haïſſez. Et dans le fonds de l'ame	Non, vous me haïssez. Et dans le fond de l’âme
Vous craignez de devoir quelque choſe à ma flâme.	Vous craignez de devoir quelque chose à ma flamme.
Ce Fils meſme, ce Fils, l’objet de tant de ſoins,	Ce Fils même, ce Fils, l’objet de tant de soins,
Si je l’avois ſauvé, vous l’en aimeriez moins.	Si je l’avais sauvé, vous l’en aimeriez moins.
La haine, le mépris, contre moy tout s’aſſemble.	La haine, le mépris, contre moi tout s’assemble.
Vous me haïſſez plus que tous les Grecs enſemble.	Vous me haïssez plus que tous les Grecs ensemble.
Jouïſſez à loiſir d’un ſi noble courroux.	Jouissez à loisir d’un si noble courroux.
Allons, Phœnix.	Allons, Phœnix.
Allons rejoindre mon Epoux.	Allons rejoindre mon Époux.
Madame....	Madame…
Et que veux-tu que je luy diſe encore?	Et que veux-tu que je lui dise encore?
Auteur de tous mes maux, crois-tu qu’il les ignore?	Auteur de tous mes maux, crois-tu qu’il les ignore?
Seigneur, voyez l’eſtat où vous me reduiſez.	Seigneur, voyez l’état où vous me réduisez.
J’ay veû mon Pere mort, & nos Murs embraſez,	J’ai vu mon Père mort, et nos Murs embrasés,
J’ay veû trancher les jours de ma Famille entiere,	J’ai vu trancher les jours de ma Famille entière,
Et mon Epoux ſanglant traiſné ſur la pouſſiere,	Et mon Époux sanglant traîné sur la poussière,
Son Fils ſeul avec moy reſervé pour les fers.	Son Fils seul avec moi réservé pour les fers.
Mais que ne peut un Fils? je reſpire, je ſers.	Mais que ne peut un Fils? je respire, je sers.
J’ay fait plus. Je me ſuis quelquefois conſolée	J’ai fait plus. Je me suis quelquefois consolée
Qu'icy plûtoſt qu’ailleurs le ſort m’euſt exilée;	Qu’ici plutôt qu’ailleurs le sort m’eût exilée;
Qu'heureux dans ſon malheur, le Fils de tant de Rois,	Qu’heureux dans son malheur, le Fils de tant de Rois,
Puis qu’il devoit ſervir, fuſt tombé ſous vos lois.	Puisqu’il devait servir, fût tombé sous vos lois.
J’ay crû que ſa Priſon deviendroit ſon Azile.	J’ai cru que sa Prison deviendrait son Asile.
Jadis Priam ſoumis fut reſpecté d’Achille.	Jadis Priam soumis fut respecté d’Achille.
J’attendois de ſon Fils encor plus de bonté.	J’attendais de son Fils encor plus de bonté.
Pardonne, cher Hector, a ma credulité.	Pardonne, cher Hector, à ma crédulité.
Je n’ay pû ſoupçonner ton Ennemy d’un crime,	Je n’ai pu soupçonner ton Ennemi d’un crime,
Malgré luy-meſme enfin je l’ay crû magnanime.	Malgré lui-même enfin je l’ai cru magnanime.
Ah! s’il l’eſtoit aſſez, pour nous laiſſer du moins	Ah! s’il l’était assez, pour nous laisser du moins
Au Tombeau qu’à ta Cendre ont élevé mes ſoins;	Au Tombeau qu’à ta Cendre ont élevé mes soins;
Et que finiſſant-là ſa haine & nos miſeres,	Et que finissant là sa haine et nos misères,
Il ne ſéparaſt point des dépoüilles ſi cheres!	Il ne séparât point des dépouilles si chères!
Va m’attendre, Phœnix.	Va m’attendre, Phœnix.
MAdame demeurez.	Madame demeurez.
On peut vous rendre encor ce Fils que vous pleurez.	On peut vous rendre encor ce Fils que vous pleurez.
Oüy, je ſens à regret, qu’en excitant vos larmes,	Oui, je sens à regret, qu’en excitant vos larmes,
Je ne fay contre moy que vous donner des armes.	Je ne fais contre moi que vous donner des armes.
Je croyois apporter plus de haine en ces lieux.	Je croyais apporter plus de haine en ces lieux.
Mais, Madame, du moins tournez vers moy les yeux.	Mais, Madame, du moins tournez vers moi les yeux.
Voyez ſi mes regards ſont d’un Juge ſevere,	Voyez si mes regards sont d’un Juge sévère,
S’ils ſont d’un Ennemy qui cherche à vous déplaire.	S’ils sont d’un Ennemi qui cherche à vous déplaire.
Pourquoy me forcez-vous vous-meſme à vous trahir?	Pourquoi me forcez-vous vous-même à vous trahir?
Au nom de voſtre Fils, ceſſons de nous haïr.	Au nom de votre Fils, cessons de nous haïr.
A le ſauver enfin, c’eſt moy qui vous convie.	À le sauver enfin, c’est moi qui vous convie.
Faut-il que mes ſoupirs vous demandent ſa vie?	Faut-il que mes soupirs vous demandent sa vie?
Faut-il qu’en ſa faveur j’embraſſe vos genoux?	Faut-il qu’en sa faveur j’embrasse vos genoux?
Pour la derniere fois, ſauvez-le, ſauvez-vous.	Pour la dernière fois, sauvez-le, sauvez-vous.
Je ſçay de quels ſermens je romps pour vous les chaiſnes,	Je sais de quels serments je romps pour vous les chaînes,
Combien je vais ſur moy faire éclater de haines.	Combien je vais sur moi faire éclater de haines.
Je renvoye Hermione, & je mets ſur ſon front,	Je renvoie Hermione, et je mets sur son front,
Au lieu de ma Couronne, un éternel affront.	Au lieu de ma Couronne, un éternel affront.
Je vous conduis au Temple, où ſon Hymen s’appreſte.	Je vous conduis au Temple, où son Hymen s’apprête.
Je vous ceins du Bandeau, préparé pour ſa Teſte.	Je vous ceins du Bandeau, préparé pour sa Tête.
Mais ce n’eſt plus, Madame, un offre à dédaigner.	Mais ce n’est plus, Madame, une offre à dédaigner.
Je vous le dis, il faut ou perir, ou regner.	Je vous le dis, il faut ou périr, ou régner.
Mon cœur deſeſperé d’un an d’ingratitude,	Mon cœur, désespéré d’un an d’ingratitude,
Ne peut plus de ſon ſort ſouffrir l’incertitude.	Ne peut plus de son sort souffrir l’incertitude.
C’eſt craindre, menaſſer, & gemir trop long-temps.	C’est craindre, menacer, et gémir trop longtemps.
Je meurs, ſi je vous pers, mais je meurs ſi j’attens.	Je meurs, si je vous perds, mais je meurs, si j’attends.
Songez-y, je vous laiſſe, & je viendray vous prendre,	Songez-y, je vous laisse, et je viendrai vous prendre,
Pour vous mener au Temple, où ce Fils doit m’attendre.	Pour vous mener au Temple, où ce Fils doit m’attendre.
Et là vous me verrez ſoûmis, ou furieux,	Et là vous me verrez soumis, ou furieux,
Vous couronner, Madame, ou le perdre à vos yeux,	Vous couronner, Madame, ou le perdre à vos yeux,
JE vous l'avois predit, qu’en dépit de la Grece,	Je vous l’avais prédit, qu’en dépit de la Grèce,
De voſtre ſort encor vous ſeriez la Maiſtreſſe.	De votre sort encor vous seriez la Maîtresse.
Helas! De quel effet tes diſcours ſont ſuivis!	Hélas! De quel effet tes discours sont suivis!
Il ne me reſtoit plus qu’à condanner mon Fils.	Il ne me restait plus qu’à condamner mon Fils.
Madame, à voſtre Epoux c’eſt eſtre aſſez fidelle.	Madame, à votre Époux c’est être assez fidèle.
Trop de vertu pourroit vous rendre criminelle.	Trop de vertu pourrait vous rendre criminelle.
Luy-meſme il porteroit voſtre ame à la douceur.	Lui-même il porterait votre âme à la douceur.
Quoy, je lui donnerois Pyrrhus pour ſucceſſeur?	Quoi, je lui donnerais Pyrrhus pour successeur?
Ainſi le veut ſon Fils, que les Grecs vous raviſſent.	Ainsi le veut son Fils, que les Grecs vous ravissent.
Penſez-vous qu’apres tout ſes Manes en rougiſſent?	Pensez-vous qu’après tout ses Mânes en rougissent?
Qu'il mépriſaſt, Madame, un Roy victorieux,	Qu’il méprisât, Madame, un Roi victorieux,
Qui vous fait remonter au rang de vos Ayeux;	Qui vous fait remonter au rang de vos Aïeux;
Qui foule aux pieds pour vous vos Vainqueurs en colere,	Qui foule aux pieds pour vous vos Vainqueurs en colère,
Qui ne ſe ſouvient plus qu’Achille eſtoit ſon Pere,	Qui ne se souvient plus qu’Achille était son Père,
Qui dément ſes Exploits, & les rend ſuperflus?	Qui dément ses Exploits, et les rend superflus?
Dois-je les oublier, s’il ne s’en ſouvient plus?	Dois-je les oublier, s’il ne s’en souvient plus?
Dois-je oublier Hector privé de funerailles,	Dois-je oublier Hector privé de funérailles,
Et traiſné ſans honneur autour de nos murailles?	Et traîné sans honneur autour de nos murailles?
Dois je oublier ſon Pere à mes pieds renverſé,	Dois-je oublier son Père à mes pieds renversé,
Enſanglantant l’Autel qu’il tenoit embraſſé?	Ensanglantant l’Autel qu’il tenait embrassé?
Songe, ſonge, Cephiſe, à cette Nuit cruelle,	Songe, songe, Céphise, à cette Nuit cruelle,
Qui fut pour tout un Peuple une Nuit eternelle.	Qui fut pour tout un Peuple une Nuit éternelle.
Figure-toy Pyrrhus, les yeux étincelans,	Figure-toi Pyrrhus, les yeux étincelants,
Entrant à la lueur de nos Palais brûlans;	Entrant à la lueur de nos Palais brûlants;
Sur tous mes Freres morts ſe faiſant un paſſage,	Sur tous mes Frères morts se faisant un passage,
Et de ſang tout couvert échauffant le carnage.	Et de sang tout couvert échauffant le carnage.
Songe aux cris des Vainqueurs, ſonge aux cris des Mourans,	Songe aux cris des Vainqueurs, songe aux cris des Mourants,
Dans la flamme étouffez, ſous le fer expirans.	Dans la flamme étouffés, sous le fer expirants.
Peins-toy dans ces horreurs Andromaque éperduë.	Peins-toi dans ces horreurs Andromaque éperdue.
Voila comme Pyrrhus vint s’offrir à ma veuë;	Voilà comme Pyrrhus vint s’offrir à ma vue;
Voila par quels exploits il ſçeût ſe couronner,	Voilà par quels exploits il sut se couronner,
Enfin voila l’Epoux que tu me veux donner.	Enfin voilà l’Époux que tu me veux donner.
Non, je ne ſeray point complice de ſes crimes.	Non, je ne serai point complice de ses crimes.
Qu’il nous prenne, s’il veut, pour dernieres Victimes.	Qu’il nous prenne, s’il veut, pour dernières Victimes.
Tous mes reſſentimens luy ſeroient aſſervis.	Tous mes ressentiments lui seraient asservis.
Hé bien, allons donc voir expirer voſtre Fils.	Hé bien, allons donc voir expirer votre Fils.
On n’attend plus que vous. Vous fremiſſez, Madame?	On n’attend plus que vous. Vous frémissez, Madame?
Ah! de quel ſouvenir vient-tu frapper mon ame!	Ah! de quel souvenir viens-tu frapper mon âme!
Quoy, Cephiſe, j’iray voir expirer encor	Quoi, Céphise, j’irai voir expirer encor
Ce Fils, ma ſeule joye, & l’image d’Hector?	Ce Fils, ma seule joie, et l’image d’Hector?
Ce Fils que de ſa flame il me laiſſa pour gage?	Ce Fils que de sa flamme il me laissa pour gage?
Helas! je m’en ſouviens, le jour que ſon courage,	Hélas! je m’en souviens, le jour que son courage,
Luy fit chercher Achille, ou plûtoſt le treſpas;	Lui fit chercher Achille, ou plutôt le trépas;
Il demanda ſon Fils, & le prit dans ſes bras.	Il demanda son Fils, et le prit dans ses bras.
Chere Epouſe, (dit-il, en eſſüyant mes larmes,)	Chère Épouse, (dit-il, en essuyant mes larmes,)
J’ignore quel ſuccés le ſort garde à mes armes,	J’ignore quel succès le sort garde à mes armes,
Je te laiſſe mon Fils, pour gage de ma foy;	Je te laisse mon Fils, pour gage de ma foi;
S’il me perd, je prétens qu’il me retrouve en toy.	S’il me perd, je prétends qu’il me retrouve en toi.
Si d’un heureux hymen la memoire t’eſt chere,	Si d’un heureux hymen la mémoire t’est chère,
Montre au Fils à quel point tu cheriſſois le Pere.	Montre au Fils à quel point tu chérissais le Père.
Et je puis voir répandre un ſang ſi precieux?	Et je puis voir répandre un sang si précieux?
Et je laiſſe avec luy perir tous ſes Ayeux?	Et je laisse avec lui périr tous ses Aïeux?
Roy barbare! faut-il que mon crime l’entraiſne?	Roi barbare! faut-il que mon crime l’entraîne?
Si je te hais, eſt-il coupable de ma haine?	Si je te hais, est-il coupable de ma haine?
