& travailler conjointement à ſa liberté, y ayant égal intereſt.	et travailler conjointement à sa liberté, y ayant égal intérêt.
Ne conſideres tu point que ſi nous periſſions tous deux dans ce combat, Mandane, l’illuſtre Mandane, demeureroit ſans protection	Ne considères-tu point que si nous périssions tous deux dans ce combat, Mandane, l’illustre Mandane, demeurerait sans protection
& ſans deffence, entre les mains de noſtre Rival?	et sans défense, entre les mains de notre Rival?
A ces mots, Artamene s’arreſta un moment:	À ces mots, Artamène s’arrêta un moment:
puis reprenant la parole;	puis reprenant la parole;
il ne ſeroit ſans doute pas juſte, dit il, d’expoſer noſtre Princeſſe, à un ſemblable malheur:	il ne serait sans doute pas juste, dit-il, d’exposer notre Princesse, à un semblable malheur:
mais il n’eſt pas équitable non plus, que commandant les armes du Roy des Medes, je diſpose ſouverainement de la liberté d’un priſonnier, comme eſt le Roy d’Aſſirie.	mais il n’est pas équitable non plus, que commandant les armes du Roi des Mèdes, je dispose souverainement de la liberté d’un prisonnier, comme est le Roi d’Assyrie.
Tout ce que je puis avec honneur;	Tout ce que je puis avec honneur;
c’eſt de luy promettre, d’employer tous mes ſoins,	c’est de lui promettre, d’employer tous mes soins,
& tout mon credit, pour la luy faire rendre, s’il m’eſt poſſible,	et tout mon crédit, pour la lui faire rendre, s’il m’est possible,
& de n’oublier rien pour cela.	et de n’oublier rien pour cela.
Mais pour luy teſmoigner, adjouſta t’il, que je ne veux pas m’eſpargner la peine qui ſe rencontre à combattre un ſi redoutable Ennemy;	Mais pour lui témoigner, ajouta-t-il, que je ne veux pas m’épargner la peine qui se rencontre à combattre un si redoutable Ennemi;
ny m’en exempter laſchement, en le retenant priſonnier;	ni m’en exempter lâchement, en le retenant prisonnier;
je veux bien luy engager ma parole, de ne pretendre jamais rien à la poſſession de la Princeſſe, quand meſme elle ſeroit en ma puiſſance;	je veux bien lui engager ma parole, de ne prétendre jamais rien à la possession de la Princesse, quand même elle serait en ma puissance;
quand meſme le Roy des Medes y conſentiroit;	quand même le Roi des Mèdes y consentirait;
& quand meſme elle le voudroit, qu’auparavant par un combat particulier;	et quand même elle le voudrait, qu’auparavant par un combat particulier;
le ſort des armes ne m’ait rendu ſon Vainqueur.	le sort des armes ne m’ait rendu son Vainqueur.
Je ne sçaurois nier, luy dit le Roy d’Aſſirie, que vous n’ayez raiſon d’en uſer comme vous faites;	Je ne saurais nier, lui dit le Roi d’Assyrie, que vous n’ayez raison d’en user comme vous faites;
& que je n’aye eu tort de vous faire cette demande:	et que je n’aie eu tort de vous faire cette demande:
mais advoüant que vous eſtes plus ſage que moy, confeſſez auſſi que je ſuis plus amoureux que vous, puis que je le ſuis juſques à perdre la raiſon, que vous conſervez toute entiere.	mais avouant que vous êtes plus sage que moi, confessez aussi que je suis plus amoureux que vous, puisque je le suis jusqu’à perdre la raison, que vous conservez toute entière.
Je vous diſputeray, luy repliqua Artamene, cette derniere qualité, bien plus opiniaſtrément que l’autre:	Je vous disputerai, lui répliqua Artamène, cette dernière qualité, bien plus opiniâtrement que l’autre:
Le Roy d’Aſſirie le ſupplia alors ſans luy repliquer, de ſe ſouvenir, que peut-eſtre ne ſeroit il pas inutile pour la liberté de la Princeſſe:	Le Roi d’Assyrie le supplia alors sans lui répliquer, de se souvenir, que peut-être ne serait-il pas inutile pour la liberté de la Princesse:
& qu’ainſi par cette ſeule raiſon, il le conjuroit de travailler pour la ſienne.	et qu’ainsi par cette seule raison, il le conjurait de travailler pour la sienne.
A ces mots Artamene ſe retira, apres avoir mis le Roy d’Aſſirie ſous la garde d’Araſpe:	À ces mots Artamène se retira, après avoir mis le Roi d’Assyrie sous la garde d’Araspe:
luy ordonnant de le traiter avec tout le reſpect,	lui ordonnant de le traiter avec tout le respect,
& toute la civilité poſſible:	et toute la civilité possible:
& de le mener à ſon Apartement accouſtumé.	et de le mener à son Appartement accoutumé.
Le Roy d’Aſſirie l’entendant, reſpondit que ce devoit eſtre le ſien:	Le Roi d’Assyrie l’entendant, répondit que ce devait être le sien:
mais Artamene ne le voulut pas:	mais Artamène ne le voulut pas:
& s’en ſeparant à l’inſtant meſme, il s’en alla dans toutes les ruës, pour tenir le Peuple en ſon devoir;	et s’en séparant à l’instant même, il s’en alla dans toutes les rues, pour tenir le Peuple en son devoir;
& pour faire achever d’eſteindre le feu.	et pour faire achever d’éteindre le feu.
Il envoya tout le long des Coſtes, pour voir ſi l’on n’apprendroit rien de la Galere, qui avoit enlevé ſa Princeſſe:	Il envoya tout le long des Côtes, pour voir si l’on n’apprendrait rien de la Galère, qui avait enlevé sa Princesse:
& il depeſcha un des ſiens vers Ciaxare, pour l’advertir de ce qui s’eſtoit paſſé.	et il dépêcha un des siens vers Ciaxare, pour l’avertir de ce qui s’était passé.
Enfin il employa tout le reſte du jour à donner ſes ordres:	Enfin il employa tout le reste du jour à donner ses ordres:
& le ſoir eſtant venu, il ſe retira dans le meſme Apartement que ſa Princeſſe avoit occupé, à ce qu’il sçeut par Thraſibule;	et le soir étant venu, il se retira dans le même Appartement que sa Princesse avait occupé, à ce qu’il sut par Thrasibule;
auquel Artamene fit toute la civilité, que l’extréme inquietude où il eſtoit, luy pût permettre de luy faire.	auquel Artamène fit toute la civilité, que l’extrême inquiétude où il était, lui put permettre de lui faire.
Il sçeut qu’eſtant arrivé ſeulement depuis un jour dans ce Port, pour y faire radouber ſes Vaiſſeaux, qui avoient eſté battus de la tempeſte;	Il sut qu’étant arrivé seulement depuis un jour dans ce Port, pour y faire radouber ses Vaisseaux, qui avaient été battus de la tempête;
le Roy d’Aſſirie l’y avoit fort bien reçeu:	le Roi d’Assyrie l’y avait fort bien reçu:
& l’avoit obligé de loger dans le Chaſteau, où il avoit veû la Princeſſe de Medie:	et l’avait obligé de loger dans le Château, où il avait vu la Princesse de Médie:
mais que la nuit derniere, l’on avoit entendu tout d’un coup, le bruit que faiſoient les Vaiſſeaux embrazez, qui en ſuite avoient mis le feu aux maiſons voiſines.	mais que la nuit dernière, l’on avait entendu tout d’un coup, le bruit que faisaient les Vaisseaux embrasés, qui ensuite avaient mis le feu aux maisons voisines.
Qu’à ce bruit, le Roy d’Aſſirie ayant voulu prendre ſon eſpée, ne l’avoit plus trouvée à ſa place,	Qu’à ce bruit, le Roi d’Assyrie ayant voulu prendre son épée, ne l’avait plus trouvée à sa place,
& qu’ayant voulu aller à l’Apartement de la Princeſſe, il l’avoit trouvé fermé:	et qu’ayant voulu aller à l’Appartement de la Princesse, il l’avait trouvé fermé:
& n’avoit trouvé aucun des Soldats qui avoient accouſtumé de garder le Chaſteau.	et n’avait trouvé aucun des Soldats qui avaient accoutumé de garder le Château.
Qu’auſſi toſt il avoit appellé quelques uns des ſiens, qui avoient ouvert par force cét Apartement,	Qu’aussitôt il avait appelé quelques-uns des siens, qui avaient ouvert par force cet Appartement,
& qui n’y avoient trouvé perſonne.	et qui n’y avaient trouvé personne.
Que cependant ayant voulu faire ſortir tous les domeſtiques,	Que cependant ayant voulu faire sortir tous les domestiques,
& voulu ſortir luy meſme, il luy avoit eſté impoſſible;	et voulu sortir lui même, il lui avait été impossible;
à cauſe de l’embrazement.	à cause de l’embrasement.
Et que depuis cela, il avoit toujours eſté ſur le haut de cette Tour, à conſiderer ſon infortune:	Et que depuis cela, il avait toujours été sur le haut de cette Tour, à considérer son infortune:
reſolu à tous les momens, de ſe jetter dans la Mer ou dans les flames.	résolu à tous les moments, de se jeter dans la Mer ou dans les flammes.
Thraſibule n’en pouvoit pas dire d’avantage:	Thrasibule n’en pouvait pas dire davantage:
car il n’y avoit encore qu’un jour qu’il eſtoit arrivé à Sinope:	car il n’y avait encore qu’un jour qu’il était arrivé à Sinope:
il laiſſa donc Artamene dans cét Apartement;	il laissa donc Artamène dans cet Appartement;
apres que ce Prince l’eut aſſeuré en s’en ſeparant, qu’il auroit ſoing de le faire recompenſer par le Roy, de la perte de ſes Vaiſſeaux, que le feu avoit devorez:	après que ce Prince l’eut assuré en s’en séparant, qu’il aurait soin de le faire récompenser par le Roi, de la perte de ses Vaisseaux, que le feu avait dévorés:
le loüant infiniment de ſa moderation;	le louant infiniment de sa modération;
luy qui dans un accident tant inopiné, ne s’amuſoit point à des regrets inutiles;	lui qui dans un accident tant inopiné, ne s’amusait point à des regrets inutiles;
& ſouffroit en homme de cœur, une perte ſi conſiderable.	et souffrait en homme de cœur, une perte si considérable.
Artamene paſſa la nuit avec des inquietudes que l’on ne sçauroit concevoir:	Artamène passa la nuit avec des inquiétudes que l’on ne saurait concevoir:
voicy, diſoit il en luy meſme, le lieu de la perſecution de ma Princeſſe;	voici, disait-il en lui-même, le lieu de la persécution de ma Princesse;
& voicy peut-eſtre l’endroit où elle s’eſt ſouvenuë de moy avec douleur;	et voici peut-être l’endroit où elle s’est souvenue de moi avec douleur;
& où peut-eſtre elle a regretté le malheureux Artamene.	et où peut-être elle a regretté le malheureux Artamène.
Du moins sçay-je bien qu’elle en a parlé:	Du moins sais-je bien qu’elle en a parlé:
Car, par quelle autre voye le Roy d’Aſſirie auroit il pû sçavoir, qu’Artamene n’eſt pas veritablement Artamene?	Car, par quelle autre voie le Roi d’Assyrie aurait il pu savoir, qu’Artamène n’est pas véritablement Artamène?
moy qui dans le temps que je l’ay veû à la Cour de Capadoce, ne le croyois eſtre que Philidaſpe;	moi qui dans le temps que je l’ai vu à la Cour de Cappadoce, ne le croyais être que Philidaspe;
c’eſt à dire un ſimple Chevalier, tel qu’il ſe diſoit;	c’est à dire un simple Chevalier, tel qu’il se disait;
quoy que je fuſſe pour le moins auſſi amoureux que luy;	quoique je fusse pour le moins aussi amoureux que lui;
& par conſequent auſſi difficile à tromper?	et par conséquent aussi difficile à tromper?
Mais helas!	Mais hélas!
adorable Princeſſe, pourquoy faut il que je ſois dans voſtre priſon;	adorable Princesse, pourquoi faut-il que je sois dans votre prison;
que voſtre perſecuteur ſoit icy,	que votre persécuteur soit ici,
& que vous n’y ſoyez pas?	et que vous n’y soyez pas?
Je tiens un Rival que je ne puis punir;	Je tiens un Rival que je ne puis punir;
je pers une Maiſtresse que je ne puis ſauver,	je perds une Maîtresse que je ne puis sauver,
& ſa beauté qui fait tout mon bon-heur	et sa beauté qui fait tout mon bonheur
& toute ſa gloire, fait auſſi toute mon infortune	et toute sa gloire, fait aussi toute mon infortune
& tout ſon mal-heur.	et tout son malheur.
Elle luy donne des Adorateurs;	Elle lui donne des Adorateurs;
mais des Adorateurs ſans reſpect:	mais des Adorateurs sans respect:
& en quelque lieu qu’elle aille, elle me donne des Rivaux	et en quelque lieu qu’elle aille, elle me donne des Rivaux
& des Ennemis.	et des Ennemis.
Ha!	Ha!
beaux yeux, s’ecrioit il, comme eſt-il poſſible que vous inſpiriez des ſentimens ſi injuſtes;	beaux yeux, s’écriait-il, comme est-il possible que vous inspiriez des sentiments si injustes;
& ſi déreglez;	et si déréglés;
Vous, dis-je, qui n’avez jamais porté dans mon cœur, que de la crainte,	Vous, dis-je, qui n’avez jamais porté dans mon cœur, que de la crainte,
& de la veneration?	et de la vénération?
Moy qui n’ay preſque jamais oſé vous dire que je vous aymois:	Moi qui n’ai presque jamais osé vous dire que je vous aimais:
moy qui ne vous ay regardez qu’en tremblant;	moi qui ne vous ai regardés qu’en tremblant;
moy qui vous ay ſi long temps adorez en ſecret;	moi qui vous ai si longtemps adorés en secret;
& moy, dis-je enfin, qui ſerois pluſtost mort mille fois, que de vous faire voir dans mes actions, la moindre choſe qui vous peuſt deſplaire.	et moi, dis-je enfin, qui serais plutôt mort mille fois, que de vous faire voir dans mes actions, la moindre chose qui vous pût déplaire.
Cependant vous avez embrazé des cœurs indignes de vous:	Cependant vous avez embrasé des cœurs indignes de vous:
& des cœurs qui ſans conſiderer ce qu’ils vous doivent, n’ont conſideré que ce qui leur plaiſt.	et des cœurs qui sans considérer ce qu’ils vous doivent, n’ont considéré que ce qui leur plaît.
Cependant je ne sçaurois me repentir de ma reſpectueuse paſſion:	Cependant je ne saurais me repentir de ma respectueuse passion:
& je ne sçay ſi tout malheureux que je ſuis;	et je ne sais si tout malheureux que je suis;
ſi tout eſloigné que je me trouve de ma Princeſſe, je n’aime pas encore mieux eſtre Artamene, que d’eſtre Mazare.	si tout éloigné que je me trouve de ma Princesse, je n’aime pas encore mieux être Artamène, que d’être Mazare.
Ce n’eſt pas pourſuivit il, qu’il ne ſoit heureux dans ſon crime:	Ce n’est pas poursuivit-il, qu’il ne soit heureux dans son crime:
car enfin il la voit;	car enfin il la voit;
il luy parle;	il lui parle;
& il luy parle de ſa paſſion.	et il lui parle de sa passion.
Mais ſans doute auſſi qu’elle luy reſpond avec mépris;	Mais sans doute aussi qu’elle lui répond avec mépris;
& que les meſmes yeux qui ſont ſon plaiſir	et que les mêmes yeux qui sont son plaisir
& ſa gloire, ſont auſſi ſa peine	et sa gloire, sont aussi sa peine
& ſon chaſtiment, par les marques de leur colere.	et son châtiment, par les marques de leur colère.
En un mot, je penſe que j’ayme mieux eſtre innocent dans le cœur de ma Princeſſe, qu’eſtre ſeulement à ſes pieds comme un Criminel.	En un mot, je pense que j’aime mieux être innocent dans le cœur de ma Princesse, qu’être seulement à ses pieds comme un Criminel.
Mais Ciel!	Mais Ciel!
adjouſtoit il tout d’un coup;	ajoutait-il tout d’un coup;
qui m’a dit que cette tempeſte qui s’eſt eſlevée,	qui m’a dit que cette tempête qui s’est élevée,
& qui dure encore, ne l’aura pas fait perir;	et qui dure encore, ne l’aura pas fait périr;
& de quelles flateuſes penſées laiſſay-je entretenir mon eſpoir, dans l’incertitude où j’en ſuis ?	et de quelles flatteuses pensées laissai-je entretenir mon espoir, dans l’incertitude où j’en suis?
Comme il en eſtoit là, il entendit un bruit aſſez grand:	Comme il en était là, il entendit un bruit assez grand:
& Chriſante eſtant entré dans ſa chambre, Seigneur, luy dit-il, l’on delivre le Roy d’Aſſirie;	et Chrysante étant entré dans sa chambre, Seigneur, lui dit-il, l’on délivre le Roi d’Assyrie;
ou pour mieux dire, on l’a deſja delivré.	ou pour mieux dire, on l’a déjà délivré.
Araſpe ayant entendu quelque bruit dans la chambre du Roy priſonnier, où par reſpect il n’avoit pas voulu coucher;	Araspe ayant entendu quelque bruit dans la chambre du Roi prisonnier, où par respect il n’avait pas voulu coucher;
l’a ouverte,	l’a ouverte,
& ne l’y a plus trouvé.	et ne l’y a plus trouvé.
A l’inſtant meſme nous ſommes ſortis;	À l’instant même nous sommes sortis;
nous avons cherché;	nous avons cherché;
& nous avons veû que ſous une feneſtre qui reſpond vers une maiſon bruſlée;	et nous avons vu que sous une fenêtre qui répond vers une maison brûlée;
un amas de ruines	un amas de ruines
& de cendres, a comblé le foſſé du Chateau en cét endroit,	et de cendres, a comblé le fossé du Château en cet endroit,
& a eſlevé un grand monceau de ces matieres fumantes, à la faveur duquel nous jugeons que ce Prince s’eſt ſauvé.	et a élevé un grand monceau de ces matières fumantes, à la faveur duquel nous jugeons que ce Prince s’est sauvé.
Artamene ſurpris d’une nouvelle ſi faſcheuse, envoya promptement ſes ordres à toutes les Portes de Sinope;	Artamène surpris d’une nouvelle si fâcheuse, envoya promptement ses ordres à toutes les Portes de Sinope;
& fut luy meſme en perſonne, pour taſcher de retrouver ſon priſonnier.	et fut lui-même en personne, pour tâcher de retrouver son prisonnier.
Mais durant qu’il eſtoit à un des bouts de la Ville, il sçeut qu’une troupe de gens armez paroiſſoit à l’autre;	Mais durant qu’il était à un des bouts de la Ville, il sut qu’une troupe de gens armés paraissait à l’autre;
& qu’ils taſchoient de ſe rendre Maiſtres de la Porte.	et qu’ils tâchaient de se rendre Maîtres de la Porte.
Il y courut auſſi toſt;	Il y courut aussitôt;
mais il y arriva trop tard:	mais il y arriva trop tard:
car le Roy d’Aſſirie eſtoit deſja ſorti,	car le Roi d’Assyrie était déjà sorti,
& avoit forcé le Corps de Garde.	et avait forcé le Corps de Garde.
Il y avoit pourtant encore quelques uns des ſiens, commandez par Aribée, que l’on avoit creû mort,	Il y avait pourtant encore quelques-uns des siens, commandés par Aribée, que l’on avait cru mort,
& qui s’eſtoit retiré de deſſous ces ruines qui l’avoient enſeveli;	et qui s’était retiré de dessous ces ruines qui l’avaient enseveli;
qui pour donner temps au Roy d’Aſſirie de ſe ſauver, rendoient encore avec luy quelque combat, malgré les bleſſures que ce perfide avoit deſja reçeuës.	qui pour donner temps au Roi d’Assyrie de se sauver, rendaient encore avec lui quelque combat, malgré les blessures que ce perfide avait déjà reçues.
Mais Artamene ne l’eut pas pluſtost reconnu, qu’il luy dit;	Mais Artamène ne l’eut pas plutôt reconnu, qu’il lui dit;
Traiſtre, tu és donc reſſuscité, pour trahir encore une fois ton Maiſtre!	Traître, tu es donc ressuscité, pour trahir encore une fois ton Maître!
Mais ſi tu veux échaper de mes mains, il faut que les tiennes m’oſtent la vie.	Mais si tu veux échapper de mes mains, il faut que les tiennes m’ôtent la vie.
En diſant cela, il fut à luy, avec une impetuoſité ſi grande;	En disant cela, il fut à lui, avec une impétuosité si grande;
qu’Aribée, quoy que courageux, fut contraint de laſcher le pied.	qu’Aribée, quoique courageux, fut contraint de lâcher le pied.
Ce ne fut neantmoins reculer ſa perte que d’un moment:	Ce ne fut néanmoins reculer sa perte que d’un moment:
car Artamene le preſſa de telle ſorte;	car Artamène le pressa de telle sorte;
qu’il ne ſongea plus qu’à parer les coups qu’il luy portoit:	qu’il ne songea plus qu’à parer les coups qu’il lui portait:
cedant viſiblement à la valeur d’un homme, qui ne combatoit gueres ſans vaincre.	cédant visiblement à la valeur d’un homme, qui ne combattait guère sans vaincre.
Il luy donna donc enfin un ſi grand coup d’eſpée à travers le corps, au deffaut de ſa cuiraſſe, qu’il l’abatit à ſes pieds.	Il lui donna donc enfin un si grand coup d’épée à travers le corps, au défaut de sa cuirasse, qu’il l’abattit à ses pieds.
Là, il advoüa avant qu’expirer, que s’eſtant retiré de deſſous ces ruines, il avoit raſſemblé tout ce qu’il avoit pû des ſiens, qu’il avoit fait cacher parmi ces maiſons bruſlées:	Là, il avoua avant qu’expirer, que s’étant retiré de dessous ces ruines, il avait rassemblé tout ce qu’il avait pu des siens, qu’il avait fait cacher parmi ces maisons brûlées:
& qu’ayant sçeu en quel Apartement eſtoit le Roy d’Aſſirie, il avoit eſté au commencement de la nuit, monter ſur cét amas de cendres	et qu’ayant su en quel Appartement était le Roi d’Assyrie, il avait été au commencement de la nuit, monter sur cet amas de cendres
& de bois à demi conſumé;	et de bois à demi-consumé;
faire quelque bruit à la feneſtre de ce Prince, pour l’obliger à y regarder;	faire quelque bruit à la fenêtre de ce Prince, pour l’obliger à y regarder;
& que la choſe luy ayant ſuccedé, il l’avoit fait ſauver par cette feneſtre.	et que la chose lui ayant succédé, il l’avait fait sauver par cette fenêtre.
A ces mots, cét infidelle perdit la parole	À ces mots, cet infidèle perdit la parole
& la vie:	et la vie:
& tous ſes compagnons le voyant en cét eſtat, prirent auſſi toſt la ſuite.	et tous ses compagnons le voyant en cet état, prirent aussitôt la suite.
Mais Artamene fut contraint de ne pourſuivre pas davantage un Prince, que l’obſcurité de la nuit, déroboit facilement à ſes ſoins.	Mais Artamène fut contraint de ne poursuivre pas davantage un Prince, que l’obscurité de la nuit, dérobait facilement à ses soins.
Comme il s’en fut retourné au Chaſteau, il dépeſcha vers Ciaxare, pour l’advertir de cét accident:	Comme il s’en fut retourné au Château, il dépêcha vers Cyaxare, pour l’avertir de cet accident:
& s’occupa tout le reſte de la nuit, à conſiderer le caprice de ſa fortune	et s’occupa tout le reste de la nuit, à considérer le caprice de sa fortune
& de ſon malheur.	et de son malheur.
Repaſſant donc tout ce qui luy eſtoit arrivé, il s’eſtonnoit quelqueſfois, qu’une vie auſſi peu avancée que la ſienne, euſt deſja eſté ſubjette à tant d’evenemens extraordinaires:	Repassant donc tout ce qui lui était arrivé, il s’étonnait quelquefois, qu’une vie aussi peu avancée que la sienne, eût déjà été sujette à tant d’évènements extraordinaires:
& ſe promenant ſeul dans ſa chambre (car il n’avoit pû ſe reſoudre de ſe remettre au lit) il apperçeut ſur la table des Tablettes de feüilles de Palmier, aſſez magnifiques:	et se promenant seul dans sa chambre (car il n’avait pu se résoudre de se remettre au lit) il aperçut sur la table des Tablettes de feuilles de Palmier, assez magnifiques:
Mais helas!	Mais hélas!
quelle ſurprise fut la ſienne, lors qu’en les ouvrant, il vit qu’il y avoit quelque choſe qui eſtoit eſcrit de la main de ſa Princeſſe.	quelle surprise fut la sienne, lorsqu’en les ouvrant, il vit qu’il y avait quelque chose qui était écrit de la main de sa Princesse.
Il les regarde de plus prés;	Il les regarde de plus près;
il parcourt en un moment toutes ces precieuſes lignes;	il parcourt en un moment toutes ces précieuses lignes;
& apres s’eſtre fortement confirmé en l’opinion que c’eſtoit elle qui les avoit tracées:	et après s’être fortement confirmé en l’opinion que c’était elle qui les avait tracées:
il lût diſtinctement ces paroles.	il lut distinctement ces paroles.
