il vit un homme de fort bonne mine qui la luy ouvrit;	il vit un homme de fort bonne mine qui la lui ouvrit;
& qui au lieu de luy en diſputer l’entrée, comme il euſt fait, s’il ne l’euſt pas reconnu auparavant du haut des creneaux;	et qui au lieu de lui en disputer l’entrée, comme il eût fait, s’il ne l’eût pas reconnu auparavant du haut des créneaux;
luy dit avec beaucoup de reſpect, Seigneur, ſi le Nom de Thraſibule n’eſt pas ſorti de voſtre mémoire, accordez luy la grace d’employer voſtre authorité, pour empeſcher la perte d’une illuſtre Perſonne, que le deſespoir va ſans doute faire perir, ſur le haut de cette Tour, ſi vous ne m’aydez à la ſecourir promptement.	lui dit avec beaucoup de respect, Seigneur, si le Nom de Thrasibule n’est pas sorti de votre mémoire, accordez lui la grâce d’employer votre autorité, pour empêcher la perte d’une illustre Personne, que le désespoir va sans doute faire périr, sur le haut de cette Tour, si vous ne m’aidez à la secourir promptement.
Artamene, qui creut que c’eſtoit ſa Princeſſe, qui eſtoit en cette extremité, ne s’amuſa pas à faire un long compliment, au genereux Thraſibule, qu’il reconnut d’abord à la voix;	Artamène, qui crut que c’était sa Princesse, qui était en cette extrémité, ne s’amusa pas à faire un long compliment, au généreux Thrasibule, qu’il reconnut d’abord à la voix;
Allons mon ancien vainqueur (dit il à ce fameux Pirate qui n’avoit point déguiſé ſon veritable Nom, parce qu’eſtant fort commun parmi les Grecs, il ne pouvoit pas le faire reconnoiſtre) allons ſecourir cette perſonne illuſtre:	Allons mon ancien vainqueur (dit-il à ce fameux Pirate qui n’avait point déguisé son véritable Nom, parce qu’étant fort commun parmi les Grecs, il ne pouvait pas le faire reconnaître) allons secourir cette personne illustre:
& en diſant ces paroles avec aſſez de precipitation;	et en disant ces paroles avec assez de précipitation;
il monta l’eſcalier, ſuivi de grand nombre des ſiens;	il monta l’escalier, suivi de grand nombre des siens;
mais particulierement d’Hidaſpe;	mais particulièrement d’Hidaspe;
de Chriſante;	de Chrysante;
d’Aglatidas;	d’Aglatidas;
de Thraſibule,	de Thrasibule,
& de Feraulas:	et de Phéraulas:
& tous, excepté Thraſibule, eſtoient eſtonnez de ne rencontrer point de Soldats dans cette Tour,	et tous, excepté Thrasibule, étaient étonnés de ne rencontrer point de Soldats dans cette Tour,
& de n’en voir point dans le reſte du Chaſteau.	et de n’en voir point dans le reste du Château.
Araſpe par les ordres d’Artamene, demeura à la porte avec ſes compagnons, afin de ne s’expoſer pas mal à propos à quelque ſurprise.	Araspe par les ordres d’Artamène, demeura à la porte avec ses compagnons, afin de ne s’exposer pas mal à propos à quelque surprise.
Ce Prince donc impatient de revoir ſa Maiſtresse, marche le premier;	Ce Prince donc impatient de revoir sa Maîtresse, marche le premier;
& devançant les autres d’aſſez loing, arrive au haut de cette Tour.	et devançant les autres d’assez loin, arrive au haut de cette Tour.
Mais helas, quel deſplaisir,	Mais hélas, quel déplaisir,
& quel eſtonnement fut le ſien!	et quel étonnement fut le sien!
lors qu’au lieu d’y voir ſa Princeſſe, il n’y vit que le Roy d’Aſſirie;	lors qu’au lieu d’y voir sa Princesse, il n’y vit que le Roi d’Assyrie;
c’eſt à dire le raviſſeur de Mandane, ſon Rival	c’est-à-dire le ravisseur de Mandane, son Rival
& ſon Ennemi:	et son Ennemi:
mais un Ennemi ſans armes,	mais un Ennemi sans armes,
& accablé de douleur.	et accablé de douleur.
Artamene ſe tourna alors vers Thraſibule, comme pour luy demander, ſi c’eſtoit là cette illuſtre perſonne, dont il luy avoit voulu parler;	Artamène se tourna alors vers Thrasibule, comme pour lui demander, si c’était là cette illustre personne, dont il lui avait voulu parler;
& voyant que tous ceux qui l’avoient ſuivi, vouloient auſſi eſtre ſur le haut de cette Tour;	et voyant que tous ceux qui l’avaient suivi, voulaient aussi être sur le haut de cette Tour;
& prevoyant que ſa converſation avec le Roy d’Aſſirie, ne ſeroit pas d’un ſtile à eſtre eſcoutée de tant de monde;	et prévoyant que sa conversation avec le Roi d’Assyrie, ne serait pas d’un style à être écoutée de tant de monde;
il leur fit ſigne qu’ils ſe retiraſſent, ſe preparant à demander où eſtoit ſa Princeſſe;	il leur fit signe qu’ils se retirassent, se préparant à demander où était sa Princesse;
croyant encore qu’elle pouvoit eſtre dans un Apartement plus bas, ou en quelque autre lieu du Chaſteau.	croyant encore qu’elle pouvait être dans un Appartement plus bas, ou en quelque autre lieu du Château.
Mais il fut bien ſurpris d’entendre que le Roy d’Aſſirie luy dit;	Mais il fut bien surpris d’entendre que le Roi d’Assyrie lui dit;
Tu vois, Artamene, tu vois un Prince bien plus malheureux que toy;	Tu vois, Artamène, tu vois un Prince bien plus malheureux que toi;
puis qu’il eſt la cauſe de ſon malheur	puisqu’il est la cause de son malheur
& du tien.	et du tien.
Mais tu peux voir en meſme temps (adjouſta t’il, en luy monſtrant une Galere qui paroiſſoit en Mer,	Mais tu peux voir en même temps (ajouta-t-il, en lui montrant une Galère qui paraissait en Mer,
& qui n’eſtoit pas encore fort eſloignée, parce qu’elle avoit le vent contraire) un autre raviſſeur de noſtre Princeſſe, bien plus criminel que moy;	et qui n’était pas encore fort éloignée, parce qu’elle avait le vent contraire) un autre ravisseur de notre Princesse, bien plus criminel que moi;
puis qu’il m’avoit promis une amitié inviolable;	puisqu’il m’avait promis une amitié inviolable;
& que je ne t’avois jamais fait eſperer nulle part en mon affection.	et que je ne t’avais jamais fait espérer nulle part en mon affection.
Quoy (s’écria alors Artamene, en regardant cette Galere,	Quoi (s’écria alors Artamène, en regardant cette Galère,
& ne regardant plus ſon Ennemi;	et ne regardant plus son Ennemi;
(la Princeſſe n’eſt plus en tes mains?	(la Princesse n’est plus en tes mains?
Non, luy reſpondit le Roy d’Aſſirie en ſoupirant:	Non, lui répondit le Roi d’Assyrie en soupirant:
le Prince Mazare, le plus infidelle de tous les hommes me l’enleve;	le Prince Mazare, le plus infidèle de tous les hommes me l’enlève;
& t’oſte le plus doux fruit de ta victoire.	et t’ôte le plus doux fruit de ta victoire.
Mais puis que tu ne peux ſatisfaire ton amour, par la veuë de ta Princeſſe;	Mais puisque tu ne peux satisfaire ton amour, par la vue de ta Princesse;
ſatisfaits du moins ta haine, par la vangeance que tu peux prendre de ton Rival.	satisfais du moins ta haine, par la vengeance que tu peux prendre de ton Rival.
Tu vois que je ne ſuis pas en eſtat de t’en empeſcher;	Tu vois que je ne suis pas en état de t’en empêcher;
& ſi j’avois pû ne ſuivre pas des yeux cette Galere, tant qu’elle paroiſtra le long de cette côſte;	et si j’avais pu ne suivre pas des yeux cette Galère, tant qu’elle paraîtra le long de cette côte;
il y auroit deſja long temps que je me ſerois jetté dans la Mer ou dans les flames, pour achever mes mal-heurs,	il y aurait déjà longtemps que je me serais jeté dans la Mer ou dans les flammes, pour achever mes malheurs,
& pour ne tomber pas entre les mains de mon Ennemi.	et pour ne tomber pas entre les mains de mon Ennemi.
Les Ennemis d’Artamene (luy reſpondit ce genereux affligé) n’ont rien à craindre de luy, que lors qu’ils ont les armes à la main:	Les Ennemis d’Artamène (lui répondit ce généreux affligé) n’ont rien à craindre de lui, que lorsqu’ils ont les armes à la main:
& l’eſtat où je te voy, te met à couvert de ma haine,	et l’état où je te vois, te met à couvert de ma haine,
& de mon reſſentiment.	et de mon ressentiment.
A ces mots, Artamene ſe ſentit ſi accablé de douleur, que jamais perſonne ne le fut davantage:	À ces mots, Artamène se sentit si accablé de douleur, que jamais personne ne le fut davantage:
il voyoit ſa Maiſtresse une ſeconde fois enlevée,	il voyait sa Maîtresse une seconde fois enlevée,
& ne pouvoit la ſuivre ny la ſecourir:	et ne pouvait la suivre ni la secourir:
puis que tous les vaiſſeaux	puisque tous les vaisseaux
& toutes les Galeres, qui eſtoient dans le Port, ayant peri par les flames, il n’eſtoit pas en ſa puiſſance de ſuivre ce dernier raviſſeur pour le punir.	et toutes les Galères, qui étaient dans le Port, ayant péri par les flammes, il n’était pas en sa puissance de suivre ce dernier ravisseur pour le punir.
Il voyoit d’autre coſté ſon premier Rival en ſon pouvoir:	Il voyait d’autre côté son premier Rival en son pouvoir:
mais il le voyoit ſeul	mais il le voyait seul
& ſans armes;	et sans armes;
& ſans autre deſſein que celuy de ſonger à mourir.	et sans autre dessein que celui de songer à mourir.
En ce pitoyable eſtat, deſesperé qu’il eſtoit, par une affliction ſans égale, comme ſans remede;	En ce pitoyable état, désespéré qu’il était, par une affliction sans égale, comme sans remède;
il y avoit des momens où ſa generoſité n’eſtoit aſſez forte, pour l’empeſcher de penſer à ſatisfaire en quelque façon ſa vangeance, par la perte de ſon Rival:	il y avait des moments où sa générosité n’était assez forte, pour l’empêcher de penser à satisfaire en quelque façon sa vengeance, par la perte de son Rival:
il y en avoit d’autres auſſi, où il n’en vouloit qu’à ſa propre vie:	il y en avait d’autres aussi, où il n’en voulait qu’à sa propre vie:
& dans cette cruelle incertitude de ſentimens, ne sçachant ce qu’il devoit faire, ny meſme ce qu’il vouloit faire;	et dans cette cruelle incertitude de sentiments, ne sachant ce qu’il devait faire, ni même ce qu’il voulait faire;
il entendit le Roy d’Aſſirie qui luy cria, Tu vois, Artamene, tu vois que la Fortune te favoriſe en toutes choſes:	il entendit le Roi d’Assyrie qui lui cria, Tu vois, Artamène, tu vois que la Fortune te favorise en toutes choses:
que le vent s’eſtant renforcé, repouſſe cette Galere vers le rivage:	que le vent s’étant renforcé, repousse cette Galère vers le rivage:
& que peut-eſtre bien toſt, tu reverras ta Princeſſe.	et que peut-être bientôt, tu reverras ta Princesse.
Artamene regardant alors vers la Mer, vit effectivement que par la violence d’un vent contraire, cette Galere c’eſtoit ſi fort raprochée, que l’on pouvoit facilement diſtinguer des Femmes, qui paroiſſoient ſur la Poupe:	Artamène regardant alors vers la Mer, vit effectivement que par la violence d’un vent contraire, cette Galère c’était si fort rapprochée, que l’on pouvait facilement distinguer des Femmes, qui paraissaient sur la Poupe:
& remarquer en meſme temps, qu’avec un prodigieux	et remarquer en même temps, qu’avec un prodigieux
& vain effort, la Chiurme faiſoit ce que les Mariniers appellent Paſſe-vogue, pour reſister aux vagues	et vain effort, la Chiourme faisait ce que les Mariniers appellent Passe-vogue, pour résister aux vagues
& aux vents;	et aux vents;
& pour s’eſloigner de la terre à force de rames.	et pour s’éloigner de la terre à force de rames.
A cét inſtant, l’on vit de la joye dans les yeux d’Artamene:	À cet instant, l’on vit de la joie dans les yeux d’Artamène:
mais pour le Roy d’Aſſirie l’on ne vit que de la douleur,	mais pour le Roi d’Assyrie l’on ne vit que de la douleur,
& du deſespoir dans les ſiens;	et du désespoir dans les siens;
sçachant bien que quand le vent repouſſeroit cette Galere dans le Port, ce ne ſeroit qu’à l’avantage d’Artamene,	sachant bien que quand le vent repousserait cette Galère dans le Port, ce ne serait qu’à l’avantage d’Artamène,
& que ce ne pouvoit eſtre au ſien.	et que ce ne pouvait être au sien.
Il s’imaginoit pourtant quelque eſpece de conſolation, dans l’eſperance qu’il concevoit, de pouvoir punir Mazare.	Il s’imaginait pourtant quelque espèce de consolation, dans l’espérance qu’il concevait, de pouvoir punir Mazare.
Ne me permettras tu pas, dit il à Artamene, ſi les Dieux te redonnent ta Princeſſe, de t’eſpargner la peine de chaſtier ton raviſſeur?	Ne me permettras-tu pas, dit-il à Artamène, si les Dieux te redonnent ta Princesse, de t’épargner la peine de châtier ton ravisseur?
& ne ſouffriras tu pas que pour faire ce combat, l’on me donne une eſpée?	et ne souffriras-tu pas que pour faire ce combat, l’on me donne une épée?
que je te promets de paſſer un moment apres ma victoire au travers de mon cœur, afin de te laiſſer joüir en paix, d’un bon heur que je te diſputerois toujours, tant que je ſerois en vie.	que je te promets de passer un moment après ma victoire au travers de mon cœur, afin de te laisser jouir en paix, d’un bonheur que je te disputerais toujours, tant que je serais en vie.
Cette vangeance me doit eſtre reſervée, reprit Artamene:	Cette vengeance me doit être réservée, reprit Artamène:
& puis que par le reſpect que je porte au Roy d’Aſſirie, deſarmé	et puisque par le respect que je porte au Roi d’Assyrie, désarmé
& malheureux, je me prive du plaiſir de me vanger de luy;	et malheureux, je me prive du plaisir de me venger de lui;
il faut du moins que je me reſerve celuy de punir Mazare,	il faut du moins que je me réserve celui de punir Mazare,
& de ſa perfidie, et de ſa temerité.	et de sa perfidie, et de sa témérité.
Apres cela, ces deux Rivaux ſans ſe ſouvenir preſque plus de leur haine, ſe mirent à regarder l’un	Après cela, ces deux Rivaux sans se souvenir presque plus de leur haine, se mirent à regarder l’un
& l’autre cette Galere:	et l’autre cette Galère:
& faiſant tantoſt des vœux,	et faisant tantôt des vœux,
& tantoſt des imprecations, comme s’ils n’euſſent eu qu’un meſme intereſt;	et tantôt des imprécations, comme s’ils n’eussent eu qu’un même intérêt;
il y avoit des momens, où l’on euſt dit qu’ils eſtoient Amis, tant cét objet dominant attachoit leurs yeux, leurs eſprits,	il y avait des moments, où l’on eût dit qu’ils étaient Amis, tant cet objet dominant attachait leurs yeux, leurs esprits,
& leurs penſées.	et leurs pensées.
Mais enfin ils virent que tout d’un coup, la Mer changea de couleur;	Mais enfin ils virent que tout d’un coup, la Mer changea de couleur;
que ſes vagues s’eſleverent;	que ses vagues s’élevèrent;
& que groſſissant encore en un moment, elles portoient tantoſt la Galere dans les Cieux;	et que grossissant encore en un moment, elles portaient tantôt la Galère dans les Cieux;
& tantoſt elles l’enfonçoient dans les abiſmes, Cette triſte veuë faiſant alors un meſme effet, dans ces cœurs également paſſionnez;	et tantôt elles l’enfonçaient dans les abîmes, Cette triste vue faisant alors un même effet, dans ces cœurs également passionnés;
Artamene regarda le Roy d’Aſſirie, avec une douleur inconcevable:	Artamène regarda le Roi d’Assyrie, avec une douleur inconcevable:
& le Roy d’Aſſirie regarda Artamene, avec un deſespoir que l’on ne sçauroit exprimer.	et le Roi d’Assyrie regarda Artamène, avec un désespoir que l’on ne saurait exprimer.
Ce fut alors que l’égalité de leur malheur, ſuspendit tous leurs autres ſentimens;	Ce fut alors que l’égalité de leur malheur, suspendit tous leurs autres sentiments;
& qu’ils eſprouverent tout ce que l’amour peut faire eſprouver de douloureux	et qu’ils éprouvèrent tout ce que l’amour peut faire éprouver de douloureux
& de ſensible.	et de sensible.
Ils voyoient que ſi le vent continuoit de ſouffler du coſté qu’il eſtoit, cette Galere ſe viendroit infailliblement briſer contre le pied de la Tour où ils eſtoient;	Ils voyaient que si le vent continuait de souffler du côté qu’il était, cette Galère se viendrait infailliblement briser contre le pied de la Tour où ils étaient;
ſi bien que faiſant des vœux tous contraires à ceux qu’ils avoient faits un peu auparavant;	si bien que faisant des vœux tous contraires à ceux qu’ils avaient faits un peu auparavant;
ils deſiroient que le vent ſecondast les vœux du raviſſeur,	ils désiraient que le vent secondât les vœux du ravisseur,
& qu’il l’eſloignast de la terre.	et qu’il l’éloignât de la terre.
Cependant la tempeſte ſe redoubla:	Cependant la tempête se redoubla:
& ſelon le caprice,	et selon le caprice,
& l’inconſtance de la Mer, le vent ayant par des tourbillons qui s’entre-choquoient, eſté quelque temps en balance;	et l’inconstance de la Mer, le vent ayant par des tourbillons qui s’entrechoquaient, été quelque temps en balance;
comme s’il n’euſt pû determiner de quel coſté il devoit ſe ranger;	comme s’il n’eût pû déterminer de quel côté il devait se ranger;
tout d’un coup il eſloigna la Galere de la Ville:	tout d’un coup il éloigna la Galère de la Ville:
& luy fit raſer la Côſte avec tant de viſtesse, que ces deux Rivaux la perdirent de veuë en un inſtant:	et lui fit raser la Côte avec tant de vitesse, que ces deux Rivaux la perdirent de vue en un instant:
& perdirent avec elle, tout ce qui leur reſtoit d’eſperance, voyant touſjours durer l’orage auſſi fort qu’auparavant.	et perdirent avec elle, tout ce qui leur restait d’espérance, voyant toujours durer l’orage aussi fort qu’auparavant.
Que ne dirent point apres cela, ces deux illuſtres malheureux;	Que ne dirent point après cela, ces deux illustres malheureux;
dans la crainte qu’ils avoient, voyant continuer la tempeſte, que leur Princeſſe ne fiſt naufrage?	dans la crainte qu’ils avaient, voyant continuer la tempête, que leur Princesse ne fît naufrage?
Ils euſſent bien voulu pouvoir ſeparer Mazare de Mandane;	Ils eussent bien voulu pouvoir séparer Mazare de Mandane;
& ne luy donner point de part aux vœux qu’ils faiſoient pour elle:	et ne lui donner point de part aux vœux qu’ils faisaient pour elle:
mais apres tout, ils conſentoient au ſalut du Rival, plus toſt que de ſe conſentir à la perte de la Maiſtresse.	mais après tout, ils consentaient au salut du Rival, plutôt que de se consentir à la perte de la Maîtresse.
Ils ſe la ſouhaiterent meſme plus d’une fois l’un a l’autre, pluſtost que de la sçavoir expoſée au danger où elle eſtoit:	Ils se la souhaitèrent même plus d’une fois l’un à l’autre, plutôt que de la savoir exposée au danger où elle était:
& plus d’une fois auſſi, ils ſe repentirent de leurs propres ſouhaits.	et plus d’une fois aussi, ils se repentirent de leurs propres souhaits.
Cependant cét objet qui avoit comme ſuspendu toutes leurs paſſions,	Cependant cet objet qui avait comme suspendu toutes leurs passions,
& toutes leurs penſées, n’eſtant plus devant leurs yeux;	et toutes leurs pensées, n’étant plus devant leurs yeux;
ils recommencerent de ſe regarder comme auparavant:	ils recommencèrent de se regarder comme auparavant:
c’eſt à dire comme deux Rivaux,	c’est à dire comme deux Rivaux,
& comme deux Ennemis.	et comme deux Ennemis.
Artamene eſtoit pres de s’en aller,	Artamène était près de s’en aller,
& de commander que l’on gardaſt le Roy d’Aſſirie;	et de commander que l’on gardât le Roi d’Assyrie;
lors que ce Prince luy dit, je sçay bien que ta naiſſance eſt égale à la mienne:	lors que ce Prince lui dit, je sais bien que ta naissance est égale à la mienne:
& je le sçay par des voyes ſi differentes,	et je le sais par des voies si différentes,
& ſi aſſeurées, que je n’en sçaurois douter:	et si assurées, que je n’en saurais douter:
c’eſt pourquoy me confiant en cette generoſité, de laquelle j’ay eſté ſi ſouvent le ſecret admirateur malgré ma haine;	c’est pourquoi me confiant en cette générosité, de laquelle j’ai été si souvent le secret admirateur malgré ma haine;
& que j’ay ſi ſouvent eſprouvée;	et que j’ai si souvent éprouvée;
je veux croire encore, que tu ne me refuſeras pas une grace que je te veux demander.	je veux croire encore, que tu ne me refuseras pas une grâce que je te veux demander.
Comme à mon Rival, luy reſpondit Artamene, je te dois refuſer toute choſe:	Comme à mon Rival, lui répondit Artamène, je te dois refuser toute chose:
mais comme au Roy d’Aſſirie, je te dois accorder tout ce qui n’offenſera point le Roy que je ſers, ou la Princeſſe ſa fille:	mais comme au Roi d’Assyrie, je te dois accorder tout ce qui n’offensera point le Roi que je sers, ou la Princesse sa fille:
c’eſt pourquoy ſois aſſeuré que je ne te refuſeray rien de tout ce qui ne choquera point ny mon honneur, ny mon amour:	c’est pourquoi sois assuré que je ne te refuserai rien de tout ce qui ne choquera point ni mon honneur, ni mon amour:
& je t’en engage la parole d’un homme, qui comme tu dis, n’eſt pas de naiſſance inégale à la tienne, quoy qu’il ne paſſe pas pour cela, dans l’opinion de toute la Terre.	et je t’en engage la parole d’un homme, qui comme tu dis, n’est pas de naissance inégale à la tienne, quoi qu’il ne passe pas pour cela, dans l’opinion de toute la Terre.
Demande donc ce que tu voudras:	Demande donc ce que tu voudras:
mais conſulte auparavant ta propre vertu, pour ne forcer pas la mienne à te refuſer malgré elle.	mais consulte auparavant ta propre vertu, pour ne forcer pas la mienne à te refuser malgré elle.
Le Roy d’Aſſirie voyant qu’il avoit ceſſé de parler;	Le Roi d’Assyrie voyant qu’il avait cessé de parler;
je sçay bien, luy dit il, que tu peux me remettre entre les mains de Ciaxare:	je sais bien, lui dit-il, que tu peux me remettre entre les mains de Ciaxare:
& qu’apres luy avoir conquis la meilleure partie de mon Royaume, il te ſeroit en quelque façon avantageux, de luy en remettre le Roy dans ſes fers.	et qu’après lui avoir conquis la meilleure partie de mon Royaume, il te serait en quelque façon avantageux, de lui en remettre le Roi dans ses fers.
Mais tu és trop brave, pour vouloir que la Fortune t’ayde à triompher d’un homme fait comme moy;	Mais tu es trop brave, pour vouloir que la Fortune t’aide à triompher d’un homme fait comme moi;
& pour te prevaloir de la captivité d’un Rival, que tu ne sçaurois croire qu’homme de cœur, puis qu’il à deſja meſuré ton eſpée avec la tienne.	et pour te prévaloir de la captivité d’un Rival, que tu ne saurais croire qu’homme de cœur, puisqu’il à déjà mesuré ton épée avec la tienne.
Dans les termes où eſt ma paſſion pour la Princeſſe, je ne te celle pas qu’il faut de neceſſité que je meure avant que tu la poſſedes:	Dans les termes où est ma passion pour la Princesse, je ne te celle pas qu’il faut de nécessité que je meure avant que tu la possèdes:
ne me prive donc pas inutilement de la gloire d’avoir contribué quelque choſe, à la punition de noſtre Ennemy commun,	ne me prive donc pas inutilement de la gloire d’avoir contribué quelque chose, à la punition de notre Ennemi commun,
& à la liberté de la Princeſſe:	et à la liberté de la Princesse:
te promettant apres cela, quand meſme le Deſtin me ſeroit favorable,	te promettant après cela, quand même le Destin me serait favorable,
& me feroit retrouver l’illuſtre Mandane;	et me ferait retrouver l’illustre Mandane;
de ne ſonger jamais à la perſuader à ton prejudice;	de ne songer jamais à la persuader à ton préjudice;
que par un combat particulier, le fort des armes n’ait decidé de noſtre Fortune.	que par un combat particulier, le fort des armes n’ait décidé de notre Fortune.
Je voy bien, Artamene, (adjouſta t’il) que ce que je veux eſt difficile:	Je vois bien, Artamène, (ajouta-t-il) que ce que je veux est difficile:
mais ſi ton ame n’eſtoit capable que des choſes aiſées, tu ſerois indigne d’eſtre mon Rival.	mais si ton âme n’était capable que des choses aisées, tu serais indigne d’être mon Rival.
Il eſt vray, reprit Artamene, qu’il ne m’eſt pas aiſé de faire ce que tu deſires:	Il est vrai, reprit Artamène, qu’il ne m’est pas aisé de faire ce que tu désires:
& qu’il me ſera bien plus facile, de terminer nos differens, te faiſant redonner une eſpée;	et qu’il me sera bien plus facile, de terminer nos différends, te faisant redonner une épée;
que de t’accorder cette liberté que tu me demandes;	que de t’accorder cette liberté que tu me demandes;
& qui n’eſt pas peut-eſtre tant en mon pouvoir que tu le crois.	et qui n’est pas peut-être tant en mon pouvoir que tu le crois.
Comme mon amour n’eſt pas moins forte que la tienne, reprit le Roy d’Aſſirie, peut-eſtre que le deſir de combattre n’eſt pas moins violent dans mon cœur, que dans celuy d’Artamene:	Comme mon amour n’est pas moins forte que la tienne, reprit le Roi d’Assyrie, peut-être que le désir de combattre n’est pas moins violent dans mon cœur, que dans celui d’Artamène:
Mais comme je ne veux combattre Artamene que pour la poſſession de la Princeſſe;	Mais comme je ne veux combattre Artamène que pour la possession de la Princesse;
& qu’elle n’eſt pas en eſtat de pouvoir eſtre le prix du Vainqueur;	et qu’elle n’est pas en état de pouvoir être le prix du Vainqueur;
il faut Artamene, il faut aller apres le Raviſſeur de Mandane,	il faut Artamène, il faut aller après le Ravisseur de Mandane,
