L’embrazement de la ville de Sinope eſtoit ſi grand, que tout le Ciel;	L’embrasement de la ville de Sinope était si grand, que tout le Ciel;
toute la Mer;	toute la Mer;
toute la Plaine;	toute la Plaine;
& le haut de toutes les Montagnes les plus reculées, en receuoient vne impreſſion de lumiere, qui malgré l’obſcurité de la nuit, permettoit de diſtinguer toutes choſes.	et le haut de toutes les Montagnes les plus reculées, en recevaient une impression de lumière, qui malgré l’obscurité de la nuit, permettait de distinguer toutes choses.
Iamais obiet ne fut ſi terrible que celuy-là:	Jamais objet ne fut si terrible que celui-là:
l’on voyoit tout à la fois vingt Galeres qui bruſloient dans le Port;	l’on voyait tout à la fois vingt Galères qui brûlaient dans le Port;
& qui au milieu de l’eau dont elles eſtoient ſi proches, ne laiſſoient pas de pouſſer des flames ondoyantes iuſques aux nuës.	et qui au milieu de l’eau dont elles étaient si proches, ne laissaient pas de pousser des flammes ondoyantes jusqu’aux nues.
Ces flames eſtant agitées par vn vent aſſez impetueux, ſe courboient quelquefois vers la plus grande partie de la Ville, qu’elles avoient deſja toute embrazée;	Ces flammes étant agitées par un vent assez impétueux, se courbaient quelquefois vers la plus grande partie de la Ville, qu’elles avaient déjà toute embrasée;
& de laquelle elles n’avoient preſque plus fait qu’un grand bûcher.	et de laquelle elles n’avaient presque plus fait qu’un grand bûcher.
L’on les voyoit paſſer d’un lieu à l’autre en un moment;	L’on les voyait passer d’un lieu à l’autre en un moment;
& par une funeſte communication, il n’y avoit quaſi pas un endroit en toute cette déplorable Ville, qui n’eſprouvast leur fureur.	et par une funeste communication, il n’y avait quasi pas un endroit en toute cette déplorable Ville, qui n’éprouvât leur fureur.
Tous les cordages,	Tous les cordages,
& toutes les voilles, des Vaiſſeaux	et toutes les voiles, des Vaisseaux
& des Galeres, ſe deſtachans toutes embrazées, s’eſlevoient affreuſement en l’air,	et des Galères, se détachant toutes embrasées, s’élevaient affreusement en l’air,
& retomboient en eſtincelles, ſur toutes les maiſons voiſines.	et retombaient en étincelles, sur toutes les maisons voisines.
Quelques unes de ces maiſons eſtant deſja conſumées, cedoient à la violence de cét impitoyable vainqueur;	Quelques-unes de ces maisons étant déjà consumées, cédaient à la violence de cet impitoyable vainqueur;
& tomboient en un inſtant, dans les ruës	et tombaient en un instant, dans les rues
& dans les Places, dont elles avoient eſté l’ornement.	et dans les Places, dont elles avaient été l’ornement.
Cette effroyable multitude de flames, qui s’élevoient de tant de divers endroits;	Cette effroyable multitude de flammes, qui s’élevaient de tant de divers endroits;
& qui avoient plus ou moins de force, ſelon la matiere qui les entretenoit, ſembloient faire un combat entr’elles, à cauſe du vent qui les agitoit;	et qui avaient plus ou moins de force, selon la matière qui les entretenait, semblaient faire un combat entre elles, à cause du vent qui les agitait;
& qui quelques-fois les confondant	et qui quelquefois les confondant
& les ſeparant, ſembloit faire voir en effet, qu’elles ſe diſputoient la gloire de deſtruire cette belle Ville.	et les séparant, semblait faire voir en effet, qu’elles se disputaient la gloire de détruire cette belle Ville.
Parmy ces flames eſclattantes, l’on voyoit encore des tourbillons de fumée, qui par leur ſombre couleur adjouſtoient quelque choſe de plus terrible, à un ſi eſpouvantable objet:	Parmi ces flammes éclatantes, l’on voyait encore des tourbillons de fumée, qui par leur sombre couleur ajoutaient quelque chose de plus terrible, à un si épouvantable objet:
& l’abondance des eſtincelles, dont nous avons deſja parlé, retombant à l’entour de cette Ville, comme une greſle enflamée, faiſoit ſans doute que l’abord en eſtoit affreux.	et l’abondance des étincelles, dont nous avons déjà parlé, retombant à l’entour de cette Ville, comme une grêle enflammée, faisait sans doute que l’abord en était affreux.
Au milieu de ce grand deſordre,	Au milieu de ce grand désordre,
& tout au plus bas de la Ville, il y avoit un Chaſteau, baſty ſur la cime d’un grand Rocher qui s’avançoit dans la Mer, que ces flames n’avoient encore pû devorer:	et tout au plus bas de la Ville, il y avait un Château, bâti sur la cime d’un grand Rocher qui s’avançait dans la Mer, que ces flammes n’avaient encore pu dévorer:
& vers lequel toutefois, elles ſembloient s’eſlancer à chaque moment, parce que le vent les y pouſſoit avec violence.	et vers lequel toutefois, elles semblaient s’élancer à chaque moment, parce que le vent les y poussait avec violence.
Il paroiſſoit que l’embrazement devoit avoir commencé par le Port;	Il paraissait que l’embrasement devait avoir commencé par le Port;
puis que toutes les maiſons qui le bordoient, eſtoient les plus allumées,	puisque toutes les maisons qui le bordaient, étaient les plus allumées,
& les plus proches de leur entiere ruine, ſi toutefois il eſtoit permis de mettre quelque difference, en un lieu où l’on voyoit eſclater par tout, le feu	et les plus proches de leur entière ruine, si toutefois il était permis de mettre quelque différence, en un lieu où l’on voyait éclater par tout, le feu
& la flame.	et la flamme.
Parmy ces feux	Parmi ces feux
& parmy ces flames, l’on voyoit pourtant encore quelques Temples	et parmi ces flammes, l’on voyait pourtant encore quelques Temples
& quelques maiſons, qui faiſoient un peu plus de reſistance que les autres;	et quelques maisons, qui faisaient un peu plus de résistance que les autres;
& qui laiſſoient encore aſſez voir de la beauté de leur ſtructure, pour donner de la compaſſion, de leur inevitable ruine.	et qui laissaient encore assez voir de la beauté de leur structure, pour donner de la compassion, de leur inévitable ruine.
Enfin ce terrible Element détruiſoit toutes choſes;	Enfin ce terrible Élément détruisait toutes choses;
ou faiſoit voir ce qu’il n’avoit pas encore détruit, ſi proche de l’eſtre;	ou faisait voir ce qu’il n’avait pas encore détruit, si proche de l’être;
qu’il eſtoit difficile de n’eſtre pas ſaisi d’horreur	qu’il était difficile de n’être pas saisi d’horreur
& de pitié, par une veuë ſi extraordinaire	et de pitié, par une vue si extraordinaire
& ſi funeſte.	et si funeste.
Ce fut par cét eſpouvantable objet, que l’amoureux Artamene (apres eſtre ſorty d’un valon, tournoyant	Ce fut par cet épouvantable objet, que l’amoureux Artamène (après être sorti d’un vallon, tournoyant
& couvert de bois, à la teſte de quatre mille hommes) fut eſtrangement ſurpris.	et couvert de bois, à la tête de quatre mille hommes) fut étrangement surpris.
Auſſi en parut-il ſi eſtonné, qu’il s’arreſta tout d’un coup:	Aussi en parut-il si étonné, qu’il s’arrêta tout d’un coup:
& ſans sçavoir ſi ce qu’il voyoit eſtoit veritable;	et sans savoir si ce qu’il voyait était véritable;
& ſans pouvoir meſme exprimer ſon eſtonnement, par ſes paroles;	et sans pouvoir même exprimer son étonnement, par ses paroles;
il regarda cette Ville;	il regarda cette Ville;
il regarda le Port;	il regarda le Port;
il jetta les yeux ſur cette Mer, qui paroiſſoit toute embrazée, par la reflexion qu’elle recevoit des Nuës, que ce feu avoit toutes illuminées;	il jeta les yeux sur cette Mer, qui paraissait toute embrasée, par la réflexion qu’elle recevait des Nues, que ce feu avait toutes illuminées;
il regarda la Plaine	il regarda la Plaine
& les Montagnes;	et les Montagnes;
il tourna ſes yeux vers le Ciel;	il tourna ses yeux vers le Ciel;
& ſans pouvoir ny parler, ny marcher, il ſembloit demander à toutes ces choſes, ſi ce qu’il voyoit eſtoit effectif, ou ſi ce n’eſtoit point une illuſion.	et sans pouvoir ni parler, ni marcher, il semblait demander à toutes ces choses, si ce qu’il voyait était effectif, ou si ce n’était point une illusion.
Hidaſpe, Chriſante, Aglatidas, Araſpe,	Hidaspe, Chrysante, Aglatidas, Araspe,
& Feraulas, qui eſtoient les plus proches de luy, regardoient cét embrazement,	et Phéraulas, qui étaient les plus proches de lui, regardaient cet embrasement,
& n’oſoient regarder Artamene;	et n’osaient regarder Artamène;
qui pouſſant enfin ſon cheval ſur une petite eminence, où ils le ſuivirent;	qui poussant enfin son cheval sur une petite éminence, où ils le suivirent;
vit	vit
& connut ſi diſtinctement, que cette Ville qui bruſloit, eſtoit celle-là meſme qu’il penſoit venir ſurprendre cette nuit, par une intelligence qu’il y avoit, afin d’en tirer ſa Princeſſe, que le Roy d’Aſſirie y tenoit captive;	et connut si distinctement, que cette Ville qui brûlait, était celle-là même qu’il pensait venir surprendre cette nuit, par une intelligence qu’il y avait, afin d’en tirer sa Princesse, que le Roi d’Assyrie y tenait captive;
que tout d’un coup s’emportant avec une violence extréme;	que tout d’un coup s’emportant avec une violence extrême;
Quoy injuſtes Dieux, s’écria t’il, il eſt donc bien vray que vous avez conſenti à la perte de la plus belle Princeſſe qui fut jamais?	Quoi injustes Dieux, s’écria t-il, il est donc bien vrai que vous avez consenti à la perte de la plus belle Princesse qui fut jamais?
& que dans le meſme temps que je croyois ſa liberté infaillible, vous me faites voir ſa perte indubitable?	et que dans le même temps que je croyais sa liberté infaillible, vous me faites voir sa perte indubitable?
En diſant cela il s’avança encore un peu davantage:	En disant cela il s’avança encore un peu davantage:
& n’eſtant ſuivi que de Chriſante	et n’étant suivi que de Chrysante
& de Feraulas, Helas mes Amis (leur dit il en commençant de galoper,	et de Phéraulas, Hélas mes Amis (leur dit il en commençant de galoper,
& commandant que tout le ſuivist) quel pitoyable deſtin eſt le mien,	et commandant que tout le suivît) quel pitoyable destin est le mien,
& à quel effroyable ſpectacle m’a t’on amené?	et à quel effroyable spectacle m’a-t-on amené?
Allons du moins, allons mourir dans les meſmes flames, qui ont fait perir noſtre illuſtre Princeſſe.	Allons du moins, allons mourir dans les mêmes flammes, qui ont fait périr notre illustre Princesse.
Peut-eſtre (pourſuivoit il en luy meſme) que ces flames que je voy, viennent d’achever de reduire en cendre, mon adorable Mandane.	Peut-être (poursuivait-il en lui même) que ces flammes que je vois, viennent d’achever de réduire en cendre, mon adorable Mandane.
Mais que dis-je, peut-eſtre?	Mais que dis-je, peut-être?
Non, non, ne mettons point noſtre malheur en doute, il eſt deſja arrivé;	Non, non, ne mettons point notre malheur en doute, il est déjà arrivé;
& les Dieux n’ont pas permis un ſi grand embrazement pour la ſauver.	et les Dieux n’ont pas permis un si grand embrasement pour la sauver.
S’ils euſſent voulu ne la perdre pas, ils auroient ſouslevé les vagues de la Mer, pour eſteindre ces cruelles flames,	S’ils eussent voulu ne la perdre pas, ils auraient soulevé les vagues de la Mer, pour éteindre ces cruelles flammes,
& ne l’auroient pas miſe en un ſi grand danger.	et ne l’auraient pas mise en un si grand danger.
Mais helas!	Mais hélas!
s’écrioit il, injuſte Rival, n’as tu point ſongé à ta conſervation pluſtost qu’à la ſienne,	s’écriait-il, injuste Rival, n’as tu point songé à ta conservation plutôt qu’à la sienne,
& n’as tu point cauſé ſa perte par ta laſcheté?	et n’as tu point causé sa perte par ta lâcheté?
Si je voyois ma Princeſſe (adjouſtoit il en ſe tournant vers Chriſante) entre les mains d’un Prince, à la teſte de cent mille hommes,	Si je voyais ma Princesse (ajoutait-il en se tournant vers Chrysante) entre les mains d’un Prince, à la tête de cent mille hommes,
& que ce Prince la vouluſt ſacrifier à mes yeux, je ne ſerois pas ſi deſesperé, j’aurois un ennemy que je pourrois du moins attaquer, ſi je ne le pouvois vaincre:	et que ce Prince la voulût sacrifier à mes yeux, je ne serais pas si désespéré, j’aurais un ennemi que je pourrais du moins attaquer, si je ne le pouvais vaincre:
Mais icy, je n’ay rien à faire, qu’à m’aller jetter dans ces meſmes flames, qui ont deſja conſumé ma Princeſſe.	Mais ici, je n’ai rien à faire, qu’à m’aller jeter dans ces mêmes flammes, qui ont déjà consumé ma Princesse.
En diſant cela, il s’avançoit encore davantage:	En disant cela, il s’avançait encore davantage:
& apres avoir eſté quelque temps ſans parler;	et après avoir été quelque temps sans parler;
Ha Ciel!	Ha Ciel!
(s’ecrioit il tout d’un coup, voyant qu’il n’y avoit que Chriſante qui le peuſt entendre) ne ſeroit-je point la cauſe de la mort de ma Princeſſe?	(s’écriait-il tout d’un coup, voyant qu’il n’y avait que Chrysante qui le pût entendre) ne serait-je point la cause de la mort de ma Princesse?
n’eſt-ce point pour l’amour de moy qu’elle a elle meſme embrazé cette Ville, pluſtost que de manquer de fidelité, au malheureux Artamene?	n’est-ce point pour l’amour de moi qu’elle a elle-même embrasé cette Ville, plutôt que de manquer de fidélité, au malheureux Artamène?
Ha Dieu!	Ha Dieu!
s’il eſt ainſi, je ſuis digne de mon infortune;	s’il est ainsi, je suis digne de mon infortune;
& je merite tous les maux que je reſſens.	et je mérite tous les maux que je ressens.
Chriſante voyant qu’il avoit ceſſé de parler, s’approcha de luy, pour taſcher de luy donner quelque legere conſolation:	Chrysante voyant qu’il avait cessé de parler, s’approcha de lui, pour tâcher de lui donner quelque légère consolation:
mais Artamene marchant touſjours;	mais Artamène marchant toujours;
& le regardant d’une maniere capable de donner de la compaſſion aux perſonnes les plus inſensibles;	et le regardant d’une manière capable de donner de la compassion aux personnes les plus insensibles;
Non, non, luy dit-il, Chriſante, ce malheur n’eſt pas de ceux dont l’on peut eſtre conſolé:	Non, non, lui dit-il, Chrysante, ce malheur n’est pas de ceux dont l’on peut être consolé:
& je n’ay qu’une voye à prendre, que je ſuivray ſans doute bien toſt.	et je n’ai qu’une voye à prendre, que je suivrai sans doute bientôt.
Ouy, Chriſante, j’auray du moins cette funeſte conſolation, que ce meſme feu qui a peut-eſtre bruſlé ma Maiſtresse	Oui, Chrysante, j’aurai du moins cette funeste consolation, que ce même feu qui a peut-être brûlé ma Maîtresse
& mon Rival;	et mon Rival;
qui a confondu l’innocence	qui a confondu l’innocence
& le crime;	et le crime;
& qui m’a privé tout enſemble, de l’objet de ma haine,	et qui m’a privé tout ensemble, de l’objet de ma haine,
& de celuy de mon amour, achevera encore de me détruire;	et de celui de mon amour, achèvera encore de me détruire;
& meſlera du moins mes Cendres, avec celles de mon adorable Princeſſe.	et mêlera du moins mes Cendres, avec celles de mon adorable Princesse.
En diſant cela, il ſembloit avoir toutes les marques d’un prochain deſespoir ſur le viſage:	En disant cela, il semblait avoir toutes les marques d’un prochain désespoir sur le visage:
ſa voix avoit quelque choſe de triſte	sa voix avait quelque chose de triste
& de funeſte:	et de funeste:
& toutes ſes actions teſmoignoient aſſez, qu’il ſe preparoit à mourir.	et toutes ses actions témoignaient assez, qu’il se préparait à mourir.
Cependant la pointe du jour venant à paroiſtre;	Cependant la pointe du jour venant à paraître;
& l’approche du Soleil, diminuant quelque choſe, de l’horreur de cét embrazement;	et l’approche du Soleil, diminuant quelque chose, de l’horreur de cet embrasement;
parce que la Mer, la Plaine,	parce que la Mer, la Plaine,
& les Montagnes, reprenoient une partie de leurs couleurs naturelles;	et les Montagnes, reprenaient une partie de leurs couleurs naturelles;
la face de cette funeſte Scene, changea en quelque façon:	la face de cette funeste Scène, changea en quelque façon:
& Feraulas vit preſque en meſme temps deux choſes, qu’il fit remarquer au meſme inſtant à ſon cher Maiſtre.	et Phéraulas vit presque en même temps deux choses, qu’il fit remarquer au même instant à son cher Maître.
Seigneur, luy dit-il, ne voyez vous pas en Mer, une Galere qui vogue,	Seigneur, lui dit-il, ne voyez vous pas en Mer, une Galère qui vogue,
& qui ſemble faire beaucoup d’effort pour s’eſloigner de cette malheureuſe Ville?	et qui semble faire beaucoup d’effort pour s’éloigner de cette malheureuse Ville?
Et ne voyez vous pas encore, comme quoy il ſemble que l’on ne ſonge qu’à eſteindre le feu qui s’approche de cette groſſe Tour, qui eſt ſur le portail du Chaſteau,	Et ne voyez vous pas encore, comme quoi il semble que l’on ne songe qu’à éteindre le feu qui s’approche de cette grosse Tour, qui est sur le portail du Château,
& que l’on abandonne tout le reſte pour la conſerver!	et que l’on abandonne tout le reste pour la conserver!
Je voy l’un	Je vois l’un
& l’autre, reſpondit Artamene;	et l’autre, répondit Artamène;
Je ne sçay, adjouſta Chriſante, ſi ce n’eſt point une marque aſſeurée, que la Princeſſe n’a pas encore pery:	Je ne sais, ajouta Chrysante, si ce n’est point une marque assurée, que la Princesse n’a pas encore péri:
puis qu’il peut eſtre, qu’elle eſt dans cette Galere, ou dans cette Tour, que les flames n’ont pas encore embrazée.	puisqu’il peut être, qu’elle est dans cette Galère, ou dans cette Tour, que les flammes n’ont pas encore embrasée.
Helas!	Hélas!
(s’eſcria tout d’un coup Artamene) s’il eſtoit ainſi, que je ſerois heureux, de pouvoir conſerver quelque eſpoir!	(s’écria tout d’un coup Artamène) s’il était ainsi, que je serais heureux, de pouvoir conserver quelque espoir!
Il s’approcha alors beaucoup plus prés de la Ville:	Il s’approcha alors beaucoup plus près de la Ville:
& voyant effectivement qu’il y avoit pluſieurs perſonnes qui taſchoient d’empeſcher le feu d’approcher de cette Tour;	et voyant effectivement qu’il y avait plusieurs personnes qui tâchaient d’empêcher le feu d’approcher de cette Tour;
Travaille (s’écria t’il en redoublant ſa courſe) trop heureux Rival;	Travaille (s’écria-t-il en redoublant sa course) trop heureux Rival;
travaille pour le ſalut de noſtre Princeſſe:	travaille pour le salut de notre Princesse:
& ſois aſſeuré ſi tu la peux ſauver de ce peril, que je te pardonne tous les maux que tu m’as faits.	et sois assuré si tu la peux sauver de ce péril, que je te pardonne tous les maux que tu m’as faits.
Ce Prince ne demeuroit pourtant pas long temps dans un meſme ſentiment:	Ce Prince ne demeurait pourtant pas longtemps dans un même sentiment:
tantoſt il faiſoit des vœux pour ſa Maiſtresse:	tantôt il faisait des vœux pour sa Maîtresse:
tantoſt des imprecations contre ſon Rival.	tantôt des imprécations contre son Rival.
Un moment apres, regardant cette Galere,	Un moment après, regardant cette Galère,
& luy ſemblant y remarquer des femmes ſur la poupe, il s’en reſjoüiſſoit beaucoup:	et lui semblant y remarquer des femmes sur la poupe, il s’en réjouissait beaucoup:
puis venant à ſonger que quand ce ſeroit ſa Maiſtresse, elle ſeroit touſjours perduë pour luy;	puis venant à songer que quand ce serait sa Maîtresse, elle serait toujours perdue pour lui;
il rentroit dans ſon deſespoir.	il rentrait dans son désespoir.
Apres venant à conſiderer cette Tour, que la Mer	Après venant à considérer cette Tour, que la Mer
& les flames environnoient de toutes parts;	et les flammes environnaient de toutes parts;
& venant à penſer, que peut-eſtre ſa Princeſſe eſtoit enfermée en ce lieu-là, il changeoit de ſentimens tout d’un coup;	et venant à penser, que peut-être sa Princesse était enfermée en ce lieu-là, il changeait de sentiments tout d’un coup;
& ces meſmes Troupes, qui eſtoient venuës pour détruire cette Ville, eurent commandement d’aider à en eſteindre le feu.	et ces mêmes Troupes, qui étaient venues pour détruire cette Ville, eurent commandement d’aider à en éteindre le feu.
Artamene donc ne pouvant ſe reſoudre de retourner ſur ſes pas, envoya Feraulas commander aux ſiens, de marcher en diligence,	Artamène donc ne pouvant se résoudre de retourner sur ses pas, envoya Phéraulas commander aux siens, de marcher en diligence,
& de le ſuivre.	et de le suivre.
Mais en approchant de Sinope, l’on ſentoit un air ſi chaud	Mais en approchant de Sinope, l’on sentait un air si chaud
& ſi embrazé;	et si embrasé;
& l’on entendoit un bruit ſi eſpouvantable, que tout autre qu’Artamene n’auroit jamais entrepris d’y aller.	et l’on entendait un bruit si épouvantable, que tout autre qu’Artamène n’aurait jamais entrepris d’y aller.
Le mugiſſement de la Mer;	Le mugissement de la Mer;
le murmure du Vent;	le murmure du Vent;
le petillement de la flame, joint au bruit affreux, de la chutte des maiſons entieres qui crouloient de fonds en comble;	le pétillement de la flamme, joint au bruit affreux, de la chute des maisons entières qui croulaient de fond en comble;
& à toutes les plaintes,	et à toutes les plaintes,
& à tous les cris que jettoient les mourants;	et à tous les cris que jetaient les mourants;
ou ceux que la peur d’une mort prochaine faiſoit crier, cauſoient une confuſion eſpouventable.	ou ceux que la peur d’une mort prochaine faisait crier, causaient une confusion épouvantable.
De tous ces mugiſſemens, dis-je;	De tous ces mugissements, dis-je;
de tous ces murmures;	de tous ces murmures;
de tous ces cris;	de tous ces cris;
de toutes ces chuttes de maiſons,	de toutes ces chutes de maisons,
& de toutes ces plaintes, il ſe formoit un bruit ſi lugubre	et de toutes ces plaintes, il se formait un bruit si lugubre
& ſi eſclatant, que tous les Echos des Montagnes y reſpondans encore, en formoient une harmonie tres-funeſte, s’il eſt permis d’appeller harmonie, un retentiſſement ſi rempli de confuſion.	et si éclatant, que tous les Echos des Montagnes y répondant encore, en formaient une harmonie très funeste, s’il est permis d’appeler harmonie, un retentissement si rempli de confusion.
Cela n’empeſcha pourtant pas Artamene de ſe faire entendre:	Cela n’empêcha pourtant pas Artamène de se faire entendre:
car eſtant deſja aſſez proche de la Ville, en un lieu où tous les ſiens l’avoient joint;	car étant déjà assez proche de la Ville, en un lieu où tous les siens l’avaient joint;
il ſe tourna vers eux,	il se tourna vers eux,
& leur dit avec une affection inconcevable;	et leur dit avec une affection inconcevable;
Imaginez vous, mes Compagnons, que c’eſt moy qui ſuis dans cette Tour;	Imaginez-vous, mes Compagnons, que c’est moi qui suis dans cette Tour;
que c’eſt moy qui ſuis dans la neceſſité de perir, parmy les eaux, ou parmy les flames;	que c’est moi qui suis dans la nécessité de périr, parmi les eaux, ou parmi les flammes;
& que c’eſt à moy enfin à qui vous allez ſauver la vie.	et que c’est à moi enfin à qui vous allez sauver la vie.
Ou pour mieux dire encore, imaginez vous que voſtre Roy;	Ou pour mieux dire encore, imaginez vous que votre Roi;
voſtre Princeſſe;	votre Princesse;
vos Femmes;	vos Femmes;
vos Peres;	vos Pères;
& vos Enfans;	et vos Enfants;
ſont enfermez dans cette Tour avec Artamene,	sont enfermés dans cette Tour avec Artamène,
& y vont perir;	et y vont périr;
afin qu’eſtans pouſſez par des ſentimens ſi tendres, vous agiſſiez avec plus de courage,	afin qu’étant poussés par des sentiments si tendres, vous agissiez avec plus de courage,
& avec plus de diligence.	et avec plus de diligence.
Il faut, mes Compagnons, il faut aujourd’huy faire, ce qui n’a peut-eſtre jamais eſté fait:	Il faut, mes Compagnons, il faut aujourd’hui faire, ce qui n’a peut-être jamais été fait:
il faut perdre nos ennemis,	il faut perdre nos ennemis,
& les ſauver;	et les sauver;
il faut les combattre d’une main,	il faut les combattre d’une main,
& les ſecourir de l’autre;	et les secourir de l’autre;
& bref il faut faire toutes choſes pour conſerver une Princeſſe, qui doit eſtre voſtre Reine;	et bref il faut faire toutes choses pour conserver une Princesse, qui doit être votre Reine;
& qui merite de l’eſtre de toute la Terre.	et qui mérite de l’être de toute la Terre.
A ces mots, Chriſante, Araſpe, Aglatidas,	À ces mots, Chrysante, Araspe, Aglatidas,
& Hidaſpe, qui commandoient chacun mille hommes en cette occaſion;	et Hidaspe, qui commandaient chacun mille hommes en cette occasion;
s’approcherent d’Artamene, pour recevoir ſes derniers ordres:	s’approchèrent d’Artamène, pour recevoir ses derniers ordres:
& Feraulas qui eſtoit l’Agent de l’entrepriſe,	et Phéraulas qui était l’Agent de l’entreprise,
& celuy qui avoit intelligence dans Sinope;	et celui qui avait intelligence dans Sinope;
& auquel Artucas avoit promis de livrer une des Portes de la Ville cette meſme nuit;	et auquel Artucas avait promis de livrer une des Portes de la Ville cette même nuit;
fut auſſi de ce conſeil:	fut aussi de ce conseil:
